"","pathway","pval","padj","log2err","ES","NES","size","leadingEdge"
"2166","GOBP_EMBRYONIC_ORGAN_DEVELOPMENT",0.603550295857988,0.822792291914067,0.044774889329693,-0.301510323568888,-0.941976575141697,160,"MAFB MEF2C RPL10 TGFBR1 PDGFB RPL38 GNAS SALL1 TGFBR2 CEBPA SPINT1 TGFB1 TIFAB ZFP36L1 CASP8 KMT2A MMP14 SH2B3 MBD3 BPTF"
"2167","GOBP_POSITIVE_REGULATION_OF_STEROID_METABOLIC_PROCESS",0.556868537666174,0.798352954623386,0.0587185879555941,-0.47199002723651,-0.942251312885703,10,"APOE"
"2168","GOBP_EPITHELIAL_CELL_DIFFERENTIATION_INVOLVED_IN_KIDNEY_DEVELOPMENT",0.541374474053296,0.7912408499866,0.057609110864425,-0.401342925551346,-0.942297082378506,22,"MEF2C PDGFB STAT1 SALL1 CD34"
"2169","GOBP_REGULATION_OF_PEPTIDYL_TYROSINE_PHOSPHORYLATION",0.603592814371257,0.822792291914067,0.0453152441270267,-0.305812640517808,-0.942444403126079,143,"CD74 TREM2 CD81 CSF1R FCGR1 RACK1 CCL5 PDGFB EHD4 IL6RA TGFB1 LYN NRP1 IL6ST GAS6 CD3E"
"2170","GOBP_POSITIVE_REGULATION_OF_ESTABLISHMENT_OF_PROTEIN_LOCALIZATION_TO_MITOCHONDRION",0.566887417218543,0.80024363455234,0.052805004567129,-0.347653078618306,-0.943841584338076,50,"YWHAH NMT1 YWHAE YWHAB YWHAQ HPS4 CASP8 BAD GZMB"
"2171","GOBP_REGULATION_OF_DNA_DAMAGE_RESPONSE_SIGNAL_TRANSDUCTION_BY_P53_CLASS_MEDIATOR",0.555240793201133,0.798352954623386,0.0568864160475701,-0.396996997988282,-0.944447046951307,24,"CD74 RPL26 MNDAL"
"2172","GOBP_CELL_CELL_RECOGNITION",0.541782729805014,0.7912408499866,0.0572461135202885,-0.387583601166268,-0.944895660808777,27,"CD81 DOCK8 CCT7 CCT4 HAVCR2 CCT2 CCT5 CCR7"
"2173","GOBP_REGULATION_OF_MITOCHONDRIAL_GENE_EXPRESSION",0.537166900420757,0.789525604136695,0.0579754757571486,-0.402531719295139,-0.945088203898306,22,"UQCC2 C1QBP CHCHD10 COA3 ALKBH1 MPV17L2 TSFM"
"2174","GOBP_PHOSPHOLIPID_METABOLIC_PROCESS",0.623883928571429,0.833645457187376,0.0405756447890657,-0.289019331047912,-0.945414303390102,269,"HEXB CSF1R ABHD12 DBI FABP5 SERINC3 PDGFB APOC2 INPP5D RAB14 DPM3 PIK3R1 LPCAT2 PLA2G15 PIP4K2A NAAA DNAJC19 SERINC1 ABHD6 PLAAT3 PLCG2 PIK3CD LPCAT3 HADHA AGPAT3 GPX4 HADHB PIK3CG PLA2G4A CLN8 PTPMT1 PIGK INPP4B EFR3A CPNE3 TTC7 FAR1 PIGT ETNK1 PLD1 SGPP1 PHB2 LPCAT1 FDPS PMVK SLC44A2 SOCS6 PDGFA GPAA1 IMPA1 APOC1 ABHD16A DGKD GGPS1 DDHD2 LPL"
"2175","GOBP_NUCLEOTIDE_TRANSPORT",0.537166900420757,0.789525604136695,0.0579754757571486,-0.402952693119925,-0.946076591587733,22,"SLC25A5 SLC25A4 SLC35B2 CR1L ABCD1 SLC25A17 SLC25A36"
"2176","GOBP_REGULATION_OF_HORMONE_SECRETION",0.58128078817734,0.810683975994346,0.0483117581055019,-0.31566193883605,-0.94618139250678,110,"H2-EB1 CCL5 UCP2 LRP1 SLC25A5 SLC25A4 GNAS AIMP1 ANXA1 CAMK2N1 OXCT1 HFE GLUD1 SOX4 BAD PPP3CA CACNA1D"
"2177","GOBP_REGULATION_OF_CELL_CYCLE_G2_M_PHASE_TRANSITION",0.589073634204276,0.814347960481733,0.0460457683018055,-0.303046248302364,-0.946608915719513,162,"NPM1 TUBB5 PSME1 PSMB10 TUBA1A YWHAE PSMB8 PSMB1 PSMB9 PSMD6 CCND1 FOXN3 CETN2 NOP53 CTC1 PSMB2 DYNC1I2 DYNC1H1 TAOK3 CSNK1E PSMA4 AKAP9 CDK4 NABP2 PSMC3 PSMD14 PSMA7 PSMA5 PSMB4 PSMC1 SSNA1 TUBB4B PSMD12 PSMC5 MECP2 DCTN3 FAM122A PCM1 BABAM1 CDK5RAP3 ACTR1A SDCCAG8 CEP250 TAOK2 CNTRL PSMD1 CENPF MTA3 PRKACA RCC2 CDK1 TRP53 PSMD9 ZFYVE19 PSME4 NDE1 TOPBP1"
"2178","GOBP_NEURON_MIGRATION",0.562834224598931,0.799780707848204,0.0535669384770951,-0.345616608754971,-0.947202320956811,56,"MEF2C SRGAP2 PLXNB2 NRP1 ADGRG1 TUBB2A GAS6 TOP2B FYN FLNA"
"2179","GOBP_WALKING_BEHAVIOR",0.565902578796562,0.800010911074741,0.0565299525056311,-0.443334357790538,-0.947414958266539,14,"ABHD12 ARRB2 CLN8 HIPK2 HTRA2 OXR1"
"2180","GOBP_NEGATIVE_REGULATION_OF_INTERLEUKIN_1_BETA_PRODUCTION",0.564102564102564,0.800010911074741,0.0564118388217596,-0.43409305088239,-0.947460028594784,15,"CX3CR1 TREM2"
"2181","GOBP_SPINDLE_LOCALIZATION",0.558945908460472,0.798878615092207,0.0555947097758869,-0.374465951632283,-0.947533677858246,35,"ACTR3 CFL1 DYNC1H1 MYH9 CLASP2 KPNB1 CENPA SPIRE1 NSFL1C NUMA1 ACTR2 HTT"
"2182","GOBP_RNA_SURVEILLANCE",0.565902578796562,0.800010911074741,0.0565299525056311,-0.443431018813941,-0.947621524930827,14,"EXOSC8 EXOSC3 EXOSC7 EXOSC5 EXOSC10 EXOSC9 XRN1 PRPF18"
"2183","GOBP_REGULATION_OF_PROTEIN_ACETYLATION",0.55718085106383,0.798425883496219,0.05378728077603,-0.350437431404184,-0.947805254271802,48,"CAMK1 PARK7 SOX4 HINT2 KMT2A DIP2B SET GSK3B CTBP1 EID1 ZFP451 SMARCB1 MAPK3 HDAC2"
"2184","GOBP_REGULATION_OF_CAMP_MEDIATED_SIGNALING",0.565902578796562,0.800010911074741,0.0565299525056311,-0.443637658361901,-0.948063118042812,14,"RGS2 PDE3B"
"2185","GOBP_RESPONSE_TO_LITHIUM_ION",0.552437223042836,0.797253269903629,0.0590954798717342,-0.475107022121077,-0.948473886145223,10,"CALR CEBPA"
"2186","GOBP_POSITIVE_REGULATION_OF_IMMUNOGLOBULIN_PRODUCTION",0.540197461212976,0.790730078068971,0.0579754757571486,-0.383508285902594,-0.948546640319438,30,"TGFB1 XBP1 XCL1 IL4RA H2-T23 SASH3 TNFSF13"
"2187","GOBP_NUCLEOTIDE_EXCISION_REPAIR_DNA_INCISION",0.560941828254848,0.799780707848204,0.0553642837725362,-0.376961193936124,-0.948899695029447,34,"RPS27A UBA52 POLD4 GTF2H2"
"2188","GOBP_VESICLE_BUDDING_FROM_MEMBRANE",0.550632911392405,0.79583985208363,0.0520570030732099,-0.32823906835639,-0.949689579022587,82,"CTSC S100A10 PICALM TMED9 LMAN1 TRAPPC1 CNIH1 RAB1B PPP6R1 AP2M1 USO1 SEC13 PREB TGFA GBF1 ARFGAP2 RAB1A BET1 STX5A CHMP6 SEC23B TFG MIA3 SAR1B"
"2189","GOBP_PYRIMIDINE_RIBONUCLEOTIDE_METABOLIC_PROCESS",0.540425531914894,0.790730078068971,0.0582216241124161,-0.416194256127136,-0.949989443031634,19,"NME2 NME1 NT5C CMPK1"
"2190","GOBP_CELLULAR_PROCESS_INVOLVED_IN_REPRODUCTION_IN_MULTICELLULAR_ORGANISM",0.580097087378641,0.809802743047819,0.0477342401407188,-0.313013169436758,-0.95026272326798,122,"HEXB TMEM119 RPS6 TGFBR1 QK PRDX4 ANG"
"2191","GOBP_DNA_REPAIR",0.621505376344086,0.833397124071203,0.0390355298112393,-0.284159664533303,-0.950304563119827,401,"NPM1 RPS27A RPS3 UBA52 HMGN1 SAMHD1 POLD4 SWI5 NUCKS1 DEK PARK7 GTF2H2 HERC2 CENPX ATRX POLR2E SMCHD1 CETN2 NONO NOP53 BTG2 VCP SMC1A HMGB1 TAOK3 POLR2I NSMCE1 GTF2I CSNK1E CEBPG DHX9 DTX3L SFR1 PARP1 SMC6 NABP2 ZBTB1 COPS6 BOD1L RAD23A PARP9 WAS SMC3 COPS4 PSMD14 ACTL6A POLR2J RPAIN SSRP1 AQR PCLAF SPIRE1 UBE2V2 APEX1 MCM3 FH1 NUDT16L1 CDKN2D CGAS ABL1 FAM111A DDX1 COMMD1 COPS3 PARP2 COPS5 SFPQ IFFO1 NSMCE4A UFL1 ERCC5 NIPBL PRPF19 UBE2W ACTR2 TEX264 TRRAP PPP5C TTC5 XPA POLR2L REXO4 HUWE1 POLB SUPT16 RFC3 BABAM1 EP300 WRN ALKBH1 SMARCAD1 MNAT1 ASCC1 RPA3 MORF4L2 DDB1 USP7 RCHY1 INO80E ALKBH3 BACH1 RUVBL1 PDS5B RFC1 RFC2 PML NSD2 RAD50 LIG1 RNF168 EYA4 INO80B CDK1 TRP53 FTO NSMCE3 SHPRH EMSY DNA2 PSME4 INO80 TOPBP1 PAXX INTS3 ACTR8"
"2192","GOBP_MUSCLE_CONTRACTION",0.570217917675545,0.802213249839565,0.0484087618816951,-0.310268748715461,-0.950428569617804,132,"ITGB5 BIN1 RGS2 VIM EEF2 GRCC10 CAMK2D DOCK4 TLN1 TIFAB ATP1A1 ASPH MYL6 SLC8A1 CACNA1D SCN1B PIK3CG ANXA6 FLNA GRK2 RAP1GDS1 AKAP9 ATP2A2 LTB4R1 SMAD7 VEGFB ATP8A2 GSTO1"
"2193","GOBP_REGULATION_OF_CELL_GROWTH_INVOLVED_IN_CARDIAC_MUSCLE_CELL_DEVELOPMENT",0.554744525547445,0.798352954623386,0.0583452776743612,-0.457228217921136,-0.950702347775584,13,"RGS2 DDX39B PARP2 PAK1"
"2194","GOBP_EMBRYO_DEVELOPMENT",0.637223974763407,0.839551832916349,0.0368389606870506,-0.282209915001556,-0.950761372443657,466,"MAFB PTPN18 MEF2C FN1 RPS7 RPL13 ITGB5 MBNL1 RACK1 RPS6 RPL10 MT-ND4 TANC2 TGFBR1 PDGFB RPL38 DAD1 GNAS PLXNB2 SALL1 TGFBR2 CEBPA NMT1 RAB14 SPINT1 ITGA4 TGFB1 HOPX TIFAB LPAR6 ZFP36L1 PHGDH YBX1 MYADM ADAM10 SOX4 CFL1 BTF3 CASP8 AKIRIN2 WNK1 KMT2A SDC4 FBXW4 PRMT1 SKI PLOD3 KLF4 NDUFA2 MYH9 YBX3 CLASP2 MMP14 SH2B3 MBD3 BPTF EMG1"
"2195","GOBP_IN_UTERO_EMBRYONIC_DEVELOPMENT",0.601851851851852,0.822792291914067,0.0438879842863647,-0.297613641813609,-0.950789362815589,198,"PTPN18 RPL13 MBNL1 MT-ND4 TANC2 TGFBR1 PDGFB DAD1 TGFBR2 CEBPA NMT1 SPINT1 HOPX LPAR6 ZFP36L1 ADAM10 BTF3 CASP8 PRMT1 PLOD3 KLF4 NDUFA2 MYH9 YBX3 MBD3 BPTF EMG1 MFNG CNOT2 ACTL6A TMEM100 H13 CHD8"
"2196","GOBP_CARDIAC_MUSCLE_TISSUE_MORPHOGENESIS",0.53758865248227,0.789525604136695,0.0584693210386381,-0.416884189308349,-0.951564258707009,19,"TGFBR1 TGFB1 S1PR1 FKBP1A SMAD7 PTCD2"
"2197","GOBP_T_CELL_DIFFERENTIATION_INVOLVED_IN_IMMUNE_RESPONSE",0.561679790026247,0.799780707848204,0.052805004567129,-0.34870789390367,-0.951814694882077,52,"H2-EB1 GPR183 CD86 FGL2 ANXA1 LGALS9 IL6RA FOXP1 IL4RA HMGB1 SLAMF6 IL18 SMAD7"
"2198","GOBP_POSITIVE_REGULATION_OF_COLLAGEN_METABOLIC_PROCESS",0.553284671532847,0.797581452164832,0.0584693210386381,-0.457777318570644,-0.951844078001741,13,"VIM VSIR TGFB1 ARRB2 RUNX1 HDAC2 ENG"
"2199","GOBP_NEGATIVE_REGULATION_OF_PHOSPHORYLATION",0.606465997770346,0.824191872546756,0.0418238690062304,-0.290899691748849,-0.952564182622492,258,"APOE NPM1 PMEPA1 RACK1 PYCARD RGS2 RHOH PID1 RTRAF CEBPA CAMK2N1 DNAJC3 PDCD4 TGFB1 PPIA SIRPA YWHAB DNAJC15 LYN PARK7 DUSP6 HHEX DUSP7 PIP4K2A MYADM PKIB CSK SLC8A1 CHORDC1 WNK1 DUSP3 CBFA2T3 ARRB2 TAOK3 INKA1 SH2B3 LRRK1 PKIG RASSF2 NUPR1 MLXIPL SMAD7 PKN1 PTPRO SPRED1 PTPN22 LDLRAD4 PTPN6 LRP6 GPS2 ANKLE2 NCOR1 DBNDD2 CDKN2D ABL1 EIF4G1 CBLB THY1 PRDX3 FKBP8 SNX6 RGS3 APC DUSP22"
"2200","GOBP_POSITIVE_REGULATION_OF_VASCULATURE_DEVELOPMENT",0.547770700636943,0.792593600959116,0.0525898950623616,-0.329886601539271,-0.952678515748197,81,"CX3CR1 CTSH GRN C3AR1 ANXA3 RHOB LRG1 TGFBR2 XBP1 ECM1 MYDGF CD34 ETS1 TNFSF12 PIK3CD KLF4 HMGB1 TJP1 TLR3 S100A1 VEGFB EMC10 SMAD1 RUNX1 PRKCA ABL1 STIM1 MTDH HIPK2"
"2201","GOBP_REGULATION_OF_ALTERNATIVE_MRNA_SPLICING_VIA_SPLICEOSOME",0.550408719346049,0.795813880837918,0.0554793308704233,-0.362040405950148,-0.952766068242418,41,"MBNL1 CELF2 HNRNPA1 RBM5 HNRNPL SRSF6 DDX17 PTBP1 RBM4 CELF1 DDX5 MAGOH KHDRBS1 THRAP3 FAM172A"
"2202","GOBP_TRANSFORMING_GROWTH_FACTOR_BETA_PRODUCTION",0.53257790368272,0.78795303726391,0.0588438169595807,-0.404057157512736,-0.953202666607627,23,"FN1 HSP90AB1 CD2AP LGALS9 XCL1 CD34 FKBP1A"
"2203","GOBP_TRANSCRIPTION_INITIATION_FROM_RNA_POLYMERASE_I_PROMOTER",0.527624309392265,0.787453311915583,0.0580983576873206,-0.386349601395577,-0.953728179574177,28,"GTF2H2 POLR2E TAF1D UBTF SMARCB1 MAPK3 POLR2L MNAT1 SMARCA4 PIH1D1 CD3EAP"
"2204","GOBP_STEROL_TRANSPORT",0.55525965379494,0.798352954623386,0.0540088272801684,-0.346923883196872,-0.953772901468398,57,"APOE LRP1 APOC2 TSPO SCP2 PIP4K2A NPC2 ABCA1 MSR1 LPCAT3 PLTP STARD3 LRP6 GPS2 OSBPL11"
"2205","GOBP_METHIONINE_BIOSYNTHETIC_PROCESS",0.545051698670606,0.791925642006727,0.0597317976364411,-0.477791021287576,-0.953832053887081,10,"APIP MRI1 MTR MTAP MTHFR ENOPH1 ADI1 MTHFD2L MTHFD1"
"2206","GOBP_SULFUR_AMINO_ACID_BIOSYNTHETIC_PROCESS",0.545051698670606,0.791925642006727,0.0597317976364411,-0.477791021287576,-0.953832053887081,10,"APIP MRI1 MTR MTAP MTHFR ENOPH1 ADI1 MTHFD2L MTHFD1"
"2207","GOBP_CORONARY_VASCULATURE_DEVELOPMENT",0.52875175315568,0.787453311915583,0.0587185879555941,-0.40633996612805,-0.954029435077851,22,"TGFBR1 NRP1 SNX17 SPRED1 VEGFB AP2B1 DCTN5"
"2208","GOBP_NEGATIVE_REGULATION_OF_DNA_RECOMBINATION",0.543909348441926,0.791457833950752,0.0578529757032509,-0.401579426763094,-0.955348543300567,24,"SMCHD1 H1F0 CGAS THOC1 NDFIP1 RIF1 FBH1 SHLD2 TERF2 MSH2 TRP53BP1 MSH6 TERF2IP"
"2209","GOBP_BONE_RESORPTION",0.537619699042408,0.789525604136695,0.0567672387487446,-0.369009772605183,-0.955352282486731,39,"CSF1R TMEM119 TRF INPP5D CSK S1PR1"
"2210","GOBP_NEGATIVE_REGULATION_OF_RESPONSE_TO_BIOTIC_STIMULUS",0.555410691003911,0.798352954623386,0.0530212512043078,-0.340300255970805,-0.955386945723847,67,"ARG1 GRN PRDX2 RPS19 KLRD1 SAMHD1 FGL2 LGALS9 H2-M3 H2-T23 HAVCR2 TRAFD1 ARRB2 C1QBP"
"2211","GOBP_REGULATION_OF_PROTEIN_MODIFICATION_BY_SMALL_PROTEIN_CONJUGATION_OR_REMOVAL",0.588785046728972,0.814347960481733,0.0453152441270267,-0.301422560725676,-0.955779172074695,187,"RPS7 RPL11 LAPTM5 RPS3 HSP90AB1 RPL5 RPS2 TGFBR1 IVNS1ABP TSPO RPL23 COPS9 SVBP MYCBP2 HERPUD1 PPIA PARK7 CENPX SOX4 NOP53 VCP FKBP1A ARRB2 DCUN1D5 RASSF5 FYN TRIM44 DTX3L UBE2C SMAD7 HSPA5 CAPN3 PTPN22 UBE2D1 NMI GPS2"
"2212","GOBP_POSITIVE_REGULATION_OF_TYROSINE_PHOSPHORYLATION_OF_STAT_PROTEIN",0.533145275035261,0.78795303726391,0.0585937568945671,-0.386510652799989,-0.955972516469227,30,"CSF1R CCL5 IL6RA LYN IL6ST FYN IL18 PARP9 TNFRSF18 TNFRSF1A"
"2213","GOBP_RNA_INTERFERENCE",0.544525547445256,0.791757380403633,0.059221919380382,-0.460093396749197,-0.956659837125255,13,"DHX9 DICER1 TSN TSNAX CELF1 PRKRA MRPL44 ADAR"
"2214","GOBP_CLEAVAGE_INVOLVED_IN_RRNA_PROCESSING",0.534075104311544,0.788001306869231,0.0578529757032509,-0.397470540013011,-0.957133588287963,25,"RPS21 EXOSC8 EXOSC3 EXOSC7 RRP36 EXOSC10 BMS1 ERI3 EXOSC9 NOB1"
"2215","GOBP_ENDOCARDIAL_CUSHION_DEVELOPMENT",0.543065693430657,0.79139741967002,0.0593487680335629,-0.460343898223891,-0.957180698110598,13,"TGFBR1 TGFBR2 BMPR2 TMEM100 MDM4"
"2216","GOBP_INTERLEUKIN_7_MEDIATED_SIGNALING_PATHWAY",0.555873925501433,0.798352954623386,0.0573667426768556,-0.447932352575358,-0.957240970982718,14,"IL7R IL2RG STAT3 SMARCA4 SOCS1 STAT5B SOCS2 JAK3"
"2217","GOBP_MITOTIC_NUCLEAR_MEMBRANE_ORGANIZATION",0.542097488921713,0.7912408499866,0.059989249649033,-0.479846335417873,-0.957935154219527,10,"VRK1 ANKLE2 BANF1 REEP4"
"2218","GOBP_MELANOCYTE_DIFFERENTIATION",0.554441260744986,0.798352954623386,0.0574877409561325,-0.44837390037362,-0.958184568025249,14,"MEF2C HPS4 BCL2 RAB27A"
"2219","GOBP_PURINE_NUCLEOSIDE_METABOLIC_PROCESS",0.53625170998632,0.789243077359729,0.0568864160475701,-0.367355766112181,-0.958268374981684,40,"NME2 NME1 GMPR2 GMPS IMPDH2 HPRT DGUOK RAN GIMAP7 OARD1 RHOQ ADK OPA1 MTAP CASK GUK1"
"2220","GOBP_FOREBRAIN_GENERATION_OF_NEURONS",0.526241134751773,0.787118038374842,0.059476028695732,-0.419928920018859,-0.958514047151409,19,"CSF1R SALL1"
"2221","GOBP_CELL_GROWTH",0.584821428571429,0.813373750689803,0.0435378240914002,-0.293065677052639,-0.958542735177271,271,"APOE FN1 RACK1 RGS2 LRP1 HSP90AB1 CXCL16 TGFBR1 SERPINE2 BST2 MACF1 CAMK2D SGK1 TGFBR2 PPT1 ITGA4 TGFB1 TWF2 ADAM15 DPYSL2 NRP1 RPS6KA1 NDUFA13 CYFIP1 ADAM10 SIPA1 VGLL4 DBNL ULK2 NDUFS3 DCUN1D5 DIP2B ARHGAP4 MMP14 EXTL3 NUBP1 OLFM1 CRLF3 DDX39B SMARCA2 SMAD7 KDM2B GSK3B SGK3 BCL2 BMPR2"
"2222","GOBP_NEGATIVE_REGULATION_OF_PEPTIDYL_LYSINE_ACETYLATION",0.5466472303207,0.792184253348354,0.0589694466690997,-0.465421288831389,-0.958883753519343,12,"HINT2 SET CTBP1 ZFP451 HDAC2 PIH1D1"
"2223","GOBP_KINETOCHORE_ORGANIZATION",0.526241134751773,0.787118038374842,0.059476028695732,-0.420174934798054,-0.959075591285248,19,"CENPX SMC4 CENPA SMC2 SENP6 CENPF POGZ CENPW"
"2224","GOBP_GLYCEROLIPID_METABOLIC_PROCESS",0.585011185682327,0.813373750689803,0.0436251240000606,-0.293365295635867,-0.959267048156152,264,"APOE CSF1R ABHD12 DBI FABP5 SERINC3 PDGFB GPX1 APOC2 INPP5D ANG RAB14 DPM3 PIK3R1 DAGLB LPCAT2 PLA2G15 PIP4K2A NAAA DNAJC19 SERINC1 ABHD6 PLAAT3 PLCG2 PIK3CD LPCAT3 HADHA AGPAT3 HADHB PIK3CG PLA2G4A SEL1L PTPMT1 PIGK INPP4B EFR3A CPNE3 TTC7 FAR1 PIGT ETNK1 CTDNEP1 PLD1 PHB2 LPCAT1 THRSP SLC44A2 SOCS6 PDGFA GPAA1 IMPA1 APOC1 ABHD16A DGKD DDHD2 LPL PIGP LMF1 DPM1"
"2225","GOBP_LIPID_MODIFICATION",0.561091340450771,0.799780707848204,0.0482149710025565,-0.306857088893474,-0.959646949651153,163,"APOE INPP5D SCP2 ETFB PIK3R1 PIP4K2A ECH1 ACAA1A B4GALNT1 PIK3CD ACADM ABCD2 HSD17B4 LPCAT3 CERK HADHA HSD17B10 ACADS ACOX3 HADHB PIK3CG ECHS1 ECI2 MAPK14 ETFA EFR3A ACAT1 TTC7 ACAA2 PHYH SGPP1 CROT SOCS6 IMPA1 APOC1 DGKD ABCD1 ABCD3"
"2226","GOBP_NEGATIVE_REGULATION_OF_TRANSCRIPTION_REGULATORY_REGION_DNA_BINDING",0.538011695906433,0.78972504165193,0.0598603117764473,-0.473975933589851,-0.959685785728615,11,"TMSB4X"
"2227","GOBP_GLYCOLIPID_BIOSYNTHETIC_PROCESS",0.531459170013387,0.78795303726391,0.0562940749700968,-0.360515619795351,-0.959690630022632,43,"DPM3 GAL3ST4 B4GALNT1 ST3GAL5 PIGK PIGT B4GALT6 GPAA1 PIGP DPM1 PIGX ST8SIA4 PIGN B4GALT3 ST3GAL2 MPPE1 PIGYL ST3GAL4 LARGE1 PIGH PIGQ UGCG"
"2228","GOBP_POSITIVE_REGULATION_OF_DOUBLE_STRAND_BREAK_REPAIR",0.522099447513812,0.784213676964035,0.0585937568945671,-0.38895348272236,-0.960156023652828,28,"SMCHD1 DTX3L PARP1 PARP9 WAS SPIRE1"
"2229","GOBP_PROTEIN_DEPHOSPHORYLATION",0.566938300349243,0.80024363455234,0.0468819856878333,-0.299372151973656,-0.960334360101158,215,"PTPN18 HSP90B1 SSH2 HSP90AB1 PPP1R14B CTTNBP2NL YWHAE PPP1CA TGFB1 PPIA YWHAB DUSP6 DUSP7 PTPRA MDP1 IGBP1 DAPP1 PPP3CA NCKAP1L FKBP1A DUSP3 PPP2R5C NUAK1 PTP4A3 SET PTP4A2 LRRK1 PTPMT1 BOD1L GSK3B PTPRO PPM1M PTPN22 BCL2 PTPN6 LCK PTBP1 CTDNEP1 PPP6R1 ANKLE2 PTPA ROCK2 PPP3R1 IKBKB PPM1H CD33 PHPT1 PALD1 SLC39A10 PPP3CB MFHAS1 DUSP22 EIF2AK2 GNAI2 URI1 PPP1R7 PPP1R12A PPP5C PTPRS"
"2230","GOBP_POSITIVE_REGULATION_OF_CHOLESTEROL_EFFLUX",0.54014598540146,0.790730078068971,0.0596037042575973,-0.461921984566719,-0.960461970639971,13,"APOE LRP1 ABCA1 PLTP"
"2231","GOBP_POSITIVE_REGULATION_OF_PROTEIN_CATABOLIC_PROCESS",0.554513481828839,0.798352954623386,0.0482149710025565,-0.304891815932703,-0.961163757951397,173,"APOE TREM2 CD81 CTSC RACK1 LAPTM5 LRP1 ATPIF1 ECSCR MNDAL CEBPA DAB2 DDRGK1 HERPUD1 NDUFA13 MYLIP BCAP31 TNFSF12 NOP53 VGLL4 VCP SNX1 CBFA2T3 UQCC2 CSNK1E IFI205 RDX NUPR1 RAD23A SMAD7 GSK3B PSMC3"
"2232","GOBP_CELLULAR_RESPONSE_TO_UV",0.531291611185087,0.78795303726391,0.0560595875032335,-0.347899463018818,-0.961217196772274,61,"CRIP1 NPM1 RPL26 COPS9 PIK3R1"
"2233","GOBP_NEGATIVE_REGULATION_OF_NATURAL_KILLER_CELL_ACTIVATION",0.536189069423929,0.789243077359729,0.0605092988656667,-0.481528978675858,-0.961294277776094,10,"H2-M3 H2-T23 HAVCR2 H2-Q7"
"2234","GOBP_HISTONE_DEUBIQUITINATION",0.53041018387553,0.78795303726391,0.0589694466690997,-0.418558141929377,-0.961602469143391,20,"ENY2 TRRAP USP21 ASXL1 USP7 ATXN7 BRCC3 SUPT3 UIMC1 USP15"
"2235","GOBP_PEROXISOME_ORGANIZATION",0.536136662286465,0.789243077359729,0.0550211117163117,-0.345893578359468,-0.961707945727443,63,"RPS27A UBA52 SCP2 ECH1 ACAA1A FIS1 PLAAT3 ABCD2 HSD17B4 ACOX3 ECI2 ZFAND6 UBE2D1 PHYH CROT DHRS4 ABCD1 IDE ABCD3 PEX3 DNM1L"
"2236","GOBP_REGULATION_OF_SODIUM_ION_TRANSPORT",0.531914893617021,0.78795303726391,0.0559428593065705,-0.360707144248208,-0.96238403985997,45,"YWHAH SERPINE2 CAMK2D ATP1A1 SLC8A1 WNK1 SCN1B"
"2237","GOBP_SOMATIC_DIVERSIFICATION_OF_IMMUNE_RECEPTORS_VIA_SOMATIC_MUTATION",0.533234859675037,0.78795303726391,0.0607719451853533,-0.482308744307084,-0.962850953017872,10,"SAMHD1 POLB ADAR MSH2 MCM3AP MSH6"
"2238","GOBP_REGULATION_OF_LEUKOCYTE_MEDIATED_IMMUNITY",0.551312649164678,0.796225865691052,0.0492917662312669,-0.310839823483323,-0.963118064764554,150,"H2-EB1 CD81 CCR2 ARG1 BST2 FCGR2B KLRD1 ITGAM IL7R LGALS9 LAG3 TGFB1 HFE LYN XCL1 KLRK1 H2-M3 IL4RA H2-T23 CADM1 HAVCR2 HMGB1 ARRB2 SLAMF6 SASH3 TNFSF13 IL18 SCIMP TLR3 ZBTB1 SMAD7 HSPD1 VAMP8 WAS"
"2239","GOBP_REGULATION_OF_MICROTUBULE_DEPOLYMERIZATION",0.542735042735043,0.7912408499866,0.0582216241124161,-0.44135048688607,-0.963300251122178,15,"NAV3 CLASP2 MID1IP1 APC SPAST ATXN7 CAMSAP1 CAMSAP2 MAP1S ARHGEF2 TAOK1"
"2240","GOBP_ACTIVATION_OF_PROTEIN_KINASE_B_ACTIVITY",0.522662889518414,0.784502563458404,0.0597317976364411,-0.408369171954768,-0.963375048381278,23,"PDGFB ANG PPIA PARK7 CCDC88A GAS6 IL18"
"2241","GOBP_FOREBRAIN_DEVELOPMENT",0.558858501783591,0.798878615092207,0.048505983646947,-0.310481487442794,-0.96410932838207,154,"P2RY12 CSF1R LRP1 SRGAP2 ANXA3 TACC1 ITGAM OPHN1 GRCC10 SALL1 TMEM14C NME1 ADGRG1 ATRX ETS1 CNP SLC8A1 BTG2 BAD SKI GM17018 TOP2B FYN RTN4RL1 XRN2 FLNA RAB3GAP1"
"2242","GOBP_BONE_REMODELING",0.531914893617021,0.78795303726391,0.0559428593065705,-0.35862483122128,-0.964289230498049,47,"CSF1R TMEM119 TRF INPP5D TGFB1 CSK S1PR1 TNFRSF11A LRRK1 RASSF2"
"2243","GOBP_NUCLEOSOME_ASSEMBLY",0.533774834437086,0.788001306869231,0.0555947097758869,-0.35523579263476,-0.964427856259833,50,"NPM1 NAP1L1 CENPX ATRX HP1BP3 KAT6A SET H1F0 CENPA RBBP4 HAT1 RBBP7 DAXX SMARCA5 NAA60 CABIN1 RUVBL1 RSF1"
"2244","GOBP_POSITIVE_REGULATION_OF_NEURON_DIFFERENTIATION",0.534818941504178,0.788036004301116,0.0578529757032509,-0.387843367084124,-0.964552505875786,31,"MEF2C TCF4 TIMP2 CSNK1E TCF12 EIF4G1 ETV5 PRPF19"
"2245","GOBP_RETINA_DEVELOPMENT_IN_CAMERA_TYPE_EYE",0.543766578249337,0.791457833950752,0.0547939500773363,-0.356479315761204,-0.965173744973862,49,"MERTK RPL24 NRP1 SKI XRN2 CLN8 ACTL6A BMPR2 ATP8A2 LRP6 LPCAT1 THY1 SERPINF1 HIPK2"
"2246","GOBP_PROTEIN_DENEDDYLATION",0.525849335302807,0.787118038374842,0.0614364107201271,-0.483642227628912,-0.965513035558176,10,"COPS6 COPS4 COPS3 COPS5 TOR1A COPS8 COPS2"
"2247","GOBP_POSITIVE_REGULATION_OF_TOR_SIGNALING",0.530470914127424,0.78795303726391,0.0579754757571486,-0.383600223360591,-0.965611688458764,34,"TREM2 LAMTOR4 GAS6 SLC38A9"
"2248","GOBP_NEGATIVE_REGULATION_OF_ENDOPLASMIC_RETICULUM_UNFOLDED_PROTEIN_RESPONSE",0.544412607449857,0.791757380403633,0.0583452776743612,-0.451864121935647,-0.965643245787127,14,"RACK1 DDRGK1 HSPA5 BFAR UFL1"
"2249","GOBP_LONG_CHAIN_FATTY_ACID_TRANSPORT",0.532786885245902,0.78795303726391,0.0571258510018113,-0.382632495110298,-0.966138968404943,33,"APOE FABP5 ANXA1 ABCD2 PLA2G4A EPRS"
"2250","GOBP_NEGATIVE_REGULATION_OF_HYDROLASE_ACTIVITY",0.562137049941928,0.799780707848204,0.0471642455670861,-0.301133244639315,-0.966179493774101,216,"CST3 GZMA BIN1 RGS2 LRP1 F11R PPP1R14B SERPINE2 RHOH BST2 ATPIF1 GPX1 PICALM ANXA1 SPINT1 YWHAE PROS1 HERPUD1 PARK7 RPS6KA1 CST7 ECM1 TIMP2 KLRK1 CDC42SE1 IGBP1 GAS6 WNK1 NCKAP1L FKBP1A RBM26 KLF4 ARRB2 IFI205 RASA4 RDX SET BOD1L PEBP1 APLP2 NAIP2 GSK3B SPRED1 TRIAP1 TNFAIP8 SORT1 RENBP GPS2 GMIP PTPA CR1L TIMP1 ROCK2 CDKN2D IKBKB ABL1 PRDX3 SERPINB6B SERPINF1 ARL6IP1 APOC1"
"2251","GOBP_NUCLEOBASE_CONTAINING_SMALL_MOLECULE_BIOSYNTHETIC_PROCESS",0.534526854219949,0.788001306869231,0.0538979025357319,-0.337055833670172,-0.966244085828118,76,"NME2 HINT1 GPX1 SAMHD1 SMPDL3A NME1 NT5C CNP VCP ACAT1 DCK GMPS IMPDH2 DTYMK HPRT NUDT3 DUT"
"2252","GOBP_REGULATION_OF_NUCLEAR_TRANSCRIBED_MRNA_CATABOLIC_PROCESS_DEADENYLATION_DEPENDENT_DECAY",0.532763532763533,0.78795303726391,0.0590954798717342,-0.443247512534258,-0.967440736603857,15,"ZFP36L2 ZFP36L1 PABPC1 TNRC6B TNRC6C DHX36"
"2253","GOBP_INTRACELLULAR_MRNA_LOCALIZATION",0.527777777777778,0.787453311915583,0.0607719451853533,-0.47805130770346,-0.967937425381993,11,"ZFP36L1 ZFP385A DHX36 CASC3 EXOSC3"
"2254","GOBP_REGULATION_OF_MEIOTIC_NUCLEAR_DIVISION",0.524372230428361,0.78584560668856,0.0615706755421678,-0.484889113932583,-0.968002241238075,10,"CALR"
"2255","GOBP_MUSCLE_HYPERTROPHY",0.529801324503311,0.78795303726391,0.0559428593065705,-0.356603973524189,-0.968142323634813,50,"RGS2 CAMK2D IL6ST MEF2A GLRX3 PPP3CA JARID2 PARP1 ATP2A2 DDX39B TNFRSF1A ROCK2 PRKCA PARP2 FOXO1 HDAC2 PAK1"
"2256","GOBP_POSITIVE_REGULATION_OF_MITOCHONDRION_ORGANIZATION",0.530183727034121,0.78795303726391,0.0554793308704233,-0.347383927923782,-0.968520251000011,65,"TREM2 PYCARD YWHAH ATPIF1 NMT1 YWHAE YWHAB PARK7 YWHAQ CASP8 FIS1 BAD GZMB"
"2257","GOBP_POSITIVE_REGULATION_OF_INTERLEUKIN_2_PRODUCTION",0.515193370165746,0.779491878658418,0.059221919380382,-0.392365439727832,-0.968578653136228,28,"CCR2 RPS3 CD86 ANXA1 CD83 CD3E SASH3 SPTBN1 RUNX1 ABL1"
"2258","GOBP_GUANOSINE_CONTAINING_COMPOUND_METABOLIC_PROCESS",0.530640668523677,0.78795303726391,0.0582216241124161,-0.389579371756551,-0.968869887063946,31,"NME2 NME1 GMPR2 GMPS IMPDH2 HPRT DGUOK RAN GIMAP7"
"2259","GOBP_REGULATION_OF_DNA_METABOLIC_PROCESS",0.555680539932508,0.798352954623386,0.0462302524077616,-0.298048652109916,-0.969119364051794,247,"GZMA NPM1 RPS3 HSP90AB1 PDGFB ANXA3 SUB1 IL7R HNRNPA2B1 NUCKS1 TGFB1 HNRNPA1 NEK7 DEK PKIB ATRX SMCHD1 CCT7 CTC1 CCT4 KMT2A CCT2 CCT6A KLF4 HMGB1 ARRB2 CCT5 MBD3 TNFSF13 CEBPG DHX9 DTX3L PARP1 H1F0 TNKS2 NABP2 DDX39B PARP9 WAS BMPR2 SPIRE1 UBE2V2 CCT3 CCT8 MBD2 NUDT16L1 DCP2"
"2260","GOBP_TOLL_LIKE_RECEPTOR_3_SIGNALING_PATHWAY",0.528913963328632,0.787453311915583,0.0589694466690997,-0.437814375963845,-0.969120448561224,16,"UNC93B1 CASP8 HAVCR2 SCIMP TLR3 PTPN22 FLOT1 RFTN1"
"2261","GOBP_DNA_STRAND_ELONGATION_INVOLVED_IN_DNA_REPLICATION",0.531339031339031,0.78795303726391,0.059221919380382,-0.4441773732276,-0.969470268837355,15,"MCM3 RFC3 LIG1 DNA2 RFC4 MCM7 MCM4 GINS4 POLD3 GINS2 PCNA"
"2262","GOBP_LACTATION",0.515193370165746,0.779491878658418,0.059221919380382,-0.392826236149839,-0.969716157953439,28,"MT-CO2 NME1 XBP1 CCND1"
"2263","GOBP_VASODILATION",0.512820512820513,0.777727099155671,0.0609039347452418,-0.427831515284253,-0.969898569507353,18,"APOE RGS2 GPX1"
"2264","GOBP_REGULATION_OF_TRANSLATION_NCRNA_MEDIATED",0.528913963328632,0.787453311915583,0.0589694466690997,-0.438211397173615,-0.96999927162877,16,"TNRC6B EIF4E2 EIF4G1 TNRC6C AGO1 RBM4 STAT3"
"2265","GOBP_DETECTION_OF_LIGHT_STIMULUS",0.524752475247525,0.786110171576164,0.059476028695732,-0.422231785480915,-0.970042359223245,20,"NMT1 METAP2 GNGT2 ATP8A2 FNTA GUCA1A"
"2266","GOBP_DETECTION_OF_MECHANICAL_STIMULUS_INVOLVED_IN_SENSORY_PERCEPTION",0.521418020679468,0.783853580756552,0.0618406035753285,-0.486040666002444,-0.970301127627764,10,"SERPINE2 FYN"
"2267","GOBP_CELLULAR_RESPONSE_TO_LIGHT_STIMULUS",0.527670527670528,0.787453311915583,0.0547939500773363,-0.341244514227466,-0.970337160088024,73,"CRIP1 NPM1 RPL26 COPS9 NMT1 PIK3R1 METAP2"
"2268","GOBP_TRNA_METABOLIC_PROCESS",0.539015606242497,0.790451358513594,0.0506004243853618,-0.31447720520465,-0.97055158041108,146,"LSM6 AIMP1 RTRAF NARS RTCB POP5 RPP21 HSD17B10 OSGEP SLFN8 EPRS LAGE3 ZBTB8OS TSEN34 SSB POLR3K LARS AARSD1 RPP25L VARS TARS DDX1 PPA1 PSTK FAM98B IARS TRMT1 DARS 2210016F16RIK QARS DALRD3 TRMT112 WARS ALKBH1 AARS POP7 TRMT13 PPA2 TRMT10A FARS2 CDKAL1 CARS2 FARSB RPP30 SLFN9 FARSA TARS2 GATC METTL1 RARS SARS THUMPD1 TPRKB TRIT1 BCDIN3D QRSL1 THUMPD3 MTO1 TSEN15 THADA KTI12 URM1 YARS TRP53RKA DTD2 PUS3 TYW1 KARS TRMT1L TRMT12 YARS2 HARS2"
"2269","GOBP_REGULATION_OF_NECROTIC_CELL_DEATH",0.519830028328612,0.782636505460219,0.059989249649033,-0.407980963955086,-0.970577658199577,24,"MT-CO2 SLC25A4 ASAH1 TSPO CASP8 YBX3 ZBP1 NUPR1"
"2270","GOBP_MUSCLE_FIBER_DEVELOPMENT",0.523338048090523,0.784905374108562,0.0596037042575973,-0.422764643566339,-0.971266556292462,20,"GPX1 PPP3CA SKI BCL2 PTCD2"
