"","pathway","pval","padj","log2err","ES","NES","size","leadingEdge"
"2970","GOBP_RESPONSE_TO_ANTIBIOTIC",0.248633879781421,0.61137515842839,0.096887770327544,-0.467793060597101,-1.18116759754551,33,"CRIP1 MEF2C RPL23 VKORC1 CASP8 RSRC1 PLA2G4A HSPA5 CIITA"
"2971","GOBP_RNA_3_END_PROCESSING",0.169512195121951,0.526265133528246,0.11378726182188,-0.387336614630678,-1.18148503067897,128,"RPS21 SRSF9 SRSF3 SARNP ZFP36L1 TUT4 THOC7 PABPC1 INTS6L HSD17B10 EXOSC8 U2AF1 FBL LARP7 DDX39B SSB NUDT21 POLR3K SRSF7 SRSF6 SNRPA CPSF2 SRSF11 MAGOHB SRSF2 CPSF3 THOC1 ALYREF U2AF1L4 DHX36 DKC1 MAGOH UPF3B VIRMA CASC3 EXOSC3 FIP1L1"
"2972","GOBP_POSITIVE_REGULATION_OF_CYTOKINE_PRODUCTION_INVOLVED_IN_IMMUNE_RESPONSE",0.254445964432285,0.614844694266867,0.0956031492204301,-0.456435253455894,-1.18169353108989,39,"CD74 CD81 LAPTM5 XCL1 H2-M3 H2-T23 SASH3 IL18 SCIMP"
"2973","GOBP_REGULATION_OF_CELL_SUBSTRATE_JUNCTION_ORGANIZATION",0.235372340425532,0.601837578826029,0.0985499803531691,-0.439566391821631,-1.18192913825576,47,"S100A10 LRP1 MACF1 PIK3R1 ACTG1 NRP1 PTPRA SDC4 DUSP3 CLASP2 MMP14 ROCK2 LDB1 ABL1 DAPK3 THY1 DUSP22"
"2974","GOBP_REGULATION_OF_RESPONSE_TO_WOUNDING",0.194049159120311,0.557584292662158,0.108820126769161,-0.418655774927905,-1.1821243392691,71,"APOE GRN LRP1 PRDX2 SERPINE2 PDGFB ANXA1 VKORC1 PROS1 ACTG1 XBP1 KLK8 CD34 STK24 KLF4 HMGB1 SLC12A2 CLASP2 SH2B3 RTN4RL1 FLNA"
"2975","GOBP_REGULATION_OF_PROTEIN_LOCALIZATION_TO_NUCLEUS",0.190114068441065,0.550788431016568,0.108820126769161,-0.402926166635423,-1.18219285069289,95,"GLUL HSP90AB1 MNDAL CD2AP PIK3R1 TGFB1 PARK7 CCT7 CCT4 CCT2 ATP13A2 CCT6A CCT5 RASSF5 FYN IFI205 FLNA MAPK14 DTX3L PARP1 PKIG LARP7 TRIM8 GSK3B PARP9 SUMO2 CCT3 CCT8"
"2976","GOBP_REGULATION_OF_MONONUCLEAR_CELL_MIGRATION",0.196911196911197,0.561211454121351,0.107554375265169,-0.415850961125838,-1.18248242481562,73,"LGMN AIF1 CSF1R CCR2 CCL5 PYCARD CXCL10 CALR C3AR1 CCL2 DOCK8 LGALS9 ITGA4 LYN ECM1 XCL1 ADAM10 KLRK1 GAS6 WNK1 HMGB1 C1QBP"
"2977","GOBP_HOMEOSTASIS_OF_NUMBER_OF_CELLS",0.138660399529965,0.481527826044366,0.125033367555272,-0.374743846197857,-1.18272287821167,177,"CD74 RPS24 MAFB MEF2C CORO1A RPS6 PRDX2 GPR183 RPS19 MERTK ATPIF1 RPS14 INPP5D STAT1 ANXA1 RPS17 IKZF1 IL7R TMEM14C LGALS9 LYN ZFP36L1 ADGRG1 TNFRSF13B SOX4 ETS1 ARID4A NCKAP1L PIK3CD PRMT1 LPCAT3 HMGB1 SH2B3 CCR7 SASH3 CEBPG MAPK14 ACIN1"
"2978","GOBP_CELLULAR_COMPONENT_MORPHOGENESIS",0.111353711790393,0.441638205343398,0.135740943810425,-0.35805702888368,-1.18317700876904,339,"APOE CSF1R FN1 ACTB LRP1 PLEKHO1 HSP90AB1 SRGAP2 YWHAH TANC2 RHOH STMN1 PMP22 MACF1 PLXNB2 PICALM OPHN1 PID1 GRCC10 RPL24 SGK1 EVL EMB MYCBP2 ITGA4 PIK3R1 TWF2 DPYSL2 NRP1 SNX2 KLK8 CYFIP1 PTPRA ADAM10 MEF2A WASF2 CFL1 FIS1 CNP SLIRP PPP3CA SH3KBP1 NCKAP1L DBNL PIK3CD SNX1 FEZ2 ULK2 TAOK3 TOP2B SCN1B DIP2B ARHGAP4 CLASP2 ARHGDIA FYN SSBP1 OLFM1 RAP2A EEF2K ZSWIM6 CUX1 PPP1R9A CAPN3 GSK3B PTPRO RERE BCL2 BMPR2 ATP8A2 NUMB DICER1 SPTBN1 B4GALT6 WDR1 PRKCA PACSIN2 HPRT ABL1 NRP2 PQBP1 THY1 FLOT1"
"2979","GOBP_ACTIN_FILAMENT_BASED_PROCESS",0.0908130939809926,0.401889598248452,0.149207542435322,-0.352455666487573,-1.18413620060417,421,"AIF1 TMSB10 CSF1R S100A10 ITGB5 TRF BIN1 ACTB CORO1A HSP90B1 PYCARD TMSB4X LRP1 CALR SSH2 F11R VIM EPB41L2 SRGAP2 TGFBR1 RHOH COTL1 BST2 STMN1 CD2AP RHOB OPHN1 CAMK2D FGD2 ANXA1 EVL PREX1 ANG TLN1 FSCN1 PIK3R1 CAPZA2 ACTG1 TWF2 ZYX NRP1 ACTR3 PFN1 MYADM CYFIP1 ATP1A1 ARHGAP17 CNN2 MARCKS CCDC88A ARPC4 MEF2A WASF2 CFL1 MYL6 S1PR1 GPR65 PDLIM4 FCHSD2 ARPC1B SH3KBP1 CACNA1D NCKAP1L SDC4 DBNL ARHGAP25 CAPZB ARPC5L ATP2C1 ARHGDIB MYH9 SCN1B RASA1 CLASP2 ARHGDIA CCR7 FLNA TJP1 RAP1GDS1 ADD3 RDX RAP2A AKAP9"
"2980","GOBP_TISSUE_MORPHOGENESIS",0.103333333333333,0.422680444633603,0.142901149386948,-0.360938977536516,-1.18440293847473,290,"CSF1R MEF2C CTSH RPS7 ACTB CXCL10 TGFBR1 PSME1 PLXNB2 RHOB STAT1 OPHN1 SALL1 TGFBR2 PSMB10 SPINT1 DAB2 PPP1CA PSMB8 ACTG1 PSMB1 TGFB1 PSMB9 NRP1 PSMD6 PFN1 CLTC FOXP1 SOX4 S1PR1 PSMB2 GCNT1 AP2S1 FKBP1A SDC4 PIK3CD SKI PLOD3 KLF4 ARRB2 CLASP2 MMP14 FLNA PSMA4 PRKACB CTNNBIP1 SMAD7 KDM2B PSMC3 PSMD14 BCL2 BMPR2 TMEM100 PTCD2 NPNT MDM4 LRP6 PSMA7 SMAD1 PHB2 PSMA5 AP2M1 PSMB4 WDR1 SH3BP1 PSMC1 PDGFA ARHGAP12 LUZP1 ABL1 NRP2 IFT20 EXT2"
"2981","GOBP_CHEMOKINE_C_X_C_MOTIF_LIGAND_2_PRODUCTION",0.291545189504373,0.642164889439142,0.0913924325943768,-0.575081774025537,-1.18481166051246,12,"CD74 LRP1 FOXP1 KLF4 HMGB1"
"2982","GOBP_DIVALENT_INORGANIC_CATION_HOMEOSTASIS",0.132352941176471,0.471171586715867,0.12563992130984,-0.365775132291128,-1.18497452927172,228,"HEXB CX3CR1 APOE CCL12 CCR2 CCL5 CORO1A HSP90B1 CCR5 MT1 CXCL10 LRP1 CALR C3AR1 CCL2 P2RY6 CCL6 CCL9 SMDT1 CAMK2D TMCO1 GNA15 CD52 CAMK2N1 CYSLTR1 YWHAE HERPUD1 LPAR6 LYN XCL1 CXCR2 BCAP31 CXCL9 S1PR1 1600014C10RIK GPR65 FIS1 SLC8A1 FKBP1A PLCG2 ATP13A2 HMGB1 ATP2C1 MTLN FYN CCR7 PIK3CG ANXA6 MCUB RAP1GDS1 GOT1 CCL7 ATP2A2 MT2 CAPN3 C5AR2 CCDC47 CMKLR1 BCL2 PTPN6 LCK GSTO1 LRP6"
"2983","GOBP_ORGANOPHOSPHATE_ESTER_TRANSPORT",0.199488491048593,0.564388626800969,0.106323255932708,-0.41468448297514,-1.18551782184632,75,"APOE DBI SLC25A5 SLC25A4 APOC2 SCP2 ATP8A1 NPC2 ABCA1 PITPNA PLTP SLC35B2 TRIAP1 ATP8A2 CR1L GLTP APOC1 SLC37A2 ABCD1"
"2984","GOBP_OLIGOSACCHARIDE_METABOLIC_PROCESS",0.239071038251366,0.604721066727449,0.0992333343771191,-0.469570497192639,-1.18565558740723,33,"HEXB MAN2B1 GM2A ST3GAL6 GAL3ST4"
"2985","GOBP_NEUROBLAST_PROLIFERATION",0.255910987482615,0.615927472690269,0.096240602328129,-0.492420974247407,-1.18578009332276,25,"CX3CR1 PLXNB2 DAGLB"
"2986","GOBP_MUSCLE_FILAMENT_SLIDING",0.283604135893649,0.639084514331375,0.0937465422491719,-0.593991819372772,-1.18580804540369,10,"VIM MYL6"
"2987","GOBP_LYMPH_NODE_DEVELOPMENT",0.28029197080292,0.636861111111111,0.0937465422491719,-0.57063233467431,-1.18650048056549,13,"IL7R TGFB1 LTB TNFRSF11A"
"2988","GOBP_EPITHELIAL_TUBE_FORMATION",0.19205298013245,0.55417853781051,0.11101149245045,-0.430379815174024,-1.18706942128071,59,"RPS7 PLXNB2 SPINT1 TGFB1 SOX4 SDC4 PIK3CD SKI PRKACB KDM2B LRP6 LUZP1 ABL1"
"2989","GOBP_CELL_JUNCTION_MAINTENANCE",0.272727272727273,0.629082214856273,0.0937465422491719,-0.52821299796566,-1.18743323280157,17,"CSF1R OPHN1 TJP1 CHCHD10"
"2990","GOBP_REGULATION_OF_RELEASE_OF_SEQUESTERED_CALCIUM_ION_INTO_CYTOSOL",0.234396671289875,0.600622014945304,0.101350743797099,-0.469304899394516,-1.18751036088014,35,"CORO1A CXCL10 P2RY6 CAMK2D LYN XCL1 CXCL9 SLC8A1 FKBP1A CAPN3 PTPN6 GSTO1 ABL1 THY1"
"2991","GOBP_NEGATIVE_REGULATION_OF_PHAGOCYTOSIS",0.264957264957265,0.619303504221736,0.0956031492204301,-0.52396497085408,-1.18783412990436,18,"RACK1 FCGR2B SIRPA CSK HMGB1"
"2992","GOBP_RESPONSE_TO_ENDOPLASMIC_RETICULUM_STRESS",0.128146453089245,0.469626934920604,0.128788713061714,-0.368856992400597,-1.18815644768126,224,"PDIA3 RACK1 ERP29 HSP90B1 CALR SDF2L1 MANF SERINC3 CCL2 SEC61B PDIA6 FCGR2B EEF2 TMCO1 PDIA4 DNAJC3 TLN1 UFC1 PIK3R1 DDRGK1 HERPUD1 XBP1 PARK7 MAN1A SELENOS MYDGF DNAJB11 BCAP31 CCND1 VCP ERLEC1 LPCAT3 SSR1 EXTL3 OS9 SEL1L SERP1 DNAJB14 ATP2A2 AUP1 NUPR1 ERP44 HSPA5 ATF6 GSK3B CCDC47 BCL2 UBAC2 H13 YIF1A RNF139 UGGT1 EIF4G1 FLOT1 RNF5 COPS5 EIF2S1 STT3B BFAR CREB3 UFL1 CANX EDEM2 P4HB PREB TXNDC12 SCAMP5"
"2993","GOBP_POSITIVE_REGULATION_OF_ENDOTHELIAL_CELL_APOPTOTIC_PROCESS",0.285714285714286,0.639913771660725,0.0925528864684773,-0.577030155465967,-1.18882581146284,12,"CCL2 ECSCR PDCD4 ITGA4 H2-M3"
"2994","GOBP_POSITIVE_REGULATION_OF_NUCLEOTIDE_METABOLIC_PROCESS",0.24929178470255,0.61137515842839,0.0988903007520636,-0.499729006187861,-1.18884421434332,24,"TREM2 MT-CO2 TMSB4X PID1 VCP ZBTB20 MLXIPL PRXL2C PFKFB4 GUCA1A"
"2995","GOBP_NEURAL_PRECURSOR_CELL_PROLIFERATION",0.20855614973262,0.575281044902203,0.106323255932708,-0.433903764364948,-1.18916349002706,56,"CX3CR1 PLXNB2 TMEM14C SPINT1 NAP1L1 DAGLB LYN ADGRG1 BTG2 FLNA KDM2B RERE NUMB"
"2996","GOBP_2_OXOGLUTARATE_METABOLIC_PROCESS",0.269005847953216,0.62460503444733,0.096240602328129,-0.587452331533709,-1.18944784410486,11,"IDH2 MRPS36 GOT1 PHYH OGDH IDH1 GOT2 DLST"
"2997","GOBP_REGULATORY_T_CELL_DIFFERENTIATION",0.265912305516266,0.620783779181652,0.0949751525905595,-0.517773940277757,-1.18954250211002,20,"H2-EB1 VSIR LGALS9 LAG3 H2-M3 TNFRSF18 CR1L RUNX1"
"2998","GOBP_MONOAMINE_TRANSPORT",0.271306818181818,0.627681661488991,0.0940503465727813,-0.529323968046526,-1.18993071544541,17,"P2RY12 ACTB PARK7"
"2999","GOBP_POSITIVE_REGULATION_OF_INTERLEUKIN_10_PRODUCTION",0.247875354107649,0.61137515842839,0.0992333343771191,-0.50019737861335,-1.18995846194814,24,"TREM2 PYCARD LGALS9 XCL1 CD34 CD83 HMGB1 SASH3"
"3000","GOBP_PROSTANOID_BIOSYNTHETIC_PROCESS",0.259574468085106,0.61795056899471,0.0965629554309422,-0.521495854507169,-1.19034693312835,19,"CD74 HPGDS FABP5 PTGS1 ANXA1 DAGLB TBXAS1"
"3001","GOBP_REGULATION_OF_PROTEIN_CATABOLIC_PROCESS",0.099889012208657,0.418536045725524,0.14551614609036,-0.363003276955432,-1.19067168029556,286,"CST3 APOE TREM2 CD81 CTSC RPS7 RACK1 RPL11 LAPTM5 LRP1 EEF1A1 HSP90AB1 RPL5 SERPINE2 ATPIF1 ECSCR GPX1 PSME1 CTSA MNDAL RPL23 EIF3H OPHN1 ATRAID CEBPA DAB2 MYCBP2 DDRGK1 HERPUD1 HFE PARK7 NDUFA13 MYLIP TIMP2 BCAP31 TNFSF12 NOP53 VGLL4 VCP SNX1 ATP13A2 CBFA2T3 UQCC2 SNRNP70 FYN CSNK1E IFI205 FLNA GNA12 RDX"
"3002","GOBP_NEGATIVE_REGULATION_OF_MYELOID_LEUKOCYTE_DIFFERENTIATION",0.22841225626741,0.595569524956712,0.103197466945307,-0.478814131045618,-1.19079352425438,31,"C1QC MAFB NME2 INPP5D PIK3R1 NME1 LYN"
"3003","GOBP_ALPHA_AMINO_ACID_BIOSYNTHETIC_PROCESS",0.242134062927497,0.607481290322581,0.0985499803531691,-0.459956396226711,-1.19080963595431,39,"GLUL SERINC3 ASS1 PARK7 PHGDH GLUD1 PLOD3 GOT1 PYCR2 APIP PSAT1 OAT MRI1 MTR ILVBL ASNSD1 PSPH ATP2B4 MTAP GOT2 MTHFR ACCS"
"3004","GOBP_POSITIVE_REGULATION_OF_RELEASE_OF_SEQUESTERED_CALCIUM_ION_INTO_CYTOSOL",0.262108262108262,0.618436695066376,0.096240602328129,-0.525308466412383,-1.19087984854262,18,"CXCL10 P2RY6 XCL1 CXCL9 CAPN3 GSTO1 ABL1 THY1"
"3005","GOBP_REGULATION_OF_MEMBRANE_DEPOLARIZATION",0.264497878359264,0.618907962604771,0.0952879846194844,-0.518400714197701,-1.19098246298675,20,"RACK1 TSPO CAMK2D SCN1B GOT1 PARP1 SMAD7 BCL2 ABCD1 SLMAP"
"3006","GOBP_HYALURONAN_METABOLIC_PROCESS",0.263083451202263,0.618436695066376,0.0956031492204301,-0.518925660989201,-1.19218848451711,20,"HEXB PDGFB HEXA GUSB TGFB1 CLTC"
"3007","GOBP_FOCAL_ADHESION_ASSEMBLY",0.206622516556291,0.574050605752864,0.106323255932708,-0.437306906945216,-1.19264691040168,53,"S100A10 LRP1 MACF1 ACTG1 NRP1 PTPRA SDC4 DUSP3 CLASP2 MMP14 BCL2 ROCK2 LDB1 ABL1 DAPK3 THY1 DUSP22"
"3008","GOBP_RNA_SPLICING",0.09375,0.406495786516854,0.148261500475107,-0.357442091639301,-1.19308861753023,381,"MBNL1 HSPA8 RPS13 SNRPG AHNAK RPS26 CELF2 LSM6 SRSF9 IVNS1ABP SRSF3 QK SNRPF RTRAF HNRNPA2B1 PIK3R1 HNRNPA1 LSM4 SNRPB2 YBX1 RBM3 PNN RTCB CWC15 POLR2E THOC7 NONO LUC7L2 SNRPE PRPF4B PABPC1 LSM7 C1QBP RSRC1 RBM5 POLR2I HNRNPL HNRNPA3 SNRNP70 CWF19L2 U2AF1 SNRPD1 SNW1 HNRNPH1 DHX9 PPIG SNRPA1 ACIN1 PRPF38B ZBTB8OS LARP7 ARL6IP4 TSEN34 DDX39B NUDT21 SRRM2 DDX46 SREK1IP1 SRSF7 HNRNPUL1 RP9 LSM5 TGS1 TIA1 SRSF6 SNRPA DDX17 POLR2J LUC7L3 PTBP1 AQR CPSF2 DDX47 CCAR1 BCAS2 DDX41 PCBP2 PQBP1 DDX1 RBM28 SRSF11 MAGOHB PRPF8 HNRNPR AKAP8L SRRT SFPQ SRSF2 CPSF3 RBM39 ZFP638 THOC1 ZMAT5 FAM98B SNRNP40 ALYREF PRPF19 NCL SCAF11 MTREX HNRNPD RBM4 SYNCRIP CTNNBL1 POLR2L U2AF1L4 CELF1 RBM6 DDX5"
"3009","GOBP_RESPONSE_TO_METAL_ION",0.115116279069767,0.449174641992146,0.138022242496643,-0.374446840581101,-1.1931178408307,192,"C1QA LGMN SPARC CRIP1 MEF2C ARG1 TRF MT1 MT-CYTB CALR MT-CO1 FOS TSPO S100A13 CAMK2D CEBPA ATP5D PPP1CA ASS1 CYB5A HFE PARK7 CCND1 APOBEC1 MEF2A CASP8 BAD PPP3CA ATP13A2 SLC12A2 KHK RASA4 GOT1 EEF2K PARP1 CDK4 ADCY7 MT2 HSPA5 CAPN3 CPNE3 BCL2 NCSTN DTYMK"
"3010","GOBP_REGULATION_OF_NEURON_DIFFERENTIATION",0.183116883116883,0.543977781926811,0.112843355675562,-0.421903942132209,-1.19355321785738,72,"MEF2C BIN1 ZFHX3 CALR TCF4 YWHAH DPYSL2 TIMP2"
"3011","GOBP_REGULATION_OF_MITOCHONDRIAL_OUTER_MEMBRANE_PERMEABILIZATION_INVOLVED_IN_APOPTOTIC_SIGNALING_PATHWAY",0.227146814404432,0.593875038473376,0.103197466945307,-0.474178302040739,-1.19361794644645,34,"SLC25A5 YWHAH ATPIF1 NMT1 YWHAE YWHAB YWHAQ CASP8 BAD GZMB GSK3B BCL2 ACAA2 CHCHD10 YWHAZ PPP3R1"
"3012","GOBP_CELL_MORPHOGENESIS",0.061909758656873,0.342421949720467,0.183023938384487,-0.354326939787124,-1.19400098382468,495,"HEXB SPARC APOE CSF1R S100A10 MEF2C FN1 ACTB CORO1A LRP1 CALR PLEKHO1 F11R HSP90AB1 SRGAP2 YWHAH TANC2 CCL2 MERTK RHOH STMN1 MACF1 PLXNB2 RHOB PICALM OPHN1 GRCC10 S100A13 RPL24 FGD2 SGK1 ANXA1 IL7R PSMB10 EVL EMB PREX1 MYCBP2 ITGA4 PIK3R1 FERMT3 TWF2 DPYSL2 NRP1 SNX2 KLK8 MYADM CYFIP1 PTPRA ADAM10 MEF2A WASF2 CFL1 CDC42SE1 ARHGAP15 CNP PPP3CA SH3KBP1 NCKAP1L DBNL PIK3CD ITGB7 SNX1 CAPZB PLOD3 FEZ2 ULK2 TAOK3 C1QBP TOP2B MYH9 SCN1B DIP2B RASA1 ARHGAP4 LPXN ARHGDIA FYN FLNA RP2 MAPK14 OLFM1 RDX RAP2A EEF2K ZSWIM6 CCL7 CUX1 PPP1R9A GSK3B PTPRO MKLN1 RERE BCL2 BMPR2 PTPN6 ATP8A2 LIMD1 ILK NUMB FES DICER1 SPTBN1 PHIP B4GALT6 ARPC2 WDR1 PRKCA PACSIN2 HPRT EPB41 ABL1 NRP2 PQBP1 DAPK3 THY1 FLOT1"
"3013","GOBP_INTRINSIC_APOPTOTIC_SIGNALING_PATHWAY_BY_P53_CLASS_MEDIATOR",0.203973509933775,0.570800416848758,0.107140237276725,-0.437921826186938,-1.19432395122162,53,"CD74 RPS7 RPL11 PYCARD RPL26 SHISA5 HINT1"
"3014","GOBP_IMMUNOGLOBULIN_PRODUCTION",0.190537084398977,0.551599856485861,0.109250039480711,-0.416642998519597,-1.1943980581425,76,"H2-AB1 H2-EB1 IGKC FCGR2B SAMHD1 CD86 TGFB1 XBP1 XCL1 IL4RA H2-T23 SASH3 TNFSF13 VPREB3 PKN1 HSPD1"
"3015","GOBP_INTRACELLULAR_LIPID_TRANSPORT",0.222841225626741,0.591454341217167,0.104732821580651,-0.480368523464944,-1.19465924230042,31,"SCP2 PIP4K2A NPC2 ABCA1 ABCD2 LRP6 SGPP1 MID1IP1 THRSP RELCH ABCD1 ABCD3"
"3016","GOBP_REGULATION_OF_MUSCLE_CELL_DIFFERENTIATION",0.181818181818182,0.540968668956333,0.11331290842208,-0.422563773815454,-1.19541986130423,72,"MEF2C TMEM119 RGS2 CAMK1 PDGFB BHLHE41 PDCD4 TGFB1 XBP1 MEF2A ARRB2 MMP14 MAPK14 NFATC1 DDX39B ANKRD17 BCL2 PTBP1"
"3017","GOBP_POSITIVE_REGULATION_OF_CELL_DIFFERENTIATION",0.0737618545837724,0.368713726475101,0.166933848713193,-0.355276528301483,-1.19566554629136,437,"CD74 CX3CR1 H2-EB1 TREM2 S100A10 MEF2C TMEM119 FN1 BIN1 NME2 LRP1 CALR F11R HSP90AB1 CAMK1 TCF4 TGFBR1 SERPINE2 RHOH PF4 GNAS MACF1 PLXNB2 FOS TSPO INPP5D STAT1 CD86 ATRAID VSIR ANXA1 IL7R TGFBR2 PREX1 CEBPA LGALS9 SPINT1 DAB2 NAP1L1 IL6RA TGFB1 TWF2 XBP1 LYN RIN2 ZFP36L1 NRP1 RPS6KA1 IFITM1 CD34 MYADM CYFIP1 MSR1 TIMP2 IL6ST CXCL9 MEF2A SOX4 ETS1 H2-M3 CASP8 CD83 IL4RA GAS6 RUNX3 BAD NCKAP1L CLIC1 DBNL PRMT1 HMGB1 ARRB2 C1QBP ARHGDIA MMP14 CSNK1E SASH3 FAIM FLNA SNW1 MAPK14 OLFM1 IL18 EEF2K ACIN1 PARP1 CUX1 DDX39B ZBTB1 NUDT21 CTNNBIP1 SMAD7 TCF12 CMKLR1 BCL2 BMPR2 TMEM100 NPNT TCF7L2 ILK NUMB ASXL2 FES DICER1 SMAD1 ARPC2 CR1L RUNX1 PRKCA"
"3018","GOBP_CELL_RECOGNITION",0.189081225033289,0.549446120032727,0.112378519110475,-0.435071493293779,-1.19611079145426,57,"CD81 IGKC IGHM TRBC2 DOCK8 EMB TRBC1 CCT7 CADM1 CCT4 HAVCR2 CCT2 IGLC1 CCT5 CCR7 TNFRSF21"
"3019","GOBP_PYROPTOSIS",0.268613138686131,0.624444639873362,0.096240602328129,-0.575606646653868,-1.19684343380454,13,"GZMA CASP8 GZMB DHX9 ZBP1 NAIP2 APIP GSDMD"
"3020","GOBP_DETECTION_OF_MOLECULE_OF_BACTERIAL_ORIGIN",0.267355982274742,0.622647396257228,0.0972150808846466,-0.599540773942502,-1.19688563057871,10,"TREM2"
"3021","GOBP_REGULATION_OF_PEPTIDE_SECRETION",0.139451728247914,0.481527826044366,0.12563992130984,-0.386423704283451,-1.19744394858132,151,"CD74 H2-EB1 APOE TREM2 ERP29 CCL5 UCP2 LRP1 SLC25A5 SLC25A4 FRMD4A CD2AP AIMP1 ANXA1 ANG CAMK2N1 OXCT1 TGFB1 PPIA HFE GLUD1 SOX4 BAD PPP3CA CACNA1D ATP13A2 SLC12A2 UQCC2"
"3022","GOBP_REGULATION_OF_POLYSACCHARIDE_METABOLIC_PROCESS",0.246175243393602,0.610349099791753,0.0985499803531691,-0.49728285568922,-1.19748780386171,25,"PDGFB PPP1CA TGFB1 SELENOS CLTC HMGB1 KHK GSK3B"
"3023","GOBP_REGULATION_OF_ANATOMICAL_STRUCTURE_SIZE",0.0970982142857143,0.411760449372057,0.148261500475107,-0.366271389842789,-1.19797986365366,271,"APOE TMSB10 FN1 BIN1 CORO1A PYCARD TMSB4X RGS2 LRP1 SSH2 LAMTOR4 HSP90AB1 COTL1 GPX1 MACF1 PICALM DOCK4 IL7R EVL PREX1 PPP1CA CAPZA2 TWF2 SCPEP1 DPYSL2 NRP1 ACTR3 PFN1 TMEM123 MYADM CYFIP1 ARPC4 WASF2 SLC8A1 HP1BP3 FCHSD2 ARPC1B NCKAP1L SLC12A9 DBNL ATP13A2 CAPZB PLOD3 ARPC5L SLC12A2 DIP2B RASA1 ARHGAP4 CCR7 CLN8 RAP1GDS1 ADD3 OLFM1 RDX"
"3024","GOBP_REGULATION_OF_WNT_SIGNALING_PATHWAY",0.109302325581395,0.437658021121905,0.142056643575821,-0.373686200075953,-1.19808091322872,211,"APOE RACK1 LRP1 PSME1 MACF1 TLE5 SALL1 PSMB10 DAB2 PPP1CA PSMB8 PSMB1 TGFB1 PSMB9 HHEX PSMD6 TLE4 SOX4 VGLL4 PSMB2 VCP WNK1 SKI RNF213 IGFBP6 CSNK1E MAPK14 NFATC1 PSMA4 LRRK1 TNKS2 CTNNBIP1 GSK3B PTPRO PSMC3 FAM53B TBL1XR1 PSMD14 UBAC2 CHD8 TCF7L2 LIMD1 LRP6 ILK CTDNEP1 PSMA7 CCNY WLS USP8 PSMA5 PSMB4 RUNX1 MBD2 PSMC1 ABL1 CTNND1 IFT20 DAPK3 TAX1BP3 HDAC1 TMEM64 APC 2210016L21RIK"
"3025","GOBP_PROTEIN_MATURATION_BY_IRON_SULFUR_CLUSTER_TRANSFER",0.25214899713467,0.613284385007191,0.0988903007520636,-0.560736250173662,-1.19830530100222,14,"CIAO2A GLRX3 CIAO2B NFU1 GLRX5 BOLA2 ISCA2"
"3026","GOBP_NEGATIVE_REGULATION_OF_IMMUNE_EFFECTOR_PROCESS",0.18437900128041,0.545224954744139,0.11146266692298,-0.417315443999287,-1.1991952152629,78,"CCR2 ARG1 GRN RPS19 BST2 FCGR2B KLRD1 FGL2 ANXA1 IL7R LGALS9 TGFB1 CUEDC2 HFE XCL1 H2-M3 IL4RA H2-T23 HAVCR2 ARRB2 C1QBP"
"3027","GOBP_AMINOGLYCAN_CATABOLIC_PROCESS",0.229166666666667,0.596081217803659,0.102821842840815,-0.484280029942191,-1.20042709346787,29,"HEXB HEXA GUSB ARSB FUCA1 SDC3 TGFB1"
"3028","GOBP_REGULATION_OF_ATP_METABOLIC_PROCESS",0.178481012658228,0.53851307884918,0.112843355675562,-0.414906657913337,-1.20044372310842,82,"TREM2 MT-CO2 TMSB4X ATPIF1 TSPO PID1 COX7A2L DNAJC15 FIS1 VCP CBFA2T3 UQCC2 ZBTB20 PARP1 NUPR1 MLXIPL PRXL2C NCOR1"
"3029","GOBP_REGULATION_OF_ANATOMICAL_STRUCTURE_MORPHOGENESIS",0.0536277602523659,0.324881517761193,0.197822021315103,-0.356398783456532,-1.20053212160282,497,"CST3 HEXB CX3CR1 SPARC CSF1R S100A10 MEF2C CTSH CCR2 FN1 GRN RACK1 CORO1A GLUL CXCL10 LRP1 CALR PLEKHO1 F11R C3AR1 YWHAH TANC2 CCL2 RHOH PF4 ANXA3 ECSCR PSME1 MACF1 PLXNB2 PDE3B RHOB STAT1 PID1 S100A13 FGD2 ANXA1 LRG1 TGFBR2 PSMB10 PREX1 STAB1 DAB2 SP100 PSMB8 PSMB1 TGFB1 TWF2 XBP1 PSMB9 HHEX NRP1 PSMD6 ECM1 PFN1 MYDGF CD34 MYADM CYFIP1 CLTC ADAM10 FOXP1 CFL1 ETS1 H2-M3 CDC42SE1 ARHGAP15 FIS1 TNFSF12 PSMB2 PPP3CA AP2S1 SH3KBP1 EPN1 DBNL PIK3CD CAPZB KLF4 HMGB1 ARRB2 SLC12A2 C1QBP MYH9 DIP2B RASA1 ARHGAP4 CLASP2 ARHGDIA FYN GTF2I FLNA TJP1 PSMA4 RDX RAP2A EEF2K TLR3 CCL7 CUX1 PPP1R9A S100A1 PKN1 GSK3B PSMC3 SPRED1 MKLN1 PSMD14 STAT2 BMPR2 VEGFB LIMD1 ILK EMC10 PSMA7 SPIRE1 FES PHIP SMAD1 PHB2 PSMA5 ARPC2 AP2M1 PSMB4 RUNX1 ROCK2 WDR1 PRKCA SYNJ2BP EPB41 PSMC1 ADAMTS1 PDGFA ABL1 STIM1 PQBP1 DAPK3 THY1"
"3030","GOBP_COGNITION",0.153186274509804,0.502703054777568,0.120985142145252,-0.398577916261112,-1.20066416391175,115,"CX3CR1 LGMN APOE MEF2C FOS GM2A PICALM GRCC10 SGK1 GATM ARL6IP5 TIFAB ATP8A1 KLK8 CYFIP1"
"3031","GOBP_MRNA_TRANSPORT",0.149817295980512,0.497971529017049,0.122107920287081,-0.396779547180872,-1.20277682842634,120,"SRSF9 SRSF3 QK SARNP HNRNPA2B1 HNRNPA1 G3BP2 ZFP36L1 CETN3 HHEX THOC7 CETN2 EIF5A U2AF1 DHX9 ENY2 DDX39B SRSF7 SRSF6 CPSF2 SRSF11 MAGOHB AKAP8L SEC13 SRSF2 CPSF3 THOC1 ALYREF"
"3032","GOBP_DEOXYRIBONUCLEOSIDE_TRIPHOSPHATE_METABOLIC_PROCESS",0.263848396501458,0.618436695066376,0.0972150808846466,-0.583923323660399,-1.20302745447,12,"SAMHD1 DTYMK DGUOK DUT TYMS DCTPP1 ADK ITPA NUDT1 CMPK2 NUDT16"
"3033","GOBP_REGULATION_OF_PROTEIN_LOCALIZATION_TO_MEMBRANE",0.147741147741148,0.494538286913858,0.123257226381337,-0.394749393915524,-1.20305608908502,127,"TREM2 CD81 RACK1 ACTB LRP1 YWHAH ITGAM PICALM PID1 NMT1 DAB2 YWHAE PIK3R1 TGFB1 TMEM59 YWHAB YWHAQ CSK ZMYND8 CLTC ADAM10 CASP8 FIS1 BAD GZMB MMP14 FYN"
"3034","GOBP_LIPOPROTEIN_BIOSYNTHETIC_PROCESS",0.1796875,0.539202225894246,0.114266502484433,-0.429452762976249,-1.20316036291541,66,"APOE GLUL DBI NMT1 DPM3"
"3035","GOBP_CARDIAC_VENTRICLE_MORPHOGENESIS",0.237960339943343,0.604535188835655,0.101713902282311,-0.506121884395238,-1.20405272971012,24,"MEF2C TGFBR1 TGFBR2 TGFB1 SOX4 FKBP1A SMAD7 PTCD2"
"3036","GOBP_NUCLEOTIDE_TRANSMEMBRANE_TRANSPORT",0.252923976608187,0.613284385007191,0.0999276973731092,-0.595579009490757,-1.20590238697901,11,"SLC25A5 SLC25A4 SLC35B2 SLC25A17 SLC25A36"
"3037","GOBP_REGULATION_OF_CELL_MORPHOGENESIS_INVOLVED_IN_DIFFERENTIATION",0.170666666666667,0.528149692595563,0.119348440591015,-0.43881947329491,-1.20602033452783,58,"S100A10 CALR PREX1 NRP1 MYADM DBNL C1QBP FLNA EEF2K CUX1 ILK ARPC2 ABL1 P4HB TESK1 RREB1 DNM1L ACTR2"
"3038","GOBP_RUFFLE_ORGANIZATION",0.235294117647059,0.601837578826029,0.10027910675413,-0.465921436237579,-1.20625289792885,39,"AIF1 P2RY12 CSF1R EVL PFN1 CYFIP1 DBNL CCR7 RDX"
"3039","GOBP_NEGATIVE_REGULATION_OF_COAGULATION",0.256011315417256,0.615927472690269,0.0972150808846466,-0.525178821335908,-1.20655459958448,20,"APOE SERPINE2 PDGFB PROS1 CD34 SH2B3 USF1"
"3040","GOBP_PROTEIN_LOCALIZATION_TO_NUCLEOLUS",0.252923976608187,0.613284385007191,0.0999276973731092,-0.596206091087237,-1.20717207442934,11,"GLUL NOP53 RAN WRN NMD3 RPF2"
"3041","GOBP_REGULATION_OF_RECEPTOR_MEDIATED_ENDOCYTOSIS",0.175765645805593,0.53629681017418,0.117249716749792,-0.436953126303605,-1.20726504014096,61,"TRF BMP2K CD2AP APOC2 LRPAP1 PICALM OPHN1 PPT1 DAB2 HFE PLCG2 ARRB2"
"3042","GOBP_POSTTRANSCRIPTIONAL_REGULATION_OF_GENE_EXPRESSION",0.0524658971668416,0.321340674850349,0.199915231309662,-0.358367581948261,-1.2082334759082,482,"RPS4X NPM1 RACK1 HSPA8 CCL5 RGS2 RPS27A CALR RPL13A RPL10 RPS3 VIM RPL22 RPL26 RPL5 EIF3E UBA52 RPL30 RPS9 RPS14 PSME1 RPL38 PLXNB2 QK EIF3H EEF2 SARNP PSMB10 ANG HNRNPA2B1 DNAJC3 TENT5A EIF3C PPP1CA PSMB8 PSMB1 TGFB1 YWHAB ZFP36L2 PSMB9 ZFP36L1 SERBP1 PSMD6 RPS6KA1 YBX1 RBM3 CYFIP1 ZFP706 PURA SOX4 POLR2E TUT4 EIF3K EIF5A BTG2 PSMB2 PABPC1 PPP3CA CNOT6L GZMB SRP9 UQCC2 C1QBP EXOSC8 POLR2I EIF5B YBX3 HELZ DNAJC1 TNFSF13 EPRS GSPT1 MAPK14 PSMA4 DHX9 SET EIF2A CDK4 DDX39B NUDT21 EIF4B TCOF1 PARP9 PSMC3 TIA1 TNRC6B CNOT2 PSMD14 POLR2J LIMD1 PLD1 PSMA7 NCOR1 APEX1 DICER1 SMAD1 PSMA5 SELENOT EIF4G3 PSMB4 ROCK2 TENT5C CNBP YWHAZ PRKCA TAF15 MKNK1 DCP2 RNF139 PSMC1 EIF4EBP2 EIF4E2 RPS27L EIF4G1 TNRC6C NCOR2 PA2G4 DAPK3 NEMF DDX1 RAN HNRNPR SRRT SEC13 EIF2S1 DNAJC24 ZCCHC17 SECISBP2L EIF2AK2 PUM1 COA3 RNASEL BANK1 MAPK3 PSMD12 AGO1 NCL RPS6KA3 HNRNPD PSMC5 RBM4 SYNCRIP LARP1 TSN TSNAX POLR2L STAT3 EIF3D"
"3043","GOBP_MEMBRANE_RAFT_ORGANIZATION",0.249287749287749,0.61137515842839,0.0992333343771191,-0.533374041674125,-1.2091645929552,18,"S100A10 PPT1 MYADM CD2 PACSIN2 DOCK2 FLOT1 RFTN1 NAXE"
"3044","GOBP_REGULATION_OF_PROTEIN_EXIT_FROM_ENDOPLASMIC_RETICULUM",0.251768033946252,0.613284385007191,0.0982123351217438,-0.526521765810403,-1.20963990266005,20,"CD81 BCAP31 ERLEC1 OS9 UBAC2"
"3045","GOBP_TELOMERASE_RNA_LOCALIZATION",0.248579545454545,0.61137515842839,0.0992333343771191,-0.538209784967607,-1.20990620706208,17,"CCT7 CCT4 CCT2 CCT6A CCT5 CCT3 CCT8 DCP2 DKC1 RUVBL1 TCP1"
"3046","GOBP_RNA_SPLICING_VIA_TRANSESTERIFICATION_REACTIONS",0.0774336283185841,0.377686045234172,0.166933848713193,-0.368240838077267,-1.21028054890215,305,"MBNL1 HSPA8 SNRPG CELF2 LSM6 SRSF9 SRSF3 QK SNRPF HNRNPA2B1 HNRNPA1 LSM4 SNRPB2 YBX1 RBM3 PNN CWC15 POLR2E NONO LUC7L2 SNRPE PRPF4B PABPC1 LSM7 C1QBP RSRC1 RBM5 POLR2I HNRNPL HNRNPA3 SNRNP70 CWF19L2 U2AF1 SNRPD1 SNW1 HNRNPH1 DHX9 SNRPA1 LARP7 DDX39B NUDT21 SRRM2 DDX46 SRSF7 HNRNPUL1 LSM5 TGS1 TIA1 SRSF6 SNRPA DDX17 POLR2J LUC7L3 PTBP1 AQR CPSF2 CCAR1 BCAS2 DDX41 PCBP2 PQBP1 DDX1 SRSF11 MAGOHB PRPF8 HNRNPR SRRT SFPQ SRSF2 CPSF3 RBM39 ZMAT5 SNRNP40 ALYREF PRPF19 NCL SCAF11 MTREX HNRNPD RBM4 SYNCRIP CTNNBL1 POLR2L U2AF1L4 CELF1 RBM6 DDX5 SNRPD2 PDCD7 PPIL3 MAGOH SRPK1"
"3047","GOBP_REGULATION_OF_LEUKOCYTE_CHEMOTAXIS",0.173299101412067,0.532029620007292,0.115734447701689,-0.424959878673998,-1.21044072919354,74,"CD74 LGMN AIF1 CSF1R CCR2 CCL5 CXCL10 CALR C3AR1 CCL2 MTUS1 LGALS9 IL6RA LYN XCL1 ADAM10 KLRK1 CAMK1D GAS6 WNK1 NCKAP1L HMGB1 C1QBP"
"3048","GOBP_PYRIMIDINE_NUCLEOSIDE_TRIPHOSPHATE_METABOLIC_PROCESS",0.246438746438746,0.610349099791753,0.0999276973731092,-0.533965956508402,-1.21050647014406,18,"NME2 NME1 DTYMK DUT TYMS DCTPP1"
"3049","GOBP_SENSORY_SYSTEM_DEVELOPMENT",0.138888888888889,0.481527826044366,0.126875729929857,-0.395266389869656,-1.21245602961529,133,"C1QA P2RY12 MAF VIM MERTK TGFBR1 CRYBB1 ITGAM GRCC10 RPL24 TGFBR2 NRP1 CRYBA4 SKI KLF4 HMGB1 XRN2 RAB3GAP1 CLN8 CDK4 ATF6 KDM2B SPRED1 ACTL6A BCL2 BMPR2 ATP8A2 LRP6 LPCAT1 THY1 SERPINF1 FKBP8 HDAC1 HIPK2"
"3050","GOBP_MULTICELLULAR_ORGANISMAL_SIGNALING",0.165333333333333,0.519464119739752,0.121543282035469,-0.439780702414655,-1.21294501431969,60,"BIN1 CAMK2D YWHAE ATP1A1 ASPH MEF2A S1PR1 SLC8A1 CACNA1D SCN1B FLNA AKAP9 ATP2A2 KCNK6"
"3051","GOBP_DETECTION_OF_OTHER_ORGANISM",0.222849083215797,0.591454341217167,0.105520936843198,-0.547983385091027,-1.21298416205358,16,"H2-EB1 H2-M3 H2-T23 NAIP2 H2-Q7"
"3052","GOBP_IRES_DEPENDENT_VIRAL_TRANSLATIONAL_INITIATION",0.251461988304094,0.613284385007191,0.10027910675413,-0.599331928314731,-1.21350113323409,11,"EIF3F MCTS1 SSB PTBP1 PCBP2 EIF3D"
"3053","GOBP_ICOSANOID_BIOSYNTHETIC_PROCESS",0.214484679665738,0.583601684918607,0.107140237276725,-0.497835491327126,-1.21368033667093,27,"CD74 LTC4S HPGDS FABP5 PTGS1 ANXA1 DAGLB TBXAS1"
"3054","GOBP_DENDRITIC_CELL_CYTOKINE_PRODUCTION",0.249271137026239,0.61137515842839,0.100633389423036,-0.589115023520004,-1.21372364901027,12,"BST2 SCIMP TLR3 DHX36 DDX21 MAVS DDX58 JAK3"
"3055","GOBP_NEGATIVE_REGULATION_OF_CELL_CELL_ADHESION",0.143396226415094,0.488407800296425,0.127505315300183,-0.409425494255682,-1.21378897398444,104,"CD74 H2-EB1 ARG1 LAPTM5 TNFAIP8L2 PRDX2 SERPINE2 FCGR2B CD86 VSIR FGL2 ANXA1 LGALS9 ASS1 LAG3 TGFB1 HFE PAG1 XCL1 MYADM H2-M3 IL4RA RUNX3 HAVCR2 WNK1 SDC4 DUSP3 KLF4 HMGB1"
