"","pathway","pval","padj","log2err","ES","NES","size","leadingEdge"
"1","WP_ELECTRON_TRANSPORT_CHAIN_OXPHOS_SYSTEM_IN_MITOCHONDRIA",0.000206901432890571,0.00680099225977718,0.518848077743792,0.49472491705566,2.0114379837224,47,"UCP2 COX6C NDUFA8 NDUFB7 SLC25A5 ATP5L NDUFS5 ATP5E COX6B1 ATP5C1 ATP5J COX6A1 UQCR11 ATP5H NDUFB8 NDUFA3 NDUFS6 NDUFB4 NDUFA4 COX7B MT-CO1 NDUFS7 COX5B ATP5J2 ATP5G3"
"2","REACTOME_RESPIRATORY_ELECTRON_TRANSPORT_ATP_SYNTHESIS_BY_CHEMIOSMOTIC_COUPLING_AND_HEAT_PRODUCTION_BY_UNCOUPLING_PROTEINS",0.00020476946467385,0.00680099225977718,0.518848077743792,0.473399099591132,1.95146267717026,52,"UCP2 NDUFB11 COX6C NDUFA8 NDUFB7 ATP5L NDUFS5 ATP5E COX6B1 ATP5C1 ATP5J COX6A1 UQCR11 ATP5H NDUFB8 NDUFA3 NDUFS6 NDUFA13 NDUFB4 NDUFA4 COX7B ETFB MT-CO1 NDUFS7 COX5B ATP5J2 ATP5G3 UQCRB COQ10B NDUFA11 SDHB UQCRH NDUFB5 NDUFB3"
"3","REACTOME_EPH_EPHRIN_SIGNALING",0.00211062923910764,0.0333792105592208,0.431707695803346,0.570501896320524,1.92772205598239,22,"MMP9 ACTB MYH9 ARPC1B ARPC2 ACTG1 MYL6 ARPC5 LYN PAK2 ACTR3 AP2S1 MYL12B ARPC4 ADAM10"
"4","WP_OXIDATIVE_PHOSPHORYLATION",0.00268721553795871,0.0417251285348497,0.431707695803346,0.552571222757811,1.88894932041872,23,"NDUFA8 NDUFB7 ATP5L NDUFS5 ATP5E ATP5J ATP5H NDUFB8 NDUFA3 NDUFS6 NDUFB4 NDUFA4 NDUFS7 ATP5J2 ATP5G3"
"5","REACTOME_IMMUNOREGULATORY_INTERACTIONS_BETWEEN_A_LYMPHOID_AND_A_NON_LYMPHOID_CELL",0.00479674240536035,0.0553570001915911,0.407017918923954,0.479880402976345,1.83509848424718,35,"IFITM1 PILRA H2-Q10 CD300LD PIRB CD33 SELL HCST SIGLECF JAML TYROBP CD300LF PILRB2 ITGA4 CD300LB SIGLECE FCGR4"
"6","REACTOME_PARASITE_INFECTION",0.00608645710027717,0.0641707946127989,0.407017918923954,0.539990069214221,1.82462279818765,22,"ACTB MYH9 ARPC1B FGR WIPF1 ARPC2 ACTG1 WAS FCGR4 ARPC5 LYN BRK1 ACTR3 ARPC4 GRB2 ARPC3 CDC42 MAPK1"
"7","REACTOME_EXTRA_NUCLEAR_ESTROGEN_SIGNALING",0.00760297828350821,0.0733132099744549,0.407017918923954,0.554243756461603,1.797022284819,19,"MMP9 FOS GNG10 GNGT2 GNAI2 CDKN1B GNG2"
"8","PID_IL6_7_PATHWAY",0.0069659589642689,0.0708205828034005,0.407017918923954,0.562676634964967,1.78889348603432,17,"CEBPD FOS SOCS3 IL6RA JUNB STAT3"
"9","REACTOME_ANTIMICROBIAL_PEPTIDES",0.00971806945275665,0.082170607055982,0.380730400722792,0.6412909966784,1.77229561024098,11,"CAMP PGLYRP1 S100A9 LTF S100A8"
"10","REACTOME_RHO_GTPASES_ACTIVATE_WASPS_AND_WAVES",0.00935731103918656,0.0816541538055673,0.380730400722792,0.550261205142872,1.74942164705091,17,"ACTB ARPC1B WIPF1 ARPC2 ACTG1 WAS ARPC5 BRK1 ACTR3 ARPC4 GRB2 ARPC3 CDC42 MAPK1"
"11","KEGG_REGULATION_OF_ACTIN_CYTOSKELETON",0.00403394994805178,0.0513002579466343,0.407017918923954,0.425171390589412,1.74805310405418,49,"ACTB SSH2 TMSB4X PFN1 GSN MYH9 ARPC1B ITGAM ITGA4 ACTN1 RAC2 ARPC2 ACTG1 WAS ARHGEF1 IQGAP1 PPP1CA CSK ARPC5 PIP4K2A PIK3CD ITGAL PPP1R12A PAK2 BRK1"
"12","KEGG_PARKINSONS_DISEASE",0.00587047645178437,0.0634605935420741,0.407017918923954,0.431661059987552,1.7379477516712,45,"COX6C NDUFA8 NDUFB7 SLC25A5 NDUFS5 ATP5E COX6B1 ATP5C1 ATP5J COX6A1 UQCR11 ATP5H NDUFB8 NDUFA3 NDUFS6 NDUFB4 NDUFA4 COX7B MT-CO1 NDUFS7 COX5B ATP5G3 UQCRB SDHB UQCRH NDUFB5 NDUFB3"
"13","WP_MYOMETRIAL_RELAXATION_AND_CONTRACTION_PATHWAYS",0.0114233724751942,0.0920335857907157,0.380730400722792,0.451897128929981,1.72552544847442,34,"IGFBP6 FOS RGS2 ACTB IL1B ARRB2 CNN2 RGS19 RGS3 ACTG1 RGS10 GNG2"
"14","REACTOME_RHO_GTPASE_EFFECTORS",0.00314934410589217,0.0463713770074468,0.431707695803346,0.402186395604738,1.72160287432492,59,"S100A9 ACTB S100A8 PFN1 MYH9 ARPC1B NCF2 DYNLL1 RAC2 WIPF1 ARPC2 CDKN1B ACTG1 WAS MYL6 PPP2R5C IQGAP1 ARPC5 PMF1 FLNA PKN1 FMNL1 PPP1R12A PAK2 BRK1 ACTR3 YWHAH H3F3B MYL12B BUB3 ARPC4"
"15","REACTOME_THE_CITRIC_ACID_TCA_CYCLE_AND_RESPIRATORY_ELECTRON_TRANSPORT",0.00338723878557105,0.0471896938006972,0.431707695803346,0.389655604674627,1.70288554946116,64,"UCP2 NDUFB11 MPC1 COX6C NDUFA8 NDUFB7 MDH2 ATP5L NDUFS5 MPC2 ATP5E COX6B1 ATP5C1 ATP5J COX6A1 UQCR11 ATP5H NDUFB8 NDUFA3 NDUFS6 NDUFA13 NDUFB4 NDUFA4 COX7B ETFB MT-CO1 NDUFS7 COX5B ATP5J2 ATP5G3 UQCRB SUCLG1 IDH3G COQ10B NDUFA11 SDHB UQCRH NDUFB5 NDUFB3"
"16","REACTOME_COMPLEX_I_BIOGENESIS",0.0155721045527191,0.107371682623778,0.380730400722792,0.523060247638805,1.69591612057248,19,"NDUFB11 NDUFA8 NDUFB7 NDUFS5 NDUFB8 NDUFA3 NDUFS6 NDUFA13 NDUFB4 NDUFS7 NDUFA11 NDUFB5 NDUFB3 NDUFB9 NDUFV2"
"17","REACTOME_G_ALPHA_Z_SIGNALLING_EVENTS",0.0163590356027547,0.108299351974825,0.352487857583619,0.63942095862201,1.69308510980338,10,"GNG10 RGS19 GNGT2 GNAI2 GNG2 GNB2"
"18","REACTOME_RESPIRATORY_ELECTRON_TRANSPORT",0.00807423726802318,0.0749499850749108,0.380730400722792,0.424815105610967,1.68741007995032,42,"NDUFB11 COX6C NDUFA8 NDUFB7 NDUFS5 COX6B1 COX6A1 UQCR11 NDUFB8 NDUFA3 NDUFS6 NDUFA13 NDUFB4 NDUFA4 COX7B ETFB MT-CO1 NDUFS7 COX5B UQCRB COQ10B NDUFA11 SDHB UQCRH NDUFB5 NDUFB3"
"19","KEGG_WNT_SIGNALING_PATHWAY",0.0126526532347954,0.097456284372435,0.380730400722792,0.51392186255631,1.67836900784808,20,"CCND3 CTNNBIP1 PPP3CA RAC2 TBL1XR1 PPP2R5C CCND2 GSK3B CHD8 NFATC1"
"20","WP_NEURAL_CREST_CELL_MIGRATION_IN_CANCER",0.0183164819278296,0.116268631281441,0.352487857583619,0.633309710557358,1.67690349585867,10,"MMP9 FOS MMP8 STAT3 PIK3CD PAK2"
"21","REACTOME_MRNA_SPLICING",0.0171609491126936,0.111873668261377,0.352487857583619,0.462729667110018,1.66989618546681,27,"SNRPG SRSF5 POLR2J SYF2 LSM6 U2AF1 DDX5 HNRNPU SF3B2 DDX46 RBM5 SNW1 BCAS2 POLR2E SF3B5 HNRNPUL1 HNRNPL PRPF8 LSM4 POLR2F MAGOH CASC3 DHX38 POLR2B CPSF2 SART1"
"22","REACTOME_FCGAMMA_RECEPTOR_FCGR_DEPENDENT_PHAGOCYTOSIS",0.0187373065122678,0.116800436215159,0.352487857583619,0.454243075369321,1.66918806101037,28,"ACTB MYH9 ARPC1B FGR FCGR3 WIPF1 ARPC2 ACTG1 WAS FCGR4 ARPC5 LYN BRK1 ACTR3 ARPC4 PLCG2 GRB2 ARPC3 CDC42 MAPK1 PIK3R1 CFL1"
"23","PID_IL8_CXCR2_PATHWAY",0.0360945965961981,0.167526008114963,0.321775918075361,0.54404945513453,1.65216939488297,15,"CXCR2 FGR ARRB2 RAC2 GNAI2 GNG2 LYN"
"24","REACTOME_RAC1_GTPASE_CYCLE",0.0108486967733754,0.0894063510573786,0.380730400722792,0.410154033907049,1.65135646261023,45,"ARHGAP45 LBR NCF2 PREX1 ARHGAP25 ARHGAP15 ARHGAP9 RALBP1 ARAP3 WIPF1 WAS DOCK8 ARHGAP30 TMPO SNAP23 IQGAP1 GMIP GIT2 ARHGDIB ARHGAP5 PKN1 FMNL1 PAK2 BRK1"
"25","REACTOME_SENSORY_PROCESSING_OF_SOUND",0.0181133416476688,0.116268631281441,0.352487857583619,0.565956491765123,1.64440858588204,13,"ACTB GSN MYH9 TWF2 ACTG1 CAPZB CAPZA1 RIPOR2"
"26","REACTOME_CDC42_GTPASE_CYCLE",0.011865561518203,0.0938258290420867,0.380730400722792,0.418264898969548,1.63560462907376,38,"ARHGAP45 LBR PREX1 ARHGAP9 RALBP1 ARAP3 WIPF1 WAS DOCK8 ARHGAP30 TMPO SNAP23 IQGAP1 GMIP GIT2 ARHGDIB ARHGAP5 FMNL1 CDC42EP3 PAK2"
"27","REACTOME_SENSORY_PROCESSING_OF_SOUND_BY_OUTER_HAIR_CELLS_OF_THE_COCHLEA",0.0292342367725253,0.152231940266687,0.352487857583619,0.591590960989273,1.63494274619503,11,"ACTB GSN MYH9 TWF2 ACTG1"
"28","REACTOME_AMYLOID_FIBER_FORMATION",0.0231806129200344,0.133245170323342,0.352487857583619,0.522233796950289,1.63229931591593,16,"TGFBI LTF SORL1 CST3 GSN APOE RPS27A"
"29","WP_MITOCHONDRIAL_COMPLEX_I_ASSEMBLY_MODEL_OXPHOS_SYSTEM",0.0253116203835287,0.136810910174263,0.352487857583619,0.51146794048139,1.62608789877958,17,"NDUFB11 NDUFA8 NDUFB7 NDUFS5 NDUFB8 NDUFA3 NDUFS6 NDUFA13 NDUFB4 NDUFB5 NDUFB3 NDUFB9 NDUFV2"
"30","KEGG_ADHERENS_JUNCTION",0.0234650340718732,0.133594260649198,0.352487857583619,0.519335148523007,1.62323927064011,16,"ACTB PTPN6 ACTN1 RAC2 ACTG1 WAS IQGAP1 TGFBR1 TGFBR2 IGF1R CDC42 MAPK1"
"31","REACTOME_TRANSLATION",0.0055780517860178,0.0610725157084513,0.407017918923954,0.358428219978177,1.62233054312941,71,"MRPL33 SEC61B RPS9 SEC11C MRPS24 EIF3F RPS24 RPSA RPL39 RPS27A RPL22 RPS21 SRP9 RPS4X MRPL51 SRP14 RPLP1 RPS27L RPS23 MRPS15 EEF1B2 RPS3 RPL27 MRPS21 MRPL18 RPS15 RPL14 MRPL42 NARS RPS29 MRPL57 MRPS18C RPS7 RPL15 RPS13 MRPL20 RPL11 RPL7A MRPL43 RPL38 MRPL36 RPL7 RPL18A RPS10 TRAM1 MRPL24 RPLP0 RPL32 RPL36"
"32","REACTOME_NEUTROPHIL_DEGRANULATION",0.000751241893685524,0.017821127144651,0.477270815362862,0.300786444462094,1.61514850320084,198,"LRG1 CAMP MMP9 CXCR2 PGLYRP1 S100A11 NFAM1 S100A9 LTF ARHGAP45 COTL1 H2-Q10 GM2A MMP8 CST3 MAN2B1 S100A8 FGL2 GMFG GSN PIRB CD33 ADGRE5 VAMP8 SELL HP FGR SIGLECF CFP FUCA1 PYGL TYROBP DOK3 DYNLL1 PTPRC PTPN6 ATP6V0A1 ITGAM ALOX5 CNN2 GLIPR1 NME2 BIN2 FCGR3 ARHGAP9 RETN HEXB CMTM6"
"33","WP_REGULATION_OF_ACTIN_CYTOSKELETON",0.024533204015972,0.136047767724936,0.352487857583619,0.41300195936331,1.61348599530652,37,"ACTB SSH2 TMSB4X PFN1 GSN ACTN1 RAC2 ACTG1 WAS ARHGEF1 IQGAP1 CSK ARPC5 PIP4K2A PIK3CD PPP1R12A PAK2 BRK1"
"34","REACTOME_G_ALPHA_Q_SIGNALLING_EVENTS",0.0347187136870014,0.165052438870693,0.321775918075361,0.42090189119988,1.60956025244429,35,"ANXA1 RGS2 CCL6 LTB4R1 GNG10 GRK2 RGS19 GNGT2 RGS3"
"35","WP_WNT_SIGNALING",0.039887835282957,0.178424820325117,0.321775918075361,0.53916326121866,1.598219096791,14,"CCND3 CTNNBIP1 PPP3CA CCND2 GSK3B CHD8 NFATC1"
"36","REACTOME_G_ALPHA_S_SIGNALLING_EVENTS",0.0308622599321548,0.157428924025013,0.352487857583619,0.494217984650641,1.59807556094623,18,"GNG10 GRK2 ARRB2 GNGT2 GNAI2 GNG2 GNB2 RAMP1"
"37","REACTOME_SIGNALING_BY_RHO_GTPASES_MIRO_GTPASES_AND_RHOBTB3",0.00467076242092109,0.0548612708508313,0.407017918923954,0.311677510463849,1.59522120399259,134,"S100A9 ACTB ARHGAP45 PICALM S100A8 PFN1 MYH9 ARPC1B LMNB1 LBR NCF2 DYNLL1 PREX1 TMEM59 ARHGAP25 ARHGAP15 ARHGAP9 ACTN1 RALBP1 ARAP3 RAC2 WIPF1 ARPC2 CDKN1B ACTG1 WAS DOCK8 ARHGAP30 ARHGEF1 MYL6 TMPO PPP2R5C SNAP23 IQGAP1 CSK ARPC5 GMIP CAPZB GIT2 ARHGDIB PMF1 ARHGAP5 FLNA PKN1 FMNL1 PPP1R12A CDC42EP3 PAK2 BRK1 ACTR3 YWHAH H3F3B MYL12B BUB3 CKAP4"
"38","REACTOME_SIGNALING_BY_NUCLEAR_RECEPTORS",0.0112342149220427,0.091371614699281,0.380730400722792,0.38618425257771,1.59007577715811,51,"MMP9 FOS GNG10 RARA GNGT2 TNRC6B APOE GNAI2 CDKN1B POLR2J GNG2 TBL1XR1 NCOR1 GNB2 JUND GPS2 TNRC6A H3F3B CBFB DDX5 IGF1R STAG2 AKT1 FABP5 RXRB POLR2E MAPK1 SMC3 PIK3R1 POLR2F AKT2 SMC1A"
"39","REACTOME_CLATHRIN_MEDIATED_ENDOCYTOSIS",0.0327102994490503,0.163061383936174,0.321775918075361,0.427632117573666,1.59005690825885,30,"ACTB PICALM VAMP8 GRK2 ARRB2 RPS27A ARPC2 ACTG1 NEDD8 ARPC5 TRF ACTR3 AP2S1 ITSN2 ARPC4 GRB2 EPN1 LDLRAP1 ARPC3 ADRB2 SYT11"
"40","PID_CXCR4_PATHWAY",0.0365300803161371,0.167574927758376,0.321775918075361,0.415737790854587,1.58981234722171,35,"MMP9 CXCR4 FGR GRK2 PTPRC PTPN6 ARRB2 ITGA4 GNAI2 STAT3 GNG2 CSK PTEN LYN PIK3CD"
"41","KEGG_LEUKOCYTE_TRANSENDOTHELIAL_MIGRATION",0.02646214858278,0.141699666026495,0.352487857583619,0.418533629629353,1.58638432274928,33,"MMP9 ACTB CXCR4 NCF2 ITGAM ITGA4 SIPA1 ACTN1 RASSF5 RAC2 GNAI2 ACTG1 ARHGAP5 PIK3CD ITGAL MAPK13 MYL12B PTK2B PLCG2"
"42","REACTOME_SRP_DEPENDENT_COTRANSLATIONAL_PROTEIN_TARGETING_TO_MEMBRANE",0.01595207734662,0.108119635349313,0.352487857583619,0.39010639681974,1.58608308820642,47,"SEC61B RPS9 SEC11C RPS24 RPSA RPL39 RPS27A RPL22 RPS21 SRP9 RPS4X SRP14 RPLP1 RPS27L RPS23 RPS3 RPL27 RPS15 RPL14 RPS29 RPS7 RPL15 RPS13 RPL11 RPL7A RPL38 RPL7 RPL18A RPS10 TRAM1 RPLP0 RPL32 RPL36"
"43","KEGG_CARDIAC_MUSCLE_CONTRACTION",0.0406579131062635,0.178891982620776,0.321775918075361,0.489113673565455,1.58585128106482,19,"COX6C COX6B1 COX6A1 UQCR11 COX7B MT-CO1 COX5B ATP1A3 ATP1A1 UQCRB UQCRH TPM3"
"44","REACTOME_ESR_MEDIATED_SIGNALING",0.0185158476045386,0.116268631281441,0.352487857583619,0.404596787491229,1.58215614114253,38,"MMP9 FOS GNG10 GNGT2 TNRC6B GNAI2 CDKN1B POLR2J GNG2 GNB2 JUND TNRC6A H3F3B CBFB DDX5 IGF1R STAG2 AKT1 POLR2E MAPK1 SMC3 PIK3R1 POLR2F AKT2 SMC1A"
"45","REACTOME_MITOCHONDRIAL_TRANSLATION",0.0668335389616239,0.234880009354843,0.287805130535564,0.516854327576235,1.56958323103755,15,"MRPL33 MRPS24 MRPL51 MRPS15 MRPS21 MRPL18 MRPL42 MRPL57 MRPS18C MRPL20 MRPL43 MRPL36"
"46","KEGG_RIBOSOME",0.0240019732203506,0.135746259140261,0.352487857583619,0.389512213743626,1.54812972954777,40,"RPS9 RPS24 RPSA RPL39 RPS27A RPL22 RPS21 RPS4X RPLP1 RPS27L RPS23 RPS3 RPL27 RPS15 RPL14 RPS29 RPS7 RPL15 RPS13 RPL11 RPL7A RPL38 RPL7 RPL18A RPS10 RPLP0 RPL32 RPL36"
"47","REACTOME_PROCESSING_OF_CAPPED_INTRON_CONTAINING_PRE_MRNA",0.0423130843139935,0.1843641530824,0.321775918075361,0.415828792346097,1.54616881368586,30,"SNRPG SRSF5 POLR2J SYF2 LSM6 U2AF1 DDX5 HNRNPU SF3B2 DDX46 RBM5 SNW1 BCAS2 POLR2E SF3B5 HNRNPUL1 HNRNPL PRPF8 LSM4 POLR2F MAGOH CASC3 DHX38 SARNP POLR2B CPSF2 SART1"
"48","REACTOME_RHOA_GTPASE_CYCLE",0.0359525296392021,0.167526008114963,0.321775918075361,0.407681284823872,1.54525025741806,33,"ARHGAP45 LBR PREX1 ARHGAP9 ARAP3 ARHGAP30 ARHGEF1 TMPO SNAP23 IQGAP1 GMIP ARHGDIB ARHGAP5 PKN1"
"49","REACTOME_EPHB_MEDIATED_FORWARD_SIGNALING",0.0527187034998038,0.212366852777511,0.321775918075361,0.519828000335242,1.54090439193617,14,"ACTB ARPC1B ARPC2 ACTG1 ARPC5 LYN ACTR3 ARPC4 ARPC3 CDC42 CFL1"
"50","REACTOME_APOPTOTIC_EXECUTION_PHASE",0.0358497763442477,0.167526008114963,0.321775918075361,0.529477533002629,1.53841755323924,13,"HMGB2 GSN LMNB1 STK24 HMGB1 PAK2 BMX"
"51","REACTOME_TRANSCRIPTIONAL_REGULATION_BY_MECP2",0.0569852941176471,0.218602755050768,0.257206466468838,0.534740896238067,1.52969115672163,12,"LBR TNRC6B TBL1XR1 NCOR1 PTEN GPS2 TNRC6A"
"52","REACTOME_REGULATION_OF_MECP2_EXPRESSION_AND_ACTIVITY",0.058176721906831,0.221798752269793,0.321775918075361,0.572345097626877,1.51547888663102,10,"LBR TNRC6B TBL1XR1 NCOR1 GPS2 TNRC6A"
"53","NABA_CORE_MATRISOME",0.060435942427126,0.22492042704672,0.321775918075361,0.571895986544854,1.51428971183879,10,"LRG1 IGFBP6 TGFBI FGL2 EMILIN2"
"54","NABA_ECM_GLYCOPROTEINS",0.060435942427126,0.22492042704672,0.321775918075361,0.571895986544854,1.51428971183879,10,"LRG1 IGFBP6 TGFBI FGL2 EMILIN2"
"55","REACTOME_CELL_CELL_COMMUNICATION",0.0607972216608009,0.22492042704672,0.321775918075361,0.447165224945784,1.51096827610195,22,"ACTB SIRPB1B TYROBP PTPN6 ACTN1 ACTG1 IQGAP1 RSU1 FLNA SKAP2 SIRPA PTK2B"
"56","PID_BETA_CATENIN_NUC_PATHWAY",0.0569852941176471,0.218602755050768,0.257206466468838,0.526574714993025,1.50633080533911,12,"MMP9 CTNNBIP1 TLE5 TBL1XR1 CCND2 CHD8 YWHAH"
"57","PID_CDC42_PATHWAY",0.0549167947078173,0.215416226422175,0.321775918075361,0.45273276400573,1.50461900980895,21,"ARPC1B ARPC2 IQGAP1 ARPC5 GSK3B PAK2 ACTR3 ARPC4 MAP2K4 ARPC3 CDC42 MAPK1 MAPK14 PIK3R1 CFL1 MAP2K3"
"58","REACTOME_MITOTIC_SPINDLE_CHECKPOINT",0.0611111111111111,0.22492042704672,0.248911114434702,0.541864513936565,1.497516890724,11,"DYNLL1 PPP2R5C PMF1 UBE2E1 BUB3 ANAPC16 ANAPC11 B9D2 PPP2R5A PPP1CC"
"59","PID_PDGFRB_PATHWAY",0.0340352744411943,0.164072787089841,0.321775918075361,0.375372102617139,1.49192937011967,40,"FOS ARPC1B FGR SIPA1 STAT3 ARPC2 IQGAP1 CSK ARPC5 PTEN LYN PIK3CD JUND BRK1 ACTR3 YWHAH ARPC4 MAP2K4 STAT5B GRB2 ARPC3 YWHAB MAPK1 PAG1 PIK3R1"
"60","REACTOME_MAP2K_AND_MAPK_ACTIVATION",0.0642722117202268,0.230435408679213,0.245041785430996,0.486508348521001,1.47742856131103,15,"ACTB TLN1 ARRB2 ACTG1 IQGAP1 CSK"
"61","KEGG_HEMATOPOIETIC_CELL_LINEAGE",0.0621468926553672,0.22492042704672,0.248911114434702,0.456769133314444,1.47698305528157,18,"CSF3R IL1R2 CD37 IL4RA CD33 IL6RA IL1B ITGAM ITGA4 CR1L"
"62","SIG_REGULATION_OF_THE_ACTIN_CYTOSKELETON_BY_RHO_GTPASES",0.0616822429906542,0.22492042704672,0.248911114434702,0.555800026986322,1.47167016818905,10,"PFN1 ACTG1 RPS4X FLNA PAK2 ACTR3 AKT1 CDC42 CFL1"
"63","REACTOME_EUKARYOTIC_TRANSLATION_ELONGATION",0.0638890402545765,0.230216204124086,0.287805130535564,0.368701263377881,1.46617891296689,43,"RPS9 RPS24 RPSA RPL39 RPS27A RPL22 RPS21 RPS4X RPLP1 RPS27L RPS23 EEF1B2 RPS3 RPL27 RPS15 RPL14 RPS29 RPS7 RPL15 RPS13 RPL11 RPL7A RPL38 RPL7 RPL18A RPS10 RPLP0 RPL32 RPL36"
"64","REACTOME_ACTIVATION_OF_THE_MRNA_UPON_BINDING_OF_THE_CAP_BINDING_COMPLEX_AND_EIFS_AND_SUBSEQUENT_BINDING_TO_43S",0.0516898608349901,0.212366852777511,0.282013350011725,0.421885034340691,1.46301101681159,24,"RPS9 EIF3F RPS24 RPSA RPS27A RPS21 RPS4X RPS27L RPS23 RPS3 RPS15 RPS29 RPS7 RPS13"
"65","REACTOME_INACTIVATION_OF_CSF3_G_CSF_SIGNALING",0.0716911764705882,0.245880581148122,0.227987202850442,0.51087512465572,1.46142022402379,12,"CSF3R SOCS3 RPS27A STAT3 ELOB LYN STAT5B JAK1"
"66","REACTOME_RHOD_GTPASE_CYCLE",0.0716911764705882,0.245880581148122,0.227987202850442,0.509915903332358,1.45867625514838,12,"LMNB1 LBR ACTN1 TMPO CAPZB ARHGAP5"
"67","REACTOME_SIGNALING_BY_MODERATE_KINASE_ACTIVITY_BRAF_MUTANTS",0.0699432892249527,0.241828214567246,0.234392647294686,0.458440101021501,1.45749878259178,17,"ACTB TLN1 ARRB2 ACTG1 IQGAP1 CSK"
"68","REACTOME_NONSENSE_MEDIATED_DECAY_NMD",0.0486506731137323,0.204668348961219,0.321775918075361,0.359786199601124,1.4511641546613,46,"RPS9 RPS24 RPSA RPL39 RPS27A RPL22 RPS21 RPS4X RPLP1 RPS27L RPS23 RPS3 RPL27 RPS15 RPL14 RPS29 RPS7 RPL15 RPS13 RPL11 RPL7A RPL38 UPF2 RPL7 RPL18A RPS10 MAGOH RPLP0 CASC3 RPL32 RPL36"
"69","REACTOME_RHO_GTPASE_CYCLE",0.0365176068796396,0.167574927758376,0.321775918075361,0.303363755477927,1.43332201349357,90,"ACTB ARHGAP45 PICALM LMNB1 LBR NCF2 PREX1 TMEM59 ARHGAP25 ARHGAP15 ARHGAP9 ACTN1 RALBP1 ARAP3 RAC2 WIPF1 ACTG1 WAS DOCK8 ARHGAP30 ARHGEF1 TMPO SNAP23 IQGAP1 CSK GMIP CAPZB GIT2 ARHGDIB ARHGAP5 PKN1 FMNL1 CDC42EP3 PAK2 BRK1"
"70","PID_ERBB1_DOWNSTREAM_PATHWAY",0.0562248995983936,0.218393285453631,0.271288554688953,0.37467781611944,1.43279593869083,35,"FOS ARPC1B ZFP36 EGR1 DUSP6 STAT3 ARPC2 IQGAP1 ARPC5 PIK3CD BRK1 ACTR3 YWHAH ARPC4 MAP2K4 GRB2 AKT1 BAD ARPC3 YWHAB CDC42 MAPK1 PIK3R1"
"71","REACTOME_RRNA_PROCESSING",0.0658275675006401,0.232300589444408,0.287805130535564,0.345357775737729,1.41990676054349,49,"RPS9 RPS24 RPSA RPL39 RPS27A RPL22 RPS21 RPS4X RPLP1 RPS27L RPS23 RPS3 RPL27 RPS15 RPL14 RPS29 RPS7 RPL15 RPS13 EXOSC5 RPL11 RPL7A C1D RPL38 RPP21 RPL7 RPL18A RPS10 DDX47 RPLP0 RPL32 RPL36"
"72","WP_CYTOPLASMIC_RIBOSOMAL_PROTEINS",0.0547667342799189,0.215416226422175,0.276500599254472,0.357970164758813,1.41694715404486,41,"RPS9 RPS24 RPSA RPL39 RPS27A RPL22 RPS21 RPS4X RPLP1 RPS23 RPS3 RPL27 RPS15 RPL14 RPS29 RPS7 RPL15 RPS13 RPL11 RPL7A RPL38 RPL7 RPL18A RPS10 RPLP0 RPL32 RPL36"
"73","KEGG_OXIDATIVE_PHOSPHORYLATION",0.0675105485232067,0.235322483423749,0.252961123069611,0.333274276569884,1.38124565685089,53,"COX6C ATP6V0A1 NDUFA8 NDUFB7 ATP5L NDUFS5 ATP5E COX6B1 ATP5C1 ATP5J COX6A1 UQCR11 ATP5H NDUFB8 NDUFA3 NDUFS6 NDUFB4 NDUFA4 COX7B MT-CO1 NDUFS7 COX5B ATP5J2 ATP5G3"
"74","WP_EGFEGFR_SIGNALING_PATHWAY",0.0689655172413793,0.23941687692739,0.245041785430996,0.347356163208074,1.37493393403118,41,"FOS RALBP1 INPP5D STAT3 ARHGEF1 NEDD8 IQGAP1 CSK NDUFA13 PTEN JUND AP2S1 PTK2B STAT5B JAK1 PLSCR1 GRB2 EPN1 AKT1 ITCH ASAP1 CDC42 MAPK1 MAPK14 PIK3R1 CFL1"
"75","REACTOME_DEVELOPMENTAL_BIOLOGY",0.0408477009497088,0.178891982620776,0.321775918075361,0.260320330244568,1.35786768918118,161,"MMP9 CEBPD CSF3R ACTB SEMA4A PFN1 MYH9 CXCR4 ARPC1B TYROBP IL6RA PTPRC TLN1 CCND3 RPS9 RARA PBX1 FES RPS24 RPSA RPL39 RPS27A STAT3 ARPC2 ACTG1 CAPN1 POLR2J RPL22 MYL6 KMT2C RPS21 TBL1XR1 RPS4X NCOR1 MED30 ARPC5 GSK3B SPI1 CAP1 ELOB LYN RPLP1 PIK3CD RPS27L RPS23 MBP PAK2 ST8SIA4 ZFP638 PITPNA EED MAPK13 FLI1 ACTR3 AP2S1 H3F3B MYL12B RPS3 RPL27"
"76","REACTOME_NERVOUS_SYSTEM_DEVELOPMENT",0.0728929384965831,0.249002277904328,0.252961123069611,0.257973135022163,1.27221401888058,117,"MMP9 ACTB SEMA4A PFN1 MYH9 CXCR4 ARPC1B TYROBP PTPRC TLN1 RPS9 FES RPS24 RPSA RPL39 RPS27A ARPC2 ACTG1 RPL22 MYL6 RPS21 RPS4X ARPC5 GSK3B CAP1 ELOB LYN RPLP1 PIK3CD RPS27L RPS23 MBP PAK2 ST8SIA4 PITPNA MAPK13 ACTR3 AP2S1 MYL12B RPS3 RPL27 ARPC4 ADAM10 RPS15 RPL14 RPS29 GRB2 PSENEN RPS7 RPL15 RPS13 RPL11 ARPC3 RPL7A CDC42 RPL38 MAPK1 MAPK14 PIK3R1 UPF2 RPL7 CFL1 RPL18A"
"77","REACTOME_CELLULAR_RESPONSES_TO_EXTERNAL_STIMULI",0.0340751150492562,0.164072787089841,0.321775918075361,-0.278274066769376,-1.40700451476165,181,"SOD2 HMOX1 PRDX1 BLVRB IL1A TXNRD1 CDKN1A ATP6V1E1 HIGD1A PRDX5 CYBB ATF3 NLRP3 PSME2 MAPKAPK2 ATP6V0C PSMB8 ATP6V1A EGLN3 ABCC1 ATP6V1C1 TXN1 PSMB5 CYCS ST13 PSMD8 FNIP2 PPP1R15A VEGFA MAP4K4 HSPA5 RRAGC HMOX2 LY96 PSMB10 RPS6KA2 DDIT3 PRDX6 EGLN1 H3F3A NFE2L2 ETS2 PSMB9 PSMB6 PTGES3 PSMA5 SUZ12 RPL22L1"
"78","REACTOME_MITOTIC_G2_G2_M_PHASES",0.0674603174603175,0.235322483423749,0.245041785430996,-0.394457247069396,-1.43475796866861,35,"CDKN1A PSME2 PSMB8 PSMB5 PSMD8 PPP1CB PSMB10 PSMB9 PSMB6 PSMA5 PSME1 YWHAG UBC OPTN TUBA1C PPME1 PSMD7 PPP2R1A"
"79","WP_NETRINUNC5B_SIGNALING_PATHWAY",0.0734341252699784,0.249851565659608,0.245041785430996,-0.504092651972024,-1.46892237331625,14,"TNF IL1A ICAM1 IL10 MAP2K1 RAF1"
"80","REACTOME_METABOLISM_OF_CARBOHYDRATES",0.0458337103373277,0.197568247100134,0.321775918075361,-0.366835773302199,-1.47719873932082,51,"TPI1 ABCC5 GBE1 PGK1 GAPDH PGAM1 ALDOA HK2 PFKFB3 PFKP PFKL AKR1A1 ENO1 GNS HK1 B4GALT5 HK3 NAGLU PKM ST3GAL1 GYS1 UBC PGM1"
"81","KEGG_TGF_BETA_SIGNALING_PATHWAY",0.0737527114967462,0.249939744516751,0.245041785430996,-0.515834003958217,-1.48049594622832,13,"TNF THBS1 INHBA ID2"
"82","WP_ADIPOGENESIS",0.0518962075848303,0.212366852777511,0.282013350011725,-0.421983423422126,-1.48064979180896,30,"GADD45B TNF NAMPT CDKN1A MIF FAS PLIN2"
"83","WP_CHEMOKINE_SIGNALING_PATHWAY",0.0472516474892931,0.200760731123663,0.321775918075361,-0.366122579168157,-1.48378470672341,52,"CCL4 CXCL2 CCL3 CXCL10 NFKBIA NFKBIB"
"84","KEGG_LEISHMANIA_INFECTION",0.0504032258064516,0.21100173940544,0.287857117255149,-0.421136678942653,-1.50291967996206,33,"TNF NFKBIA MARCKSL1 IL1A NFKBIB NOS2 PTGS2 C3 ITGB1"
"85","REACTOME_CYCLIN_A_CDK2_ASSOCIATED_EVENTS_AT_S_PHASE_ENTRY",0.06187624750499,0.22492042704672,0.257206466468838,-0.469033628034147,-1.50341714954904,21,"CDKN1A PSME2 PSMB8 PSMB5 PSMD8 PSMB10 PSMB9 PSMB6 PSMA5 PSME1 UBC"
"86","WP_GLUCOCORTICOID_RECEPTOR_PATHWAY",0.0598802395209581,0.22492042704672,0.261663521711573,-0.471320486202204,-1.51074733140158,21,"GADD45B TNFAIP3 CPEB4 PTGS2 PLK2 NFKB2 AKAP13 STOM BHLHE40 PTGES3 ARL5B"
"87","REACTOME_NUCLEOTIDE_BINDING_DOMAIN_LEUCINE_RICH_REPEAT_CONTAINING_RECEPTOR_NLR_SIGNALING_PATHWAYS",0.0482002033558809,0.203777097356051,0.321775918075361,-0.498216918379614,-1.51316050728221,18,"HMOX1 TNFAIP3 NLRP3 CASP4 TXN1 NFKB2 P2RX7 IRAK2"
"88","WP_FAS_LIGAND_FASL_PATHWAY_AND_STRESS_INDUCTION_OF_HEAT_SHOCK_PROTEINS_HSP_REGULATION",0.06553911205074,0.232242330669427,0.257206466468838,-0.514513042326205,-1.51786625369999,15,"TNF IL1A MAPKAPK2 CFLAR FAS CYCS"
"89","REACTOME_SIGNALING_BY_GPCR",0.0222906807969618,0.133120569235003,0.352487857583619,-0.335118714549984,-1.52122131928223,93,"CXCL3 CCL4 CXCL2 CCL3 CCRL2 CXCL10 HCAR2 ITPR2 FPR1 GNA13 C3 CXCL1 FPR2 PTAFR PSAP PROK2"
"90","REACTOME_APC_C_CDH1_MEDIATED_DEGRADATION_OF_CDC20_AND_OTHER_APC_C_CDH1_TARGETED_PROTEINS_IN_LATE_MITOSIS_EARLY_G1",0.0525210084033613,0.212366852777511,0.287857117255149,-0.512524688664731,-1.5328309035682,16,"PSME2 PSMB8 PSMB5 PSMD8 PSMB10 PSMB9 PSMB6 PSMA5 PSME1 UBC PSMD7"
"91","NABA_ECM_REGULATORS",0.0336506365995363,0.164072787089841,0.321775918075361,-0.44841166384252,-1.53374627470834,28,"SLPI F10 CTSZ CSTB CTSB P4HA1 EGLN3 FAM20C ADAM17"
"92","PID_IL1_PATHWAY",0.0611353711790393,0.22492042704672,0.271288554688953,-0.551471890617576,-1.53521332360929,12,"IL1RN SQSTM1 IL1A IRAK3"
"93","WP_TNF_RELATED_WEAK_INDUCER_OF_APOPTOSIS_TWEAK_SIGNALING_PATHWAY",0.0570824524312896,0.218602755050768,0.276500599254472,-0.522674600611948,-1.54194368785701,15,"TNF NFKBIA TRAF1 NFKBIB"
"94","REACTOME_SWITCHING_OF_ORIGINS_TO_A_POST_REPLICATIVE_STATE",0.0607105079485618,0.22492042704672,0.321775918075361,-0.509114243901973,-1.54391470875104,17,"PSME2 PSMB8 PSMB5 PSMD8 PSMB10 PSMB9 PSMB6 PSMA5 PSME1 UBC PSMD7"
"95","WP_METABOLIC_REPROGRAMMING_IN_COLON_CANCER",0.0549682875264271,0.215416226422175,0.282013350011725,-0.523539235573441,-1.54449444968782,15,"LDHA PGK1 GAPDH PGAM1 PFKL ENO1 HK3 PKM"
"96","REACTOME_G_ALPHA_I_SIGNALLING_EVENTS",0.0294856628811402,0.152610643033296,0.352487857583619,-0.384621229216812,-1.54881839849095,51,"CXCL3 CCL4 CXCL2 CXCL10 HCAR2 ITPR2 FPR1 C3 CXCL1 FPR2 PSAP"
"97","WP_RANKLRANK_RECEPTOR_ACTIVATOR_OF_NFKB_LIGAND_SIGNALING_PATHWAY",0.0518962075848303,0.212366852777511,0.282013350011725,-0.484615351097047,-1.55336203254277,21,"NFKBIA SQSTM1 ACP5 TRAF1 ICAM1"
"98","REACTOME_TRANSFERRIN_ENDOCYTOSIS_AND_RECYCLING",0.0647593654367811,0.230435408679213,0.287805130535564,-0.570689485512005,-1.55601306626595,11,"ATP6V1E1 ATP6V0C ATP6V1A ATP6V1C1 TFRC ATP6V1G1 ATP6V0B ATP6V0E ATP6V1D"
"99","REACTOME_INNATE_IMMUNE_SYSTEM",0.00112757948774386,0.0221947680520692,0.45505986738723,-0.286180613121862,-1.55668923527502,324,"CXCL3 CXCL2 LCN2 CLEC4E NFKBIA HMOX1 SLPI FTH1 ISG15 FTL1 CTSZ TNFAIP3 CREG1 ATP6V1E1 NFKBIB NOS2 CYBB CSTB CD68 MIF ZBP1 CLEC4D TNFRSF1B NLRP3 PSME2 CHIL1 BST2 CD14 ITPR2 MAPKAPK2 MALT1 FPR1 HERC6 NPC2 ATP6V0C GLA IKBKE LAMP1 CTSB IRAK3 PSMB8 B2M BRI3 LGALS3 C3 H2-Q7 PGAM1 ALDOA CXCL1 FPR2 PTAFR ATP6V1A ATP6V1C1 SLC11A1 CASP4 TXN1 PSMB5 PSAP FCER1G PLAC8 TBK1 NFKB2 PSMD8 OLR1 PFKL P2RX7 SURF4"
"100","WP_STING_PATHWAY_IN_KAWASAKILIKE_DISEASE_AND_COVID19",0.0647593654367811,0.230435408679213,0.287805130535564,-0.571183584433822,-1.55736025137781,11,"NFKBIA NLRP3 IKBKE TBK1 F3 NFKBIE FCGR2B IKBKG"
"101","REACTOME_REGULATION_OF_RUNX2_EXPRESSION_AND_ACTIVITY",0.0525210084033613,0.212366852777511,0.287857117255149,-0.520807445867941,-1.55760252235775,16,"PSME2 PSMB8 PSMB5 PSMD8 PSMB10 PSMB9 PSMB6 PSMA5 PSME1 UBC PSMD7"
"102","REACTOME_MYD88_INDEPENDENT_TLR4_CASCADE",0.0467945229346944,0.199812612931145,0.321775918075361,-0.44223723746961,-1.55761498580675,31,"NFKBIA NFKBIB CD14 MAPKAPK2 IKBKE TBK1 NFKB2 IRF7 MAP3K8 IRAK2 LY96 RPS6KA2 MAP2K1"
"103","WP_SPINAL_CORD_INJURY",0.034788570253776,0.165052438870693,0.321775918075361,-0.434341251082257,-1.55807927241749,34,"CXCL3 CXCL2 TNF CXCL10 IL1A NOS2 MIF ICAM1 PTGS2 LGALS3 CXCL1"
"104","PID_P73PATHWAY",0.0525210084033613,0.212366852777511,0.287857117255149,-0.522020598638075,-1.56123075353946,16,"GDF15 CDKN1A BCL2L11 BAX FAS"
