"","pathway","pval","padj","log2err","ES","NES","size","leadingEdge"
"105","REACTOME_METABOLISM_OF_VITAMINS_AND_COFACTORS",0.0562605653393429,0.218393285453631,0.321775918075361,-0.514915482874739,-1.56150725951212,17,"ACP5 NAMPT PTGS2 PARP14 ABCC1"
"106","REACTOME_REGULATION_OF_PTEN_STABILITY_AND_ACTIVITY",0.0549891538173701,0.215416226422175,0.321775918075361,-0.51621400246725,-1.565445085889,17,"PSME2 PSMB8 PSMB5 PSMD8 PSMB10 PSMB9 PSMB6 PSMA5 PSME1 UBC PSMD7"
"107","WP_RAC1PAK1P38MMP2_PATHWAY",0.0309696243983632,0.157428924025013,0.352487857583619,-0.515482862484617,-1.56559980385529,18,"NFKBIA NOS2 BAX ITGB1 TNIP1"
"108","PID_P38_ALPHA_BETA_DOWNSTREAM_PATHWAY",0.0621559962330514,0.22492042704672,0.321775918075361,-0.574519096405264,-1.56645468949523,11,"NOS2 MAPKAPK2 PTGS2 DDIT3 EIF4E CEBPB MAPKAPK3"
"109","REACTOME_SIGNALING_BY_NOTCH4",0.0328414028536557,0.163061383936174,0.321775918075361,-0.494268622723738,-1.56684228528469,20,"PSME2 RBPJ PSMB8 PSMB5 PSMD8 PSMB10 PSMB9 PSMB6 PSMA5 PSME1 UBC SMAD3 PSMD7"
"110","REACTOME_DISEASES_OF_PROGRAMMED_CELL_DEATH",0.0589017861473142,0.223565001643584,0.321775918075361,-0.575878704878318,-1.57016172914251,11,"SOD2 PRDX1 BCL2L11"
"111","REACTOME_REGULATED_NECROSIS",0.0537177426229397,0.214743205058331,0.321775918075361,-0.51839840363056,-1.57206939296004,17,"IL1A BAX CFLAR FAS CASP4 CYCS"
"112","WP_PHOTODYNAMIC_THERAPYINDUCED_AP1_SURVIVAL_SIGNALING",0.0394818367529498,0.178399410513329,0.321775918075361,-0.52738178681573,-1.57726470292825,16,"TNF CDKN1A BCL2L11 BAX CFLAR FAS"
"113","REACTOME_HEDGEHOG_OFF_STATE",0.0403594600378486,0.178585382758149,0.321775918075361,-0.508967330947122,-1.57884497690707,19,"PSME2 PSMB8 PSMB5 PSMD8 PSMB10 PSMB9 PSMB6 PSMA5 PSME1 UBC TUBA1C PSMD7"
"114","REACTOME_ANTIVIRAL_MECHANISM_BY_IFN_STIMULATED_GENES",0.0399123834009438,0.178424820325117,0.321775918075361,-0.494576973752973,-1.58529252418156,21,"ISG15 HERC6 USP18 OASL1 EIF4A1 DDX58 OAS3 EIF4E EIF2AK2 UBC KPNA4 IFIT1BL1"
"115","WP_CAMKK2_PATHWAY",0.033811794822594,0.164072787089841,0.321775918075361,-0.570832168114463,-1.58910937246993,12,"HMOX1 SQSTM1 ICAM1"
"116","WP_P53_TRANSCRIPTIONAL_GENE_NETWORK",0.0341978408688428,0.164072787089841,0.321775918075361,-0.516981498627561,-1.60370537091862,19,"SLC7A11 ISG15 CDKN1A ICAM1 THBS1 BAX FAS"
"117","KEGG_SMALL_CELL_LUNG_CANCER",0.0317332008785821,0.159412667942995,0.321775918075361,-0.519331236777601,-1.61099438938732,19,"NFKBIA TRAF1 NOS2 PTGS2 ITGB1 CYCS"
"118","REACTOME_SIGNALING_BY_THE_B_CELL_RECEPTOR_BCR",0.026547946796533,0.141699666026495,0.352487857583619,-0.43681853250716,-1.61561124496032,36,"NFKBIA NFKBIB PSME2 ITPR2 MALT1 PIK3AP1 PSMB8 PSMB5 PSMD8 PSMB10 PSMB9 NFKBIE PSMB6 PSMA5 PSME1 UBC PPIA IKBKG PSMD7 KRAS"
"119","WP_MIRNA_REGULATION_OF_DNA_DAMAGE_RESPONSE",0.0516307759779058,0.212366852777511,0.321775918075361,-0.555285265422483,-1.61809728184097,14,"GADD45B CDKN1A BAX FAS CYCS"
"120","KEGG_ADIPOCYTOKINE_SIGNALING_PATHWAY",0.0249869567524449,0.136808264698189,0.352487857583619,-0.54186314613488,-1.62057476306974,16,"TNF NFKBIA NFKBIB TNFRSF1B"
"121","REACTOME_DEUBIQUITINATION",0.0179946191474942,0.116268631281441,0.352487857583619,-0.433665302254145,-1.62148355349002,39,"NFKBIA TNFAIP3 NLRP3 PSME2 PSMB8 USP18 TNIP1 PSMB5 PSMD8 VDAC1 TOMM20 PSMB10 DDX58 PSMB9 PSMB6 PSMA5 PSME1 UBC IKBKG MDM2 SMAD3 PSMD7"
"122","WP_SUDDEN_INFANT_DEATH_SYNDROME_SIDS_SUSCEPTIBILITY_PATHWAYS",0.0314752073755042,0.159052231353139,0.321775918075361,-0.473495860539673,-1.62398101729117,27,"IL1RN TNF IL1A GAPDH ALDOA NFKB2 IL10 VEGFA REST BHLHE40"
"123","WP_OXIDATIVE_DAMAGE",0.045453579741044,0.197042421821582,0.321775918075361,-0.552143807459958,-1.62888087101502,15,"TNF TRAF1 CDKN1A TNFRSF1B CYCS"
"124","KEGG_TYPE_I_DIABETES_MELLITUS",0.0460375657762608,0.197568247100134,0.321775918075361,-0.610477454387293,-1.63226482167,10,"TNF IL1A FAS H2-Q7 H2-T23 IL12A"
"125","KEGG_LYSOSOME",0.0163182913379823,0.108299351974825,0.352487857583619,-0.42209915745704,-1.63236705334414,42,"ACP5 CTSZ CD68 NPC2 ATP6V0C GLA LAMP1 CTSB SLC11A1 PSAP AP3S1 M6PR NEU1 LIPA ACP2 NPC1 GNS TPP1 CTSL NAGLU"
"126","WP_CHROMOSOMAL_AND_MICROSATELLITE_INSTABILITY_IN_COLORECTAL_CANCER",0.0358542946211872,0.167526008114963,0.321775918075361,-0.488778109374727,-1.63349257744413,24,"GADD45B CDKN1A BCL2L11 PTGS2 RALGDS BAX CYCS TBK1"
"127","REACTOME_G2_M_CHECKPOINTS",0.0291151558715151,0.152231940266687,0.352487857583619,-0.510686381306117,-1.63692882089227,21,"PSME2 PSMB8 PSMB5 PSMD8 PSMB10 PSMB9 PSMB6 PSMA5 PSME1 YWHAG PIAS4 UBC"
"128","PID_CERAMIDE_PATHWAY",0.0231011745736282,0.133245170323342,0.352487857583619,-0.547833546433357,-1.63843071086421,16,"TNF NFKBIA BAX CYCS MAP4K4 MAP2K1 RAF1 EIF2AK2"
"129","REACTOME_CYTOSOLIC_SENSORS_OF_PATHOGEN_ASSOCIATED_DNA",0.0333752385986547,0.164072787089841,0.321775918075361,-0.544408792571008,-1.6509472136977,17,"NFKBIA NFKBIB ZBP1 TBK1 NFKB2 IRF7"
"130","KEGG_CHEMOKINE_SIGNALING_PATHWAY",0.0108878928688143,0.0894063510573786,0.380730400722792,-0.401272597859673,-1.65094868580264,55,"CXCL3 CCL4 CXCL2 CCL3 CXCL10 NFKBIA NFKBIB"
"131","KEGG_APOPTOSIS",0.025135238369971,0.136808264698189,0.352487857583619,-0.48624586982852,-1.65449877279833,26,"TNF NFKBIA IL1A BAX CFLAR IRAK3 FAS CYCS IRAK2"
"132","WP_DNA_DAMAGE_RESPONSE",0.0538115291363967,0.214743205058331,0.321775918075361,-0.578231040162389,-1.65958177315728,13,"GADD45B CDKN1A BAX FAS CYCS"
"133","REACTOME_NEGATIVE_REGULATORS_OF_DDX58_IFIH1_SIGNALING",0.0366938073662956,0.167574927758376,0.321775918075361,-0.570703616403005,-1.66302624604295,14,"ISG15 TNFAIP3 HERC6 IKBKE TBK1 DDX58 TAX1BP1 UBC"
"134","PID_P53_DOWNSTREAM_PATHWAY",0.0184756992147421,0.116268631281441,0.352487857583619,-0.47422287791571,-1.67027242093034,31,"SPP1 GDF15 CDKN1A ATF3 BCL2A1A BAX FAS RGCC DDIT4 MAP4K4 BNIP3L GADD45A"
"135","WP_APOPTOSISRELATED_NETWORK_DUE_TO_ALTERED_NOTCH3_IN_OVARIAN_CANCER",0.0149346114577236,0.107177799873076,0.380730400722792,-0.550073494885222,-1.67065681203707,18,"TNF SQSTM1 TRAF1 CDKN1A THBS1 IER3"
"136","WP_PROTEASOME_DEGRADATION",0.0225331129037849,0.133245170323342,0.352487857583619,-0.538671458972189,-1.67098883462484,19,"PSME2 PSMB8 H2-Q7 PSMB5 PSMD8 H2-T23 PSMB10 PSMB9 PSMB6 PSMA5 PSME1 UBC"
"137","REACTOME_TRANSCRIPTIONAL_REGULATION_BY_RUNX2",0.0283324163576625,0.149357305984221,0.352487857583619,-0.501439096025338,-1.67580549473772,24,"CDKN1A PSME2 BAX PSMB8 LGALS3 PSMB5 PSMD8 PSMB10 PSMB9 PSMB6 PSMA5 PSME1 UBC"
"138","KEGG_CYTOKINE_CYTOKINE_RECEPTOR_INTERACTION",0.0101898203970652,0.0853147707754285,0.380730400722792,-0.416604764919076,-1.67761183156621,51,"CXCL3 CCL4 CXCL2 CCL3 TNF CXCL10 IL1A TNFRSF1B IFNAR2 FAS CXCL1 INHBA IL10 VEGFA"
"139","REACTOME_ABC_TRANSPORTER_DISORDERS",0.0157159957002017,0.107371682623778,0.352487857583619,-0.561564046298206,-1.67949514147557,16,"PSME2 PSMB8 PSMB5 PSMD8 PSMB10 PSMB9 PSMB6 PSMA5 PSME1 UBC PSMD7"
"140","REACTOME_DEFECTIVE_CFTR_CAUSES_CYSTIC_FIBROSIS",0.0157159957002017,0.107371682623778,0.352487857583619,-0.561564046298206,-1.67949514147557,16,"PSME2 PSMB8 PSMB5 PSMD8 PSMB10 PSMB9 PSMB6 PSMA5 PSME1 UBC PSMD7"
"141","REACTOME_AMINO_ACIDS_REGULATE_MTORC1",0.0302060920183753,0.155397605925858,0.352487857583619,-0.569891048755922,-1.68123705335322,15,"ATP6V1E1 ATP6V0C ATP6V1A ATP6V1C1 FNIP2 RRAGC FNIP1 ATP6V1G1 ATP6V0B ATP6V0E ATP6V1D RRAGD"
"142","REACTOME_ROS_AND_RNS_PRODUCTION_IN_PHAGOCYTES",0.0157159957002017,0.107371682623778,0.352487857583619,-0.562287757021175,-1.68165957605978,16,"ATP6V1E1 NOS2 CYBB ATP6V0C ATP6V1A ATP6V1C1 SLC11A1 HVCN1 ATP6V1G1 ATP6V0B CYBA ATP6V0E ATP6V1D"
"143","KEGG_P53_SIGNALING_PATHWAY",0.0270431810349031,0.143446438532964,0.352487857583619,-0.555581474843799,-1.68482893809213,17,"GADD45B CDKN1A THBS1 BAX FAS CYCS"
"144","PID_IL12_2PATHWAY",0.013676498222064,0.101562865057762,0.380730400722792,-0.501664788064587,-1.69546868977568,25,"CCL4 CCL3 GADD45B NOS2 B2M H2-Q7 NFKB2"
"145","REACTOME_PURINERGIC_SIGNALING_IN_LEISHMANIASIS_INFECTION",0.0401142453189958,0.178424820325117,0.321775918075361,-0.592518718886033,-1.70058886123029,13,"HMOX1 IL1A NLRP3 C3 TXN1 NFKB2 P2RX7 P2RX4"
"146","REACTOME_TNF_SIGNALING",0.0381574970791051,0.173332460135935,0.321775918075361,-0.593879845366874,-1.70449543237862,13,"TNF TRAF1 TNFAIP3 CFLAR ADAM17 TAX1BP1 UBC IKBKG SPPL2A"
"147","KEGG_ANTIGEN_PROCESSING_AND_PRESENTATION",0.0125884633754044,0.097456284372435,0.380730400722792,-0.573299986644109,-1.71459435219164,16,"PSME2 CTSB B2M H2-Q7 TAPBP HSPA5 H2-T23 CTSL TAP1 PSME1"
"148","WP_TGFBETA_RECEPTOR_SIGNALING",0.0232476936512622,0.133245170323342,0.352487857583619,-0.581685573693213,-1.71603211180266,15,"SPP1 TNF ZEB2 THBS1 TGIF1 INHBA"
"149","WP_TGFBETA_RECEPTOR_SIGNALLING_IN_SKELETAL_DYSPLASIAS",0.0232476936512622,0.133245170323342,0.352487857583619,-0.581685573693213,-1.71603211180266,15,"SPP1 TNF ZEB2 THBS1 TGIF1 INHBA"
"150","WP_IL1_SIGNALING_PATHWAY",0.0148127572215383,0.107177799873076,0.380730400722792,-0.524503938282734,-1.71708514859273,22,"NFKBIA SQSTM1 IL1A NFKBIB MAPKAPK2 IRAK3"
"151","WP_NOCGMPPKG_MEDIATED_NEUROPROTECTION",0.0244488522865769,0.136047767724936,0.352487857583619,-0.6299249240724,-1.71752141489669,11,"TNF NFKBIA NOS2 CYCS"
"152","BIOCARTA_P53HYPOXIA_PATHWAY",0.024187087272802,0.135893240335348,0.352487857583619,-0.643185493736543,-1.71971798088481,10,"CDKN1A NFKBIB BAX NQO1 GADD45A"
"153","REACTOME_G1_S_DNA_DAMAGE_CHECKPOINTS",0.00956137632383692,0.0816541538055673,0.380730400722792,-0.566291043447407,-1.7199119719964,18,"CDKN1A PSME2 PSMB8 PSMB5 PSMD8 PSMB10 PSMB9 PSMB6 PSMA5 PSME1 UBC MDM2 PSMD7"
"154","BIOCARTA_HIVNEF_PATHWAY",0.021349953314287,0.129311064754618,0.352487857583619,-0.567922441694457,-1.72225354459088,17,"TNF NFKBIA TRAF1 TNFRSF1B CFLAR FAS"
"155","REACTOME_TNFR2_NON_CANONICAL_NF_KB_PATHWAY",0.0193381019114588,0.118811072175438,0.352487857583619,-0.517839729414669,-1.73061628186795,24,"TNF TNFRSF1B PSME2 PSMB8 PSMB5 NFKB2 PSMD8 PSMB10 PSMB9 PSMB6 RELB PSMA5 PSME1 UBC UBE2M PSMD7"
"156","REACTOME_REGULATION_OF_RUNX3_EXPRESSION_AND_ACTIVITY",0.00946094169858653,0.0816541538055673,0.380730400722792,-0.582808677905564,-1.74303242774273,16,"PSME2 PSMB8 PSMB5 PSMD8 PSMB10 PSMB9 PSMB6 PSMA5 PSME1 UBC MDM2 PSMD7"
"157","REACTOME_NEGATIVE_REGULATION_OF_NOTCH4_SIGNALING",0.0221341965929327,0.133116928805384,0.352487857583619,-0.598743879431311,-1.74473537144841,14,"PSME2 PSMB8 PSMB5 PSMD8 PSMB10 PSMB9 PSMB6 PSMA5 PSME1 UBC PSMD7"
"158","REACTOME_REGULATION_OF_RAS_BY_GAPS",0.0191359269158343,0.118420881058858,0.352487857583619,-0.575424457200704,-1.74500378625885,17,"PSME2 PSMB8 PSMB5 PSMD8 PSMB10 PSMB9 PSMB6 PSMA5 PSME1 UBC PSMD7 KRAS RASA2"
"159","REACTOME_CLEC7A_DECTIN_1_SIGNALING",0.0132381200271449,0.100047384983909,0.380730400722792,-0.509072392646186,-1.7460002736711,27,"NFKBIA PSME2 ITPR2 MALT1 PSMB8 PSMB5 NFKB2 PSMD8 PSMB10 PSMB9 PSMB6 RELB PSMA5 PSME1 UBC IKBKG UBE2M PSMD7"
"160","REACTOME_DEGRADATION_OF_GLI1_BY_THE_PROTEASOME",0.0166056184062956,0.109086139376742,0.352487857583619,-0.593783384549469,-1.75172189482416,15,"PSME2 PSMB8 PSMB5 PSMD8 PSMB10 PSMB9 PSMB6 PSMA5 PSME1 UBC PSMD7"
"161","REACTOME_FCERI_MEDIATED_NF_KB_ACTIVATION",0.0116631501853938,0.0930871986759471,0.380730400722792,-0.550718694775325,-1.76524641478843,21,"NFKBIA PSME2 MALT1 PSMB8 PSMB5 FCER1G PSMD8 PSMB10 PSMB9 PSMB6 PSMA5 PSME1 UBC IKBKG PSMD7"
"162","WP_ARYL_HYDROCARBON_RECEPTOR_NETPATH",0.0195492298729797,0.119250302225176,0.352487857583619,-0.606333089784509,-1.76685027600019,14,"TNF CDKN1A PTGS2 VEGFA NQO1 MAP2K1 NFE2L2 RAF1"
"163","REACTOME_DISORDERS_OF_TRANSMEMBRANE_TRANSPORTERS",0.0151407801641959,0.107371682623778,0.380730400722792,-0.529403047647735,-1.76926079998784,24,"BSG PSME2 PSMB8 SLC3A2 PSMB5 PSMD8 PSMB10 HK1 PSMB9 PSMB6 PSMA5 PSME1 UBC SLC11A2 PSMD7"
"164","REACTOME_SCF_SKP2_MEDIATED_DEGRADATION_OF_P27_P21",0.0143993575361266,0.105103002870531,0.380730400722792,-0.599736261138911,-1.76928349141014,15,"CDKN1A PSME2 PSMB8 PSMB5 PSMD8 PSMB10 PSMB9 PSMB6 PSMA5 PSME1 UBC"
"165","REACTOME_ASSEMBLY_OF_THE_PRE_REPLICATIVE_COMPLEX",0.007508167954974,0.0733132099744549,0.407017918923954,-0.592614861445466,-1.77236022698531,16,"PSME2 PSMB8 PSMB5 PSMD8 PSMB10 PSMB9 PSMB6 PSMA5 PSME1 UBC PSMD7"
"166","REACTOME_DNA_REPLICATION_PRE_INITIATION",0.007508167954974,0.0733132099744549,0.407017918923954,-0.592614861445466,-1.77236022698531,16,"PSME2 PSMB8 PSMB5 PSMD8 PSMB10 PSMB9 PSMB6 PSMA5 PSME1 UBC PSMD7"
"167","WP_VITAMIN_B12_METABOLISM",0.0161782640298367,0.108299351974825,0.352487857583619,-0.664825574374993,-1.77757817229793,10,"SOD2 TNF ICAM1 NFKB2"
"168","REACTOME_REGULATION_OF_TNFR1_SIGNALING",0.0153866608346533,0.107371682623778,0.380730400722792,-0.651980262132302,-1.77765638333987,11,"TNF TRAF1 TNFAIP3 CFLAR"
"169","REACTOME_STABILIZATION_OF_P53",0.00696353907425836,0.0708205828034005,0.407017918923954,-0.595398717716171,-1.78068603258493,16,"PSME2 PSMB8 PSMB5 PSMD8 PSMB10 PSMB9 PSMB6 PSMA5 PSME1 UBC MDM2 PSMD7"
"170","WP_TLR4_SIGNALING_AND_TOLERANCE",0.025150933908215,0.136808264698189,0.352487857583619,-0.620499539945114,-1.78089665759934,13,"TNF NFKBIA IKBKE IRAK3 TBK1 IRF7"
"171","WP_TYPE_II_INTERFERON_SIGNALING_IFNG",0.009453425569787,0.0816541538055673,0.380730400722792,-0.546026003893472,-1.78754261617291,22,"CXCL10 GBP2 ISG15 NOS2 IFIT2 CYBB ICAM1 H2-Q7 H2-T23 SOCS1 PSMB9 STAT2 TAP1 EIF2AK2"
"172","WP_PHOTODYNAMIC_THERAPYINDUCED_NFKB_SURVIVAL_SIGNALING",0.0228792697331528,0.133245170323342,0.352487857583619,-0.624970966474087,-1.7937301055675,13,"TNF IL1A ICAM1 BCL2A1A PTGS2 CFLAR CXCL1 NFKB2 VEGFA"
"173","REACTOME_CELLULAR_RESPONSE_TO_CHEMICAL_STRESS",0.00297820965924418,0.0446208955963953,0.431707695803346,-0.43477658845968,-1.7971181906712,56,"SOD2 HMOX1 PRDX1 BLVRB TXNRD1 PRDX5 CYBB NLRP3 PSME2 PSMB8 ABCC1 TXN1 PSMB5 CYCS PSMD8 HMOX2 PSMB10 PRDX6 NFE2L2 PSMB9 PSMB6 PSMA5 P4HB PSME1"
"174","WP_SELENIUM_MICRONUTRIENT_NETWORK",0.009533356380349,0.0816541538055673,0.380730400722792,-0.579647639589044,-1.79809922660102,19,"SOD2 TNF PRDX1 TXNRD1 PRDX5 ICAM1 PTGS2 TXN1 NFKB2"
"175","KEGG_EPITHELIAL_CELL_SIGNALING_IN_HELICOBACTER_PYLORI_INFECTION",0.00764036965775935,0.0733132099744549,0.407017918923954,-0.526100080848913,-1.80440129618071,27,"CXCL3 CXCL2 NFKBIA ATP6V1E1 ATP6V0C CXCL1 ATP6V1A ATP6V1C1"
"176","REACTOME_AUF1_HNRNP_D0_BINDS_AND_DESTABILIZES_MRNA",0.0135849878049504,0.101562865057762,0.380730400722792,-0.619771517439428,-1.80600975782814,14,"PSME2 PSMB8 PSMB5 PSMD8 PSMB10 PSMB9 PSMB6 PSMA5 PSME1 UBC PSMD7"
"177","REACTOME_ASYMMETRIC_LOCALIZATION_OF_PCP_PROTEINS",0.0127811520488439,0.097456284372435,0.380730400722792,-0.621010262182107,-1.80961945112605,14,"PSME2 PSMB8 PSMB5 PSMD8 PSMB10 PSMB9 PSMB6 PSMA5 PSME1 UBC PSMD7"
"178","REACTOME_DEGRADATION_OF_AXIN",0.0127811520488439,0.097456284372435,0.380730400722792,-0.621010262182107,-1.80961945112605,14,"PSME2 PSMB8 PSMB5 PSMD8 PSMB10 PSMB9 PSMB6 PSMA5 PSME1 UBC PSMD7"
"179","REACTOME_ABC_FAMILY_PROTEINS_MEDIATED_TRANSPORT",0.00463869458570128,0.0548612708508313,0.407017918923954,-0.573898359519296,-1.81927028301965,20,"ABCC5 PSME2 PSMB8 ABCC1 PSMB5 PSMD8 PSMB10 PSMB9 PSMB6 PSMA5 PSME1 UBC"
"180","REACTOME_INTERLEUKIN_1_FAMILY_SIGNALING",0.00375359821421035,0.0504574968026456,0.431707695803346,-0.470575534849337,-1.8198377931518,42,"IL1RN NFKBIA SQSTM1 IL1A NFKBIB PSME2 IL18BP IRAK3 PSMB8 PSMB5 TBK1 NFKB2 PSMD8 MAP3K8 IRAK2 PSMB10 MAP2K1 PSMB9 PSMB6 PSMA5 PSME1"
"181","BIOCARTA_PPARA_PATHWAY",0.00486283318963222,0.0553714605859456,0.407017918923954,-0.609667449689876,-1.82336017845097,16,"TNF NFKBIA NOS2 PTGS2"
"182","REACTOME_INTERFERON_GAMMA_SIGNALING",0.00550723339788154,0.0610725157084513,0.407017918923954,-0.521719019577039,-1.83060071757077,30,"GBP2 GBP5 ICAM1 B2M H2-Q7 PTAFR OASL1 H2-K1 GBP3 H2-T22 GBP7 H2-Q4 IRF7 H2-T23 OAS3 SOCS1"
"183","REACTOME_DETOXIFICATION_OF_REACTIVE_OXYGEN_SPECIES",0.00455161873121823,0.0548612708508313,0.407017918923954,-0.613278086097313,-1.83415867301967,16,"SOD2 PRDX1 TXNRD1 PRDX5 CYBB TXN1 CYCS"
"184","REACTOME_DEGRADATION_OF_DVL",0.0142897837430224,0.105103002870531,0.380730400722792,-0.640746215055103,-1.83900667011292,13,"PSME2 PSMB8 PSMB5 PSMD8 PSMB10 PSMB9 PSMB6 PSMA5 PSME1 UBC PSMD7"
"185","REACTOME_THE_ROLE_OF_GTSE1_IN_G2_M_PROGRESSION_AFTER_G2_CHECKPOINT",0.00330583128935757,0.0470529986851894,0.431707695803346,-0.605866131289493,-1.8401075289631,18,"CDKN1A PSME2 PSMB8 PSMB5 PSMD8 PSMB10 PSMB9 PSMB6 PSMA5 PSME1 UBC TUBA1C PSMD7"
"186","REACTOME_UB_SPECIFIC_PROCESSING_PROTEASES",0.00384044179411237,0.0504574968026456,0.431707695803346,-0.538002448439284,-1.84018239848353,28,"NFKBIA PSME2 PSMB8 USP18 PSMB5 PSMD8 VDAC1 TOMM20 PSMB10 DDX58 PSMB9 PSMB6 PSMA5 PSME1 UBC IKBKG MDM2 SMAD3 PSMD7"
"187","REACTOME_INTEGRIN_CELL_SURFACE_INTERACTIONS",0.00916510484972189,0.0816541538055673,0.380730400722792,-0.689312186016646,-1.84304927937539,10,"SPP1 BSG ICAM1 THBS1 ITGB1"
"188","WP_PROXIMAL_TUBULE_TRANSPORT",0.0088463267728997,0.0803698198303866,0.380730400722792,-0.691069861220418,-1.84774886554752,10,"ATP6V1E1 ATP6V0C SLC3A2 ATP6V1A ATP6V1C1 ATP6V1G1 ATP6V0B ATP6V0E ATP6V1D"
"189","REACTOME_GLUCOSE_METABOLISM",0.00603339619359599,0.0641707946127989,0.407017918923954,-0.596195914145919,-1.84943289493682,19,"TPI1 PGK1 GAPDH PGAM1 ALDOA HK2 PFKFB3 PFKP PFKL ENO1 HK1 HK3 PKM"
"190","WP_APOPTOSIS_MODULATION_AND_SIGNALING",0.00382230361332488,0.0504574968026456,0.431707695803346,-0.583978937690011,-1.85122593509191,20,"NFKBIA BNIP3 BCL2L11 TNFRSF1B BCL2A1A BAX CFLAR FAS CASP4 CYCS"
"191","REACTOME_ORC1_REMOVAL_FROM_CHROMATIN",0.00827968970186475,0.076030698982715,0.380730400722792,-0.636112761589084,-1.85362802610749,14,"PSME2 PSMB8 PSMB5 PSMD8 PSMB10 PSMB9 PSMB6 PSMA5 PSME1 UBC PSMD7"
"192","WP_FIBRIN_COMPLEMENT_RECEPTOR_3_SIGNALING_PATHWAY",0.00408479805664067,0.0513002579466343,0.407017918923954,-0.619807648848731,-1.85368693340111,16,"CXCL2 TNF CXCL10 NOS2 CD14"
"193","KEGG_FRUCTOSE_AND_MANNOSE_METABOLISM",0.00804938302273576,0.0749499850749108,0.380730400722792,-0.694798080192702,-1.85771719547062,10,"TPI1 ALDOA HK2 PFKFB3 PFKP PFKL HK1 HK3"
"194","REACTOME_REGULATION_OF_HMOX1_EXPRESSION_AND_ACTIVITY",0.00716430043890003,0.0719801479390662,0.407017918923954,-0.612998011083162,-1.85894748984603,17,"HMOX1 PSME2 PSMB8 PSMB5 PSMD8 PSMB10 NFE2L2 PSMB9 PSMB6 PSMA5 PSME1 UBC"
"195","REACTOME_METABOLISM_OF_WATER_SOLUBLE_VITAMINS_AND_COFACTORS",0.00789601191989572,0.0749243797732327,0.380730400722792,-0.682154783497783,-1.85992870603894,11,"ACP5 NAMPT PTGS2 PARP14 ABCC1 BST1"
"196","REACTOME_TRANSCRIPTIONAL_REGULATION_BY_RUNX3",0.0039519590954491,0.0511359555683869,0.407017918923954,-0.543229020742111,-1.8631495885125,27,"SPP1 CDKN1A BCL2L11 PSME2 RBPJ PSMB8 PSMB5 PSMD8 PSMB10 PSMB9 PSMB6 PSMA5 PSME1 UBC MDM2 SMAD3 PSMD7 KRAS"
"197","WP_GLYCOLYSIS_AND_GLUCONEOGENESIS",0.00645962254617155,0.0672746055418354,0.407017918923954,-0.615617980883404,-1.86689268085085,17,"TPI1 LDHA PGK1 GAPDH PGAM1 ALDOA HK2 PFKP PFKL ENO1 HK1 HK3 PKM"
"198","REACTOME_HEDGEHOG_LIGAND_BIOGENESIS",0.00342594966702954,0.0471896938006972,0.431707695803346,-0.626545448059024,-1.87383797603377,16,"PSME2 PSMB8 PSMB5 PSMD8 ADAM17 PSMB10 PSMB9 PSMB6 PSMA5 P4HB PSME1 UBC PSMD7"
"199","REACTOME_GPCR_LIGAND_BINDING",0.0020414949480386,0.0328950318042447,0.431707695803346,-0.476645298423943,-1.88578805384641,47,"CXCL3 CCL4 CXCL2 CCL3 CCRL2 CXCL10 HCAR2 FPR1 C3 CXCL1 FPR2 PTAFR PSAP PROK2"
"200","REACTOME_IRON_UPTAKE_AND_TRANSPORT",0.00329177329999126,0.0470529986851894,0.431707695803346,-0.589386653039542,-1.88919077211762,21,"LCN2 HMOX1 FTH1 FTL1 ATP6V1E1 ATP6V0C ATP6V1A ATP6V1C1"
"201","WP_ALLOGRAFT_REJECTION",0.00505027001663732,0.0567490867658983,0.407017918923954,-0.64115650222671,-1.8914774515147,15,"TNF IL1A FAS C3 H2-Q7 IL10 VEGFA H2-T23 IL12A"
"202","BIOCARTA_IL1R_PATHWAY",0.00468954657155818,0.0548612708508313,0.407017918923954,-0.700565942042393,-1.91012763906257,11,"IL1RN TNF NFKBIA IL1A IRAK3"
"203","WP_SIGNAL_TRANSDUCTION_THROUGH_IL1R",0.00468954657155818,0.0548612708508313,0.407017918923954,-0.700565942042393,-1.91012763906257,11,"IL1RN TNF NFKBIA IL1A IRAK3"
"204","REACTOME_TRANSPORT_OF_SMALL_MOLECULES",7.20418715815085e-05,0.00384523489566301,0.538434096309916,-0.417833596442126,-1.9366645479266,109,"LCN2 HMOX1 SLC7A11 FTH1 FTL1 BSG ATP6V1E1 ABCC5 PSME2 SLC15A3 NPC2 ATP6V0C PSMB8 SLC31A1 SLC3A2 ATP6V1A ABCC1 ATP6V1C1 SLC11A1 PSMB5 PSMD8 VDAC1 FURIN TFRC SOAT1 LIPA HMOX2 SLC44A1 PSMB10 STOM NPC1 SLCO3A1 PSMB9 NCEH1 PSMB6 PSMA5 CLCN7 RAF1 SLC32A1 P4HB PSME1 SLC8B1"
"205","REACTOME_C_TYPE_LECTIN_RECEPTORS_CLRS",0.00151890831207182,0.0264724020103946,0.45505986738723,-0.534814643317915,-1.9452794363949,35,"CLEC4E NFKBIA CLEC4D PSME2 ITPR2 MALT1 PSMB8 PSMB5 FCER1G NFKB2 PSMD8 CLEC4N PSMB10 PSMB9 PSMB6 RELB PSMA5 RAF1 PSME1 UBC IKBKG UBE2M PSMD7 KRAS"
"206","REACTOME_DOWNSTREAM_SIGNALING_EVENTS_OF_B_CELL_RECEPTOR_BCR",0.00275106807544219,0.0419537881504934,0.431707695803346,-0.582403460891681,-1.94638776204883,24,"NFKBIA NFKBIB PSME2 MALT1 PSMB8 PSMB5 PSMD8 PSMB10 PSMB9 NFKBIE PSMB6 PSMA5 PSME1 UBC PPIA IKBKG PSMD7 KRAS"
"207","REACTOME_CELLULAR_RESPONSE_TO_HYPOXIA",0.000818355555515682,0.0179356538952842,0.477270815362862,-0.643905120127524,-1.95563771977609,18,"HIGD1A PSME2 PSMB8 EGLN3 PSMB5 PSMD8 VEGFA PSMB10 EGLN1 PSMB9 PSMB6 PSMA5 PSME1 UBC"
"208","REACTOME_INTERLEUKIN_1_SIGNALING",0.000482822933925498,0.0117808795877821,0.49849310876659,-0.550776066255557,-1.96556659777498,33,"IL1RN NFKBIA SQSTM1 IL1A NFKBIB PSME2 IRAK3 PSMB8 PSMB5 NFKB2 PSMD8 MAP3K8 IRAK2 PSMB10 MAP2K1 PSMB9 PSMB6 PSMA5 PSME1"
"209","KEGG_PEROXISOME",0.00145127259888385,0.0264724020103946,0.45505986738723,-0.7101408498675,-1.97692341695768,12,"SOD2 PRDX1 NOS2 PRDX5"
"210","WP_TNF_ALPHA_SIGNALING_PATHWAY",0.000418673962157234,0.0111733613650712,0.49849310876659,-0.55441215950538,-1.97854280330772,33,"TNF NFKBIA TRAF1 TNFAIP3 NFKBIB TNFRSF1B BAX CFLAR TXN1 TBK1 NFKB2 MAP3K8"
"211","REACTOME_DECTIN_1_MEDIATED_NONCANONICAL_NF_KB_SIGNALING",0.00106896855274717,0.0221947680520692,0.45505986738723,-0.662140051041621,-1.98029237454111,16,"PSME2 PSMB8 PSMB5 NFKB2 PSMD8 PSMB10 PSMB9 PSMB6 RELB PSMA5 PSME1 UBC UBE2M PSMD7"
"212","REACTOME_DEATH_RECEPTOR_SIGNALLING",0.00107147301833593,0.0221947680520692,0.45505986738723,-0.577524054884731,-1.98077360400334,27,"TNF NFKBIA SQSTM1 TRAF1 TNFAIP3 BCL2L11 CFLAR GNA13 FAS"
"213","REACTOME_DDX58_IFIH1_MEDIATED_INDUCTION_OF_INTERFERON_ALPHA_BETA",0.00151272375618333,0.0264724020103946,0.45505986738723,-0.608047786582157,-1.99058528977545,22,"NFKBIA ISG15 TNFAIP3 NFKBIB HERC6 IKBKE TBK1 NFKB2 IRF7 DDX58 TANK TAX1BP1 UBC IKBKG"
"214","REACTOME_INTERFERON_ALPHA_BETA_SIGNALING",0.000819075529175744,0.0179356538952842,0.477270815362862,-0.548503122090609,-1.99506849248142,35,"RSAD2 GBP2 ISG15 IFIT3 IFIT2 BST2 IFNAR2 XAF1 PSMB8 USP18 ISG20 H2-Q7 OASL1 H2-K1 H2-T22 H2-Q4 IRF7 H2-T23 IFI35 OAS3 SOCS1 STAT2 IFITM3"
"215","KEGG_PROTEASOME",0.0018752746533549,0.0307977798839439,0.45505986738723,-0.734620632341756,-2.00297943398553,11,"PSME2 PSMB8 PSMB5 PSMD8 PSMB10 PSMB9 PSMB6 PSMA5 PSME1"
"216","REACTOME_CROSS_PRESENTATION_OF_SOLUBLE_EXOGENOUS_ANTIGENS_ENDOSOMES",0.0018752746533549,0.0307977798839439,0.45505986738723,-0.734620632341756,-2.00297943398553,11,"PSME2 PSMB8 PSMB5 PSMD8 PSMB10 PSMB9 PSMB6 PSMA5 PSME1"
"217","NABA_MATRISOME",6.82735483956418e-05,0.00384523489566301,0.538434096309916,-0.450368590115564,-2.00482484333635,86,"CXCL3 CCL4 CXCL2 CCL3 SPP1 IL1RN TNF CXCL10 CLEC4E SLPI GDF15 F10 IL1A CTSZ CSTB CLEC4D THBS1 CTSB P4HA1 LGALS3 CXCL1 EGLN3 EBI3 INHBA IL10 FAM20C SEMA4D VEGFA ADAM17 CLEC4N"
"218","REACTOME_PEPTIDE_LIGAND_BINDING_RECEPTORS",0.00146357058811869,0.0264724020103946,0.45505986738723,-0.604389180449966,-2.0113106123805,23,"CXCL3 CCL4 CXCL2 CCL3 CCRL2 CXCL10 FPR1 C3 CXCL1 FPR2 PSAP PROK2"
"219","REACTOME_CLASS_A_1_RHODOPSIN_LIKE_RECEPTORS",0.000295537031063092,0.00901387944742432,0.49849310876659,-0.540234660516334,-2.01994859284163,39,"CXCL3 CCL4 CXCL2 CCL3 CCRL2 CXCL10 HCAR2 FPR1 C3 CXCL1 FPR2 PTAFR PSAP PROK2"
"220","REACTOME_SIGNALING_BY_INTERLEUKINS",1.04227933753436e-05,0.00111263319281793,0.593325476396405,-0.415966782265675,-2.03103179267685,137,"CXCL3 CCL4 CXCL2 CCL3 SOD2 IL1RN LCN2 TNF CXCL10 NFKBIA HMOX1 SQSTM1 IL1A CDKN1A NFKBIB NOS2 MIF ICAM1 TNFRSF1B PSME2 MAPKAPK2 FPR1 IL18BP PTGS2 IRAK3 PSMB8 ITGB1 CXCL1 PTAFR PSMB5 EBI3 TBK1 NFKB2 IL10 PSMD8"
"221","PID_HIF1_TFPATHWAY",0.00033252487038784,0.00946587464370719,0.49849310876659,-0.590297182415827,-2.03333657108887,29,"HMOX1 BNIP3 NOS2 LDHA PGK1 PLIN2 ALDOA HK2 EGLN3 PFKFB3 PFKL ID2 VEGFA FURIN TFRC ENO1 BHLHE40 EGLN1 HK1"
"222","WP_FERROPTOSIS",0.00158103720798939,0.0270041155124588,0.45505986738723,-0.71119217999802,-2.04119373945273,13,"HMOX1 SLC7A11 FTH1 FTL1 CYBB SLC3A2 GCLM"
"223","NABA_SECRETED_FACTORS",0.000366862822875687,0.0101064790559947,0.49849310876659,-0.581110657920297,-2.04674458073168,31,"CXCL3 CCL4 CXCL2 CCL3 IL1RN TNF CXCL10 GDF15 IL1A CXCL1 EBI3 INHBA IL10 VEGFA"
"224","WP_SENESCENCE_AND_AUTOPHAGY_IN_CANCER",0.000452528066658495,0.0113664402625399,0.49849310876659,-0.544122219764075,-2.05002848217571,40,"CXCL3 CXCL2 CCL3 SQSTM1 IL1A CREG1 CDKN1A THBS1 LAMP1 CXCL1 INHBA IRF7"
"225","PID_IL23_PATHWAY",0.00132250656353302,0.0250982356723822,0.45505986738723,-0.714790140199116,-2.05152025040691,13,"CXCL3 CXCL2 TNF NFKBIA NOS2 CXCL1"
"226","PID_TNF_PATHWAY",0.00114352434928694,0.0221947680520692,0.45505986738723,-0.718620081925257,-2.06251257188307,13,"TNF SQSTM1 TRAF1 TNFAIP3 TNFRSF1B TXN1 ADAM17 MAP4K4"
"227","REACTOME_GLYCOLYSIS",0.000814895278325341,0.0179356538952842,0.477270815362862,-0.680607658394324,-2.06397716675538,17,"TPI1 PGK1 GAPDH PGAM1 ALDOA HK2 PFKFB3 PFKP PFKL ENO1 HK1 HK3 PKM"
"228","WP_LUNG_FIBROSIS",0.0011236374749381,0.0221947680520692,0.45505986738723,-0.719438070748122,-2.06486028282693,13,"CCL4 CCL3 SPP1 TNF HMOX1"
