"","pathway","pval","padj","log2err","ES","NES","size","leadingEdge"
"229","KEGG_TOLL_LIKE_RECEPTOR_SIGNALING_PATHWAY",0.00018223592811226,0.00680099225977718,0.518848077743792,-0.562213649700054,-2.08978074157902,37,"CCL4 CCL3 SPP1 TNF CXCL10 NFKBIA CD14 IFNAR2 IKBKE TBK1 IRF7 MAP3K8 IL12A LY96 MAP2K1"
"230","WP_PATHWAYS_IN_CLEAR_CELL_RENAL_CELL_CARCINOMA",0.000207055970438181,0.00680099225977718,0.518848077743792,-0.664271091743365,-2.10575380994288,20,"SQSTM1 TPI1 LDHA PGK1 GAPDH ALDOA HK2 PFKP PFKL VEGFA ENO1 HK1 HK3 PKM"
"231","REACTOME_METABOLISM_OF_POLYAMINES",0.000443612904474643,0.0113664402625399,0.49849310876659,-0.725100451544404,-2.11293751656273,14,"PSME2 PSMB8 PSMB5 PSMD8 NQO1 SMOX PSMB10 PSMB9 PSMB6 PSMA5 PSME1"
"232","WP_NOVEL_INTRACELLULAR_COMPONENTS_OF_RIGILIKE_RECEPTOR_RLR_PATHWAY",0.000145894189361624,0.0059330303673727,0.518848077743792,-0.713160487558522,-2.13288151519381,16,"TNF CXCL10 NFKBIA ISG15 NFKBIB IKBKE TBK1 IRF7"
"233","KEGG_GLYCOLYSIS_GLUCONEOGENESIS",5.60840444536986e-05,0.00342112671167562,0.557332238758646,-0.70392714978715,-2.13793374686256,18,"TPI1 LDHA PGK1 GAPDH PGAM1 ALDOA HK2 PFKP PFKL AKR1A1 ENO1 HK1 HK3 PKM"
"234","WP_TOLLLIKE_RECEPTOR_SIGNALING_PATHWAY",9.66513498743874e-05,0.00412701263963634,0.538434096309916,-0.574703987121349,-2.14657425606473,38,"CCL4 CCL3 SPP1 TNF CXCL10 NFKBIA NFKBIB CD14 IFNAR2 IKBKE TBK1 IRF7 MAP3K8 IL12A LY96 MAP2K1"
"235","REACTOME_INTERFERON_SIGNALING",2.94384296512495e-05,0.00209503491018059,0.575610261071129,-0.508832454039417,-2.14674387230991,63,"RSAD2 GBP2 ISG15 IFIT3 GBP5 IFIT2 ICAM1 BST2 HERC6 IFNAR2 XAF1 PSMB8 USP18 B2M ISG20 H2-Q7 PTAFR OASL1 H2-K1 GBP3 H2-T22 GBP7 H2-Q4 IRF7 H2-T23 EIF4A1 DDX58 IFI35 OAS3 SOCS1 STAT2 IFITM3 EIF4E"
"236","REACTOME_CHEMOKINE_RECEPTORS_BIND_CHEMOKINES",0.000312616330448025,0.00920601193802115,0.49849310876659,-0.751139027888255,-2.15584524732595,13,"CXCL3 CCL4 CXCL2 CCL3 CCRL2 CXCL10"
"237","NABA_MATRISOME_ASSOCIATED",1.39079587374969e-05,0.00131971075131359,0.593325476396405,-0.49724264923144,-2.15599354020628,76,"CXCL3 CCL4 CXCL2 CCL3 IL1RN TNF CXCL10 CLEC4E SLPI GDF15 F10 IL1A CTSZ CSTB CLEC4D CTSB P4HA1 LGALS3 CXCL1 EGLN3 EBI3 INHBA IL10 FAM20C SEMA4D VEGFA ADAM17 CLEC4N"
"238","KEGG_CYTOSOLIC_DNA_SENSING_PATHWAY",0.000258463556753054,0.00817510657285586,0.49849310876659,-0.754190883394355,-2.16460438237829,13,"CCL4 CXCL10 NFKBIA NFKBIB ZBP1 IKBKE TBK1 IRF7"
"239","WP_SMALL_CELL_LUNG_CANCER",0.0002052043174018,0.00680099225977718,0.518848077743792,-0.65087218349778,-2.16599861863465,23,"GADD45B NFKBIA TRAF1 CDKN1A NFKBIB NOS2 PTGS2 BAX ITGB1 CYCS"
"240","WP_CYTOSOLIC_DNASENSING_PATHWAY",2.81995072917013e-05,0.00209503491018059,0.575610261071129,-0.715691105402935,-2.17366266812264,18,"CCL4 CXCL10 NFKBIA ISG15 NFKBIB ZBP1 IKBKE TBK1 IRF7"
"241","WP_SARSCOV2_INNATE_IMMUNITY_EVASION_AND_CELLSPECIFIC_IMMUNE_RESPONSE",8.24230507934192e-05,0.00391051585431,0.538434096309916,-0.678895907422254,-2.17609930071575,21,"CXCL3 CCL4 CXCL2 CCL3 TNF CXCL10 BSG IFIT2 IFNAR2 CXCL1 TBK1 IL10 IRF7"
"242","KEGG_RIG_I_LIKE_RECEPTOR_SIGNALING_PATHWAY",7.84900321560845e-05,0.00391051585431,0.538434096309916,-0.728582945504272,-2.17900616181291,16,"TNF CXCL10 NFKBIA ISG15 NFKBIB IKBKE TBK1 IRF7 IL12A DDX58 TANK"
"243","WP_APOPTOSIS",9.30659795633491e-05,0.00412701263963634,0.538434096309916,-0.636204419771036,-2.18203364998233,27,"TNF NFKBIA TRAF1 NFKBIB BCL2L11 TNFRSF1B BAX CFLAR FAS CASP4 CYCS IRF7"
"244","REACTOME_CYTOKINE_SIGNALING_IN_IMMUNE_SYSTEM",1.43911081891214e-09,1.22900063935096e-06,0.788186810800237,-0.430642588043063,-2.21423419141921,206,"CXCL3 CCL4 CXCL2 CCL3 SOD2 IL1RN RSAD2 LCN2 TNF CXCL10 NFKBIA HMOX1 GBP2 SQSTM1 ISG15 IL1A IFIT3 GBP5 CDKN1A NFKBIB NOS2 IFIT2 MIF ICAM1 BCL2L11 TNFRSF1B PSME2 BST2 MAPKAPK2 FPR1 IL18BP PTGS2 HERC6 IFNAR2 XAF1 IRAK3 PSMB8 USP18 B2M ISG20 H2-Q7 ITGB1 CXCL1 PTAFR PSMB5 EBI3 OASL1 TBK1 NFKB2 H2-K1 GBP3 IL10 PSMD8 H2-T22 VEGFA GBP7 H2-Q4 IRF7 MAP3K8 ADAM17 IRAK2"
"245","WP_REGULATION_OF_TOLLLIKE_RECEPTOR_SIGNALING_PATHWAY",1.84113790436645e-05,0.00157233177032895,0.575610261071129,-0.553161950740918,-2.24179903002838,52,"CCL4 CCL3 SPP1 TNF CXCL10 NFKBIA SQSTM1 TNFAIP3 CD14 IFNAR2 IKBKE IRAK3 TBK1 NFKB2 IRF7 MAP3K8 IRAK2 IL12A LY96 MAP2K1"
"246","KEGG_NOD_LIKE_RECEPTOR_SIGNALING_PATHWAY",3.98102702666195e-05,0.0026152285236687,0.557332238758646,-0.724207080670111,-2.24653065537389,19,"CXCL3 CXCL2 TNF NFKBIA TNFAIP3 NFKBIB NLRP3 CXCL1 CASP4"
"247","WP_PHOTODYNAMIC_THERAPYINDUCED_HIF1_SURVIVAL_SIGNALING",7.97313650942396e-06,0.00107980853152622,0.593325476396405,-0.776518895725103,-2.29081039783292,15,"BNIP3 NOS2 LDHA BCL2A1A PTGS2 BAX PGK1 PFKL VEGFA BNIP3L EGLN1 HK1 PKM MCL1"
"248","WP_NUCLEAR_RECEPTORS_METAPATHWAY",3.84368941153908e-06,0.000656502151490874,0.610526878385931,-0.550735694306826,-2.29428274619581,60,"GADD45B TNF HMOX1 SLC7A11 PRDX1 FTH1 BLVRB SQSTM1 FTL1 TNFAIP3 TXNRD1 ABCC5 CPEB4 PTGS2 BAX MAFG GCLM SRXN1 PLK2 MAFF TXN1 NFKB2"
"249","WP_IL18_SIGNALING_PATHWAY",6.47186605805896e-07,0.000138174340339559,0.659444398037935,-0.534236913399321,-2.31254628711626,75,"CCL4 CXCL2 CCL3 SPP1 ACOD1 TNF NFKBIA HMOX1 HCAR2 BSG TRAF1 TNFAIP3 NOS2 ATF3 NFKBIZ ICAM1 IL18BP IER3 PTGS2 BAX CFLAR B2M FAS CXCL1 CYCS NFKB2 IL10 VEGFA ZC3H12A NR4A1"
"250","WP_MIRNAS_INVOLVEMENT_IN_THE_IMMUNE_RESPONSE_IN_SEPSIS",8.85088960267395e-06,0.00107980853152622,0.593325476396405,-0.770932476671753,-2.33789174913866,17,"CCL4 CCL3 LCN2 TNF NFKBIA IL1A ICAM1 NFKB2 IL10 IRF7"
"251","WP_NRF2_PATHWAY",2.50863322455581e-07,7.14124257923553e-05,0.674962860011025,-0.730803285677527,-2.50648582642653,27,"HMOX1 SLC7A11 PRDX1 FTH1 BLVRB SQSTM1 FTL1 TXNRD1 ABCC5 MAFG GCLM SRXN1 MAFF TXN1"
"252","REACTOME_INTERLEUKIN_10_SIGNALING",1.9287045557924e-07,7.14124257923553e-05,0.690132458796796,-0.757000222916719,-2.51917577477687,23,"CXCL3 CCL4 CXCL2 CCL3 IL1RN TNF CXCL10 IL1A ICAM1 TNFRSF1B FPR1 PTGS2 CXCL1 PTAFR"
