pathway	pval	padj	log2err	ES	NES	size	leadingEdge
GOBP_REGULATION_OF_SYSTEMIC_ARTERIAL_BLOOD_PRESSURE_MEDIATED_BY_A_CHEMICAL_SIGNAL	6.23708563020827e-06	0.0142018439799842	0.610526878385931	0.93512033707507	1.84762168611953	24	SOD2 CTSZ ATP6AP2
GOBP_REGULATION_OF_SYSTEMIC_ARTERIAL_BLOOD_PRESSURE	8.48351524017986e-05	0.0352204997159284	0.538434096309916	0.780568439226761	1.79908588950578	54	SOD2 CTSZ ATP6AP2
GOBP_REGULATION_OF_SYSTEMIC_ARTERIAL_BLOOD_PRESSURE_BY_HORMONE	0.000209318854817723	0.0433290029472687	0.518848077743792	0.944442997486171	1.75573442313342	17	CTSZ ATP6AP2
GOBP_REGULATION_OF_PH	0.000154509261196793	0.0390908430827888	0.518848077743792	0.699415555250485	1.71263731444257	80	MAFG SLC11A1 ATP6V1E1 CLIC4 TCIRG1 ATP6AP2 ATP6V0C ATP6V1C1 ATP6V1A ATP6V1D RAB20 HVCN1 ATP6V0B CLN5 TM9SF4 ATP5B ATP6V1F LACC1 ATP6AP1 ATP6V0E UBE3A SLC4A7 TMEM165 ATP6V0D1 CLCN3
GOBP_CELLULAR_MONOVALENT_INORGANIC_CATION_HOMEOSTASIS	0.000135642954355996	0.0390908430827888	0.518848077743792	0.68571034928283	1.70343922083928	89	MAFG SLC11A1 ATP6V1E1 CLIC4 IL1A TCIRG1 ATP6AP2 ATP6V0C ATP6V1C1 ATP6V1A ATP6V1D RAB20 HVCN1 ATP6V0B ATP1B3 CLN5 TM9SF4 ATP5B ATP6V1F LACC1 ATP6AP1 ATP6V0E UBE3A SLC4A7 TMEM165 ATP6V0D1 CLCN3
GOBP_IRON_ION_TRANSPORT	0.000632240746951873	0.0944838942173256	0.477270815362862	0.720824314525245	1.69822122946455	63	LCN2 FTH1 FTL1 SLC11A1 ATP6V1E1 TCIRG1 ATP6V0C ATP6V1C1 ATP6V1A ATP6V1D SLC25A37 SLC11A2 ATP6V0B B2M ATP6V1F MCOLN1 ATP6AP1 ATP6V0E TFRC PGRMC2
GOBP_REGULATION_OF_BLOOD_PRESSURE	0.000124305081491568	0.0390908430827888	0.518848077743792	0.663611848506702	1.69480358242327	105	SOD2 CTSZ NOS2 ID2 P2RX4 ATP6AP2 PTAFR HMOX1 SMAD3 PTGS2 ACTA2 AGTRAP ATP2B1 ADH5 ERAP1 RENBP NISCH SNX5 SOD1 MECP2
GOBP_SIGNALING_RECEPTOR_LIGAND_PRECURSOR_PROCESSING	0.0011850496404928	0.124215387636088	0.45505986738723	0.908763251918169	1.6894052135685	17	CTSZ ATP6AP2 FURIN
GOBP_INTERMEDIATE_FILAMENT_BASED_PROCESS	0.000781836646344597	0.0947033025929492	0.477270815362862	0.800557877629759	1.688461423053	33	NDEL1 VIM ERBIN ATXN3 PLEC KLHL24 MTM1 MACF1 SOD1
GOBP_REGULATION_OF_CELLULAR_AMINO_ACID_METABOLIC_PROCESS	0.000643170997087636	0.0944838942173256	0.477270815362862	0.722845240733813	1.68229961340208	57	SLC7A11 PSMB5 PSMB6 PSME2 PSMD11 PSMD8 PSMD14 PSMA2 PSMB4 PSMA4 PSMA7 PSMC6 PARK7 PSMD7 PSMD12 PSMB10 PSMB3 PSMD10 PSMC3 PSMD4 PSMC2 NQO1 PSMD9 PSMD3 PSMC1 PSMB8 PSMA5 PSMD1 ODC1 OAZ1 PSMC4
GOBP_POSITIVE_REGULATION_OF_LONG_TERM_SYNAPTIC_POTENTIATION	0.00162599070950281	0.137125216501404	0.45505986738723	0.901660891384873	1.67620181335588	17	SQSTM1 LGMN NPTN CREB1 STAU1 APP ADORA2A
GOBP_EOSINOPHIL_MIGRATION	0.000792305885612735	0.0947033025929492	0.477270815362862	0.916308525565683	1.67212993767103	16	CCL3 CCL4 CCL5 LGALS3 CCL2 CD300A
GOBP_PH_REDUCTION	0.00130580668791324	0.128220318186648	0.45505986738723	0.732044410212598	1.66846806435406	49	SLC11A1 ATP6V1E1 CLIC4 TCIRG1 ATP6AP2 ATP6V0C ATP6V1C1 ATP6V1A ATP6V1D RAB20 ATP6V0B CLN5 ATP6V1F ATP6AP1 ATP6V0E UBE3A ATP6V0D1 CLCN3 GRN ATP6V1H
GOBP_NEUROTRANSMITTER_REUPTAKE	0.00324411601998354	0.187515086633852	0.431707695803346	0.878768113965513	1.65038777824943	18	ITGB1 PARK7 ATP1A2
GOBP_EOSINOPHIL_CHEMOTAXIS	0.00154359566957483	0.13602179930664	0.45505986738723	0.947152844623045	1.64666130084617	13	CCL3 CCL4 CCL5 LGALS3 CCL2
GOBP_MONOVALENT_INORGANIC_CATION_HOMEOSTASIS	0.000174727847609058	0.0397855309005825	0.518848077743792	0.641144560150624	1.64158149272435	111	MAFG SLC11A1 ATP6V1E1 CLIC4 IL1A TCIRG1 ATP6AP2 ATP6V0C ATP6V1C1 ATP6V1A ATP6V1D RAB20 HVCN1 ATP6V0B ATP1B3 CLN5 MLLT6 TM9SF4 ATP5B ATP6V1F LACC1 ATP6AP1 ATP6V0E UBE3A SLC4A7 TMEM165 ATP6V0D1 CLCN3 GRN ADORA2A ATP6V1H
GOBP_POSITIVE_REGULATION_OF_LIPID_STORAGE	0.00310924934901472	0.187515086633852	0.431707695803346	0.844421224902763	1.64069515428634	22	HILPDA IKBKE EHD1 PLIN2 C3 PLIN3 NR1H2 ZC3H12A
GOBP_NEGATIVE_REGULATION_OF_BLOOD_PRESSURE	0.00234018697765808	0.161974509944793	0.431707695803346	0.86382672934374	1.63107127872813	19	SOD2 NOS2 PTAFR SNX5
GOBP_NITRIC_OXIDE_MEDIATED_SIGNAL_TRANSDUCTION	0.00348959992587545	0.195237684878219	0.431707695803346	0.87496226272636	1.62656864172882	17	NOS2 FPR1 APOE VEGFA THBS1
GOBP_CELLULAR_RESPONSE_TO_MOLECULE_OF_BACTERIAL_ORIGIN	7.91214629493766e-05	0.0352204997159284	0.538434096309916	0.597608234435832	1.62384768224904	169	CXCL2 TNF CCL3 CD274 TNFAIP3 NFKBIA CCL5 CD68 MALT1 NOS2 CXCL3 IL10 ACOD1 IL1A CXCL9 IRAK2 ICAM1 CD14 NFKBIB TNFRSF1B PDCD1LG2 TLR2 CCL2 TREM2 PTAFR CXCL1 PLAA PYCARD NR1H3 MTDH VIM NLRP3 TICAM2 TLR4 FCGR2B IL12B RHOA TLR6 PF4 PIRA2 NOD2 TGFB1 SIRT2 UPF1 ZC3H12A
GOBP_TRANSMISSION_OF_NERVE_IMPULSE	0.00435480320775006	0.210084162876645	0.407017918923954	0.79781734201011	1.61679907696613	28	P2RX4 PAFAH1B1 GBA S1PR1 SOD1
GOBP_RESPONSE_TO_MOLECULE_OF_BACTERIAL_ORIGIN	1.28464626651334e-05	0.0195009303256726	0.593325476396405	0.572423204518115	1.61622867402385	274	SOD2 CXCL2 TNF CCL3 CD274 TNFAIP3 NFKBIA CCL5 SLPI SLC11A1 CD68 MAPKAPK2 MALT1 NOS2 CXCL3 IL10 ACOD1 IL1A CXCL9 IRAK2 ICAM1 PTGES CD14 NFKBIB TNFRSF1B PDCD1LG2 CD24A TLR2 CSF2RB2 CCL2 ADAM17 NFKB2 TREM2 PTAFR IRAK3 CXCL1 B2M PLAA PELI1 PYCARD NR1H3 MTDH VIM ERBIN NLRP3 TICAM2 TLR4 FCGR2B IL12B MGST1 RHOA LTA CHUK TLR6 GNG12 PF4 IL12A JAK2 PIRA2 NOD2 ATP2A2 TGFB1 SIRT2 HNRNPA0 UPF1 ADH5 ZC3H12A AKIRIN2 LIAS
GOBP_REGULATION_OF_LIPID_STORAGE	0.00158101571793682	0.13602179930664	0.45505986738723	0.722372276251023	1.61304276309031	46	TNF HILPDA NFKBIA IKBKE EHD1 PLIN2 OSBPL8 C3 NR1H3 PLIN3 NR1H2 SIRT1 SREBF1 ZC3H12A
GOBP_REGULATION_OF_HEMATOPOIETIC_PROGENITOR_CELL_DIFFERENTIATION	0.000752361653788352	0.0947033025929492	0.477270815362862	0.65299164473174	1.60855252442529	85	PSMB5 PSMB6 PSME2 PSMD11 PSMD8 PSMD14 NFE2L2 PSMA2 PSMB4 PSMA4 PSMA7 PSMC6 PSMD7 FNIP1 PSMD12 PSMB10 PSMB3 OSM NUDT21 PSMD10 FLCN PSMC3 PSMD4 PSMC2 PSMD9 PSMD3 N4BP2L2 HES1 PSMC1 LMO2 SOS1 PSMB8 PSMA5 ITCH PSMD1
GOBP_POSITIVE_REGULATION_OF_LIPID_LOCALIZATION	0.00110356497554508	0.11965797377696	0.45505986738723	0.655516182013968	1.60514227215891	80	HILPDA NFKBIA IKBKE EHD1 SPP1 PLIN2 PTGES P2RX4 ITGB1 ARL6IP1 C3 NR1H3 ACSL5 APOE LRP1 TMF1 PLIN3 GPS2 ACSL1 TRIAP1 NR1H2 SIRT1 ZC3H12A
GOBP_RESPONSE_TO_OXYGEN_LEVELS	3.53808795160107e-06	0.0142018439799842	0.627256739718528	0.559418530338294	1.60248766321155	315	SOD2 CYBB HILPDA NOS2 PSMB5 CPEB4 ITPR2 FAS ICAM1 PSMB6 CFLAR ATP6V1A CD24A TLR2 BNIP3L ADAM17 SLC11A2 PSME2 PSMD11 PSMD8 REST PSMD14 HMOX1 P4HB MDM2 RBPJ ENO1 NFE2L2 MDM4 HSP90B1 SMAD3 PSMA2 LDHA PTGS2 DDIT4 TM9SF4 GNB1 STUB1 PSMB4 PSMA4 VEGFA UBC PSMA7 ATP6AP1 PSMC6 CDKN1A TSC1 PSMD7 ARNT LTA ALAS1 PSMD12 HIGD1A PGK1 PDK1 PSMB10 PSMB3 CREB1 FAM162A ATG7 ALKBH5 PSMD10 AGTRAP PSMC3 PSMD4 THBS1 BNIP3 PHB2 ATP6V0D1 SIRT1 RBX1 MT-ND4 SIRT2 PSMC2 AK4 HP1BP3 UBB UBQLN1 PSMD9 F7 ATF4 SCFD1 PSMD3 PTK2B TMBIM6 CD38
GOBP_REGULATION_OF_SYSTEMIC_ARTERIAL_BLOOD_PRESSURE_BY_RENIN_ANGIOTENSIN	0.00147343370037118	0.134875283410551	0.45505986738723	0.944446101920033	1.59823140892786	12	CTSZ ATP6AP2
GOBP_PLASMINOGEN_ACTIVATION	0.00593318907586459	0.240792809548699	0.407017918923954	0.914684578163936	1.5902139827736	13	CTSZ PLGRKT ENO1 PGK1 THBS1
GOBP_REGULATION_OF_SYSTEMIC_ARTERIAL_BLOOD_PRESSURE_BY_CIRCULATORY_RENIN_ANGIOTENSIN	0.000515773773415925	0.0838869201477186	0.477270815362862	0.989608838459242	1.58963030916343	10	CTSZ ATP6AP2 ACE
GOBP_CELLULAR_RESPONSE_TO_OXYGEN_RADICAL	0.00477755543573891	0.217465491107818	0.407017918923954	0.840591677015699	1.587199023767	19	SOD2 PRDX1 NFE2L2 NQO1
GOBP_ANAPHASE_PROMOTING_COMPLEX_DEPENDENT_CATABOLIC_PROCESS	0.00148084413055063	0.134875283410551	0.45505986738723	0.64796507359047	1.58665210568434	80	PSMB5 PSMB6 ANAPC10 PSME2 PSMD11 PSMD8 PSMD14 UBE2S PSMA2 PSMB4 PSMA4 UBC PSMA7 PSMC6 UBE2E1 PSMD7 PSMD12 PSMB10 PSMB3 PSMD10 PSMC3 PSMD4 ANAPC16 FZR1 PSMC2 UBB PSMD9 PSMD3 PSMC1 ANAPC5 PSMB8 CDC26 PSMA5
GOBP_IONOTROPIC_GLUTAMATE_RECEPTOR_SIGNALING_PATHWAY	0.00452091523098621	0.210084162876645	0.407017918923954	0.889288702170573	1.58105141700271	14	CPEB4 CDK5R1 PTK2B APP
GOBP_REGULATION_OF_HEMATOPOIETIC_STEM_CELL_DIFFERENTIATION	0.0020154265748511	0.149891607507974	0.431707695803346	0.657838368531717	1.57719929059453	70	PSMB5 PSMB6 PSME2 PSMD11 PSMD8 PSMD14 NFE2L2 PSMA2 PSMB4 PSMA4 PSMA7 PSMC6 PSMD7 PSMD12 PSMB10 PSMB3 OSM PSMD10 PSMC3 PSMD4 PSMC2 PSMD9 PSMD3 N4BP2L2 PSMC1 LMO2 PSMB8 PSMA5 ITCH PSMD1
GOBP_HEMATOPOIETIC_STEM_CELL_DIFFERENTIATION	0.00189650004144558	0.147289696753878	0.45505986738723	0.640316269469003	1.57348685298382	83	PSMB5 PSMB6 PSME2 PSMD11 PSMD8 PSMD14 NFE2L2 PSMA2 PSMB4 PSMA4 BATF PSMA7 PSMC6 PSMD7 PSMD12 PSMB10 PSMB3 OSM PSMD10 PSMC3 PSMD4 PSMC2 PSMD9 PSMD3 N4BP2L2 PSMC1 LMO2 PSMB8 TRP53 PSMA5 ITCH PSMD1
GOBP_LIPOPOLYSACCHARIDE_MEDIATED_SIGNALING_PATHWAY	0.00360122211896583	0.195237684878219	0.431707695803346	0.67365111506154	1.57169448302881	56	TNF CCL3 TNFAIP3 NFKBIA CCL5 MALT1 ACOD1 IRAK2 CD14 TLR2 CCL2 PTAFR MTDH TLR4
GOBP_CELLULAR_RESPONSE_TO_BIOTIC_STIMULUS	0.000203811582967513	0.0433290029472687	0.518848077743792	0.573469746457614	1.57111189939041	191	CXCL2 TNF CCL3 CD274 TNFAIP3 NFKBIA CCL5 CD68 MALT1 BCL2L11 NOS2 CXCL3 IL10 ACOD1 IL1A CXCL9 IRAK2 ICAM1 CD14 NFKBIB TNFRSF1B PDCD1LG2 TLR2 CCL2 TREM2 PTAFR CXCL1 PLAA PYCARD NR1H3 MTDH VIM NLRP3 TICAM2 TLR4 FCGR2B IL12B RHOA TLR6 HSPA5 PF4 PIRA2 NOD2 TGFB1 SIRT2 UPF1 ZC3H12A
GOBP_NEGATIVE_REGULATION_OF_EPITHELIAL_CELL_APOPTOTIC_PROCESS	0.0064967146699505	0.240939928094649	0.407017918923954	0.754449063750907	1.57007033289198	31	TNFAIP3 ICAM1 NUPR1 CFLAR HMOX1 NFE2L2 SRSF6 MAPK7
GOBP_TRANSITION_METAL_ION_TRANSPORT	0.000987777613068127	0.110687821372442	0.45505986738723	0.621984471587718	1.56757840033467	98	LCN2 FTH1 FTL1 SLC11A1 ATP6V1E1 SLC31A2 TCIRG1 SLC31A1 ATP6V0C ATP6V1C1 ATP6V1A ATP6V1D SLC25A37 SLC11A2 ATP6V0B B2M COX17 ATP6V1F MCOLN1 ATP6AP1 ATP6V0E TFRC PGRMC2 TMEM165 CLTC ATP6V0D1 SLC39A6 ATP13A1
GOBP_POSITIVE_REGULATION_OF_VASCULAR_PERMEABILITY	0.00354208233871884	0.195237684878219	0.431707695803346	0.925401660395389	1.56600360413488	12	APOE VEGFA TGFB1
GOBP_ADULT_BEHAVIOR	0.00253836466790242	0.166776623329887	0.431707695803346	0.651246644070397	1.56064484740807	68	CSTB SLC7A11 MAFG PARK7 NPC1 TSC1 PUM1 CLCN3 PAFAH1B1 APP BTBD9 MECP2 CXCL12 HTRA2
GOBP_REGULATION_OF_LIPID_LOCALIZATION	0.000750685302691341	0.0947033025929492	0.477270815362862	0.597844353114069	1.55484955812591	123	TNF HILPDA NFKBIA IKBKE EHD1 SPP1 PLIN2 OSBPL8 PTGES P2RX4 ITGB1 FURIN ARL6IP1 C3 NR1H3 ACSL5 APOE LRP1 TMF1 CRY1 PLIN3 GPS2 ACSL1 TRIAP1 THBS1 NUS1 PTPN11 NR1H2 SIRT1 ZC3H12A
GOBP_ANTIGEN_PROCESSING_AND_PRESENTATION_OF_PEPTIDE_ANTIGEN_VIA_MHC_CLASS_I	0.00190919364115987	0.147289696753878	0.45505986738723	0.61877215273971	1.5497445116364	95	CYBB PSMB5 H2-Q7 FCER1G PSMB6 H2-K1 PSME2 PSMD11 PSMD8 CYBA PSMD14 B2M PSMA2 NCF1 PSMB4 PSMA4 IKBKG H2-Q4 CANX PSMA7 H2-D1 PSMC6 PSMD7 H2-M3 NCF4 PSMD12 CHUK PSMB10 PSMB3 TAPBP PSMD10 PSMC3 PSMD4 PSMC2 ERAP1 PSMD9 MFSD6 PSMD3 SAR1B SEC24B PSMC1 PDIA3 PSMB8 CALR PSMA5 SEC31A PSMD1 SEC22B
GOBP_CELLULAR_RESPONSE_TO_OXYGEN_LEVELS	0.000395908159920149	0.0693448369337061	0.49849310876659	0.565046567889497	1.54615556798291	187	CYBB HILPDA PSMB5 CPEB4 FAS ICAM1 PSMB6 CFLAR ATP6V1A BNIP3L PSME2 PSMD11 PSMD8 PSMD14 HMOX1 P4HB MDM2 RBPJ ENO1 NFE2L2 MDM4 PSMA2 PTGS2 GNB1 STUB1 PSMB4 PSMA4 VEGFA UBC PSMA7 ATP6AP1 PSMC6 TSC1 PSMD7 ARNT PSMD12 HIGD1A PGK1 PDK1 PSMB10 PSMB3 FAM162A ATG7 PSMD10 PSMC3 PSMD4 BNIP3 PHB2 ATP6V0D1 SIRT1 RBX1 SIRT2 PSMC2 AK4 HP1BP3 UBB UBQLN1 PSMD9 ATF4 PSMD3 TMBIM6 PSMC1 EGLN3 PSMB8 TRP53 RGCC PSMA5 CBL ELOC NPEPPS
GOBP_REGULATION_OF_CELLULAR_AMINE_METABOLIC_PROCESS	0.00418761967136293	0.209565054762492	0.407017918923954	0.648452178712133	1.54433901619004	67	SLC7A11 PSMB5 PSMB6 PSME2 PSMD11 PSMD8 PSMD14 PSMA2 PSMB4 PSMA4 PSMA7 PSMC6 PARK7 PSMD7 PSMD12 PSMB10 PSMB3 PSMD10 PSMC3 PSMD4 PSMC2 NQO1 PSMD9 PSMD3 PSMC1 PSMB8 PSMA5 PSMD1 ODC1 OAZ1 PSMC4
GOBP_TOOTH_MINERALIZATION	0.00564087104745266	0.240659063949555	0.407017918923954	0.912469385999657	1.54411906558248	12	FAM20C TCIRG1 BCOR
GOBP_POSITIVE_REGULATION_OF_PEPTIDYL_SERINE_PHOSPHORYLATION	0.00576017522408905	0.240659063949555	0.407017918923954	0.638837558328491	1.53622994417705	72	TNF IFNB1 HSP90AB1 FNIP2 TBK1 MIF HSP90AA1 VEGFA PARK7 LATS1 TERF2IP FNIP1 TFRC OSM EIF4G1 TGFB1 AKAP9 ARAF APP RIPK2 TXN1 CD44 CAMK1 PDCD10 SMYD3 MAPKAP1 AXIN1 MAD2L2
GOBP_OLIGOPEPTIDE_TRANSPORT	0.00688573498236854	0.246475835409662	0.407017918923954	0.907003244841213	1.5348690316554	12	SLC7A11 ABCC5 SLC15A3 ABCC1 SLC15A4
GOBP_SUPEROXIDE_METABOLIC_PROCESS	0.00684344591299062	0.246475835409662	0.407017918923954	0.665070106143839	1.5337135272128	53	SOD2 CYBB PRDX1 FPR2 NOS2 HVCN1 BST1 CYBA NFE2L2 NCF1 GNAI3 NCF4
GOBP_RESPONSE_TO_INTERLEUKIN_1	0.000389693690474895	0.0693448369337061	0.49849310876659	0.561070256076612	1.5294622115704	172	CCL3 CCL4 IL1RN SQSTM1 NFKBIA CCL5 PSMB5 ACOD1 IL1A IRAK2 ICAM1 PSMB6 CHIL1 CCL2 TANK PSME2 PSMD11 PSMD8 IRAK3 PSMD14 PELI1 PYCARD PSMA2 OTUD4 PSMB4 PSMA4 IKBKG UBC PSMA7 PSMC6 PSMD7 PSMD12 MAP3K7 CHUK PSMB10 PSMB3 PSMD10 UBE2V1 PSMC3 PSMD4 NOD2 RBX1 UPF1 PSMC2 ZC3H12A UBB PSMD9 PSMD3 CD38 APP CEBPB PSMC1 RELA RIPK2 VRK2
GOBP_ANTIGEN_PROCESSING_AND_PRESENTATION_OF_EXOGENOUS_PEPTIDE_ANTIGEN_VIA_MHC_CLASS_I	0.00496627384172444	0.217465491107818	0.407017918923954	0.62597288458507	1.52742016729431	78	CYBB PSMB5 H2-Q7 FCER1G PSMB6 H2-K1 PSME2 PSMD11 PSMD8 CYBA PSMD14 B2M PSMA2 NCF1 PSMB4 PSMA4 IKBKG H2-Q4 PSMA7 H2-D1 PSMC6 PSMD7 H2-M3 NCF4 PSMD12 CHUK PSMB10 PSMB3 TAPBP PSMD10 PSMC3 PSMD4 PSMC2 PSMD9 MFSD6 PSMD3 PSMC1 PDIA3 PSMB8 CALR PSMA5
GOBP_REGULATION_OF_STEM_CELL_DIFFERENTIATION	0.00325289675978795	0.187515086633852	0.431707695803346	0.604983060869483	1.51520907019529	95	PSMB5 PSMB6 CDK12 PSME2 PSMD11 PSMD8 REST PSMD14 NFE2L2 CDK13 PSMA2 PSMB4 PSMA4 PSMA7 PSMC6 KDM3A PSMD7 PSMD12 PSMB10 PSMB3 OSM NUDT21 PSMD10 PSMC3 PSMD4 PSMC2 PSMD9 PSMD3 N4BP2L2 HES1 PSMC1 LMO2 PWP1 PSMB8 PSMA5 NSUN2 ITCH PSMD1
GOBP_INTERLEUKIN_1_MEDIATED_SIGNALING_PATHWAY	0.0025635405430593	0.166776623329887	0.431707695803346	0.598661785767389	1.50879857511425	98	IL1RN SQSTM1 NFKBIA PSMB5 IL1A IRAK2 PSMB6 PSME2 PSMD11 PSMD8 IRAK3 PSMD14 PELI1 PSMA2 OTUD4 PSMB4 PSMA4 IKBKG UBC PSMA7 PSMC6 PSMD7 PSMD12 MAP3K7 CHUK PSMB10 PSMB3 PSMD10 UBE2V1 PSMC3 PSMD4 NOD2 RBX1 PSMC2 UBB PSMD9 PSMD3 PSMC1 RELA RIPK2 VRK2
GOBP_REACTIVE_OXYGEN_SPECIES_BIOSYNTHETIC_PROCESS	0.00372693213133219	0.198615869317036	0.431707695803346	0.605652037362667	1.50455864594111	89	SOD2 TNF NOS2 HSP90AB1 IL10 GLA ICAM1 P2RX4 CFLAR HSP90AA1 CYBA SMAD3 PTGS2 TLR4 PARK7 TLR6 JAK2 SLC25A33 CLCN3 NQO1 ZC3H12A PTK2B
GOBP_REGULATION_OF_PEPTIDYL_SERINE_PHOSPHORYLATION	0.00378029350173189	0.198615869317036	0.431707695803346	0.588313855511908	1.4942006761404	102	TNF IFNB1 HSP90AB1 FNIP2 TBK1 MIF BAX HSP90AA1 DDIT4 VEGFA PARK7 GGNBP2 LATS1 TERF2IP FNIP1 TFRC OSM EIF4G1 TGFB1 AKAP9 ARAF APP RIPK2 PWP1 SMAD7 TXN1 PLCL2 CD44 GPD1L CAMK1 PDCD10 SMYD3 MAPKAP1 AXIN1 MAD2L2
GOBP_RESPONSE_TO_BACTERIUM	2.10962277357682e-05	0.0205256420242787	0.575610261071129	0.500302189154502	1.47047743248915	443	LCN2 SOD2 CXCL2 TNF CCL3 CAMP CD274 FPR2 TNFAIP3 NFKBIA CCL5 SLPI SLC11A1 LYZ2 CD68 MAPKAPK2 MALT1 NOS2 CXCL3 IL10 ACOD1 IL1A CXCL9 IRAK2 ICAM1 H2-Q7 PTGES MPEG1 TBK1 FCER1G CD14 NFKBIB TNFRSF1B PDCD1LG2 RGS1 CD24A TLR2 CSF2RB2 CCL2 ADAM17 ST13 NFKB2 TREM2 PTAFR IRAK3 CYBA C3 CXCL1 B2M PLAA PELI1 PYCARD NR1H3 RBPJ MTDH VIM NLRC5 ERBIN NLRP3 GBP3 TMF1 TICAM2 H2-D1 TLR4 FCGR2B NAIP2 IL12B H2-M3 MGST1 FUCA2 RHOA LTA RPS19 CHUK SHC1 TLR6 IL27 PPP1R11 GNG12 PF4 ANXA3 IL12A JAK2 BNIP3 PIRA2 NOD2 ATP2A2 SNX3 SEH1L TGFB1 SIRT2 HNRNPA0 UPF1 ADH5 ZC3H12A ERAP1 GBP4 AKIRIN2 LIAS
GOBP_NEGATIVE_REGULATION_OF_NEURON_DEATH	0.00305141454464925	0.187515086633852	0.431707695803346	0.547243598675866	1.46776868222342	151	SOD2 SLC7A11 GPNMB VPS35 HSP90AB1 CPEB4 IL10 GCLM H2-Q7 GBE1 LGMN TNFRSF1B CCL2 BAX REST HMOX1 TRAF2 APOE LRP1 IKBKG H2-D1 TMEM259 NAIP2 PARK7 TSC1 H2-M3 RETREG1 CREB1 ATG7 EIF4G1 JAK2 FBXO7 SIRT1 ZPR1 GBA ATF4 PTK2B PARP2 DNAJC5 SNX6 GRN ADORA2A CEBPB PSMC1 CX3CR1 UBE2V2 ALKBH1 CBL SOD1 LRRK2
GOBP_NIK_NF_KAPPAB_SIGNALING	0.00158303806834693	0.13602179930664	0.45505986738723	0.546501341813368	1.46562705574584	153	TNF NFKBIA IKBKE MALT1 PSMB5 CD14 PSMB6 CHIL1 TLR2 PSME2 NFKB2 TREM2 PSMD11 PSMD8 PSMD14 DDX3X PSMA2 TRAF2 NLRP3 PSMB4 PSMA4 NFAT5 PSMA7 LIMS1 TLR4 PSMC6 NMI IL12B PSMD7 TERF2IP RHOA TRADD PSMD12 MAP3K7 CHUK TLR6 PSMB10 PSMB3 RELB ZFP91 PSMD10 RC3H2 PSMC3 PSMD4 NOD2 PHB2 RBCK1 PSMC2 ZC3H12A PSMD9 PSMD3 PPM1A APP PSMC1 RELA
GOBP_RESPONSE_TO_TOXIC_SUBSTANCE	0.00204068503853631	0.149891607507974	0.431707695803346	0.536476664115264	1.46046992004235	178	SOD2 ESD CCL3 CCL4 PRDX1 SLC7A11 TXNRD1 CCL5 PTGES PRDX5 AKR1A1 NUPR1 TLR2 BAX SRXN1 NFE2L2 PTGS2 APOE KDM1A CDKN1A PARK7 MGST1 CHUK KDM5C
GOBP_NEURON_DEATH	0.00073254099896086	0.0947033025929492	0.477270815362862	0.515160928650167	1.4545494627914	274	SOD2 TNF CCL3 CTSZ SLC7A11 CCL5 BCL2L11 GPNMB VPS35 HSP90AB1 CPEB4 IL10 FAS GCLM H2-Q7 GBE1 TBK1 NUPR1 LGMN TNFRSF1B CCL2 C1QA BAX REST HMOX1 DDIT4 TRAF2 APOE LRP1 IKBKG H2-D1 TLR4 FCGR2B TMEM259 NAIP2 PARK7 SRPK2 TSC1 H2-M3 RETREG1 TLR6 CREB1 BID FAM162A ATG7 HSPA5 EIF4G1 CDK5R1 JAK2 BNIP3 FBXO7 SIRT1 ZPR1 NQO1 UBB GBA ATF2 ATF4 EIF2S1 G6PDX PTK2B PARP2 DNAJC5 APP SNX6 GRN ADORA2A CEBPB PSMC1 EGLN3 CX3CR1 TRP53 TNFRSF21 MAP3K11 UBE2V2 ALKBH1 CBL SOD1 DDIT3 LRRK2
GOBP_POSITIVE_REGULATION_OF_DEFENSE_RESPONSE	0.000277217323923567	0.0548890301368663	0.49849310876659	0.506369455746182	1.44069058780751	303	TNF CCL3 CLEC4E FPR2 NFKBIA IKBKE CCL5 MALT1 IFNB1 PSMB5 CLEC4D TNIP1 H2-Q7 LAMP1 TBK1 CLEC4N NUPR1 FCER1G PSMB6 TGM2 NFKBIZ TLR2 HSP90AA1 PLA2G7 PSME2 TREM2 PSMD11 PSMD8 CYBA PSMD14 C3 PYCARD MATR3 PSMA2 PTGS2 NLRC5 PSMB4 PSMA4 IKBKG GBP5 PSMA7 ABCC1 RIOK3 H2-D1 TLR4 PSMC6 NMI PARK7 IL12B SLC15A4 PSMD7 H2-M3 TOMM70A TRADD LTA PSMD12 RPS19 MAP3K7 CHUK PSMB10 PSMB3 OSM RELB PSMD10 PSMC3 PSMD4 IL12A JAK2 PIRA2 NOD2
GOBP_CELLULAR_RESPONSE_TO_LIPID	0.000163996290195452	0.0393073213447415	0.518848077743792	0.483377647414033	1.41342802814107	418	CXCL2 TNF CCL3 CD274 TNFAIP3 NFKBIA CCL5 SPP1 CD68 MALT1 BCL2L11 NOS2 CXCL3 IL10 ACOD1 IL1A CXCL9 IRAK2 ICAM1 CD14 NFKBIB TNFRSF1B CFLAR PDCD1LG2 TLR2 CCL2 WBP2 EIF4E ZMIZ1 PTAFR REST CXCL1 PLAA PYCARD NR1H3 MTDH GRAMD1B VIM DDIT4 LRP8 TAF7 NLRP3 TMF1 TICAM2 TLR4 CRY1 PARK7 VPS18 HMGCS1 IL12B KDM3A NPC1 HDAC1 LATS1 MGST1 RHOA PGRMC2 CREB1 INHBA RUVBL2 PF4 UBE3A ATP2B1 JAK2 PIRA2 NOD2 PHB2 GRAMD1A TGFB1 DDX17 SIRT1 SREBF1
GOBP_NEURON_APOPTOTIC_PROCESS	0.00442638745964239	0.210084162876645	0.407017918923954	0.518741136743461	1.41218784931086	178	SOD2 TNF CCL3 BCL2L11 HSP90AB1 CPEB4 IL10 FAS GCLM GBE1 NUPR1 LGMN CCL2 BAX HMOX1 APOE LRP1 NAIP2 PARK7 SRPK2 RETREG1 BID FAM162A HSPA5 CDK5R1 JAK2 BNIP3 ZPR1 NQO1 GBA ATF2 ATF4 G6PDX PTK2B DNAJC5 APP SNX6 GRN ADORA2A CEBPB EGLN3 CX3CR1 TRP53 TNFRSF21 MAP3K11 UBE2V2 ALKBH1 SOD1 DDIT3 MECP2 GAPDH
GOBP_RESPONSE_TO_TUMOR_NECROSIS_FACTOR	0.00218869854282473	0.158211637524187	0.431707695803346	0.501574254359429	1.40980328134993	256	TNF CCL3 CCL4 TNFAIP3 TRAF1 NFKBIA CCL5 PSMB5 FAS ACOD1 ICAM1 CASP4 CD14 PSMB6 CHIL1 TNFRSF1B CCL2 ADAM17 TANK PSME2 NUB1 PSMD11 PSMD8 PSMD14 PYCARD NFE2L2 PSMA2 TNFSF9 TRAF2 ERBIN PSMB4 PSMA4 IKBKG PSMA7 LIMS1 PSMC6 ZFAND6 PSMD7 OTULIN TAX1BP1 TRADD GPS2 LTA TRAF3 PSMD12 CHUK PSMB10 PSMB3 PSMD10 PSMC3 PSMD4 JAK2 THBS1 RBCK1 SIRT1 PSMC2 ZC3H12A PSMD9 GBA CXCL16 PSMD3 PTK2B
GOBP_POSITIVE_REGULATION_OF_RESPONSE_TO_BIOTIC_STIMULUS	0.00303713046381782	0.187515086633852	0.431707695803346	0.504493466993915	1.40318409341339	225	CD274 CLEC4E FPR2 IKBKE CCL5 MALT1 IFNB1 PSMB5 CLEC4D ACOD1 H2-Q7 LAMP1 TBK1 CLEC4N FCER1G PSMB6 HSP90AA1 PSME2 PSMD11 PSMD8 CYBA PSMD14 PYCARD MATR3 PSMA2 NLRC5 PSMB4 PSMA4 IKBKG GBP5 PSMA7 RIOK3 H2-D1 TLR4 PSMC6 NMI IL12B SLC15A4 PSMD7 H2-M3 TOMM70A PSMD12 RPS19 MAP3K7 CHUK PSMB10 PSMB3 PUM1 RELB PSMD10 PSMC3 PSMD4 IL12A PIRA2 NOD2
GOBP_EXTRINSIC_APOPTOTIC_SIGNALING_PATHWAY	0.00449296659456122	0.210084162876645	0.407017918923954	0.509740331509089	1.38758466404606	184	TNF TNFAIP3 TRAF1 BCL2L11 FAS GCLM IL1A LGALS3 ICAM1 BCL2A1A SIVA1 TNFRSF1B CFLAR BAX ATF3 HMOX1 PYCARD EYA3 DDX3X RNF34 SMAD3 STX4A TRAF2 PARK7 TRADD DAPK3 CASP8AP2 BID INHBA P2RX7 IFI27 PF4 IL12A JAK2 THBS1 RBCK1 CRADD TNFSF10 ITM2C TGFB1 ITPRIP WWOX MAPK7 FAF1 PARP2 ARHGEF2
GOBP_PATTERN_RECOGNITION_RECEPTOR_SIGNALING_PATHWAY	0.0061863765299073	0.240792809548699	0.407017918923954	0.505255680983745	1.37890847541386	185	CLEC4E TNFAIP3 NFKBIA IKBKE MAPKAPK2 CTSB ACOD1 TNIP1 IRAK2 SLC15A3 TBK1 CD14 LGMN TLR2 TANK IRAK3 CYBA PELI1 NR1H3 RSAD2 DDX3X HSP90B1 CD300A OTUD4 TIFA ERBIN LACC1 IKBKG UBC TICAM2 RIOK3 TLR4 NMI SLC15A4 OTULIN GPS2 TRAF3 MAP3K7 CHUK TLR6 CNPY3 PIK3AP1 PUM1 UBE2V1 PIRA2 NOD2 PHB2 TREML4
GOBP_NEGATIVE_REGULATION_OF_APOPTOTIC_SIGNALING_PATHWAY	0.00703251889158415	0.246475835409662	0.407017918923954	0.504968278340526	1.37867593643298	188	SOD2 TNF TNFAIP3 FAS GCLM IL1A PPIA LGALS3 ICAM1 MIF CFLAR BAX HMOX1 MDM2 EYA3 DDX3X PTPN1 CSNK2A1 ENO1 NFE2L2 RNF34 VDAC2 TRAF2 KDM1A PARK7 HDAC1 GNAI3 TRADD PLAUR BID CAAP1 PSMD10 PF4 TRIAP1 THBS1 PTTG1IP TNFSF10 SIRT1 ITPRIP ING2 NDUFS3 MAPK7 SLC35F6 TMBIM6 ARHGEF2 RELA XBP1 CX3CR1 NOC2L CD44 BIRC6 TGFBR1 ARMC10
GOBP_CELLULAR_ION_HOMEOSTASIS	0.000151664311783657	0.0390908430827888	0.518848077743792	0.467862975435307	1.37606293732651	466	LCN2 CCL3 FTH1 CCRL2 FPR2 CCL5 MAFG FTL1 SLC11A1 ITPR2 ATP6V1E1 CLIC4 SLC31A2 IL1A CXCL9 UBASH3B FPR1 PROK2 P2RX4 TCIRG1 ATP6AP2 SLC31A1 ATP6V0C TGM2 ATP6V1C1 ATP6V1A CD24A ATP6V1D CCL2 RAB20 BAX HVCN1 SLC11A2 ATP6V0B HMOX1 ATP1B3 HEXB CLN5 PDZD8 HSP90B1 NPTN SMAD3 TM9SF4 GNB1 ATP5B ATP6V1F APOE LRP1 LACC1 MCOLN1 ATP6AP1 TRPM7 GNA13 ATP6V0E PTGER2 P2RY2 TFRC SLC8B1 P2RX7 UBE3A BOLA2 TRPM4 ATP2B1 JAK2 BNIP3 SLC4A7 TMEM165 ATP2A2 ATP6V0D1 CLCN3 SLC39A6 PTPN6 ATP13A1 CCDC47 RMDN3 ATF4 PTK2B TMEM38B TMBIM6 CD38 APP ATP13A3 GRN
GOBP_VASCULAR_PROCESS_IN_CIRCULATORY_SYSTEM	0.00605071037793564	0.240792809548699	0.407017918923954	0.503148925347526	1.36378176826836	168	SOD2 ABCC5 GCLM ICAM1 PTAFR PIK3C2A SLCO3A1 SLC38A1 APOE LRP1 VEGFA ABCC1 PTPRJ P2RY2 TFRC SLC6A13 ACTA2 GCLC TRPM4 ATP2B1 PLOD3 TGFB1 ROCK1 SLC6A6 ABCC3 CD38 ADORA2A ATG5 SLC7A8
GOBP_LIPID_LOCALIZATION	0.00169740529774767	0.140545158653507	0.45505986738723	0.466301522039903	1.3585695513506	368	TNF PSAP HILPDA SLC7A11 NFKBIA IKBKE ABCC5 EHD1 SPP1 NOS2 PLIN2 OSBPL8 PTGES P2RX4 SOAT1 ITGB1 FURIN OSBPL3 ARL6IP1 C3 HEXB NR1H3 ACSL5 SLCO3A1 GRAMD1B PDZD8 VPS4B APOE LRP1 TMF1 PRELID3B ABCC1 CRY1 PLIN3 NPC1 VPS4A GPS2 RELCH PNPLA8 ACSL1 INHBA P2RX7 SPNS1 GLTP UGCG NPC2 TRIAP1 THBS1 NUS1 PTPN11 GRAMD1A NR1H2 SIRT1 SREBF1 ZC3H12A CHKA GBA ABCC3 GIPC1 ABCD3 ADORA2A ATP8B4 PTPN2
GOBP_REGULATION_OF_INNATE_IMMUNE_RESPONSE	0.00647258935315868	0.240939928094649	0.407017918923954	0.474021739651512	1.33820813836614	278	CLEC4E FPR2 TNFAIP3 IKBKE CCL5 MALT1 IFNB1 PSMB5 HSP90AB1 CLEC4D ACOD1 H2-Q7 LAMP1 TBK1 CLEC4N IFNAR2 FCER1G PSMB6 HSP90AA1 PSME2 TREM2 PSMD11 PSMD8 IRAK3 PSMD14 PYCARD NR1H3 MATR3 PTPN1 PSMA2 LRP8 NLRC5 PSMB4 PSMA4 APOE USP18 IKBKG GBP5 PSMA7 RIOK3 H2-D1 TLR4 PSMC6 FCGR2B NMI IL12B SLC15A4 PIAS1 PSMD7 H2-M3 TOMM70A PSMD12 RPS19 MAP3K7 CHUK PSMB10 PSMB3 RELB PSMD10 PSMC3 PSMD4 IL12A CDC37 JAK2 PIRA2 NOD2 PTPN11 PARP14 NR1H2 PSMC2 ERAP1 AKIRIN2 PTPN6 PSMD9
GOBP_RESPONSE_TO_DRUG	0.00550409612412317	0.238720511897685	0.407017918923954	0.47535659802811	1.33368688535466	262	SOD2 CYBB TIMP2 NOS2 HSP90AB1 IL10 PLIN2 GCLM ICAM1 GGH TGIF1 ADAM17 REST HMOX1 RAP1A B2M ADSSL1 NFE2L2 DAD1 LDHA LRP8 MT-ND1 ABCC1 CDKN1A PTGR1 HMGCS1 NPC1 FOSB MGST1 TFRC LTA CHUK CREB1 ACSL1 INHBA HSPA5 THBS1 SREBF1 AK4 RPP21 NQO1 F7 XPC PTK2B ABCC3 CD38 ABCD3 ADORA2A RELA PPP1R12A ATG5 ARG1
GOBP_POSITIVE_REGULATION_OF_RESPONSE_TO_EXTERNAL_STIMULUS	0.00187619699992042	0.147289696753878	0.45505986738723	0.455409300131309	1.33133633283948	416	TNF CCL3 CCL4 CLEC4E FPR2 NFKBIA IKBKE CCL5 MALT1 IFNB1 PSMB5 CLEC4D ACOD1 TNIP1 CSF1R H2-Q7 LAMP1 P2RX4 TBK1 CLEC4N NUPR1 FCER1G PSMB6 LGMN TGM2 NFKBIZ TLR2 ADAM17 NDEL1 HSP90AA1 PLA2G7 PSME2 TREM2 PSMD11 PSMD8 CYBA PSMD14 C3 PYCARD MATR3 SMAD3 PSMA2 PTGS2 STX4A NLRC5 PSMB4 PSMA4 LRP1 IKBKG VEGFA GBP5 PSMA7 ABCC1 RIOK3 H2-D1 TLR4 PSMC6 NMI PARK7 IL12B SLC15A4 PSMD7 H2-M3 TOMM70A TRADD LTA F3 PSMD12 RPS19 MAP3K7 CHUK PSMB10 PSMB3 PUM1 OSM RELB PSMD10 PSMC3 PSMD4 IL12A JAK2 THBS1 PIRA2 NOD2
GOBP_REGULATION_OF_CELL_PROJECTION_ORGANIZATION	0.00656861371140508	0.240939928094649	0.407017918923954	-0.431706564701032	-1.25773433708166	493	RGS2 S100A9 PFN1 ID1 PPP3CA DNM2 P2RY12 ATG3 STK24 ACTR3 ACTR2 RAC2 SEMA4A YWHAH PSEN1 CDC42 VDAC3 CDC42EP3 FES DBNL CYLD ARPC2 PRNP EP300 SPRY2 TACSTD2 RAPGEF2 RIPOR2 BIN3 PIK3CA CIB1 CAPZB PPP2R5B KIDINS220 WAS DAB2IP PIK3R1 TMEM30A NME2 SETX CRK TWF2 RAB11A RALA WASF2 LYN RNF6 MARK2 LGALS1 DGKG PALM CORO1B PRKCD AKIRIN1 DOCK11 CUX1 ARF6 CDC42EP2 SIPA1L1 DIP2B SCARB2 GSK3A PREX1 ZFYVE27 BCAS3 CERS2 TIAM2 OPA1 RAP2A MAP2K1 DENND5A BMPR2 STAP1 PAK2 PDLIM5 ATP7A CFL1 ARAP1 ARHGEF7 RTN4 PTEN TESK1 WASHC1 L1CAM FYN SRF KREMEN1 KLF5
GOBP_LEUKOCYTE_DIFFERENTIATION	0.00569012499048003	0.240659063949555	0.407017918923954	-0.443194944189572	-1.28716883048916	455	H2-EB1 CD74 FGL2 FOS SOCS1 CCR1 IL4RA LBR ANXA1 PTPRC IL1B PIRB EGR1 ITGA4 ANXA2 PIK3CD IKZF1 EGR3 RIPK1 MYH9 TPD52 IFI205 SBNO2 CTNNBIP1 NFAM1 IL6RA RARA NRROS SEMA4A CR1L ZFP36L2 PSEN1 CDC42 JUNB IRF7 INPP5D FOXP1 NOTCH2 CSF1 CASP8 FES ZFP36L1 MMP9 TMEM176A VAV1 HCLS1 EP300 NKAP LGALS9 NCKAP1L VSIR STAT3 CHD7 HLX TYROBP SP3 HHEX CCR2 AP3B1 SPI1 OSTM1 PDE1B KLF6 NDFIP1 SASH3 PIK3R1 NME2 H2-Q10 MT1 CD86 IRF1 IL15 IL18 BCL3 RUNX3 LYN ACIN1 FBXW7 LGALS1 HMGB1 SYK DOCK11 CEACAM1 TNFRSF18 GPC3 L3MBTL3 CD101 MAPK14 STAT5B TFE3 BCL6 PREX1 RPS6 HDAC5 GLO1
