pathway	pval	padj	log2err	ES	NES	size	leadingEdge
GOBP_MONOSACCHARIDE_METABOLIC_PROCESS	0.0192494497349646	0.147083882706424	0.352487857583619	0.430855630577537	1.35098420198726	218	FABP5 MAN2A1 ATF3 G6PC3 DDB1 EP300 PKM TNF MDH1 SLC25A12 G6PDX IGF1 ALDOA TALDO1 MDH2 PDK1 CYB5R3 GPI1 CYB5A WDR5 AKR1A1 APOD AKR1B3 CRY1 PFKL SIRT7 AKT2 NISCH SLC23A2 POFUT2 GAA FUCA2 FUOM USP7 SLC25A13 GALT GSK3B NLN RANBP2 OGT TPI1 KAT2B PDK2 PFKM MAN2B1 PGM2 DGKQ RPIA PASK B4GALT1 FUCA1 PGK1 ENO1 INSR SLC35A2 SDHAF3 INPPL1 MIDN BAD PGAM1 PRKAA1 GALK1 PPP1CB
GOBP_POSITIVE_REGULATION_OF_ANION_TRANSPORT	0.00315336393387696	0.0512872119816988	0.431707695803346	0.413086430351822	1.35086351580078	380	SPP1 C3 ADAM8 ANXA2 ABCA1 HIF1A EZR NFKBIA OSBPL8 TARDBP TMED10 MAPK1 FABP3 FLNA CLN3 TNF PLA2G4A IL1B SLC12A2 SH3GLB1 TMEM30A OAZ2 RHOQ ITGB1 IGF1 CAR2 DBI HFE EDEM2 APOE PRR5L HCLS1 JAK2 RNASEL CIB1 KIF5B ADAM9 PINK1 SELENOT YWHAZ TFDP2 OXCT1 GRK2 EDEM1 ITGAM KIF20B BCL2 TMF1 UBE2D3 PSMD9 RAB3GAP1 LDLRAP1 PPP3R1 AKT2 XPO4 MYO18A VPS11 ARF1 FRMD4A APPL1 ANG ABCB4 CTDSPL2 TM9SF4 ATP13A2 TREM2 GSK3B PTAFR HRAS CPSF6 SAE1 ZPR1 PTGES CD81 SCP2 SNX4 IPO5 DYNLL1 DNM1L INSR BAG3 PIK3R1 MPC2 PRKACA MAPK8 BAP1 SREBF2 BAD PRKAA1 ARL6IP1 SMO MAPK14 CAPN10 B3GAT3 PRKCE ECT2 JUP TGFB1 AZIN1 PARD6A SOX4 CEP131 PSEN1 ABCG1 HSP90AB1 ITGB2
GOBP_NEGATIVE_REGULATION_OF_CELL_CELL_ADHESION	0.037344398340249	0.213919987473577	0.276500599254472	0.445314492820496	1.35023781492567	151	LGALS3 ARG1 SERPINE2 SPINT2 IL1RN CD9 IL4RA LAG3 LILR4B LGALS9 RDX HFE HAVCR2 TNFRSF21 GPNMB JAK2 PRKAR1A ZC3H8 SH2B3 NDFIP1 CD300A LAPTM5 PELI1 CASP3 DUSP3 VSIR UBASH3B RC3H1 DLG1 SCRIB RUNX1
GOBP_PROTEIN_STABILIZATION	0.0371900826446281	0.213573311933968	0.276500599254472	0.439658772852377	1.34946954764844	171	CLU CALR HSP90AA1 EP300 FLNA CDKN1A CRYAB GRN HSPD1 GLMP USP9X IGF1 RAB21 SUMO1 PRKRA IRGM1 CDC37 COG7 PINK1 SEL1L ZSWIM7 CRTAP ATP1B3 BAG1 PARK7 STK3 CHEK2 RASSF2 TRIM44 TBRG1 LAMP1 USP7 USP33 DVL3 APOA2 PIN1 CCT6A IRGM2 HIP1 ATP1B1 CCNH MT3 BAG3 TAF1 RABL3 PIK3R1 VHL AAK1 ZBED3 RTN4 MORC3 STX12 SMO STXBP4 USP2 TYROBP
GOBP_RESPONSE_TO_TOXIC_SUBSTANCE	0.0383561643835616	0.216914687017447	0.271288554688953	0.437801259487448	1.34861982506454	178	PRDX1 CCL5 MT1 ESD ARG1 MAPK1 PRDX6 SOD2 CDKN1A WAPL MT2 GSR TXNRD1 BLMH APOE SRXN1 PRDX5 SLC7A8 PON2 MGST3 PINK1 SELENOT CD36 MAOB SCN1B AKR1A1 RDH11 BCL2 SOD1 PARK7 TXN1 PRXL2C MGST1 GPX4 EHMT1 AKR7A5 BPHL PRDX4 ATP7A SCFD1 PTGES PTGS1 BAK1 MT3 MGST2 CHUK KDM1A
GOBP_MULTICELLULAR_ORGANISMAL_SIGNALING	0.0446927374301676	0.229510760760761	0.252961123069611	0.458334860786263	1.34801133713418	111	FXYD1 ATP1A1 FLNA AHCYL1 ATP1A2 SCN1B KCNE2 ATP1B3 SOD1 ASPH KCNK1 SLC8A1 CALM1 S1PR1 NFASC ATP1B1 CAMK2D PRKACA KCNJ2 NTRK2 JUP CNTNAP2 KCNK6
GOBP_REGULATION_OF_CELL_MORPHOGENESIS	0.0165679223738403	0.135814183374878	0.352487857583619	0.425538089575493	1.34779634434921	254	ENPP2 CCL7 CALR SPARC RHOB EZR FLNA RDX RHOQ FGD2 ALDOA CYFIP1 RHOC RAB21 RHOG PALMD HEXB ILK CIB1 F11R EPB41L3 P4HB RASA1 FBLIM1 DVL2 CAPZB DNM2 DBNL CD44 FITM2 CAPRIN1 WTIP SLC23A2 BRWD3 CCL2 STRIP2 DLG1 DVL3 EEF2K CDC42EP4 DAPK3 PLEKHO1 TBCCD1 ACTN4 BAIAP2 DNM1L ZMYM3 CXCR4 MYO10 ARHGEF18 ARHGAP18 RHOH LIMD1 PHIP PLXNA4 CORO1C ACTR2 SS18L2 MYH9 CSF1R PLXNC1 ABL1 LARP4 ITGB2 OPA1 CRK CARMIL1 MARK2 SRC UNC13A FGR S100A10 DOCK1 SMURF1
GOBP_CARDIAC_CONDUCTION	0.0499265785609398	0.239837171694641	0.245041785430996	0.473274824936769	1.34774153567615	87	FXYD1 ATP1A1 FLNA AHCYL1 ATP1A2 SCN1B KCNE2 ATP1B3 ASPH KCNK1 SLC8A1 CALM1 ATP1B1 CAMK2D PRKACA KCNJ2
GOBP_RESPONSE_TO_PURINE_CONTAINING_COMPOUND	0.0390173410404624	0.218160745468313	0.276500599254472	0.464440313461734	1.34763348111264	102	APP HSPA5 P2RY12 SPARC EZR HSP90B1 PIK3CG NME1 CIB2 ADSS SOD1 SLC8A1 DHODH FOSB EEF2K PTAFR DGKQ KDM1A TAF1 PRKAA1 PNPT1 CDO1 HMGCS1
GOBP_RESPONSE_TO_ENDOPLASMIC_RETICULUM_STRESS	0.0119647570987537	0.118451095277661	0.380730400722792	0.423767397502442	1.3473845132949	266	CLU HSPA5 CALR ATF3 TARDBP EP300 DDX3X GORASP2 EIF4G1 THBS1 HSP90B1 PDIA3 ATP6V0D1 XBP1 ADD1 CANX EDEM2 PDIA6 VCP COPS5 TMEM33 P4HB DNAJB9 LMNA SEL1L RNF121 SEC31A ERLIN2 EDEM1 PPP1R15B BCL2 SCAMP5 PARK7 ERLIN1 UBQLN2 TMX1 BCL2L1 SGTA DCTN1 APAF1 CCL2 SHC1 DNAJC3 DNAJB2 FAF2 PPP1R15A PTPN1 TXNDC12 MAN1A GSK3B UGGT1 UBQLN1 TMTC4 EEF2 BFAR DDIT3 UFM1 UBE2G2 BAK1 UBXN4 UBXN8 DNAJB12 DDX11 EIF2AK4 PIK3R1 CCND1 DNAJB14 ARFGAP1 SRPR PSMC6 TRIM13 DNAJC10 DNAJB11 PDIA5 ACADVL TBL2 POMT2 ASNS EXTL3 TATDN2 SRPRB TMCO1 TMED2 CDK5RAP3 OPA1 NR1H2 BCL2L11 AMFR UBE2K BBC3
GOBP_REPRODUCTIVE_SYSTEM_DEVELOPMENT	0.00878231046024653	0.0989966382078285	0.380730400722792	0.42174559678479	1.34730170248547	285	SPP1 C3 PSAP SERPINE2 HSPA5 SPINT2 HIF1A ATRX BASP1 MAPK1 FLNA CEBPA ADGRG1 TGFBR1 ARID5B IDH1 SULF1 COL9A3 ADAM15 ARID4A ZFX PDGFB SENP2 BCL2 TMF1 SOD1 STK3 MERTK LRP6 MGST1 SGPL1 NRIP1 RRM1 ITGB8 ANG JUNB CASP3 MDFI SERPINF1 DLG1 TSPYL1 PRDX4 ARNT NR2F2 FEM1B STRA6 BAK1 SAFB2 BIK CCND1 PRKACA MMP14 PLEKHA1 ASH1L RAB13 ING2 MAPK14 BMPR2 HMGCS1 ADAMTS1 EIF2B2 EPOR TLR3 ARRB2 GRB2 TMED2 NUDT1 UBE3A
GOBP_NEGATIVE_REGULATION_OF_CELLULAR_CATABOLIC_PROCESS	0.0172088168079848	0.137489389023795	0.352487857583619	0.43009642913956	1.34663227619999	215	HMOX1 TIMP2 FUS CST3 ANXA2 TARDBP HTR2B FEZ2 HNRNPU LARP1 EIF4G1 WAC PIK3CG HFE EIF4G2 SNRNP70 POLDIP2 NPC1 ZFP36 PINK1 GABARAPL2 BCL2 SDCBP PARK7 TENT4B HNRNPC SLC11A1 SGTA ANGEL2 ROCK1 EIF4ENIF1 ATP13A2 SUFU TREM2 USP7 CTSA OGT SCFD1 MAPKAPK2 DAP RRAGA MT3 TAF1 N4BP1 SEC22B PARN USP30 NSUN2 NMNAT1 MAPK14 LARP4B HNRNPD NOCT PSEN1 QSOX1 CDK5RAP3 ZKSCAN3 HSP90AB1 SECISBP2 RGP1 BECN1 TRP53 GOLGA2 KLHL22 BAG5 TIRAP TSC2 SMARCC1 TRIM39 THRAP3 UBQLN4
GOBP_FATTY_ACID_CATABOLIC_PROCESS	0.04644412191582	0.233193529442827	0.252961123069611	0.470493012247526	1.34661950055687	90	MCEE PLA2G15 ECH1 GCDH ACAA1A HADHB ACOX1 PEX13 DECR2 ACAA2 HADH ECI1 AIG1 IVD AKT2 PEX2 ABHD3 ABHD2 ACADL LONP2 ETFDH MMAA SCP2 ECI2 PEX7 HADHA HSD17B10 CRAT
GOBP_POSITIVE_REGULATION_OF_MAP_KINASE_ACTIVITY	0.0245837567532923	0.169885323603176	0.352487857583619	0.433932052367643	1.34610766080553	189	GADD45B ADAM8 TRF IQGAP1 HTR2B MAPK1 TNF IL1B THBS1 PIK3CG IGF1 UBC FGD2 C5AR1 PROK2 IRAK2 MDFIC CD24A MAP3K11 PDGFB DVL2 PIK3R5 DBNL SOD1 TGFA PIK3CB EZH2 KRAS SHC1 MAP3K4 PTPN1 GADD45G DVL3 HRAS MAPKAPK2 CD81 CXCR4 INSR IKBKG PRKAA1 PTPRC MAPK14 TAOK1 AVPI1 IRAK1 CSPG4 TGFB1 MAPKAPK3 PSEN1 GDF15
GOBP_RESPIRATORY_SYSTEM_DEVELOPMENT	0.0351617440225035	0.210139871756537	0.287857117255149	0.451313823171889	1.34253311573626	130	ARG1 MAN2A1 CHIL1 SPARC SKI LIPA BASP1 EP300 MAPK1 CEBPA TNF SMCHD1 NFIB LRP6 KRAS ATP7A STRA6 AP3B1 RPGRIP1L MMP14 HIKESHI STK40 BMPR2 SLC7A11 SMAD2 PLOD3
GOBP_RESPONSE_TO_ESTRADIOL	0.054093567251462	0.248078655854137	0.234392647294686	0.470416679183436	1.34243595020083	88	IGFBP2 CALR HPGD PCNA CRYAB MBD4 MBD2 CTNNB1 MBD3 NRIP1 EZH2 CASP3 MMP15 NR2F2 EEF2 DDX18 RUVBL2 STRN3 CCND1 BAD ZFP703 TGFB1 HNRNPD GGT5 F7 PTEN BCL2L11
GOBP_ORGANIC_ACID_TRANSMEMBRANE_TRANSPORT	0.0364145658263305	0.212648796913291	0.282013350011725	0.453309782049741	1.3421887699507	122	SLC43A2 FOLR1 SLC25A12 THBS1 ITGB1 ABCC1 ATP1A2 SLC7A8 CD36 RGS2 SLC7A10 SLC3A2 SLC46A1 PRAF2 AKT2 SLC23A2 EMB MPC1 SLC25A13 STRA6 SLC16A1 FOLR2 SLC1A5 SLC25A30 MPC2 ARL6IP1 SLC16A2 SLC7A11 SLC36A1 CPT2 PSEN1 ACACA SLC25A14 ABCD2 SLC7A2 SLC6A9 IRS2 ACSL1 ABCD3 ABCD1 SLC25A1 KCNJ10 SFXN3 AKT1
GOBP_PHOSPHOLIPID_METABOLIC_PROCESS	0.00498378375367054	0.067857329639881	0.407017918923954	0.414107495275118	1.34211631185493	354	FABP5 ENPP2 SERINC1 ABHD12 OSBPL8 HTR2B PRDX6 FABP3 MBOAT7 CLN3 PLA2G4A LPGAT1 DGKZ RAB14 PLA2G15 IDH1 PIK3CG INPP5D SLC44A2 DBI HADHB HEXB ABCA2 CDIPT NUS1 GDE1 PDGFB ARF3 APOC2 PIK3R5 TAZ PIK3CB PLA2G7 FITM2 PLEK SRD5A3 ABHD6 PLBD1 GPX4 ARF1 ABHD3 ISYNA1 GPAA1 CHPT1 SELENOI PLBD2 PNPLA7 ABHD5 FIG4 CPNE1 APOA2 PLSCR3 PI4K2A DGKQ IPMK SERINC2 PIP4K2B DPM2 MTMR1 FAM126B PIK3R1 PITPNM1 HADHA INPPL1 NAPEPLD PIGS PIKFYVE PLPP1 IMPA2 PLEKHA1 FAM126A ABHD8 CHKA CSF1R FADS1 HMGCS1 PIGQ PLCD1 ETNK1 SGMS1 CAPN2 PIGL NR1H2 PIP4K2C PLA2G12A PTEN SMPD4 DGKD SOCS4 ACSL3 PGAP3
GOBP_REGULATION_OF_RAS_PROTEIN_SIGNAL_TRANSDUCTION	0.0358126721763085	0.211742878402376	0.282013350011725	0.439160473878211	1.34207360081886	162	TIMP2 SQSTM1 CUL3 ABCA1 ADGRG1 RDX PIK3CG IGF1 MYO9B APOE JAK2 ARFGEF1 F11R RALGPS2 RASA1 DNM2 PIK3CB MAP4K4 KRAS ERBIN SHC1 HRAS OGT CADM4 CSF1 ARHGEF3 DENND1A ARHGEF18 RABL3 FLCN ARFGAP1 IQSEC1 RASAL3 GPR65 RASA4 LZTR1 EPOR CYTH2 GRB2 BCL6 ABL1 DENND4C CRK ARHGDIB ABL2 KITL DENND4A ITPKB RALGPS1 IRS2 GBF1 RGL2 VAV1 CDC42SE2 AKAP13 PRAG1 TGFB2 DENND4B CCDC125
GOBP_RESPONSE_TO_OXYGEN_LEVELS	0.0062342790172918	0.0784279189081405	0.407017918923954	0.417375673692252	1.34206998348957	315	HMOX1 ADAM8 PSMD1 ROCK2 HIF1A ATP6V1A EP300 PSMC4 HILPDA PKM SOD2 CDKN1A PSMB5 CRYAB THBS1 HSP90B1 ATP6V0D1 UBC CCDC115 CPEB4 HIGD1A EGLN1 PSMD12 ADAM15 BNIP3L PDK1 CD24A ACAA2 P4HB PINK1 LMNA CREBBP ANGPTL4 BCL2 PSMD7 PSMD9 CPEB2 PSMD2 WTIP ATP6V1G1 PSMA5 APAF1 ALKBH5 SLC8A1 ANG RBX1 CASP3 TM9SF4 ATP6AP1 ALAS1 EEF2K ARNT SCAP UBQLN1 PIN1 ATP7A SCFD1 SLC29A1 PSMB6 TMEM199 CAR9 ATP1B1 ACTN4 SLC2A8 PSMD13 MT3 BNIP1 PSMA4 DNM1L PGK1 ENO1 SLC11A2 CXCR4 UCP2 PLOD1 VHL LIMD1 AGTRAP PSMD5 MMP14 RGCC CUL2 BAD PRKAA1 PSMC6
GOBP_EPITHELIAL_TUBE_FORMATION	0.0469897209985316	0.234185318244204	0.252961123069611	0.467557977417373	1.34177565590395	97	SPINT2 FOLR1 HIF1A SKI RALA KDM2B KIF20B PHACTR4 DVL2 LMO4 STK3 LRP6 APAF1 CASP3 SUFU DVL3 SCRIB BRD2 PRKACA TGFB1 SOX4 TMED2 ABL1 OPA1 LUZP1
GOBP_CELL_AGING	0.052863436123348	0.245644718904977	0.237793834423688	0.470813564992131	1.34073262228649	87	ECRG4 CALR CDKN1A ID2 LMNA PLK2 BCL2 SOD1 CHEK2 BCL2L12 KRAS ZFP277 NEK6 TERF2 FZR1 SERPINE1 HRAS PRELP MIF CDKN2A SMC5 WRN NSMCE2 MORC3 ING2 PNPT1 MAPK14 CDK6 BCL6 ABL1 ZKSCAN3 OPA1 PTEN HMGA1 TRP53 ARG2 RBL1 YPEL3
GOBP_REGULATION_OF_DEVELOPMENTAL_GROWTH	0.0176301484912539	0.139146787225599	0.352487857583619	0.42705110670107	1.33986851800928	219	SPP1 APP EZR BASP1 MAPK1 CDKN1A TGFBR1 WWC2 G6PDX IGF1 CYFIP1 RAB21 EIF4G2 GAMT APOE SIN3A RAB11A RGS2 BCL2 LGMN DNM2 DBNL SOD1 STK3 CDKN1B SGPL1 SLC23A2 DIP2B VGLL4 GSK3B RUNX1 PIN1 CSF1 TNKS2 ADRB1 MT3 CXCR4 INSR IST1 NDEL1 RTN4 PLXNA4 FXN SMO MAPK14 BMPR2 DISC1 ABL1 GDF15 RYK PTEN BCL2L11 MEIS1 ADRB2 UNC13A SMURF1 RAI1 PIM1 MUL1 SAV1 ATRN SEMA6B LATS2
GOBP_CELLULAR_RESPONSE_TO_STARVATION	0.0272015834533493	0.180686804316687	0.352487857583619	0.450550050613617	1.3398492846606	128	HSPA5 ATF3 MAPK1 SH3GLB1 CDKN1A XBP1 CPEB4 HFE MAP1LC3B VPS41 GABARAPL2 BCL2 MYBBP1A ATG14 PPM1D GABARAP LARS RALB UPP1 USP33 RPTOR SLC39A4 WDR45B DAP FNIP1 RRAGA EIF2AK4 UCP2 RNF152 FLCN RRP8 MAPK8 SREBF2 WRN PRKAA1 SEH1L BMPR2 FADS1 TBL2 ASNS NUAK2 SIK1 XPR1 ZFYVE1
GOBP_HEART_PROCESS	0.0369357045143639	0.212648796913291	0.276500599254472	0.4348480758385	1.33953098826088	175	FXYD1 ATP1A1 FLNA GLRX3 PIK3CG AHCYL1 ATP1A2 JAK2 SCN1B GRK2 RGS2 KCNE2 ATP1B3 TAZ SOD1 ASPH SMAD5 S100A1 KCNK1 SLC8A1 GAA CALM1 DLG1 ATP1B1 ADRB1 DNM1L CXCR4 ASB3 PDE4B CAMK2D PRKACA KCNJ2
GOBP_MULTICELLULAR_ORGANISM_GROWTH	0.0466760961810467	0.233842620471382	0.248911114434702	0.456857498716735	1.33918165369297	108	APP EZR ATRX EP300 FKBP8 ARID5B IGF1 ADD1 GAMT ZFX BCL2 LGMN SOD1 SOS1 TARBP2 RBBP6 SGPL1 GNAS CLIC4 CELA1 CSF1 TNKS2 ADRB1 SLC4A10 PLEKHA1 FXN STK40 SMO TMED2 GDF15 ADRB2 RAI1 TRP53 SP2 KAT2A ATRN
GOBP_PYRUVATE_METABOLIC_PROCESS	0.0350140056022409	0.209807607253428	0.287857117255149	0.450357259253439	1.33814053797593	127	APP HIF1A EP300 PKM IGF1 LDHB ALDOA DLD NUP153 PDK1 GPI1 GLO1 NUP205 EIF6 PFKL RAE1 POM121 PRXL2C ME1 ZBTB7A ARNT RANBP2 OGT TPI1 PDK2 PFKM SLC16A1 NUP43 PGK1 AAAS ENO1 INSR MPC2 PGAM1 PRKAA1 GALK1 SEH1L NDC1 PSEN1 ZBTB20 NUP88 NUP210 NCOR1
GOBP_REGULATION_OF_DNA_BINDING_TRANSCRIPTION_FACTOR_ACTIVITY	0.00475030524406862	0.0661556271605153	0.407017918923954	0.413504163010035	1.33804602907339	353	HMOX1 CLU ADAM8 APP NFKBIA EP300 MAPK1 FLNA NFKB1 TNF IL1B BUD31 LGALS9 ARID5B UBC RAB7B PPP3CA ID1 HAVCR2 SMARCB1 SUMO1 EGLN1 IRAK2 HCLS1 JAK2 CTNNBIP1 COPS5 ID2 CIB1 MTDH CEBPG ATF2 PINK1 CX3CR1 CD36 DVL2 LRRFIP1 PARK7 CTNNB1 PPRC1 RB1 STK3 SGK1 PRKD2 LRP6 PELI1 NLRP3 EZH2 KRAS ERBIN MDFI SP100 ITCH SUFU USP7 ZBTB7A RIPK3 CARF MALT1 JMY FAF1 HDAC5 DDIT3 DAP TRIM27 ANXA3 G3BP2 CHUK BTK KDM1A EIF2AK4 PEX14 CDKN2A TAF1 IKBKG TERF2IP RNF2 DHX33 MAPK8 RGCC LAMTOR5 COMMD7 IRAK3 NFKB2 TRIM13 SMO MAPK14 WWP2 IRAK1 PIDD1 JUP TLR3 ARRB2 SIK1 TNFAIP3 NFKBIE
GOBP_CELL_PART_MORPHOGENESIS	0.00270094352189608	0.0465912757527073	0.431707695803346	0.401930994704275	1.33799263805125	498	ENPP2 SPP1 APP NRP2 IQGAP1 EZR HSP90AA1 RAP2A MAPK1 FEZ2 ULK2 USP9X CYFIP1 SKIL RAB21 PPP3CA RHOG ID1 EIF4G2 APOE TMEM106B POLDIP2 NFIB KIF5B ABI2 EPB41L3 B4GALT5 SCN1B PACSIN2 TRIO SIN3A RAB11A LLPH KIF20B DVL2 BCL2 S100B DNM2 DBNL GORASP1 PDLIM5 CD44 TRAK2 PIK3CB CTNNB1 SOS1 GAB1 SGK1 RANBP9 CAPRIN1 ROCK1 SLC23A2 MAP4K4 EMB NCKAP1L HPRT SHC1 TUBB2B DIP2B USP33 SPAST FARP1 DVL3 EEF2K GSK3B SDC2 CPNE1 ATP7A NFASC PLEKHO1 NEDD4 DOCK10 BAIAP2 MT3 DNM1L SLC11A2 CXCR4 EIF2AK4 IST1 NDEL1 PIK3R1 NPTN DCLK1 RHOH NIN RTN4 PANK2 OTX2 PLXNA4 CORO1C NTRK2 ACTR2 SS18L2 NRTN PNPT1 B4GALT6 SMO CSF1R BMPR2 MYCBP2 METRN TAOK1 MAP1S PLXNC1 SIPA1L1 DISC1 C9ORF72 GRB2 WASF2 NEO1 CNTNAP2 UBE3A PSEN1 ABL1 HSP90AB1 RYK OPA1 KIF1A PTEN STK25 FBXO45 RAB8A SMAD4 MARK2 SRC DTNBP1 UNC13A SMURF1 GRCC10 EXT1 APBB1 PLPPR4 MUL1
GOBP_LYMPHOCYTE_MIGRATION	0.0497803806734993	0.239837171694641	0.245041785430996	0.467253256155296	1.33768873762572	93	CCL5 ADAM8 APP CCL7 ECM1 SLC12A2 PIK3CG CH25H F11R APOD CD200R1 CD99L2 CCL2 DOCK8 RIPK3 S1PR1 JAM2
GOBP_COGNITION	0.0362903225806452	0.212648796913291	0.276500599254472	0.430953618009705	1.33618987429929	185	APP HIF1A EP300 MAPK1 CLN3 TNF IFT20 MAGT1 C5AR1 PIAS1 CYFIP1 ZFP385A APOE ATP1A2 NQO2 CX3CR1 PPP1R1B GM2A PLK2 TUSC3 GPR155 S100B LGMN SGK1 CHMP2B KRAS CASP3 SERPINF1 ATXN1 STRA6 GATM AAAS SLC11A2 INSR EIF2AK4 CTNS NPTN PJA2 PAIP2 NTRK2 ACTR2 ADCY3 SLC7A11
GOBP_CELLULAR_RESPONSE_TO_OXYGEN_LEVELS	0.0340136054421769	0.207360052454717	0.287857117255149	0.431696025040772	1.3360294629808	187	HMOX1 ADAM8 PSMD1 ROCK2 HIF1A ATP6V1A EP300 PSMC4 HILPDA PSMB5 ATP6V0D1 UBC CCDC115 CPEB4 HIGD1A EGLN1 PSMD12 BNIP3L PDK1 ACAA2 P4HB PINK1 LMNA CREBBP BCL2 PSMD7 PSMD9 CPEB2 PSMD2 ATP6V1G1 PSMA5 SLC8A1 RBX1 ATP6AP1 EEF2K ARNT UBQLN1 ATP7A SLC29A1 PSMB6 TMEM199 CAR9 PSMD13 MT3 PSMA4 DNM1L PGK1 ENO1 VHL LIMD1 PSMD5 RGCC CUL2 BAD PRKAA1 PSMC6 PSMB4 TBL2 PRKCE IRAK1 EGR1 ATP6V0A2 PSMA8 PSMB3 OPA1 BNIP3 PTEN EGLN3
GOBP_REGULATION_OF_PROTEIN_BINDING	0.0424076607387141	0.225023116171046	0.257206466468838	0.436345390688668	1.33506365390599	163	APP ANXA2 EP300 CDKN1A TGFBR1 DAB2 LRPAP1 ADD1 RAMP1 HFE ID1 APOE SLPI ADAM15 CTNNBIP1 PLK2 PDGFB SENP2 CTSZ PARK7 LDLRAP1 STK3 ROCK1 MARK3 DNAJB2 RALB MAPRE1 BTBD1 UBASH3B USP33 GSK3B PIN1 HDAC5 AURKB CSNK1E DDX11 KDM1A PEX14 RUVBL2 TAF1 PRKACA MAPK8 DTX3L DISC1 ARRB2 PSEN1 ABL1 HSP90AB1 CRK AMFR MARK2 SRC ADRB2 DTNBP1 MITD1 GOLGA2 NMD3 MAPRE3 SNAPIN TCF7L2 DVL1 CDC42 TIAM1 ZFPM1 CCL9 VTN
GOBP_POSITIVE_REGULATION_OF_PROTEIN_CONTAINING_COMPLEX_ASSEMBLY	0.0141956168869225	0.125885449349444	0.380730400722792	0.426413080485601	1.33424810973158	225	LGALS3 CLU P2RY12 ABCA1 DDB1 HSP90AA1 PSMC4 DDX3X TNF SH3GLB1 EIF4G1 CYFIP1 RHOC CUL4B SUMO1 MTLN PIH1D1 VCP RPA3 ABI2 PINK1 CD36 LCP1 BAIAP2L1 ARPC3 PARK7 GMFG ARPC5L PLEK DCTN1 NCKAP1L ARF1 RBX1 FNIP2 ARFIP1 MAPRE1 WASHC5 RICTOR DLG1 CUL4A GSK3B JMY CDC42EP4 FAF1 BRK1 FNIP1 TRIM27 CKAP5 BAK1 BAIAP2 ASAP1 PARP1 BIK NIN
GOBP_NEGATIVE_REGULATION_OF_ION_TRANSPORT	0.0168358672100749	0.136015149577055	0.352487857583619	0.426929062481162	1.3330910501279	211	FABP5 SLC43A2 SERPINE2 P2RY12 NFKB1 TNF IL1B THBS1 OAZ2 PPP3CA APOE ABCA2 SUMO1 NUP153 ATP1A2 MDFIC CD36 MAOB RGS2 APOD KCNE2 BCL2 APOC2 NDFIP1 CRY1 PSMD9 PIM3 PARK7 THADA PFKL TXN1 AKT2 FRMD4A RRAD SP100 CALM1 SUFU APOA2 UBQLN1 ATP7A NDFIP2 UFM1 UBE2G2 NEDD4 JAGN1 TRIM27 IDH2
GOBP_NEGATIVE_REGULATION_OF_CATABOLIC_PROCESS	0.0235038501258867	0.164418638207815	0.352487857583619	0.418123823254107	1.33107536484887	260	HMOX1 TIMP2 FUS CST3 ANXA2 SERPINE2 TARDBP HTR2B FLNA TNF IL1B FEZ2 SLC25A12 HNRNPU LARP1 EIF4G1 WAC PIK3CG HFE EIF4G2 SNRNP70 POLDIP2 NPC1 ZFP36 PINK1 GABARAPL2 BCL2 SDCBP PARK7 TENT4B HNRNPC SLC11A1 SGTA ANGEL2 ROCK1 EIF4ENIF1 ATP13A2 SUFU TREM2 USP7 CTSA APOA2 OGT PIN1 SCFD1 MAPKAPK2 DAP RRAGA MT3 TAF1 N4BP1 SEC22B IRAK3 PRKAA1 PARN SNX12 USP30 NSUN2 NMNAT1 MAPK14 MYCBP2 BANP LARP4B HNRNPD NOCT AZIN1 PSEN1 QSOX1 CDK5RAP3 ZKSCAN3 HSP90AB1 SECISBP2 NCOR1 RGP1 BECN1 TRP53 GOLGA2 KLHL22 BAG5 TIRAP TSC2 SMARCC1 TRIM39 THRAP3 UBQLN4
GOBP_MULTICELLULAR_ORGANISMAL_HOMEOSTASIS	0.00415242287010513	0.0606094030463422	0.407017918923954	0.407318548451013	1.33007692486531	375	FABP5 SPP1 PRDX1 LYZ2 CST3 ADAM8 TRF PRLR LIPA IL4RA TNF IL1B SLC12A2 EIF4G1 ITGB1 ADD1 INPP5D CAR2 ABCA4 ID1 NANOS1 SLC40A1 CIB2 JAK2 PRKAR1A DRAM2 F11R CD36 HADH RAB11A CLCN3 STRAP BCL2 AKR1B3 SOD1 RB1 SLC11A1 ABHD6 LNPEP PRCP KRAS EHMT1 GPR137B IQCB1 ACADL ATP6AP1 GNAS UBASH3B GADD45G SNX10 S1PR1 MEX3C OGT JAM2 LDB1 DDIT3 CSF1 PTGES PASK NPHP4 ADRB1 GATM SLC11A2 CXCR4 DEF8 KDM1A UCP2
GOBP_ACTIN_FILAMENT_BASED_MOVEMENT	0.0483162518301611	0.235833023402522	0.248911114434702	0.462089220825952	1.32993338103153	99	VIM ATP1A1 FLNA MYO9B ATP1A2 SCN1B KCNE2 MYL6 MYO5A WIPF1 DLG1 MYO1B ACTN4 PDE4B CAMK2D KCNJ2 MYH9 JUP WASF2 CACNA1D MYO6 TMOD1 WIPF3 MYO1G WAS TPM2
GOBP_PROTEIN_AUTOPHOSPHORYLATION	0.0382441200355239	0.216914687017447	0.321775918075361	0.427714347290351	1.32861846876257	194	IQGAP1 RAP2A DDX3X ULK2 SLK VRK1 GPNMB JAK2 RAP2B MVP PINK1 MAP3K11 PDGFB PIM3 CHEK2 PRKD2 DYRK1A RASSF2 MARK3 NEK6 CALM1 ATP13A2 RIPK3 EEF2K GSK3B DAPK3 MAPKAPK2 MEX3B MKNK2 PASK AURKB ENG BTK INSR EIF2AK4 PPP2R5C TAF1 PEAK1 TTK CAMK2D TOM1L1 PRKACA EIF2AK1 PIKFYVE AAK1 IRAK3 PTPRC NTRK2 CLK3 CSF1R TAOK1 IRAK1 STK10 STK16 MAPKAPK3 CLK2 SIK1 ABL1 NME2 STK25 VRK2 MELK IGF1R MARK2 SRC FGR CSNK1G2 PIM1 CLK1 STK24 ULK1
GOBP_REGULATION_OF_CELL_PROJECTION_ORGANIZATION	0.00218492424501486	0.0409289637810081	0.431707695803346	0.399297741194465	1.32764812941709	493	ENPP2 SPP1 LGALS1 VIM SCARB2 HSPA5 P2RY12 IQGAP1 EZR RAP2A EP300 FLNA TGFBR1 TMEM30A IFT20 GRN RDX RHOQ NME1 CERS2 CYFIP1 DOCK11 RALA SKIL RAB21 PPP3CA RHOG ID1 EIF4G2 APOE AKIRIN1 ITGA6 PIFO CIB1 ABI2 SCN1B RAB11A RGS2 DVL2 ANLN CAPZB DNM2 DBNL GORASP1 PDLIM5 CD44 TRAK2 MIEN1 CSMD3 CAPRIN1 RRN3 EZH2 MYLIP WASHC5 DIP2B SERPINF1 TREM2 DVL3 EEF2K GSK3B SDC2 HRAS ATP7A CDC42EP4 ZMYND8 BRK1 NEDD4 VDAC3 DYNLL1 MT3 DNM1L DEF8 KDM1A IST1 MYO10 NDEL1 PIK3R1 NPTN NIN DYNC2LI1 CDK10 IFT88 RTN4 PLXNA4 ITM2C CORO1C NTRK2 ACTR2 SS18L2 BMPR2 METRN PLXNC1 SIPA1L1 DISC1 TAPT1 WASF2 UBE3A PSEN1 RYK NME2 OPA1 KIF1A CRK PTEN PLEKHM1 AP2A1 STK25 RAB8B NEURL1A CARMIL1 CEP97 MARK2 SRC
GOBP_REGULATION_OF_EXOCYTOSIS	0.0388888888888889	0.218103448275862	0.271288554688953	0.4367143044585	1.32745168017963	157	HMOX1 CD84 VPS18 IL4RA LGALS9 RAB7 RALA RAB21 ITGAM SCAMP5 CD300A SDCBP RAB3GAP1 PDCD6IP ARF1 LAMP1 CALM1 ATP13A2 ATP6AP1 GSK3B PTAFR VPS4A RAB12 CLASP2 SNX4 CEACAM1 DNM1L RAB2B NSF RAB9
GOBP_REGULATION_OF_TRANSMEMBRANE_TRANSPORT	0.00573630192341444	0.0748513437227202	0.407017918923954	0.406219107307796	1.32655256972593	381	FABP5 C3 FXYD1 APP CD63 SLC43A2 OSBPL8 TMEM37 FLNA TNF PSEN2 IL1B THBS1 OAZ2 RHOQ G6PDX ITGB1 PIK3CG IGF1 CAR2 AHCYL1 SUMO1 ATP1A2 RNASEL KIF5B PINK1 SCN1B RGS2 KCNE2 BCL2 ATP1B3 DNM2 PARK7 THADA KCNJ13 AKT2 CCL2 ARF1 APPL1 SLC8A1 RRAD CALM1 TREM2 UBASH3B DLG1 CLIC4 PTAFR UBQLN1 TSPAN13 ATP7A NEDD4 ATP1B1 CTSS SELENON ACTN4
GOBP_GLYCOPROTEIN_METABOLIC_PROCESS	0.0113709716472231	0.114565055047465	0.380730400722792	0.412103226245275	1.32599140134206	310	MAN2A1 CST3 CTSL HIF1A MPDU1 IGF1 MAGT1 GAL3ST4 AGO2 RAMP1 EDEM2 SOAT1 NUDT14 HEXB ABCA2 SULF1 RPN2 NPC1 ARFGEF1 ALG3 COG7 B4GALT5 PRKCSH SEL1L NUS1 EDEM1 TUSC3 BCL2 GORASP1 PARK7 TRAK2 CTNNB1 MAN1C1 GALNT12 SRD5A3 NGLY1 RPN1 NAGPA DDOST POFUT2 GANAB HEXA GALNT10 ST3GAL5 MAN1A UGGT1 OGT ATP7A TMTC4 POMGNT1 CELA1 MAN2B1 B4GALT1 MCFD2 MT3 MGAT2 IDS RXYLT1 DPM2 HS6ST2 RAB1B UGDH ITM2C TRIM13 B3GALNT1 B4GALT6 KRTCAP2 BMPR2 B3GAT3 B3GALT4 PMM1 POMT2 CANT1 CSPG4 EXTL3 IL15 GXYLT1 PLOD3 PSEN1 CHST11 FKTN GCNT2 AMFR ALG14 MPI NCSTN POMK NDST1 EXT1
GOBP_ORGANELLE_FUSION	0.0438472418670438	0.227426354740909	0.257206466468838	0.446458329947774	1.32579008154233	131	ANXA2 CALR CHMP3 VPS18 CLN3 TGFBRAP1 RAB7B SPG7 RAB7 SNAP29 TAPBP KIF5B VPS41 RAB20 ANKFY1 VAT1 BET1 AKT2 CHMP2B VPS11 VPS16 ATP13A2 RAB34 VPS4A BAK1 PIP4K2B BNIP1 DNM1L ENO1 STX8 SEC22B PIKFYVE VPS8 RAB13 USP30 STX12 LRMP VAMP3 USO1 OPA1 BNIP3 SAMD9L RAB8B STX4A RAB8A MFN1
GOBP_REGULATION_OF_EPITHELIAL_CELL_DIFFERENTIATION	0.0483162518301611	0.235833023402522	0.248911114434702	0.460562548168719	1.32553948297623	99	CTSL ROCK2 TNF IL1B ADD1 ID1 CD24A SPRED2 F11R ZFP36 CTNNB1 ROCK1 EZH2 XDH SERPINE1 RUNX1 TNFRSF1A CEACAM1 CCND1 ZBED3 BAD SMO
GOBP_REGULATION_OF_PROTEIN_STABILITY	0.0168283878278343	0.136015149577055	0.352487857583619	0.41615098415481	1.32381369238222	267	CLU TRF CUL3 CALR HSP90AA1 TARDBP EP300 MAPK1 FLNA SH3GLB1 CDKN1A CRYAB GRN HSPD1 GLMP USP9X IGF1 RAB21 SUMO1 PRKRA IRGM1 CDC37 COG7 PINK1 B4GALT5 SEL1L CREBBP ZSWIM7 SENP2 BCL2 CRTAP ATP1B3 BAG1 PARK7 STK3 CHEK2 RASSF2 PEX2 KRAS DDOST TRIM44 VPS11 FBXL3 TBRG1 MYLIP CASP3 LAMP1 USP7 USP33 CTSA DVL3 APOA2 PIN1 CCT6A IRGM2 HIP1 ATP1B1 CD81 CCNH MT3 FBXO4 DPM2 FBXW11 RNF149 BAG3 TAF1 RABL3 PIK3R1 VHL USP8 AAK1 CMTM6 ZBED3 RTN4 MORC3 CDKN2AIP STX12 SMO STXBP4 USP2
GOBP_RESPONSE_TO_CORTICOSTEROID	0.0491329479768786	0.238540986233161	0.245041785430996	0.455975433211101	1.3230715391177	102	ARG1 IGFBP2 IL1RN SPARC TNF PCNA CDKN1A HNRNPU ADAM9 ZFP36 MAOB BCL2 IGFBP7 SGK1 KRAS CASP3 CALM1 SERPINF1 FOSB PTAFR NR3C1 ANXA3 ENG PARP1 CCND1 USP8 BAD CPN1 ZFP36L2 CDO1
GOBP_MICROTUBULE_BASED_MOVEMENT	0.00995459090234812	0.105810951253326	0.380730400722792	0.414895769116329	1.32185142817749	275	APP HIF1A CLN3 HNRNPU TEKT1 IFT20 COPG2 ARL8B IFT22 RAB21 ARL3 ARL8A TPGS1 KIFAP3 KIF5B VPS13A DST CENPE DLGAP5 KIF20B KIF24 TMF1 SOD1 TRAK2 MEIG1 CFAP298 CFAP20 KIF15 IFT43 UXT LAMP1 TERF2 DNAAF5 SPAST DYNLRB1 RSPH4A KIF2A IFT74 AP3B1 NPHP4 DYNLL1 AP3D1 KLC2 RACGAP1 FBXW11 PEX14 ENKUR BAG3 NDEL1 KTN1 DYNC2LI1 BLOC1S5 IFT88 PGAM1 NDE1 ASH1L INTS13 ACTR2 RHOT1 ING2 AP3M1 ADCY3 KIF1B MAP1S RABL2 DYNC1I2 KIF3C CEP131 AP3S1 OPA1 KIF1A KIF3A NEURL1A DTNBP1 DYNLRB2 KIF3B CATSPER2 BICDL1 HSPB1 KIFC5B SNAPIN KIF16B TRIP11
GOBP_SPHINGOLIPID_METABOLIC_PROCESS	0.0450070323488045	0.229889905919605	0.252961123069611	0.444216990927588	1.32142201340432	130	ENPP2 PSAP SERINC1 TNF PLA2G15 GLA NAGA CERS2 CERK HEXB ABCA2 TECR B4GALT5 GM2A PPT1 ELOVL7 PRKD2 SGPL1 FADS3 ITGB8 NEU1 HEXA CTSA ST3GAL5 TNFRSF1A ESYT1 SERINC2 PPP2R1A
GOBP_MEMBRANE_DOCKING	0.0424076607387141	0.225023116171046	0.257206466468838	0.428813725864464	1.32094243001869	175	VPS18 EZR HSP90AA1 CLN3 PSEN2 RAB7 AHCYL1 SNAP29 NPHP1 NINL RAB11A KIF24 NEDD1 HAUS4 PLEK CNTRL CEP89 ATG14 ROCK1 DCTN1 VPS11 IQCB1 RALB MAPRE1 B9D1 SCFD1 ESYT1 CKAP5 RAB12 NPHP4 CSNK1E DYNLL1 PPP2R1A CEP83 TUBA1A NSF CEP41 STX8 CEP63 PRKACA RPGRIP1L NDE1 ACTR1A RAB13 ODF2 STX12 VAMP3 CEP250 DYNC1I2 CEP57 CEP131 HAUS6 USO1 RAB8B CEP78 STX4A PEX16 RAB8A CEP97 UNC13A VPS45 CTBP2 HAUS1 ALMS1 DCTN2
GOBP_RESPONSE_TO_CARBOHYDRATE	0.046831955922865	0.234108372417922	0.245041785430996	0.431765799098605	1.31947548828676	162	LGALS1 SPARC HIF1A GCLM SOD2 THBS1 XBP1 NME1 PPP3CA SMARCB1 PIH1D1 KRT18 KIF5B SELENOT OXCT1 SIN3A PIM3 PFKL TRA2B SLC2A5 ME1 SLC8A1 CASP3 SERPINF1 APOA2 SLC29A1 JAGN1 DYNLL1 UCP2 MPC2 EIF2B3 PRKACA ZBED3 BAD PRKAA1 KAT7 STXBP4 PRKCE ENY2 EGR1 EIF2B2 SMAD2 SOX4 KHK ZBTB20 NME2 OPA1 PTEN STX4A GOT1 SLC39A14 IGF1R NDUFA9
GOBP_REGULATION_OF_MYELOID_CELL_DIFFERENTIATION	0.0279857058513198	0.184973736497693	0.352487857583619	0.42453277103315	1.31943558740584	203	LGALS3 PF4 HIF1A NFKBIA EP300 TNF LILR4B ACIN1 THBS1 RAB7B INPP5D NME1 BRD1 CAR2 HSPA9 HCLS1 CTNNBIP1 CIB1 ZFP36 CREBBP WDR5 SIN3A CTR9 NDFIP1 EIF6 RB1 DPY30 RASSF2 PRMT1 AGO1 NCKAP1L CNOT4 GPR137B TOB2 ATP6AP1 TREM2 GNAS UBASH3B NCAPG2 CUL4A ARNT RUNX1 KAT2B LDB1 CSF1 KMT2E
GOBP_MYELOID_CELL_DIFFERENTIATION	0.00845024331834725	0.0961822527932122	0.380730400722792	0.408033770141817	1.31934178400216	344	LGALS3 PF4 MT1 TRF APP ANXA2 HIF1A NFKBIA EP300 CEBPA TNF LILR4B ACIN1 THBS1 G6PDX ADD1 RAB7B INPP5D NME1 BRD1 MT2 CAR2 HSPA9 ZFP385A HCLS1 JAK2 CTNNBIP1 CIB1 ARID4A CEBPG ZFP36 SH2B3 GLO1 CREBBP WDR5 SIN3A CTR9 IKZF1 NDFIP1 ADAR EIF6 IRF8 RB1 SMAD5 DPY30 RASSF2 PRMT1 AGO1 NCKAP1L CNOT4 ITGB8 GPR137B JUNB CASP3 TOB2 ATP6AP1 TREM2 FLI1 GNAS UBASH3B ZBTB7A ALAS1 NCAPG2 SNX10 CUL4A ARNT RUNX1 KAT2B ACTN1 LDB1 CSF1 KMT2E JAGN1 CD81 AP3B1 PITHD1 CEACAM1 PABPC4 SLC11A2 PIK3R1 PARP1 SETD1A
GOBP_CELLULAR_RESPONSE_TO_CHEMICAL_STRESS	0.00991724432598208	0.105810951253326	0.380730400722792	0.411121493763595	1.31925739299751	294	HMOX1 PRDX1 SERPINB6A ARG1 HIF1A RHOB SIRPA MAPK1 DDX3X PRDX6 CLN3 PCNA SOD2 G6PDX NONO GSR TXNRD1 SRXN1 PRR5L PDK1 PRKRA JAK2 PRDX5 P4HB PINK1 CD36 SIN3A BCL2 VKORC1L1 AKR1B3 DNM2 SOD1 PARK7 NCF4 CPEB2 CYBA TXN1 MGST1 EZH2 ZFP277 CDK2 CASP3 ZFP580 PYCR2 ATP13A2 MICU1 RIPK3 ARNT UBQLN1 ATP7A AIFM2 PDK2 DDIT3 PCGF2 MT3 ZFP622 CHUK BTK PARP1 MAPK8 BAD PLEKHA1 PRKAA1 XRCC5 DHFR FXN MTR PNPT1 SLC7A11 MBIP ECT2 HNRNPD SLC12A6 TNFAIP3 ABL1 NME2 BNIP3 CRK STK25 VRK2 MELK STX4A SRC DIABLO STAU1 BECN1 TRP53 FANCD2 TLR4 GPX3 BAG5 SLC25A24 STK24 CAT HSPB1 FOXO3 GPX7 SIGMAR1 SOD3
GOBP_NEGATIVE_REGULATION_OF_IMMUNE_SYSTEM_PROCESS	0.00996769830647276	0.105810951253326	0.380730400722792	0.408439307685636	1.31819906256971	328	HMOX1 LGALS3 A2M ARG1 CD84 CD68 DDT EZR IL4RA LAG3 TNF DGKZ LILR4B LGALS9 CST7 GRN THBS1 CD300LF INPP5D NME1 HSPA9 HFE HAVCR2 TNFRSF21 GPNMB PRKAR1A ZC3H8 RIOK3 CD47 APOD CD200R1 NDFIP1 ADAR C5AR2 CD300A TARBP2 MERTK LAPTM5 PELI1 CCL2 APPL1 GPR137B CASP3 H2-OA ITCH TOB2 DUSP3 VSIR UBASH3B RC3H1 DLG1 SCRIB CUL4A APOA2 RUNX1
