pathway	pval	padj	log2err	ES	NES	size	leadingEdge
GOBP_PROCESS_UTILIZING_AUTOPHAGIC_MECHANISM	0.000682610362649681	0.0447604869113935	0.477270815362862	0.387535445503354	1.37047017903097	497	HSP90AA1 VCP HMOX1 LAMTOR5 ABL2 ADRB2 VPS28 IFT20 MTDH TRAPPC8 ADPRH CHMP2B RAB39 LARP1 TRIM65 ATP6V1E1 CLTC TRAPPC4 TOMM5 TREM2 HSPA8 CDK5R1 ABL1 DAPK3 MTM1 TGFBRAP1 ATP6V1C1 VPS26A ATG4B HUWE1 RNF166 RNF5 ATG14 ULK2 UBQLN1 MAP1S TBC1D14 ATG12 PIP4K2A UFL1 SCOC LAMTOR1 SUPT20 EVA1A RAB3GAP2 TRP53 RAB33B WAC ULK1 STAM2 UVRAG HERC1 SCFD1 ATP6V0A1 SBF2 SNX5 TRIM8 DDIT3 TPCN1 MUL1 PIK3CA LGALS8 IRF8 VPS41 GSK3B TAB2 PINK1 PRKAB1 SMG1 NSFL1C UBQLN2 STAT3 CHMP3 CD84 SNAPIN SREBF2 GOLGA2 ILRUN PIK3R2 GABARAPL1 SNAP29 NPC1 ATG4D TLK2 STK11 FEZ2 RALB CTSA ATP6V1G1 GPSM1 SPTLC1 FUNDC1 USP36 EIF4G2 RRAGC FOXK1 PHF23 BNIP3L MTMR9 ULK3 YOD1 GABARAP TECPR1 TICAM1 KDM4A CSNK2B ATG10 KDR RMC1 ZKSCAN3 RUBCNL TRIM21 PIK3CB FBXW7 TFEB GPR137 SH3GLB1 ATG2B TBC1D5 VTI1A VPS37C DRAM2 RAB1A SUPT5 MARK2 PRKN TMEM41B AMBRA1 NOD1 PACS2 TOLLIP WIPI2 ATPIF1 VTA1 SYT11 BECN1 TEX264 MVB12A STX12 SQSTM1 PIP4K2B MCL1 RETREG3 FBXO7 PIKFYVE ERCC4 ATG101 XBP1 TRIM30D EI24 VPS13D ATG5
GOBP_NUCLEOBASE_CONTAINING_COMPOUND_TRANSPORT	0.00661544450343184	0.140331498317665	0.407017918923954	0.414741871573414	1.3697735216045	222	TGFBR2 CPSF6 SLC29A3 SLC35A5 RBM8A PABPN1 FMR1 CR1L RAN NCBP3 HNRNPU QK RIOK2 SEH1L AHCTF1 EIF4E ABCD1 FIP1L1 YTHDC1 BICD2 SLC25A23 SSB SRSF11 SARNP CASC3 SMG7 NUP214 MAGOH U2AF2 SLC25A5 DHX9 SMG1 SLC33A1 HNRNPA2B1 MRPL18 U2AF1L4 SLC35B4 SLC29A1 SRSF9 FLOT1 ALYREF ZC3H11A SRSF1 EIF5A ENY2 SRSF2 CETN2 AGFG1 KHDRBS1 NXT2 LRPPRC HHEX SLC35E3 RAE1 CDC40 UPF2 THOC7 CPSF1 CHTOP EIF4A3 SRSF3 ZC3H3 CPSF4 NUP37 SLC25A4 SUPT6 NUPL2
GOBP_TRANSMEMBRANE_RECEPTOR_PROTEIN_SERINE_THREONINE_KINASE_SIGNALING_PATHWAY	0.00665324938135711	0.140331498317665	0.407017918923954	0.408598894673548	1.36648464628936	249	TGFBR2 HPGD PDCD4 PMEPA1 TRF GLG1 ZMIZ1 CREBBP JUN HSP90AB1 SMAD1 HSPA1A ABL1 TGFBR1 TGFBRAP1 UBC LDLRAD4 UBE2D1 ZFP703 SMAD4 NUMA1 TRP53 EID2 ENG TGFB1 LPXN PXN ZBTB7A BMPR1A NLK APPL2 CREB1 SLC33A1 HES1 CDKN1C SKIL FKBP1A RBM14 LEFTY1 SPG20 STK11 SKI PELO NOMO1 CSNK2B NOTCH2 HIPK2 UBE2O THBS1 SDCBP CBL SUB1 LATS2 UBB ZFP451 ZFP128 NOTCH1 SMURF2 LATS1 ZC3H3 SMAD2 PARD6A PIN1 GOT1
GOBP_POSITIVE_REGULATION_OF_CYTOSKELETON_ORGANIZATION	0.0137264763212204	0.191237450906966	0.380730400722792	0.422554161698006	1.366248789053	187	HSPA1B PFDN2 SPIRE1 AKAP9 WAS ARPC5 GMFB HSPA1A CDK5R1 ABL1 TGFBR1 WASF2 ARPC2 WHAMM NUMA1 P2RX7 BCAS3 SPAST CDC42 HRAS PXN RAC1 ABI2 ARPC1A DRG1 CDK5RAP2 VASP RHOC WASL MAPRE1 CYFIP1 ARF1 DYNC1H1 DSTN NRP1 GMFG WASHC2 JMY ARF6 ARFIP1 CEP295 PLEK ARPC5L NCKAP1L
GOBP_CELLULAR_RESPONSE_TO_TOPOLOGICALLY_INCORRECT_PROTEIN	0.024699884880181	0.239326118604988	0.352487857583619	0.426805465551539	1.36431802487656	154	HSPA1B CCND1 CREB3L2 VCP TMEM33 CREBRF SULT1A1 SEC31A TM7SF3 HSPA1A HSPA8 DNAJB11 NFE2L2 RNF5 CXXC1 COPS5 TPP1 UFL1 RNF121 DDIT3 SSR1 CANX DNAJC3 PPP1R15B HSP90B1 EXTL3 TMTC4 HERPUD2 HERPUD1 UFD1 HDGF MYDGF YOD1 DERL2 PREB SYVN1 EDEM1 DNAJB9 PRKN BAX UGGT2 HSPA14 CREB3 TLN1 XBP1 YIF1A
GOBP_TRANSFORMING_GROWTH_FACTOR_BETA_RECEPTOR_SIGNALING_PATHWAY	0.0173351234856816	0.210155261282689	0.352487857583619	0.42381951084832	1.36323959850776	161	TGFBR2 HPGD PMEPA1 GLG1 ZMIZ1 CREBBP JUN HSP90AB1 SMAD1 HSPA1A TGFBR1 TGFBRAP1 UBC LDLRAD4 ZFP703 SMAD4 TRP53 EID2 ENG TGFB1 LPXN PXN ZBTB7A BMPR1A NLK APPL2 CREB1 CDKN1C SKIL LEFTY1 STK11 SKI HIPK2 THBS1 SDCBP CBL LATS2 UBB ZFP451 SMURF2 LATS1 SMAD2 PARD6A PIN1 GOT1 GDF9 SMAD3 FNTA NRROS CAV2
GOBP_NEGATIVE_REGULATION_OF_CELLULAR_PROTEIN_LOCALIZATION	0.0264273161240361	0.243046396605041	0.352487857583619	0.445676430220756	1.36265837636472	99	ABHD17C CLTC DNAJA1 BCL2L1 PPFIA1 COMMD1 TGFB1 TXN1 GSK3B TMBIM1 INPP5E NSFL1C ILRUN OTUD7B SUFU LMAN1 UBE2J1 POLR1A LEPROTL1 YOD1 DERL2 UBE2G2 PKIG FBXO4 CTNNA1 GDI1 LATS2 TERF1 PKDCC NUMB ARF6 LATS1 CHP1 LILR4B TRP53INP2 NEDD4L ERLEC1 ANKRD13A BAG3 RHOQ LYPLA1
GOBP_PHOSPHATIDYLINOSITOL_BIOSYNTHETIC_PROCESS	0.0234568913182224	0.232063723182828	0.352487857583619	0.444440198037773	1.36257167361338	108	PIK3CG PTEN PIGP RAB14 MTM1 PIGF PIGH PIP4K2A PIGK IMPA1 PLEKHA2 PIK3CA INPP5E PGAP2 PIGU CDIPT PIK3R2 ARF3 ARF1 MTMR9 PIGA PIK3CB PIGYL PLEKHA8 PIP5K1C PLCG2 PIP4K2B PIKFYVE PLEKHA3 PIGC PI4K2A PIGM MPPE1 SACM1L VAC14 MTMR1
GOBP_RESPIRATORY_SYSTEM_DEVELOPMENT	0.0214195199583393	0.225232429184141	0.352487857583619	0.435141190680345	1.36240336942998	130	TGFBR2 LIPA MAP2K1 BASP1 EIF4E MAN1A2 ATP7A PLOD3 SMCHD1 CDC42 MAPK1 BMPR1A CREB1 HES1 ABCA3 ARG1 SKI MMP14 MAN2A1 FBXW7 PKDCC JMJD6 NOTCH1
GOBP_MESENCHYMAL_CELL_DIFFERENTIATION	0.0108214232562043	0.172364163676613	0.380730400722792	0.422614493243351	1.360987221987	166	TGFBR2 PTEN PDCD4 AKNA HNRNPAB PPP2CA TGFBR1 LDLRAD4 ZFP703 FAM172A MCRIP1 SMAD4 PDCD6 ENG CTNNB1 MAPK1 TGFB1 NOLC1 RTN4 GSK3B BMPR1A NRP2 HES1 CORO1C NRP1 SDCBP KLHL12 SEMA4D MEF2C NOTCH1 TIAM1 SEMA4B HDAC2 SMAD2
GOBP_RESPONSE_TO_TOPOLOGICALLY_INCORRECT_PROTEIN	0.0163968125073337	0.205705466001096	0.352487857583619	0.421393089496513	1.3606004575068	188	HSPA1B CCND1 HSP90AA1 CREB3L2 VCP HSPA4 TMEM33 CREBRF HSP90AB1 SULT1A1 SEC31A DNAJA1 TM7SF3 HSPA1A HSPA8 DNAJB11 NFE2L2 RNF5 CXXC1 COPS5 TPP1 UFL1 HSPH1 DNAJB1 RNF121 DDIT3 SSR1 CANX DNAJC3 PPP1R15B HSP90B1 EXTL3 TMTC4 HERPUD2 HERPUD1 UFD1 HDGF MYDGF YOD1 DERL2 PREB THBS1 TOR1B SYVN1 EDEM1 DNAJB9 PRKN FBXO6 BAX UGGT2 HSPA14 CREB3 TLN1 XBP1 YIF1A EDEM2
GOBP_TRANSCRIPTION_INITIATION_FROM_RNA_POLYMERASE_II_PROMOTER	0.0255589900228178	0.241054911182187	0.352487857583619	0.425267066428314	1.35940040825101	154	CCND1 PTEN PSMC4 RXRA PSMC5 CREBBP MED1 NR3C1 CTNNBIP1 POLR2I POLR2G MAZ PPM1D GTF2A1 TRP53 POLR2J POLR2B CBFB GTF2H2 CREB1 TAF8 GTF2B GTF2A2 POLR2C E2F3 NOTCH2 TAF3 DR1 MED23 MED8 SUB1 MED14 ZFP451 NOTCH1 TAF1 BAX GTF2F2
GOBP_PROTEIN_POLYUBIQUITINATION	0.00627601003974244	0.138742474373724	0.407017918923954	0.398861576686765	1.35879932483879	308	LNPEP RC3H1 UBE3A FBXO11 PSMC4 RNF6 PSMB3 PSMA2 TRIM44 PSMC5 ZNRF2 PSMA6 RNF167 RNF213 PELI2 PSMD7 PSMD14 UBE2E3 UBC HUWE1 RNF166 UBE2D1 RNF5 PSMD12 UBE2S ANAPC2 PSMD2 HACE1 UBE4A CTNNB1 PSMA4 DDX3X MUL1 RNF34 OTUB1 TRAF6 CBFB ARIH1 RFFL TRAF3 FBXW5 FBXL14 PSMD9 PSMD1 PSMA5 PSMB6 MKRN1 ITCH PSMD8 PSMA3 MYLIP UBE2J1 TTC3 TRAF5 SHARPIN CDC16 UBE2G2 UBE2O TRIM21 FBXW7 FBXO4 CUL1 CBL SYVN1 D7ERTD443E RLIM NPEPPS UBB PELI1 ANAPC7 RNF4 PSMD10 UBE2N PRKN FBXO6 TAF1 RBCK1 UBE2Q1 UBE2E1 SMURF2 UBR2 RNF8 IRF2BP1 ANKRD39 PSMD3 UBE3C FBXO7 SPOP TRIM30D NHLRC3 LRSAM1 GPS2 PELI3 PSMB10 FBXO28 UBE2G1 MDM2 NEDD4L
GOBP_LYSOSOMAL_TRANSPORT	0.0273563608984004	0.246207248085604	0.352487857583619	0.444057193434756	1.35641619723382	102	HOOK3 VCP ADRB2 CHMP2B AP1G1 VAMP7 NCOA4 HSPA1A HSPA8 MTM1 TGFBRAP1 ATG14 AP3D1 VPS41 PINK1 SCARB2 SORT1 CHMP3 SNAPIN NPC1 ARF1 NAGPA ANKFY1 GGA3 LAPTM5 GPRASP1 PRKN VIPAS39
GOBP_CELL_CYCLE_ARREST	0.00968898346637443	0.169439324016136	0.380730400722792	0.413495779576081	1.35419839880442	205	CCND1 SOX4 LAMTOR5 CNOT8 MAP2K1 HSP90AB1 ZFHX3 CDK5R1 CRLF3 ABL1 TGFBR1 WHAMM CNOT6L LAMTOR1 TRP53 CDK6 TGFB1 HRAS KMT2E DDIT3 RB1 UHRF2 PRKAB1 CDKN1C CDC14A SKIL PKD2 HBP1 STK11 ZFP385A EIF4G2 RRAGC NOTCH2 CNOT4 THBS1 CNOT10 ARID3A PPP1R9B CDK2 TBRG1 NOTCH1 BAX JMY CAB39L TRIAP1 TFAP4 CRADD NBN MSH2 VASH1 CNOT2 MDM2 PRKAA1 SMAD3 KAT2B CNOT1 SDE2 MED25 MLXIPL PRMT1 MYBBP1A PRKAG2 CASP2 RBL2 EIF2AK4 EP300 PKD1
GOBP_TRANSPORT_ALONG_MICROTUBULE	0.0228186863244668	0.229903313100933	0.352487857583619	0.425678139055539	1.3540130653129	144	TNPO1 IFT20 KIFAP3 VAMP7 HSPA8 ARL8B HNRNPU KIF5B MAP1S SUN2 AP3D1 BICD2 SPAST CDC42 ARL3 RAB6A TRIP11 SNAPIN PAFAH1B1 IFT52 STK11 COPG1 DYNC1H1 IFT140 BLOC1S3 LRPPRC BORCS5 UBB OPA1 RAB1A APBA1 IFT80 ARMCX3 TRAK2 PEX14 ARHGAP21 IFT88 IFT22 NDE1 BAG3 TRAK1
GOBP_REGULATION_OF_WNT_SIGNALING_PATHWAY	0.00664431884527475	0.140331498317665	0.407017918923954	0.400011738861488	1.35229427246952	291	CSNK1E FAM53B VCP SOX4 IFT20 PSMC4 PSMB3 PSMA2 PSMC5 PSMA6 RNF213 CTNNBIP1 PPP2CA JADE1 PSMD7 SALL1 PSMD14 ABL1 DAPK3 WLS ZFP703 PSMD12 CHD8 USP34 OTULIN PSMD2 CTNND1 EMD CTNNB1 PSMA4 TGFB1 CSNK1G2 DDX3X DDIT3 MDFI GSK3B CBFB NLK KPNA1 USP47 TLE5 PPP2R1A PPM1B PSMD9 NFKB1 PSMD1 STK11 PSMA5 PSMB6 PSMD8 PSMA3 CDK14 SKI LYPD6 CYLD CTDNEP1 TMEM237 HHEX KLHL12 RAPGEF1 CSNK1A1 LATS2 PSMD10 NOTCH1 PRKN CSNK1G1 TIAM1 SMURF2 TLE3 AMER2 LATS1 IFT80 PSMD3 PIN1 WWOX TMEM64 FZD4 PSMB10 TMEM9 SNX3 SMAD3 SLC9A3R1 CSNK1G3 PSMB8 TBL1XR1 PTPRO HMGXB4 CAPRIN2 TMEM131L LBX2 ATP6V0C ARNTL PSMC3 MLLT3 TLE1 MAD2L2
GOBP_REGULATION_OF_CELLULAR_PROTEIN_LOCALIZATION	0.000784401779692058	0.0476288760629018	0.477270815362862	0.382768423810729	1.35210705864304	483	CSNK1E HSP90AA1 TMEM30A VCP LAMTOR5 RASSF5 VPS28 YWHAE ABHD17C XPO4 HSP90AB1 RAN CLTC CCT6A DNAJA1 BCL2L1 TREM2 CDK5R1 YWHAG ZDHHC5 CCT4 SLC5A3 HUWE1 KIF5B RIOK2 PPFIA1 YWHAB GPC2 ENTR1 NUMA1 TRP53 COMMD1 BCAS3 ATAD1 EMD CTNNB1 CDC42 MAPK1 MSN CRIPT TGFB1 PDCD10 HRAS NOLC1 TRIM8 CCT8 RB1 YWHAZ TXN1 RTN4 GSK3B TMBIM1 INPP5E RAB11FIP5 PRKCH MESD PINK1 BYSL NSFL1C LGALS3 ZDHHC8 SREBF2 ILRUN PIK3R2 OTUD7B STK11 CCT2 SUFU RALB LMAN1 UBE2J1 POLR1A USP36 MMP14 MFF BNIP3L LEPROTL1 MCRS1 YOD1 ZDHHC7 DERL2 UBE2G2 CCDC66 ITGB2 RDX PKIG FBXW7 FBXO4 ABCA2 CTNNA1 PCNT EDEM1 LCP1 SH3GLB1 STX6 PPP1R9B TCAF1 NPEPPS GDI1 LATS2 TERF1 PKDCC PRKN NUMB GRIPAP1 ACSL3 ATPIF1 ARF6 SYT11 LATS1 B3GAT3 CHP1 CCT3 PARD6A SUMO2 RER1 SQSTM1 ZFAND1 PIN1 CEP72 LILR4B IL1B PDCD5 MEAK7 EDEM2 TRP53INP2 MIEF1 C2CD5 PRKCD CIB1 NEDD4L PRKAA1 CROCC SMAD3 NMD3 GPR137B CAMK1 CASP8 VPS4A RAP1A
GOBP_REGULATION_OF_CELL_CYCLE_G2_M_PHASE_TRANSITION	0.012501786507168	0.183655276624655	0.380730400722792	0.412785566913625	1.35108694249777	204	CCND1 CSNK1E HSP90AA1 TUBA1A PSMC4 PSMB3 PSMA2 YWHAE PSMC5 AKAP9 PSMA6 PSMD7 PSMD14 YWHAG PSMD12 CEP135 CEP57 PSMD2 TRP53 PSMA4 USP47 CDK5RAP2 PPP2R1A PAFAH1B1 PSMD9 PSMD1 RCC2 PSMA5 MAPRE1 PSMB6 PSMD8 PSMA3 TUBB4B DYNC1H1 TUBG1 TAOK3 CETN2 HAUS3 CUL1 PCNT FOXN3 PSMD10 CDK2 TUBB5 RINT1 ATAD5 PBX1 HAUS6 FBXO5 NBN PSMD3 TRIM39 ZFYVE19 CEP72 CCP110 MIIP PSMB10 UIMC1 BABAM1 VPS4A PSMB8 RAD21 NDE1
GOBP_ESTABLISHMENT_OF_RNA_LOCALIZATION	0.0146447016425162	0.195577628387152	0.380730400722792	0.418166647634777	1.35036681087841	180	TGFBR2 CPSF6 RBM8A PABPN1 FMR1 RAN NCBP3 HNRNPU QK RIOK2 SEH1L AHCTF1 EIF4E FIP1L1 YTHDC1 BICD2 SSB SRSF11 SARNP CASC3 SMG7 NUP214 MAGOH U2AF2 DHX9 SMG1 HNRNPA2B1 MRPL18 U2AF1L4 SRSF9 FLOT1 ALYREF ZC3H11A SRSF1 EIF5A ENY2 SRSF2 CETN2 AGFG1 KHDRBS1 NXT2 LRPPRC HHEX RAE1 CDC40 UPF2 TERF1 THOC7 CPSF1 CHTOP EIF4A3 SRSF3 ZC3H3 CPSF4 NUP37
GOBP_CELL_PART_MORPHOGENESIS	0.00152996969691512	0.0663569714262043	0.45505986738723	0.381659766367828	1.35001057256307	498	SPP1 PTEN HSP90AA1 UBE3A PPP3CA B4GALT6 RNF6 PLXNB2 GAB1 MAP2K1 HSP90AB1 SRGAP2 KLK8 CSF1R CDK5R1 ABL1 WASF2 MTM1 PTPRM KIF5B ULK2 MAP1S PLEKHO1 ANAPC2 SMAD4 PRKCA RAB10 ATP7A ULK1 PPP3CB SPAST GAB2 RERE CTNNB1 CDC42 SH3KBP1 ARHGDIA MAPK1 TUBB2B MEF2A MUL1 PIK3CA RAC1 RYK RTN4 ABI2 GSK3B STXBP1 CREB1 NRP2 LLPH MAP4K4 SKIL PACSIN2 PAFAH1B1 VASP WASL ZSWIM6 FLOT1 RREB1 SPG20 STK11 B4GALT5 FEZ2 CORO1C PDLIM5 MYO9A CYFIP1 EIF4G2 MFF SPAG9 POSTN TAOK3 UST NOTCH2 SPTAN1 PIK3CB NRP1 SEMA4D TANC2 TTL GDI1 UBB OPA1 MARK2 LYPLA2 NOTCH1 PRKN BAX SLC23A2 RPS6KA5 CCK NUMB METRN TIAM1 DIP2A SLC11A2 NUBPL SEMA4B CAPRIN1 AFG3L2 DLG4 DPYSL2 NCKAP1L
GOBP_RESPONSE_TO_HEAT	0.0252738594159015	0.240789028828484	0.352487857583619	0.426556506915299	1.34927244402537	139	HSPA1B HSP90AA1 VCP IRAK1 HMOX1 YWHAE CREBBP HSP90AB1 DNAJA1 HSPA1A HSPA8 GCLC ATP2A2 SEH1L PDCD6 HSPH1 DNAJB1 MAPK1 NUP214 MAP2K7 CAMK2G GSK3B HSBP1 RBBP7 DNAJA4 FKBP4 THBS1 IL1A RAE1 CLPB HDAC2 BAG5 CD14 NUP37 NUPL2 DNAJB6 DNAJA2 RPA3 EIF2B3
GOBP_WOUND_HEALING	0.0040094372586236	0.111335227291292	0.407017918923954	0.385976937864071	1.34293918322202	393	TGFBR2 P2RY12 PIK3CG PTEN ENTPD1 CRK HMOX1 PPP3CA ITGA9 TLR4 CASK DGKD WAS TGFBR1 MERTK SERPINE2 NFE2L2 IRF2 GNA13 ELK3 METAP1 PRKCB PF4 PRKCA AKAP10 P2RX7 CD151 CDC42 MAPK1 TGFB1 PDCD10 HRAS PIK3CA SH2B3 RAC1 YWHAZ PRKCH STXBP1 BC004004 ETS1 DOCK11 VAV1 ADIPOR2 MYL12A PHF21A RHOC SLC11A1 MAP3K5 RREB1 ENPP4 CLIC1 LMAN1 CD9 TSPAN32 PRKAR1A PROCR GNA15 FERMT3 POSTN ITPK1 NOTCH2 PLAUR SERPINE1 KDR BLOC1S3 PIK3CB THBS1 ITGA5 IL1A DOCK8 CFLAR GP9 GNA12 ITPR2 SLC12A2 NF1 TNFRSF12A HMG20B SYT11 HDAC2 PLEK PLCG2 SMAD2
GOBP_DEVELOPMENTAL_GROWTH_INVOLVED_IN_MORPHOGENESIS	0.021357407009546	0.225232429184141	0.352487857583619	0.416472076593518	1.34257045784849	169	TGFBR2 SPP1 HSP90AA1 RNF6 MED1 HSP90AB1 SALL1 CDK5R1 ABL1 ULK2 ANAPC2 ULK1 PPP3CB CTNNB1 MUL1 RYK RTN4 GSK3B NRP2 LLPH SPG20 STK11 BIN3 CYFIP1 EIF4G2 SPAG9 POSTN NRP1 SEMA4D TTL GDI1 NOTCH1 PRKN SLC23A2 TIAM1 SEMA4B
GOBP_PROTEIN_DEPHOSPHORYLATION	0.00641864663155476	0.140331498317665	0.407017918923954	0.397598337941191	1.34244863646498	285	SPPL3 CALM2 PTEN PPP6C DUSP6 PPP1R14B PPP3CA TIPRL CD300A YWHAE UBLCP1 HSP90AB1 PPP2CA PPP4R3B MTM1 PTPRM YWHAB PPP1R3B DUSP7 CNEP1R1 PALD1 PPM1D PPP3CB TGFB1 CAMK2G GSK3B BOD1 PINK1 MGAT5 LGALS3 CDC14A FKBP1A PPP1R15B HSP90B1 PPP2R1A ACP1 PPM1B CALM1 CTTNBP2NL STK11 PPP1CB CTDP1 STYX PTP4A3 PTP4A2 DUSP27 CTDNEP1 DAPP1 MINPP1 PTPA PTPRJ PPP1R9B PTPN23 ENSA IGBP1 LRRC40 NUAK1 PPP2R2D TIMM50 PPP2R2A IKBKB B3GAT3 NCKAP1L PPP2R5D EYA3 PPP4R2 SSH2 PIN1 PTPRA PPA2 PPP2R5C PTBP1
GOBP_NEGATIVE_REGULATION_OF_CELL_GROWTH	0.0271188373656625	0.245934816986601	0.352487857583619	0.42361168654149	1.34146737416654	142	HSPA1B SPP1 RNF6 PPP2CA JADE1 HSPA1A CDK5R1 CRLF3 SERPINE2 SMAD4 TRP53 TGFB1 DDX3X MUL1 HYAL1 RYK RB1 RTN4 RBBP7 RGS2 PPP2R1A ADIPOR2 MYL2 SPG20 STK11 TCHP CTDP1 SPAG9 CDKN2AIP NRP1 SEMA4D PTPRJ PPP1R9B SEMA4B ING1 PRDM11 EI24 NME6 GDF9 ENO1 SMAD3
GOBP_INTRACELLULAR_RECEPTOR_SIGNALING_PATHWAY	0.0139810818861225	0.191776647317476	0.380730400722792	0.406390641551551	1.34011570968682	220	HSPA1B FABP5 PMEPA1 UBE3A IRAK1 RXRA RNF6 ZMIZ1 TLR4 MED1 NR3C1 SLC15A3 ARID1A PLPP1 DNAJA1 NCOA4 HSPA1A PUM1 UBC WBP2 PUM2 SLC15A4 CTBP2 OTULIN UFL1 NCOR2 RNF34 ZBTB7A TRAF6 CBFB TAB2 KDM5D STAT3 NCOR1 DDX60 UFD1 ITCH CYLD PADI2 LSM14A STRN3 UBB UBE2N NOD1 SAFB CLPB LATS1 TMF1 EGLN2 FOXP1 CNOT2 KLF2 IFIH1 GPS2 UFSP2 NR2F6 UBA5 PRMT2 SEC14L1 DHRS3 CASP8 IRAK2 CNOT1
GOBP_REGULATION_OF_ENDOCYTOSIS	0.0152553499491502	0.200970657853401	0.380730400722792	0.412496676956424	1.33256903001583	173	TRF ABL2 PPP3CA VPS28 SNX17 CD300A FMR1 DGKD RIN3 TREM2 ABL1 RUFY2 CD151 PPP3CB ATAD1 CDC42 RAC1 SMAP1 ITGAV APPL2 AHI1 UBQLN2 LGALS3 APOC2 PACSIN2 AAK1 BTBD9 CALM1 WASL FLOT1 ARF1 RAB31 SERPINE1 PIK3CB SDCBP ANKFY1 ABCA2 CBL SNX12 RAB4B TBC1D5 VAMP4 NUMB ARF6 SYT11 DLG4 PLCG2 NCKAP1L CD14 MIB1 LRSAM1 AP2S1 EEF2K CBLL1 NEDD4L MCTP1 VEGFA SYK ANKRD13A
GOBP_CYTOSKELETON_DEPENDENT_INTRACELLULAR_TRANSPORT	0.0192532469288284	0.21863626942093	0.352487857583619	0.411176782317891	1.33026246143045	176	HOOK3 TNPO1 TUBA1A IFT20 KIFAP3 VAMP7 HSPA8 ARL8B HNRNPU KIF5B MAP1S SUN2 AP3D1 CCDC88B BICD2 SPAST CDC42 TUBA1B ARL3 MYO1B RAB6A MYO7A TRIP11 SNAPIN PAFAH1B1 IFT52 WASL STK11 COPG1 DYNC1H1 IFT140 BLOC1S3 LRPPRC BORCS5 TANC2 UBB OPA1 RAB1A TUBB5 APBA1 IFT80 ARMCX3
GOBP_ORGANELLE_FISSION	0.00507734665267562	0.126351019979698	0.407017918923954	0.381004434056799	1.32794419511795	411	HSPA1B SPIRE1 TMEM135 CDK13 CHMP2B NEK6 RAN PPP2CA BUB3 HSPA1A DAPK3 HNRNPU ZFP207 ZCWPW1 RMI1 RIOK2 SEH1L PDS5A SLF2 UBE2S CHAMP1 CNEP1R1 MAU2 REEP3 PRKCB MIS12 PRKCA STAG2 NUMA1 EMD SPAST CDC42 SMC2 KIF2A MUL1 RANBP1 RB1 BOD1 DYNC1LI1 CHMP1A DRG1 PINK1 PHF13 NSFL1C CDC14A CDK5RAP2 KPNB1 GOLGA2 PPP2R1A FBXW5 NEK9 TGFA NCAPH DDHD1 CORO1C MAD2L1BP CHMP1B CTDP1 EML4 TUBB4B MFF PRKAR1A MZT1 TUBG1 CDC16 PTTG1 CTDNEP1 KDR IL1A PSMG2 LSM14A AGO4 MAD1L1 PPP1R9B CENPC1 UBB ANAPC7 OPA1 PRKN TAF1 UBR2 PPP2R2D PPP2R2A BECN1 FBXO5 ERCC4 PIN1 BANF1 INCENP IL1B NAA50 MAP10 MLH1 MIEF1 NME6 EME2 STAG1 PEX11G TDRKH VPS4A MSH3 CAV2 RAD21 NDE1 CHMP5 NCAPD3
GOBP_MUSCLE_CONTRACTION	0.0135536899465959	0.191094439680488	0.380730400722792	0.403811283974346	1.32565192247038	213	RCSD1 CALM2 PIK3CG GAA ADRB2 PABPN1 AKAP9 DAPK3 ATP2A2 TPM3 SNTA1 ASPH ATP2B1 EMD ALDOA PXN PIK3CA HSBP1 ANK2 RGS2 TMOD3 TIFAB MYL12A CALM1 MYL2 TAZ GRK2 PTAFR DOCK4
GOBP_MRNA_PROCESSING	0.00459543016090171	0.118976452537241	0.407017918923954	0.375015626660121	1.32244960547354	472	CPSF6 HNRNPF PAPOLA SFSWAP CDK13 FRG1 RBM8A PABPN1 FMR1 LSM5 SF3B2 U2SURP FUS POLR2I SNRNP200 CCAR1 HNRNPA0 PAN3 SF3B6 PRPF8 POLR2G SRRM2 RBM6 HSPA8 NCBP3 HNRNPU QK SCAF11 FAM172A KIN SF3B5 FIP1L1 RBM42 LSM2 YTHDC1 RALY WBP4 CNOT6L DDX1 SNRNP48 CELF1 FXR1 CPSF7 TENT2 GEMIN5 RBM27 HNRNPUL1 SRSF11 GEMIN2 SARNP CASC3 RPRD2 SF3B4 POLR2J TXNL4A METTL16 CTR9 LSM6 MAGOH U2AF2 DHX9 SF3A1 POLR2B HNRNPA3 ELAVL1 PUF60 ZBTB7A SYNCRIP GTF2H2 SNRPB WDR83 PRPF6 LGALS3 GPATCH1 HNRNPA2B1 SCAF4 U2AF1L4 CWC15 RBM14 SPEN SNRNP27 CWF19L2 SF1 LEO1 SRSF9 DDX20 KHDRBS3 ALYREF PHRF1 TUT1 SNU13 SREK1IP1 AAR2 ZC3H11A POLR2C RAMAC CTNNBL1 SRSF1 TENT4B PCBP1 ZC3H10 SRSF2 PCF11 KHDRBS1 ACIN1 COIL MBNL1 RBM38 DAZAP1 ZC3H14 SUPT4A CDC40 TRA2B THOC7 LSM10 JMJD6 SUPT5 CPSF1 TSEN15 LUC7L3 CHTOP SRPK3 GTF2F2 SAFB AHCYL1 SF3A2 CELF2 EIF4A3 SMNDC1 SRSF3 ZC3H3 CPSF4 HNRNPD PPP4R2 AQR LSM7 SRSF10 SNRPD1 SUPT6 PTBP1 METTL3 MFAP1A RBM28 SNRPD3 TGS1 SNIP1 POLR2A SRSF6 MBNL2 HNRNPH1 DHX16 PPIH DDX47 KHSRP CSTF2T TIA1
GOBP_REGIONALIZATION	0.022203217801918	0.227864172698711	0.352487857583619	0.408362025870176	1.32115600162657	176	CTNNBIP1 BASP1 TGFBR1 WLS LDB1 ADGRG1 SMAD4 TRP53 DDIT3 MDFI BMPR1A AHI1 NRP2 HES1 PRKDC TIFAB IFT52 SUFU SKI NOTCH2 HIPK2 CHSY1 IFT140 HHEX BMI1 MTF2 MEF2C TRA2B NOTCH1 AIDA PBX1 SMAD2 MIB1 LFNG ARL13B FKBP8 SMAD3 PBX2 TBX6 YY1 MLLT3 MEGF8 EP300 LRP6 TCTN1 KDM2B ACVR2B PRKACA BMPR2 FZD5
GOBP_PHOSPHOLIPID_BIOSYNTHETIC_PROCESS	0.0196057702844476	0.219342469046642	0.352487857583619	0.396249045704179	1.31998921211554	237	PIK3CG PTEN FABP5 DGKD PIGP SERINC1 RAB14 MTM1 SAMD8 PIGF PIGH PIP4K2A DOLK FADS1 PIGK CPNE3 IMPA1 PLEKHA2 PIK3CA AGPAT5 INPP5E PGAP2 PIGU GGPS1 CDIPT GPAT4 PTDSS1 PIK3R2 ARF3 CEPT1 PISD DDHD1 TAZ ARF1 MTMR9 LPIN2 PIGA CSNK2B SLC44A2 LPGAT1 FAR1 HEXB PIK3CB ABCA2 DPAGT1 PIGYL AGPAT1 PLEKHA8 ACSL3 PIP5K1C PLCG2 CHPT1 CHP1 PIP4K2B PIKFYVE GPD1 PLEKHA3 PIGC PTPMT1 CHKB PI4K2A AGK PLD1 PIGM MPPE1 AJUBA SACM1L DGKZ
GOBP_REGULATION_OF_CELLULAR_AMIDE_METABOLIC_PROCESS	0.00697262140776935	0.141125857293252	0.407017918923954	0.378897134484365	1.31821813858905	384	BANK1 RC3H1 SOX4 EIF1B MTPN EIF5 CNBP RBM8A FMR1 PLXNB2 CNOT8 LARP4 LARP1 ORMDL2 GSPT1 ANG LARP4B POLR2G DPH6 PUM1 DAPK3 CPEB4 SAMD8 QK NFE2L2 PUM2 ZFP706 EIF4E DPH3 CNOT6L DDX6 METAP1 DDX1 CELF1 FXR1 GEMIN5 TNRC6B XRN1 TRP53 NGDN EEFSEC SARNP CASC3 DNAJC1 MAPK1 NSUN3 METTL16 DDX3X NOLC1 AGO1 MAGOH NGRN EIF3B DHX9 RTN4 ELAVL1 ENC1 COA3 INPP5E DNAJC3 SYNCRIP PINK1 RPS6KA1 RTN3 PKM STAT3 RGS2 YBX3 PPP1R15B EIF4H PRKDC METTL5 PAIP1 TYMS EIF4G3 NSMAF RPS6KA3 MTG1 EIF5A CYFIP1 ZFP385A EIF4G2 PTAFR LSM14B CSDE1 ETF1 MKNK2 KHDRBS1 ALKBH1 THBS1 LRPPRC LSM14A ABCA2 CNOT10 AGO4 GGA3 RNF139 PAIP2 EIF3E TRAP1 NANOS1 ZFP607A SAMD4B MEX3D EIF4A3 TRNAU1AP CAPRIN1 DPH7 HNRNPD SHFL PLEKHN1 UNK PIN1 ILF3 MRPL13 EIF4EBP3 CNOT2 EIF4A2 PDPR ACO1 EIF3C METTL3 NEURL1A FASTKD3 LTN1 IFNGR1 EPRS PRKCD MTRF1 PRKAA1 PLD1 KHSRP TIA1 ZFP598 GSTZ1 PAIP2B CNOT1 IL6 DHX29 PA2G4 EIF2B1 RCC1L CAPRIN2 PUM3 SIRT3 TRMT10C YTHDF1 TMED10 UPF3B
GOBP_RNA_SPLICING	0.00824508114685691	0.16103947669318	0.380730400722792	0.376727665393587	1.31679107365574	413	HNRNPF PAPOLA SFSWAP CDK13 FRG1 RBM8A PABPN1 FMR1 LSM5 IVNS1ABP SF3B2 U2SURP FUS POLR2I SNRNP200 CCAR1 HNRNPA0 SF3B6 PRPF8 PPP2CA POLR2G HSPA1A ZFP638 SRRM2 RBM6 HSPA8 HNRNPU QK SCAF11 FAM172A SF3B5 METTL4 FIP1L1 RBM42 LSM2 YTHDC1 RALY WBP4 FAM98B DDX1 SNRNP48 CELF1 FXR1 CPSF7 GEMIN5 HNRNPUL1 SRSF11 GEMIN2 CASC3 SF3B4 POLR2J TXNL4A METTL16 LSM6 MAGOH U2AF2 DHX9 SF3A1 POLR2B HNRNPA3 ELAVL1 PUF60 ZBTB7A SYNCRIP SNRPB WDR83 PRPF6 LGALS3 GPATCH1 HNRNPA2B1 U2AF1L4 CWC15 RBM14 PPP2R1A CLK3 SPEN SNRNP27 CWF19L2 SF1 SRSF9 DDX20 KHDRBS3 ALYREF SNU13 SREK1IP1 AAR2 POLR2C CTNNBL1 SRSF1 RRAGC PCBP1 ZC3H10 SRSF2 PCF11 KHDRBS1 ACIN1 COIL MBNL1 RBM38 DAZAP1 CDC40 PPP1R9B TRA2B RBM12B2 THOC7 LSM10 JMJD6 CPSF1 TSEN15 LUC7L3 SRPK3 GTF2F2 SF3A2 CELF2 EIF4A3 SMNDC1 SRSF3 CPSF4 HNRNPD PPP4R2 AQR PPIG LSM7 SRSF10 SNRPD1 SUPT6 PTBP1 METTL3 AI597479 MFAP1A RBM28 SNRPD3 TGS1 SNIP1 POLR2A SRSF6 MBNL2 HNRNPH1 DHX16 PPIH DDX47 KHSRP CSTF2T TIA1
GOBP_PROTEIN_CONTAINING_COMPLEX_LOCALIZATION	0.0175949406840902	0.210861473356175	0.352487857583619	0.392403055655194	1.31232061001599	249	TNPO1 RBM8A IFT20 PABPN1 KIFAP3 RAN HNRNPU KIF5B RIOK2 SEH1L EIF4E AP3D1 FIP1L1 YTHDC1 SSB SRSF11 ATAD1 SARNP CASC3 SMG7 HRAS NUP214 MAGOH U2AF2 ARL3 SMG1 HNRNPA2B1 TRIP11 U2AF1L4 SNAPIN IFT52 SRSF9 WASL ALYREF RCC2 ZC3H11A RALB SRSF1 EIF5A MZT1 ENY2 SRSF2 AGFG1 IFT140 HHEX RAE1 CDC40 UPF2 TERF1 THOC7 CPSF1 NUMB CHTOP GRIPAP1 EIF4A3 ADAM22 SRSF3 EPS15 CPSF4 IFT80 DLG4 NUP37 CEP72 SUPT6 NUPL2 SRSF6 NMD3 SMG5 IFT88 IFT22 GPHN RAP1A
GOBP_RESPONSE_TO_WOUNDING	0.00536845267555309	0.131440502604671	0.407017918923954	0.370568886546733	1.30937626922419	481	TGFBR2 P2RY12 SPP1 PIK3CG PTEN ENTPD1 CREB3L2 CRK HMOX1 PPP3CA ITGA9 TLR4 CASK DGKD WAS MAP2K1 KLF4 KLK8 CX3CR1 TGFBR1 MERTK SERPINE2 NFE2L2 IRF2 GNA13 MTR ELK3 GIT1 METAP1 PRKCB PF4 PRKCA ATP7A AKAP10 P2RX7 CD151 CDC42 MAPK1 TGFB1 PDCD10 HRAS PIK3CA SH2B3 RAC1 YWHAZ PRKCH STXBP1 BC004004 ETS1 WDR83 DOCK11 VAV1 ADIPOR2 ARG1 MYL12A ADORA3 PHF21A RHOC SLC11A1 MAP3K5 RREB1 ENPP4 CLIC1 LMAN1 CD9 TSPAN32 JAM3 PRKAR1A PROCR GNA15 FERMT3 POSTN ITPK1 NOTCH2 PLAUR SERPINE1 KDR BLOC1S3 PIK3CB THBS1 NRP1 ITGA5 IL1A DOCK8 HHEX CTNNA1 CFLAR GP9 GNA12 ITPR2 SLC12A2 NF1 BAX TNFRSF12A HMG20B SYT11 POU5F1 HDAC2 CERS2 PLEK PLCG2 SMAD2
GOBP_VESICLE_ORGANIZATION	0.016938521256027	0.208481150810667	0.352487857583619	0.382557102616739	1.30209356404153	302	HOOK3 PPP6C VPS28 RAB20 CHMP2B RAB39 AP1G1 VAMP7 SEC31A WASHC4 TRAPPC4 RAB22A RAB14 TGFBRAP1 KIF5B SERPINE2 AP3D1 PIP4K2A TMED9 LAMTOR1 PDCD6 TRAPPC2L STAM2 UVRAG SCFD1 USO1 VPS41 CHMP1A STXBP1 ARFGAP2 SCARB2 CREB1 MYO7A SORT1 CHMP3 SNAPIN GOLGA2 GOSR1 PAFAH1B1 TAP2 SNAP29 WASL TGFA TBPL1 CORO1C LMAN1 CHMP1B STX5A ZFP385A ARF1 RAB8B PREB RUBCNL BLOC1S3 SDCBP ANKFY1 VAPA KLHL12 TRAPPC1 LAPTM4B VTI1A STX6 VPS37C USP50 ABCA1 VAMP4 RAB1A HPS1 PRKN VTA1 SYT11 TRAPPC9 TMF1 EPS15 FBXO5 DLG4 TBC1D20 CHP1 MVB12A STX12 TRAPPC6B SQSTM1 PIP4K2B SNX19 PIKFYVE SEC22B C2CD5 PI4K2A STX1A TMEM9 SNX3 VPS4A CAV2 CHMP5 GNAI3 SNX10 PHETA1 RNF26 PEF1 NAPA VAMP3 TMED10 TBC1D4
GOBP_CELL_PROJECTION_ASSEMBLY	0.00419223199996762	0.113561431508188	0.407017918923954	0.367859278346177	1.30088789787598	497	P2RY12 FSCN1 TNPO1 CSNK1E HSP90AA1 TUBA1A IFT20 FMR1 YWHAE AKAP9 KIFAP3 WAS SRGAP2 YWHAG ABL1 RO60 TGFBR1 WASF2 ARPC2 WHAMM CEP135 ENTR1 CEP57 CEP350 NEK1 FXR1 ATP7A P2RX7 BCAS3 NUDCD3 CDC42 RALA DNAAF2 ABLIM1 ASAP1 HRAS FGD4 PIK3CA ARL3 RAC1 ABI2 CCDC28B AHI1 DOCK11 C2CD3 CDC14A TRIP11 CDK5RAP2 TWF1 PPP2R1A PAFAH1B1 SNAP29 IFT52 FAM149B WASL RCC2 BIN3 MAPRE1 PARVG TCHP CORO1C VDAC3 CYFIP1 TUBB4B DYNC1H1 TUBG1 MIEN1 CYLD CCDC66 CETN2 SCLT1 HAUS3 CC2D2A IFT140 RDX NRP1 SDCBP TMEM237 HDAC4 PCNT BBS4 PPP1R9B PTPN23 IQCB1 TUBB5 QRICH2 NOTCH1 CFAP298 SH3BP1 ARF6 HAUS6 IFT80 FGD3 NCKAP1L MTSS1 CEP72 BBS7 ATG5 CCP110 NEURL1A PRKCD ARL13B BRK1 CROCC PLD1 SLC9A3R1 AJUBA IFT88 PPP1R9A IFT22 CEP83 ARHGAP35 NDE1 TAPT1 MKKS PTPRO CPLANE1 SNX10 TMEM67 PLXNB3 TWF2 DNAAF5 PARVB PLK4 HAUS2 RHOQ ALMS1 DNAAF3 PMP22 EPS8L1 CFAP20
GOBP_SENSORY_SYSTEM_DEVELOPMENT	0.0234917383371287	0.232063723182828	0.352487857583619	0.392203570650888	1.30018231627024	231	TGFBR2 P2RY12 CRYBB1 MAF MED1 KLF4 ANGPTL7 TGFBR1 PTPRM MERTK MITF TUG1 TENT2 ATP2B1 NAGLU ABI2 CTNS AHI1 MYO7A STAT3 PYGO2 SKIL PKNOX1 SIPA1L3 SKI CLN8 NOTCH2 HIPK2 ZDHHC16 MAN2A1 IFT140 BLOC1S3 NRP1 SMG9 BBS4 NF1 OPA1 JMJD6 BAX PBX1 HDAC2 ZHX2 BBS7 MEIS3 FZD4 ROM1 RCN1 FKBP8 SMAD3 RAB3GAP1 PBX2 ARHGAP35 VEGFA SLC25A25
GOBP_DEPHOSPHORYLATION	0.00687174442794011	0.140331498317665	0.407017918923954	0.371615801642227	1.30008497986101	418	SPPL3 CALM2 PTEN PPP6C DUSP6 PPP1R14B ACP2 PPP3CA TIPRL CD300A YWHAE UBLCP1 HSP90AB1 PLPP1 PPP2CA PPP4R3B MTM1 PTPRM APEX1 YWHAB PPP1R3B DUSP7 CNEP1R1 PALD1 PPM1D SGPP1 PNKP PPP3CB TGFB1 SMG7 PFKFB3 IMPA1 CAMK2G GSK3B BOD1 ARMT1 INPP5E PINK1 MGAT5 LGALS3 CDC14A PPP2R3C FKBP1A PPP1R15B HSP90B1 PFKFB4 PPP2R1A ACP1 PPM1B CALM1 CTTNBP2NL STK11 PPP1CB CTDP1 HDHD2 STYX MTMR9 PTP4A3 PTP4A2 PIP4P1 DUSP27 LPIN2 CTDNEP1 DAPP1 MINPP1 SEMA4D ENTPD6 PTPA PTPRJ PPP1R9B PTPN23 MEF2C G6PC3 ENSA IGBP1 LRRC40 NUAK1 PPP2R2D TIMM50 PPP2R2A IKBKB INPP5B ELL PLEK B3GAT3 NCKAP1L CHP1 PPP2R5D EYA3 PPP4R2 SSH2 NT5C2 PIN1 PTPRA PPA2 PPP2R5C PTBP1 PTPMT1 PSPH PRKCD SMAD3 SMG5 SACM1L GBA PRUNE1 SLC39A10 ZFYVE1 PTPRO RCAN3 HACD2 PTPRE PON3 MTMR1
GOBP_REGULATION_OF_BINDING	0.0103420850448556	0.17176037688942	0.380730400722792	0.384611058354596	1.29999320153463	296	SPPL3 CSNK1E CRK HMOX1 LAMTOR5 PPP3CA ADRB2 NUCKS1 FMR1 JUN CTNNBIP1 HSP90AB1 KLF4 RAN PPP2CA ABL1 TGFBR1 ATP2A2 CCL9 CTBP2 DPH3 SMAD4 PLCL2 RSF1 CTNNB1 CDC42 HMBOX1 TGFB1 DDIT3 DHX9 MDFI IDE RB1 TXN1 GSK3B ZBTB7A TRAF6 PLCL1 CLN5 PYGO2 HES1 FKBP1A SNAPIN GTF2B GOLGA2 TLE5 ILRUN CALM1 FLOT1 MAPRE1 RALB SLPI GPSM1 SKI STYX TICAM1 CSNK2B HIPK2 PLAUR TRIM21 NRP1 FBXW7 HDAC4 CEBPG CSNK1A1 EIF3E MARK2 PRKN TAF1 BAX TIAM1 EIF4A3 TFAP4 HDAC2 SRI SMAD2 BTBD1 SUMO2 ERCC4 PIN1
