pathway	pval	padj	log2err	ES	NES	size	leadingEdge
GOBP_MONONUCLEAR_CELL_DIFFERENTIATION	0.00487124130083978	0.217465491107818	0.407017918923954	-0.460845759388307	-1.31059384766443	357	H2-EB1 CD74 FGL2 SOCS1 IL4RA ANXA1 PTPRC IL1B PIRB EGR1 ITGA4 PIK3CD IKZF1 EGR3 MYH9 TPD52 IFI205 CTNNBIP1 NFAM1 IL6RA RARA SEMA4A CR1L ZFP36L2 PSEN1 IRF7 INPP5D FOXP1 NOTCH2 CSF1 FES ZFP36L1 TMEM176A VAV1 EP300 NKAP LGALS9 NCKAP1L VSIR STAT3 CHD7 HLX SP3 HHEX CCR2 AP3B1 SPI1 PDE1B KLF6 NDFIP1 SASH3 PIK3R1 H2-Q10 MT1 CD86 IRF1 IL15 IL18 BCL3 RUNX3 LYN ACIN1 LGALS1 HMGB1 SYK DOCK11 TNFRSF18 STAT5B BCL6 PREX1 RPS6 HDAC5
GOBP_REGULATION_OF_CELLULAR_COMPONENT_SIZE	0.00703598124797014	0.246475835409662	0.407017918923954	-0.467647086466185	-1.31919306344187	306	CORO1A PFN1 GSN COTL1 SSH2 LAMTOR4 TMSB4X GMFG DNM2 ARPC3 PICALM MTPN ACTR3 CAPZA1 RB1CC1 ACTR2 SVIL ARPC1B SEMA4A IQGAP2 CDC42EP3 TMSB10 DBNL VAV1 ARPC2 HCLS1 NCKAP1L ARPC5L MYADM PIK3CA CAPZB VILL WAS SNF8 MSN PLEK CLNS1A TWF2 RAB11A WASF2 RNF6 RICTOR CORO1B PRKCD ARF6 CDC42EP2 ARFIP1 ADD1 DIP2B PREX1 ZFYVE27 ARPC4 BMPR2 GRB2 WASHC2 PPP1CA TMEM123 ARFIP2 ATP7A VAV3 AKT3 ADD3 RTN4 PTEN FLII WASHC1 L1CAM SRF AP1AR TRIOBP DPYSL2 PRKCE PAK1 WDR1 IL7R RASA1 NCK1 HIP1R SLC12A6 LAMTOR5 LRRC8A SNX9 JMY FER ATP13A2 ARPC5
GOBP_REGULATION_OF_HEMOPOIESIS	0.00425270009410558	0.210084162876645	0.407017918923954	-0.472562594166482	-1.34358105853635	340	H2-EB1 CD74 CSF3R FGL2 FOS SOCS1 CCR1 IL4RA ANXA1 ZFP36 PTPRC STAT1 PIRB KLF13 EGR3 RIPK1 CREBBP CTNNBIP1 NFAM1 RARA CR1L ZFP36L2 KMT2E IRF7 INPP5D TNRC6A FOXP1 NOTCH2 CSF1 CASP8 FES ZFP36L1 TMEM176A HCLS1 EP300 NKAP FOXO3 LGALS9 NCKAP1L VSIR STAT3 HLX TYROBP CCR2 AP3B1 HIF1A SPI1 CIB1 NDFIP1 PURB SASH3 PIK3R1 WDR61 NME2 BRD1 KAT2B KMT2B H2-Q10 CD86 IRF1 IL15 IL18 PITHD1 MYSM1 RUNX3 LYN PRMT1 ACIN1 FBXW7 HMGB2 HMGB1 SYK CEACAM1 TNFRSF18 CD101 MAPK14 STAT5B TFE3 BCL6
GOBP_RESPONSE_TO_MECHANICAL_STIMULUS	0.00641526005212872	0.240939928094649	0.407017918923954	-0.51511947872817	-1.36599781904496	155	BTG2 TNFRSF1A FOS GSN MBD2 IL1B TNFSF14 TXNIP CNN2 MTPN JUND CASP8 RIPOR2 PIK3CA KCNJ2 SLC38A2 MAP2K4 IRF1 CXCR4 JUP CTNNB1 MAPK14 XPA MAP3K2 RETN TGFBR2 MYD88 FYN PSPH SLC9A1 CASP2 SLC2A1 PKD2L2 GOT1 F11R MAP3K14 CASP1 CLCN6 BAD ABHD12 JUN P2RY1 NFKB1 ETS1
GOBP_MYELOID_CELL_DIFFERENTIATION	0.000620129902535451	0.0944838942173256	0.477270815362862	-0.489348362888663	-1.39158110175234	344	H2-EB1 CD74 CSF3R FOS CCR1 LBR ZFP36 ARID4A STAT1 PIRB ANXA2 PIK3CD KLF13 IKZF1 RIPK1 CREBBP MYH9 IFI205 SBNO2 CTNNBIP1 RARA SNRK NRROS PSEN1 CDC42 JUNB KMT2E IRF7 INPP5D TNRC6A SH2B3 FOXP1 NOTCH2 CSF1 CASP8 TIRAP FES ZFP36L1 RASGRP4 MMP9 HCLS1 EP300 FOXO3 NCKAP1L STAT3 PIP4K2A TYROBP TMEM14C SP3 AP3B1 FLI1 HIF1A SPI1 CIB1 OSTM1 PDE1B NDFIP1 PURB PIK3R1 WDR61 NME2 BRD1 KAT2B KMT2B MT1 IL15 PITHD1 WASF2 LYN PRMT1 ACIN1 FBXW7 HMGB2 HMGB1 CEACAM1 UBA5 GPC3 L3MBTL3 CD101 MAPK14 ADD1 STAT5B TFE3 BCL6 RPS6 GLO1 HIPK2 NFE2 NBEAL2 TRF PTBP3 TNRC6B
GOBP_REGULATION_OF_LYMPHOCYTE_DIFFERENTIATION	0.00311165740244457	0.187515086633852	0.431707695803346	-0.529721105411028	-1.40179006334967	153	H2-EB1 CD74 FGL2 SOCS1 IL4RA ANXA1 PTPRC PIRB EGR3 NFAM1 RARA CR1L ZFP36L2 INPP5D ZFP36L1 NKAP LGALS9 NCKAP1L VSIR HLX CCR2 AP3B1 NDFIP1 SASH3 CD86 IRF1 IL15 IL18 RUNX3 HMGB1 SYK TNFRSF18 STAT5B BCL6
GOBP_ACTIN_FILAMENT_BUNDLE_ORGANIZATION	0.00703596801576126	0.246475835409662	0.407017918923954	-0.544288426283628	-1.41716793775003	133	ACTG1 PFN1 LCP1 ID1 ZYX CDC42 S100A10 SDC4 ROCK2 TACSTD2 MICAL1 WAS PIK3R1 PLEK WASF2 CORO1B ADD1 ARHGEF18 CD47 AIF1 KCTD13 PAK2 RFLNB ARAP1 TESK1 PXN SRF SLC9A1 PAK1 F11R MARCKS PDLIM1 NEDD9
GOBP_REGULATION_OF_CYTOSKELETON_ORGANIZATION	0.00010000203165148	0.0352204997159284	0.538434096309916	-0.494139848290048	-1.43213136028682	436	CDK2AP2 CORO1A ACTG1 S100A9 PFN1 GSN COTL1 SSH2 ID1 S100A8 TMSB4X GMFG ARPC3 SMAD4 ARHGAP17 MTPN ACTR3 CAPZA1 ACTR2 RAC2 SVIL ARPC1B CDC42 IQGAP2 CDC42EP3 S100A10 NOTCH2 CCNF TMSB10 SDC4 FES DBNL CYLD HNRNPU ARPC2 HCLS1 ROCK2 NCKAP1L TACSTD2 ARPC5L MYADM PIK3CA CIB1 CAPZB VILL NUMA1 WAS PIK3R1 PLEK KAT2B SENP6 CHMP4B CRK TWF2 WASF2 CLIP1 MARK2 CAMSAP1 RICTOR CORO1B PRKCD ARF6 CDC42EP2 RASSF1 ARFIP1 ADD1 ARHGEF18 CD47 PREX1 BCAS3 ARPC4 RND1 GRB2 WASHC2 STAP1 ARFIP2 PAK2 CHMP5 RPS3 ARAP1 MAPRE2 ADD3 TAOK2 TESK1 PRKAA1 PXN FLII WASHC1 AP1AR TRIOBP SLC9A1 ARHGDIA PRKCE PAK1 WDR1 RASA1 NCK1 F11R NUP62 HIP1R PRUNE1 CNTRL CEP120 KAT2A SNX9 JMY FER
GOBP_REGULATION_OF_T_CELL_DIFFERENTIATION	0.0061725225313724	0.240792809548699	0.407017918923954	-0.554072820467804	-1.44164821833361	128	H2-EB1 CD74 FGL2 SOCS1 IL4RA ANXA1 PTPRC PIRB EGR3 RARA CR1L NKAP LGALS9 NCKAP1L VSIR HLX CCR2 AP3B1 SASH3 CD86 IRF1 IL15 IL18 RUNX3 HMGB1 SYK TNFRSF18 STAT5B BCL6
GOBP_REGULATION_OF_TRANSPORTER_ACTIVITY	0.00227469150517799	0.161858517415322	0.431707695803346	-0.530493789759925	-1.44403036157172	198	ACTB FXYD5 TMSB4X DNM2 RIPK1 STIMATE PIM1 YWHAH CAPN1 SRI CAMK2D PINK1 MMP9 PRNP SUMO1 CCR2 GLRX NDFIP1 FKBP1A P2RY6 CAB39 SGK1 KCNAB1 PRKCD ACTN4 HSPA2 YWHAE CTSS WNK1 ATP7A CALM3 PTEN NOS1AP PRKACA KMT2A STAC GOPC SLC9A1 PRKCE PPIF SELENON
GOBP_NEGATIVE_REGULATION_OF_ORGANELLE_ORGANIZATION	0.000440785387919283	0.0743458020957191	0.49849310876659	-0.513687286924726	-1.447718620662	303	CORO1A PFN1 GSN SSH2 TMSB4X PIRB TSPO GMFG DNM2 SMAD4 GPX1 MTPN CAPZA1 SVIL CCNF TMSB10 PHF23 PINK1 HNRNPU TACSTD2 MYADM PHF2 PIK3CA CIB1 CAPZB VILL OMA1 WAS PIK3R1 RAB7 KAT2B CHMP4B TWF2 WASF2 CAMSAP1 ERCC1 APOBEC1 CORO1B PRKCD SLC25A5 STN1 ADD1 ARHGEF18 BUB3 OPA1 DCP2 SMCR8 BCL2L1 WASHC2 GHITM PAK2 ARAP1 ADD3 TESK1 FLII TRIOBP DUSP1 XRN1
GOBP_PROTEIN_POLYMERIZATION	0.000798879646647337	0.0947033025929492	0.477270815362862	-0.527182134410666	-1.45756473469288	249	CORO1A PFN1 GSN COTL1 SSH2 TMSB4X GMFG DNM2 ARPC3 MTPN ACTR3 CAPZA1 ACTR2 SVIL ARPC1B IQGAP2 CDC42EP3 TMSB10 PSTPIP1 FES DBNL PINK1 ARPC2 HCLS1 NCKAP1L ARPC5L MYADM CAPZB VILL NUMA1 WAS TUBGCP6 GPX4 GOLGA2 CHMP4B TWF2 WASF2 CLIP1 CAMSAP1 RICTOR CORO1B PRKCD ARF6 CDC42EP2 ARFIP1 TUBGCP4 ADD1 PREX1 ARPC4 AIF1 OPA1 GRB2 WASHC2 ARFIP2 RPS3 ADD3 RANBP9 FLII WASHC1 AP1AR TRIOBP MZT1
GOBP_ACTIN_FILAMENT_BASED_MOVEMENT	0.00617252401584835	0.240792809548699	0.407017918923954	-0.584681804473455	-1.46559975311715	99	GSN MYH9 WIPF1 SRI TPM3 CAMK2D MYL6 MYO9B PIK3CA KCNJ2 WAS WASF2 JUP ACTN4 NOS1AP SLC9A1 SYNE2
GOBP_REGULATION_OF_GLUCOSE_METABOLIC_PROCESS	0.00650047223498432	0.240939928094649	0.407017918923954	-0.591304567669812	-1.46884974126052	94	MIDN PPP4R3B SESN2 ARPP19 RANBP2 EP300 KAT2B DGKQ HMGB1 SLC25A12 PPP1R3D PPP1R3B NCOA2 GSK3A OGT PPP1CA KHK EPM2AIP1 MAEA FOXK2 PPP1R3E C1QTNF12 PHKG2 PDK3 SIK1 KAT2A DGAT2 PDK2 BAD PMAIP1 WDR5 AKT1 SELENOS IRS2 ADIPOR1 RUBCNL
GOBP_POSITIVE_REGULATION_OF_HEMOPOIESIS	0.0041725130898795	0.209565054762492	0.407017918923954	-0.561529285262623	-1.47211199461763	136	H2-EB1 CD74 FOS SOCS1 CCR1 IL4RA ANXA1 PTPRC PIRB EGR3 RIPK1 CTNNBIP1 RARA CR1L INPP5D NOTCH2 CSF1 CASP8 FES ZFP36L1 HCLS1 NKAP LGALS9 NCKAP1L VSIR HLX TYROBP AP3B1 SASH3 CD86 IL15 IL18 RUNX3 ACIN1 HMGB1 SYK CD101 STAT5B BCL6
GOBP_REGULATION_OF_SUPRAMOLECULAR_FIBER_ORGANIZATION	0.000307630438410462	0.0583728756883852	0.49849310876659	-0.52238916523728	-1.47326672856825	312	CORO1A ACTG1 PFN1 GSN COTL1 SSH2 ID1 TMSB4X GMFG ARPC3 SMAD4 GPX1 MTPN ACTR3 CAPZA1 ACTR2 SVIL ARPC1B PSEN1 CDC42 IQGAP2 CDC42EP3 S100A10 TMSB10 SDC4 FES DBNL ARPC2 HCLS1 ROCK2 NCKAP1L TACSTD2 ARPC5L MYADM PIK3CA CIB1 CAPZB VILL NUMA1 WAS PFDN5 PIK3R1 PLEK TWF2 WASF2 CLIP1 CAMSAP1 RICTOR CORO1B PRKCD ARF6 CDC42EP2 ARFIP1 ADD1 ARHGEF18 CD47 PREX1 ARPC4 GRB2 WASHC2 ARFIP2 PAK2 RPS3 ARAP1 VBP1 RB1 ADD3 TESK1 PFDN6 PXN FLII WASHC1 AP1AR TRIOBP SLC9A1 PRKCE PAK1 WDR1 RASA1 NCK1 F11R HIP1R PRUNE1
GOBP_ACTIN_FILAMENT_ORGANIZATION	5.83121796838739e-05	0.0352204997159284	0.557332238758646	-0.521832310242624	-1.49141605566742	360	CORO1A ACTG1 PFN1 GSN COTL1 LCP1 SSH2 ID1 ZYX TMSB4X GMFG ARPC3 ARHGAP17 MTPN ACTR3 CAPZA1 ACTR2 RAC2 SVIL WIPF1 ARPC1B CDC42 IQGAP2 CDC42EP3 S100A10 TPM3 TMSB10 PSTPIP1 SDC4 DBNL ARPC2 HCLS1 ROCK2 NCKAP1L TACSTD2 ARPC5L MICAL1 MCU MYADM BIN3 PIK3CA CAPZB VILL WAS PIK3R1 PLEK TWF2 CTNNA1 WASF2 RICTOR CORO1B PRKCD PPP1R9B ARF6 CDC42EP2 ARFIP1 ADD1 ARHGEF18 CD47 PREX1 ARPC4 AIF1 RND1 TRF KCTD13 GRB2 WASHC2 ARFIP2 PAK2 RFLNB ARHGAP25 CFL1 ARAP1 ADD3 TESK1 PXN FLII WASHC1 SRF AP1AR TRIOBP SLC9A1 PRKCE PAK1 WDR1 RASA1 NCK1 KHDC3 ENAH F11R HIP1R MPRIP MSRB1 SNX9 MARCKS PDLIM1 JMY FER NEDD9
GOBP_REGULATION_OF_PROTEIN_POLYMERIZATION	0.000701451256362278	0.0947033025929492	0.477270815362862	-0.553099674509981	-1.4966687264259	191	CORO1A PFN1 GSN COTL1 SSH2 TMSB4X GMFG ARPC3 MTPN ACTR3 CAPZA1 ACTR2 SVIL ARPC1B IQGAP2 CDC42EP3 TMSB10 FES DBNL PINK1 ARPC2 HCLS1 NCKAP1L ARPC5L MYADM CAPZB VILL NUMA1 WAS TWF2 WASF2 CLIP1 CAMSAP1 RICTOR CORO1B PRKCD ARF6 CDC42EP2 ARFIP1 ADD1 PREX1 ARPC4 GRB2 WASHC2 ARFIP2 RPS3 ADD3 FLII WASHC1 AP1AR TRIOBP PRKCE PAK1 RASA1 NCK1 HIP1R PRUNE1 SNX9 JMY FER ARPC5
GOBP_POSITIVE_REGULATION_OF_MYELOID_CELL_DIFFERENTIATION	0.00315934563849736	0.187515086633852	0.431707695803346	-0.611254566850813	-1.50169030957207	87	H2-EB1 CD74 FOS CCR1 STAT1 RIPK1 CTNNBIP1 INPP5D NOTCH2 CSF1 CASP8 FES ZFP36L1 HCLS1 FOXO3 NCKAP1L STAT3 TYROBP HIF1A BRD1 PITHD1 PRMT1 ACIN1 HMGB2 HMGB1 CD101 MAPK14 STAT5B
GOBP_EPHRIN_RECEPTOR_SIGNALING_PATHWAY	0.00593557808617358	0.240792809548699	0.407017918923954	-0.62349943298466	-1.50399263563238	74	ACTG1 ACTB ARPC3 ACTR3 SS18 ACTR2 ARPC1B PSEN1 CDC42 MMP9 ARPC2 ROCK2 AP2A2 CRK LYN SIPA1L1 ARPC4 PSENEN VAV3 ARHGEF7 FYN APH1A YES1 SDCBP PAK1 RASA1 NCK1 AP2B1 AP2A1
GOBP_REGULATION_OF_ACTIN_FILAMENT_BASED_PROCESS	6.41651396598148e-05	0.0352204997159284	0.538434096309916	-0.535133972145955	-1.51273058942687	319	CORO1A ACTG1 PFN1 GSN COTL1 SSH2 ID1 TMSB4X GMFG ARPC3 SMAD4 MYH9 ARHGAP17 CNN2 MTPN ACTR3 CAPZA1 ACTR2 RAC2 SVIL ARPC1B CDC42 IQGAP2 CDC42EP3 S100A10 SRI NOTCH2 CAMK2D TMSB10 SDC4 FES DBNL ARPC2 HCLS1 ROCK2 NCKAP1L TACSTD2 ARPC5L MYADM PIK3CA CAPZB VILL KCNJ2 WAS PIK3R1 PLEK CRK TWF2 WASF2 RICTOR CORO1B PRKCD ARF6 CDC42EP2 ARFIP1 JUP ADD1 ARHGEF18 CD47 PREX1 BCAS3 ARPC4 RND1 GRB2 WASHC2 STAP1 ARFIP2 PAK2 ARAP1 ADD3 TAOK2 TESK1 PXN FLII WASHC1 AP1AR TRIOBP SLC9A1 ARHGDIA PRKCE PAK1 WDR1 RASA1 NCK1 F11R HIP1R
GOBP_PLASMA_MEMBRANE_ORGANIZATION	0.00572232637988173	0.240659063949555	0.407017918923954	-0.620516926691457	-1.51382543829806	83	S100A9 GSN BIN2 PTPRC SERP1 DNM2 SH3GLB1 MYH9 PLSCR1 CR1L FLOT1 SYT11 BIN3 CXCR4 PRKCD
GOBP_NEGATIVE_REGULATION_OF_PROTEIN_POLYMERIZATION	0.00385486044397179	0.198615869317036	0.431707695803346	-0.642708383542687	-1.52308552304846	65	PFN1 GSN SSH2 TMSB4X MTPN CAPZA1 SVIL TMSB10 MYADM CAPZB VILL TWF2 PRKCD ADD1 WASHC2 ADD3 FLII TRIOBP
GOBP_FC_RECEPTOR_MEDIATED_STIMULATORY_SIGNALING_PATHWAY	0.00234745666586657	0.161974509944793	0.431707695803346	-0.627330060651783	-1.54590046705691	88	ACTG1 ACTB FCGR4 PTPRC FCGR3 ARPC3 CSK FGR ACTR3 PLSCR1 ACTR2 WIPF1 ARPC1B CDC42 VAV1 ARPC2 NCKAP1L FCGR1 PIK3CA WAS PIK3R1 CRK WASF2 LYN PRKCD SYK CD47 ARPC4 PIK3R2 GRB2 APPL1 VAV3 FYN YES1 PRKCE PAK1 NCK1
GOBP_POSITIVE_REGULATION_OF_OSTEOBLAST_DIFFERENTIATION	0.00661341480277362	0.240939928094649	0.407017918923954	-0.710613064364381	-1.54994336623847	41	IFITM1 CLIC1 CTNNBIP1 JUND IL6RA SMAD1 BMPR2 SUCO IL6ST
GOBP_REGULATION_OF_ACTIN_FILAMENT_ORGANIZATION	9.9595462417093e-05	0.0352204997159284	0.538434096309916	-0.56879206711917	-1.55935990915979	227	CORO1A ACTG1 PFN1 GSN COTL1 SSH2 ID1 TMSB4X GMFG ARPC3 MTPN ACTR3 CAPZA1 ACTR2 SVIL ARPC1B CDC42 IQGAP2 CDC42EP3 S100A10 TMSB10 SDC4 DBNL ARPC2 HCLS1 ROCK2 NCKAP1L TACSTD2 ARPC5L MYADM PIK3CA CAPZB VILL WAS PIK3R1 PLEK TWF2 WASF2 RICTOR CORO1B PRKCD ARF6 CDC42EP2 ARFIP1 ADD1 ARHGEF18 CD47 PREX1 ARPC4 GRB2 WASHC2 ARFIP2 PAK2 ARAP1 ADD3 TESK1 PXN FLII WASHC1 AP1AR TRIOBP SLC9A1 PRKCE PAK1 WDR1 RASA1 NCK1 F11R HIP1R
GOBP_EMBRYONIC_FORELIMB_MORPHOGENESIS	0.00608943391486286	0.240792809548699	0.407017918923954	-0.929945054945055	-1.56376678155874	11	NIPBL LNPK
GOBP_PIRNA_METABOLIC_PROCESS	0.00445136268897103	0.210084162876645	0.407017918923954	-0.950492684383398	-1.56579218203398	10	PIWIL2
GOBP_ADHERENS_JUNCTION_ORGANIZATION	0.00593890845402068	0.240792809548699	0.407017918923954	-0.683705662796003	-1.56982076568841	54	ACTB CSK CDC42 PIP5K1C CTNNA1 JUP CTNNB1 ADD1 PAK2 HIPK1
GOBP_REGULATION_OF_ACTIN_FILAMENT_LENGTH	0.000142735347050781	0.0390908430827888	0.518848077743792	-0.59207246275511	-1.57006233745404	155	CORO1A PFN1 GSN COTL1 SSH2 TMSB4X GMFG ARPC3 MTPN ACTR3 CAPZA1 ACTR2 SVIL ARPC1B IQGAP2 CDC42EP3 TMSB10 DBNL ARPC2 HCLS1 NCKAP1L ARPC5L MYADM PIK3CA CAPZB VILL WAS PLEK TWF2 WASF2 RICTOR CORO1B PRKCD ARF6 CDC42EP2 ARFIP1 ADD1 PREX1 ARPC4 GRB2 WASHC2 ARFIP2 ADD3 FLII WASHC1 AP1AR TRIOBP PRKCE WDR1 RASA1 NCK1 HIP1R SNX9 JMY FER ARPC5
GOBP_SECONDARY_PALATE_DEVELOPMENT	0.0065897506945268	0.240939928094649	0.407017918923954	-0.85961999533438	-1.57222910543453	17	SMAD4 CHD7 SMAD2 TGFBR2 MMP25
GOBP_NEGATIVE_REGULATION_OF_PROTEIN_CONTAINING_COMPLEX_ASSEMBLY	0.000996530671117727	0.110687821372442	0.45505986738723	-0.612551042109548	-1.57525733943206	116	SORL1 PFN1 GSN SSH2 TMSB4X AIDA MTPN CAPZA1 CTNNBIP1 SVIL CDC42 TMSB10 IMPACT EP300 BIRC2 MYADM EIF4EBP1 CAPZB VILL TFIP11 TWF2 HMGB1 PRKCD MEFV ADD1 WASHC2 DNAJC15 ULK1 RPL13A ADD3 FLII TRIOBP
GOBP_POSITIVE_REGULATION_OF_LAMELLIPODIUM_ORGANIZATION	0.00495944260040656	0.217465491107818	0.407017918923954	-0.75141641560829	-1.57586089786558	32	DNM2 ACTR3 ACTR2 RAC2 CDC42 ARPC2 PIK3CA PIK3R1 TWF2 WASF2 CORO1B AKIRIN1 ATP7A ARHGEF7
GOBP_SEROTONIN_TRANSPORT	0.00430892217166403	0.210084162876645	0.407017918923954	-0.940217391304348	-1.58104042399841	11	PIRB SYK
GOBP_DETECTION_OF_LIGHT_STIMULUS_INVOLVED_IN_SENSORY_PERCEPTION	0.00388160131076333	0.198615869317036	0.431707695803346	-0.943442427138079	-1.58646354429924	11	CEP250
GOBP_GAMMA_DELTA_T_CELL_DIFFERENTIATION	0.00383732448972801	0.198615869317036	0.431707695803346	-0.929940870811683	-1.58765853850821	12	PTPRC EGR3 NCKAP1L SYK STAT5B
GOBP_TRIGLYCERIDE_CATABOLIC_PROCESS	0.00630462083330813	0.240939928094649	0.407017918923954	-0.832228007465167	-1.5921529689152	21	SORL1 FABP5 APOC2 DDHD2 PNPLA2 PIK3CG ABHD5 LIPG MGLL
GOBP_MODULATION_BY_SYMBIONT_OF_ENTRY_INTO_HOST	0.00490699437362752	0.217465491107818	0.407017918923954	-0.744142515729506	-1.59311609882267	37	H2-EB1 IFITM1 CD74 LY6E IFITM2 GSN TRIM25 TRIM30D LGALS9 IFITM3 LGALS1 TRIM11 TRIM14 TRIM8 TRIM12C
GOBP_ACTIN_POLYMERIZATION_OR_DEPOLYMERIZATION	0.000100541610958952	0.0352204997159284	0.538434096309916	-0.590898071201343	-1.59348091386273	180	CORO1A PFN1 GSN COTL1 SSH2 TMSB4X GMFG ARPC3 MTPN ACTR3 CAPZA1 ACTR2 SVIL WIPF1 ARPC1B IQGAP2 CDC42EP3 TMSB10 PSTPIP1 DBNL ARPC2 HCLS1 NCKAP1L ARPC5L MICAL1 MYADM PIK3CA CAPZB VILL WAS PLEK TWF2 WASF2 RICTOR CORO1B PRKCD PPP1R9B ARF6 CDC42EP2 ARFIP1 ADD1 PREX1 ARPC4 AIF1 GRB2 WASHC2 ARFIP2 CFL1 ADD3 FLII WASHC1 AP1AR TRIOBP PRKCE WDR1 RASA1 NCK1 ENAH HIP1R MSRB1 SNX9 JMY FER ARPC5
GOBP_REGULATION_OF_SMOOTHENED_SIGNALING_PATHWAY	0.00287802498058922	0.184598954388779	0.431707695803346	-0.681036941588405	-1.5983890676411	62	CREBBP NDST1 HERC4 BTRC CTNNA1 GPC3 C2CD3 TXNDC15 RB1 MGRN1 PRKACA
GOBP_POSITIVE_REGULATION_OF_LAMELLIPODIUM_ASSEMBLY	0.00339062958893595	0.193011589350179	0.431707695803346	-0.812561997133808	-1.59919874306301	24	DNM2 ACTR3 ACTR2 RAC2 CDC42 ARPC2 PIK3CA PIK3R1 TWF2 WASF2 AKIRIN1 ATP7A
GOBP_REGULATION_OF_DENDRITE_DEVELOPMENT	0.00194057571480735	0.147289696753878	0.45505986738723	-0.66444610174702	-1.60024650213225	73	ID1 PPP3CA ACTR2 YWHAH DBNL RAPGEF2 DAB2IP CRK DGKG CUX1 ARF6 SIPA1L1 GSK3A PREX1 OPA1 RAP2A
GOBP_REGULATION_OF_LAMELLIPODIUM_ORGANIZATION	0.00321014181398831	0.187515086633852	0.431707695803346	-0.723569809159919	-1.60303826175314	45	DNM2 ACTR3 ACTR2 RAC2 CDC42 ARPC2 BIN3 PIK3CA CAPZB WAS PIK3R1 TWF2 WASF2 CORO1B AKIRIN1 ATP7A ARHGEF7
GOBP_NEGATIVE_REGULATION_OF_TRANSPORTER_ACTIVITY	0.00496541710385818	0.217465491107818	0.407017918923954	-0.702428046485582	-1.60338811747859	53	SRI CAMK2D MMP9 SUMO1 NDFIP1 CAB39 KCNAB1 YWHAE CALM3 PTEN GOPC PRKCE PPIF NDFIP2
GOBP_NEGATIVE_REGULATION_OF_ACTIN_FILAMENT_POLYMERIZATION	0.00248263211032373	0.166776623329887	0.431707695803346	-0.70938221181119	-1.60848239449848	51	PFN1 GSN SSH2 TMSB4X MTPN CAPZA1 SVIL TMSB10 MYADM CAPZB VILL TWF2 PRKCD ADD1 WASHC2 ADD3 FLII TRIOBP
GOBP_POSITIVE_REGULATION_OF_GRANULOCYTE_CHEMOTAXIS	0.00356700845980538	0.195237684878219	0.431707695803346	-0.846224326957854	-1.61892962319056	21	CD74 RAC2 TIRAP NCKAP1L RIPOR2 MCU C5AR1
GOBP_CALCIUM_DEPENDENT_CELL_CELL_ADHESION_VIA_PLASMA_MEMBRANE_CELL_ADHESION_MOLECULES	0.00255221540166921	0.166776623329887	0.431707695803346	-0.858157372000395	-1.61970173962984	20	FXYD5 SELL ATP2C1
GOBP_NEPHRON_MORPHOGENESIS	0.00120014867281245	0.124215387636088	0.45505986738723	-0.747483474105267	-1.65601797345593	45	STAT1 PBX1 SMAD4 CTNNBIP1 TACSTD2 GPC3
GOBP_NEGATIVE_REGULATION_OF_SUPRAMOLECULAR_FIBER_ORGANIZATION	8.27126536684721e-05	0.0352204997159284	0.538434096309916	-0.635503152151289	-1.65658323195456	130	CORO1A PFN1 GSN SSH2 TMSB4X GMFG SMAD4 MTPN CAPZA1 SVIL TMSB10 TACSTD2 MYADM PIK3CA CIB1 CAPZB VILL WAS PFDN5 PIK3R1 TWF2 WASF2 CAMSAP1 CORO1B PRKCD ADD1 ARHGEF18 WASHC2 PAK2 ARAP1 VBP1 ADD3 PFDN6 FLII TRIOBP
GOBP_REGULATION_OF_MONOCYTE_DIFFERENTIATION	0.00126174094609988	0.127688183745307	0.45505986738723	-0.898731679364352	-1.6594977660823	18	H2-EB1 CD74 CTNNBIP1 IRF7 INPP5D FOXP1 CSF1 FES ZFP36L1 ACIN1
GOBP_REGULATION_OF_VESICLE_FUSION	0.000811029600598379	0.0947033025929492	0.477270815362862	-0.882149793110134	-1.6649854690218	20	CORO1A ANXA1 ANXA2
GOBP_REGULATION_OF_LAMELLIPODIUM_ASSEMBLY	0.00173813897712843	0.141347944675766	0.45505986738723	-0.795967928729156	-1.66980893944595	33	DNM2 ACTR3 ACTR2 RAC2 CDC42 ARPC2 BIN3 PIK3CA CAPZB WAS PIK3R1 TWF2 WASF2 AKIRIN1
GOBP_MONOCYTE_DIFFERENTIATION	0.00143194136126348	0.134875283410551	0.45505986738723	-0.793221411555514	-1.67564729218138	34	H2-EB1 CD74 MYH9 IFI205 CTNNBIP1 IRF7 INPP5D FOXP1 CSF1 FES ZFP36L1 SP3 PDE1B MT1 ACIN1
GOBP_NEUTRAL_LIPID_CATABOLIC_PROCESS	0.00132331026674846	0.128220318186648	0.45505986738723	-0.821664975608893	-1.69028778779224	29	SORL1 FABP5 APOC2 ABHD2 DDHD2 PNPLA2 LYPLA2 PIK3CG ABHD16A ABHD5 LIPG MGLL
GOBP_NEGATIVE_REGULATION_OF_CYTOSKELETON_ORGANIZATION	2.25358388496692e-05	0.0205256420242787	0.575610261071129	-0.653740479511585	-1.70412296578351	130	CORO1A PFN1 GSN SSH2 TMSB4X GMFG SMAD4 MTPN CAPZA1 SVIL CCNF TMSB10 TACSTD2 MYADM PIK3CA CIB1 CAPZB VILL WAS PIK3R1 KAT2B TWF2 WASF2 CAMSAP1 CORO1B PRKCD ADD1 ARHGEF18 WASHC2 PAK2 ARAP1 ADD3 FLII TRIOBP
