pathway	pval	padj	log2err	ES	NES	size	leadingEdge
GOBP_POSITIVE_REGULATION_OF_PATTERN_RECOGNITION_RECEPTOR_SIGNALING_PATHWAY	5.1710325081251e-05	0.0100118020019266	0.557332238758646	0.71475105285519	1.89528892704926	39	HSPA1B PJA2 TLR3 TLR4 SLC15A3 HSPA1A PUM1 ZDHHC5 WDFY1 PUM2 SLC15A4 DDX3X TICAM2 RTN4 TIRAP DDX60 FLOT1 TLR9 PELI1
GOBP_PITUITARY_GLAND_DEVELOPMENT	0.000124501116494905	0.0147698438658658	0.518848077743792	0.827419074922493	1.87485473347002	18	SALL1 BMPR1A CREB1 ETS1 HES1
GOBP_COMPLEMENT_DEPENDENT_CYTOTOXICITY	6.12986557574863e-05	0.0107234453029672	0.538434096309916	0.926925606073442	1.83847775129682	10	CFH CR1L HSP90AB1 CD5L
GOBP_SYNAPTIC_VESICLE_CLUSTERING	0.000132903522361792	0.01513106602089	0.518848077743792	0.914668586912759	1.81416700092323	10	PTEN NLGN2
GOBP_CEREBRAL_CORTEX_RADIALLY_ORIENTED_CELL_MIGRATION	0.000885464745207628	0.0496246070694336	0.477270815362862	0.777795226223776	1.8135011555702	20	P2RY12 ZMIZ1 SRGAP2 CDK5R1 SUN2 ADGRG1 RTN4 PAFAH1B1
GOBP_MESODERMAL_CELL_DIFFERENTIATION	0.000479543195333757	0.0358006510090152	0.49849310876659	0.800007018290906	1.81274156048728	18	KLF4 SMAD1 KDM6B BMPR1A TAL1 ITGB3
GOBP_POSITIVE_REGULATION_OF_ORGANELLE_ASSEMBLY	9.89412191884123e-05	0.0136834990212917	0.538434096309916	0.634965394707953	1.80869875982297	59	FSCN1 CEP135 ENTR1 PIP4K2A CNOT6L RAB3GAP2 NUMA1 ULK1 MSN ASAP1 MAPK9 G3BP1 RALB DYNC1H1 SDCBP LCP1 SH3GLB1 BBS4 BECN1 CEP295 PIP4K2B CNOT2 LRSAM1 CCP110 CROCC RAB3GAP1 ARHGAP35 TAPT1 CNOT1
GOBP_CENTRAL_NERVOUS_SYSTEM_NEURON_DIFFERENTIATION	6.3234280590655e-06	0.00191979275873229	0.610526878385931	0.589158238369927	1.80625049314417	108	PTEN CSNK1E HSP90AA1 CRK SOX4 MTPN B4GALT6 ZMIZ1 HSP90AB1 SALL1 CSF1R LDB1 ATP7A HERC1 CTNNB1 RYK NRP2 HES1 PAFAH1B1 ZSWIM6 B4GALT5 TAL1 SUFU LMO4 CLN8
GOBP_EMBRYONIC_HEART_TUBE_MORPHOGENESIS	0.000215345136050718	0.020865569139893	0.518848077743792	0.668983611861158	1.80212174267476	43	TGFBR2 ENG AHI1 HES1 C2CD3 PKD2 IFT52 SUFU NOTCH2 BBS4 MEF2C NOTCH1 MIB1 BBS7 SMAD3 MKKS TBX6 MEGF8 BBS5
GOBP_TRACHEA_DEVELOPMENT	0.000966279977774332	0.0517698708092271	0.477270815362862	0.888415406933931	1.79994381642755	11	TGFBR2 MAP2K1 MAPK1
GOBP_REGULATION_OF_SPINDLE_ASSEMBLY	0.000713462396493148	0.0452363357091483	0.477270815362862	0.740498079181784	1.78962846866762	24	HSPA1B CHMP2B HSPA1A HNRNPU NUMA1 CHMP1A DRG1 CHMP1B DYNC1H1 RNF4
GOBP_BRANCH_ELONGATION_OF_AN_EPITHELIUM	0.00119818270420149	0.0593453758087962	0.45505986738723	0.883207666117619	1.7893928502841	11	MED1 RDH10
GOBP_REGULATION_OF_SPINDLE_ORGANIZATION	0.000746354753660209	0.0459310749752512	0.477270815362862	0.683671177803866	1.78578024676512	36	HSPA1B CHMP2B CLTC HSPA1A HNRNPU NUMA1 CHMP1A DRG1 CHMP1B DYNC1H1 RAE1 RNF4
GOBP_EMBRYONIC_HEART_TUBE_DEVELOPMENT	0.000622690576167829	0.0447604869113935	0.477270815362862	0.645676869215752	1.77702183551574	47	TGFBR2 MED1 ENG AHI1 HES1 C2CD3 PKD2 IFT52 SUFU NOTCH2 BBS4 MEF2C NOTCH1 MIB1 BBS7 SMAD3 MKKS TBX6 MEGF8 BBS5
GOBP_CARDIAC_MUSCLE_CELL_PROLIFERATION	0.000890917903845365	0.0496246070694336	0.477270815362862	0.709160899577288	1.77504304347218	28	TGFBR2 PTEN SMAD1 TGFBR1 MAPK1 ARID2 BMPR1A PRKAR1A MEF2C NOTCH1
GOBP_REGULATION_OF_MITOTIC_SPINDLE_ASSEMBLY	0.00119889648098578	0.0593453758087962	0.45505986738723	0.780874534446686	1.76938913003753	18	HSPA1B CHMP2B HSPA1A HNRNPU CHMP1A DRG1 CHMP1B
GOBP_RESPIRATORY_SYSTEM_PROCESS	0.000877291432944229	0.0496246070694336	0.477270815362862	0.726173176960781	1.76397775951224	25	GAA ADH5 ZFAND5 GLS MTG1
GOBP_REGULATION_OF_ORGANELLE_ASSEMBLY	1.74425730682857e-06	0.000567381983949807	0.643551836150722	0.545925054067095	1.7594428092522	165	HSPA1B FSCN1 IFT20 ADPRH CHMP2B HSPA1A MTM1 HNRNPU RNF5 TBC1D14 CEP135 ENTR1 PIP4K2A CNOT6L SMAD4 RAB3GAP2 NUMA1 ULK1 SCFD1 MSN ASAP1 MAPK9 CHMP1A DRG1 G3BP1 PINK1 UBQLN2 CDK5RAP2 RBM14 TCHP FEZ2 RALB CHMP1B VDAC3 PHF23 DYNC1H1 CYLD IFT140 RDX SDCBP LCP1 SH3GLB1 ATXN2L D7ERTD443E BBS4 RNF4 BECN1 CEP295 PIP4K2B PIKFYVE CNOT2 ATG5 LRSAM1 CCP110 SEC22B PRKAA1 CROCC IFT88 RAB3GAP1 KAT2B ARHGAP35 TAPT1 CHMP5 CNOT1
GOBP_OUTFLOW_TRACT_MORPHOGENESIS	0.0010566818868664	0.0553118311814894	0.45505986738723	0.661557663316542	1.75423723949723	39	TGFBR2 SMAD4 ENG CTNNB1 BMPR1A NRP2 HES1 ATF2 NRP1 MEF2C NOTCH1 DHRS3 VEGFA ZFPM1 BMPR2 NIPBL
GOBP_TELENCEPHALON_GLIAL_CELL_MIGRATION	0.00195995559267846	0.0769451531815319	0.431707695803346	0.797106466727128	1.74191583246799	15	P2RY12 ZMIZ1 SRGAP2 CDK5R1 SUN2 ADGRG1 RTN4 PAFAH1B1
GOBP_OUTFLOW_TRACT_SEPTUM_MORPHOGENESIS	0.00124037993250277	0.0598340112093362	0.45505986738723	0.809364062011655	1.73568984537138	14	TGFBR2 SMAD4 ENG BMPR1A NRP2 NRP1
GOBP_CARDIAC_VENTRICLE_MORPHOGENESIS	0.000660810867748646	0.0447604869113935	0.477270815362862	0.651817770486424	1.7355293841533	40	TGFBR2 SOX4 MED1 TGFBR1 SMAD4 ENG TGFB1 BMPR1A FKBP1A MYL2 MEF2C NOTCH1
GOBP_ANDROGEN_RECEPTOR_SIGNALING_PATHWAY	0.00155825707903028	0.0667325368845249	0.45505986738723	0.669350191040936	1.72780831314393	33	PMEPA1 UBE3A RNF6 ZMIZ1 ARID1A PLPP1 DNAJA1 NCOR2 ZBTB7A KDM5D NCOR1
GOBP_REGULATION_OF_HEART_GROWTH	0.00240939920249986	0.084403107447572	0.431707695803346	0.641999104780297	1.72372544284935	42	TGFBR2 PTEN DUSP6 BASP1 TGFBR1 MAPK1 BMPR1A RGS2 PARP2 CTDP1 MEF2C NOTCH1 PIN1
GOBP_BONE_GROWTH	0.00192400836086689	0.0761990162520059	0.45505986738723	0.777825377557551	1.72325825850429	16	TGFBR2 COL27A1 IFT80
GOBP_POSITIVE_REGULATION_OF_OSTEOBLAST_PROLIFERATION	0.0013468481367013	0.0619550142882596	0.45505986738723	0.866776507193246	1.71917715227654	10	TMEM119 ABL1 ITGAV
GOBP_CARDIAC_EPITHELIAL_TO_MESENCHYMAL_TRANSITION	0.00372230576914987	0.107287218181699	0.431707695803346	0.725456955177885	1.71816765424559	21	TGFBR2 PDCD4 TGFBR1 SMAD4 ENG RTN4
GOBP_ANIMAL_ORGAN_FORMATION	0.00380881949353008	0.109090339456201	0.431707695803346	0.678590627345507	1.71543321404028	30	TGFBR2 MAP2K1 MAPK1 BMPR1A HES1 MEF2C NOTCH1
GOBP_AXIS_SPECIFICATION	0.00091534189587888	0.0496246070694336	0.477270815362862	0.616040319390995	1.71291761259444	50	BASP1 WLS LDB1 SMAD4 DDIT3 MDFI BCOR BMPR1A AHI1 C2CD3 TIFAB SKI NOTCH2 NOTCH1 SMAD2
GOBP_CARDIAC_MYOFIBRIL_ASSEMBLY	0.00263014617785036	0.08938571413381	0.431707695803346	0.806921102498006	1.70660689043507	13	SMAD4 MEF2A MYL2
GOBP_LIMBIC_SYSTEM_DEVELOPMENT	0.00126132302944582	0.0598340112093362	0.45505986738723	0.591976038091653	1.70021076109039	62	PTEN CRK ANXA3 ARPC5 CDK5R1 KIF5B TENT2 CDK6 KDM6B GSK3B ETS1 NRP2 PAFAH1B1 UBA6 EZH1 BBS4 PPP1R9B UBB BAX EIF2B3 RAB3GAP1 MKKS XRCC1
GOBP_NEGATIVE_REGULATION_OF_AXONOGENESIS	0.00232181117081974	0.0832561265504968	0.431707695803346	0.610599233711558	1.69601943304969	49	SPP1 PTEN RNF6 CDK5R1 ARHGDIA RYK RTN4 SPG20 NRP1 SEMA4D GDI1 SEMA4B TRAK2
GOBP_REPRODUCTIVE_BEHAVIOR	0.00317537377543756	0.0970513568680715	0.431707695803346	0.763661344247694	1.69187809519362	16	PTEN ZFX HEXB HDAC4 PPP1R9B UBE2Q1 HDAC2
GOBP_REGULATION_OF_MEMBRANE_INVAGINATION	0.00317537377543756	0.0970513568680715	0.431707695803346	0.763551709139129	1.69163520056494	16	CD300A TREM2 APPL2 RAB31 SYT11 NCKAP1L
GOBP_RESPONSE_TO_MAGNESIUM_ION	0.00301441199527578	0.0964266907604815	0.431707695803346	0.813313768067847	1.69004613573707	12	CCND1 THBS1 ENTPD6 CD14
GOBP_CATECHOLAMINE_SECRETION	0.00336972494592092	0.100958732919236	0.431707695803346	0.687148145358474	1.68664858267779	26	P2RY12 NISCH PINK1 GRK2 PRKN SYT11 STX1A
GOBP_STRIATED_MUSCLE_CELL_PROLIFERATION	0.00202540889187165	0.0781299467783097	0.431707695803346	0.636067982485768	1.68484912919394	38	TGFBR2 PTEN SMAD1 TGFBR1 MAPK1 ARID2 BMPR1A KPNA1 PRKAR1A CFLAR MEF2C NOTCH1
GOBP_ATTACHMENT_OF_SPINDLE_MICROTUBULES_TO_KINETOCHORE	0.00349916649594088	0.103475352094252	0.431707695803346	0.652452348174927	1.68470259829599	34	BUB3 HNRNPU ZFP207 SEH1L CHAMP1 MIS12 CDC42 RB1 BOD1 RCC2 EML4 MAD1L1 CENPC1 BECN1
GOBP_MATING	0.00660123452318111	0.140331498317665	0.407017918923954	0.709602340610085	1.68061768559963	21	PTEN SERPINE2 HEXB HDAC4 PPP1R9B UBE2Q1 HDAC2
GOBP_REGULATION_OF_AUTOPHAGOSOME_ASSEMBLY	0.00618276923644138	0.138742474373724	0.407017918923954	0.64195824276644	1.67682416108704	36	IFT20 ADPRH MTM1 RNF5 TBC1D14 PIP4K2A RAB3GAP2 ULK1 SCFD1 PINK1 UBQLN2 FEZ2 RALB PHF23 SH3GLB1 BECN1 PIP4K2B PIKFYVE LRSAM1 SEC22B IFT88 RAB3GAP1
GOBP_REGULATION_OF_VACUOLE_ORGANIZATION	0.00300499329132248	0.0964266907604815	0.431707695803346	0.622045153764728	1.67590421331417	44	IFT20 ADPRH MTM1 RNF5 TBC1D14 PIP4K2A RAB3GAP2 ULK1 SCFD1 PINK1 SCARB2 UBQLN2 FEZ2 RALB PHF23 SH3GLB1 LAPTM4B BECN1 PIP4K2B PIKFYVE LRSAM1 SEC22B ENO1 IFT88 RAB3GAP1
GOBP_MICROTUBULE_ORGANIZING_CENTER_LOCALIZATION	0.00297941882120127	0.0964266907604815	0.431707695803346	0.663823679415478	1.66853358962704	29	IFT20 AKAP9 ARPC5 KIF5B SUN2 BICD2 NUBP1
GOBP_ERBB2_SIGNALING_PATHWAY	0.00459812376955521	0.118976452537241	0.407017918923954	0.673731657011343	1.66710254235904	27	HSP90AA1 GAB1 MATK PRKCA CPNE3 CUL5 PIK3CA
GOBP_GROWTH_PLATE_CARTILAGE_DEVELOPMENT	0.0108578748911241	0.172364163676613	0.380730400722792	0.818989359445308	1.65928553438872	11	TGFBR2 COL27A1 IFT80
GOBP_POSITIVE_REGULATION_OF_MICROTUBULE_POLYMERIZATION_OR_DEPOLYMERIZATION	0.00530387478417261	0.13056132847093	0.407017918923954	0.650529273629907	1.65481434399301	31	HSPA1B AKAP9 HSPA1A CDK5R1 NUMA1 SPAST RAC1 DRG1 CDK5RAP2 MAPRE1
GOBP_DIENCEPHALON_DEVELOPMENT	0.00859355894476508	0.162776422885367	0.380730400722792	0.633449164317213	1.65459806072456	36	SALL1 BMPR1A CREB1 ETS1 NRP2 HES1 UBB BAX RAB3GAP1 PTCHD1 LRP6 UQCRQ
GOBP_NEGATIVE_REGULATION_OF_CATION_TRANSMEMBRANE_TRANSPORT	0.00205876012591067	0.0781299467783097	0.431707695803346	0.579770703165802	1.65391487065907	58	CALM2 PTEN FMR1 YWHAE UBQLN1 ATP7A COMMD1 OXSR1 RGS2 PKD2 CALM1 TLR9 GNB5 SRI NEDD4L SLC9A3R1
GOBP_SKELETAL_MUSCLE_CONTRACTION	0.00686251595173448	0.140331498317665	0.407017918923954	0.660708850155208	1.65376665426361	28	RCSD1 GAA ATP2A2
GOBP_MITOTIC_SPINDLE_ORGANIZATION	0.00038068796417783	0.0310903828834262	0.49849310876659	0.534277408048986	1.65028118596751	112	HSPA1B VCP CHMP2B RAN CLTC SBDS HSPA1A HNRNPU ZFP207 SUN2 TACC1 STAG2 NUMA1 SPAST KIF2A CHMP1A DRG1 KPNB1 GOLGA2 CHMP1B DYNC1H1 MZT1 TUBG1 LSM14A PCNT RAE1 PTPA
GOBP_CEREBRAL_CORTEX_CELL_MIGRATION	0.00462940451480597	0.119109085652127	0.407017918923954	0.678241276672536	1.64754436764078	25	P2RY12 ZMIZ1 SRGAP2 CDK5R1 SUN2 ADGRG1 RTN4 PAFAH1B1
GOBP_PEPTIDYL_THREONINE_DEPHOSPHORYLATION	0.0099713963189118	0.169439324016136	0.380730400722792	0.691655912424793	1.64284792454689	22	DUSP6 PPP2CA DUSP7 PPM1D PPM1B
GOBP_CHONDROCYTE_DIFFERENTIATION_INVOLVED_IN_ENDOCHONDRAL_BONE_MORPHOGENESIS	0.00655693093577721	0.140331498317665	0.407017918923954	0.789759912953926	1.64110180037735	12	TGFBR2 COL27A1 TRIP11 IFT80
GOBP_CENTRAL_NERVOUS_SYSTEM_NEURON_DEVELOPMENT	0.00258439309271959	0.0891615616988259	0.431707695803346	0.575046286618327	1.64043750324401	58	PTEN HSP90AA1 CRK B4GALT6 ZMIZ1 HSP90AB1 ATP7A NRP2 PAFAH1B1 B4GALT5 UBB NANOS1
GOBP_GANGLION_DEVELOPMENT	0.0142544264975967	0.193365926297035	0.380730400722792	0.809300741364216	1.63965623927668	11	CTNNB1 NRP2 NRP1 TULP3
GOBP_CELL_PROLIFERATION_IN_FOREBRAIN	0.00701398065015986	0.141334813631982	0.407017918923954	0.74005247007322	1.63957305531063	16	HOOK3 AKNA NUMB RRM1
GOBP_NEGATIVE_REGULATION_OF_NEURON_PROJECTION_REGENERATION	0.00680671136826815	0.140331498317665	0.407017918923954	0.787614540644353	1.63664376914283	12	SPP1 PTEN KLK8 CERS2
GOBP_NEGATIVE_REGULATION_OF_ORGAN_GROWTH	0.0116226896153377	0.177022503372066	0.380730400722792	0.687119073394693	1.63207184868212	22	TGFBR2 PTEN RGS2 CTDP1
GOBP_HEART_VALVE_DEVELOPMENT	0.00502533135582096	0.125743730738509	0.407017918923954	0.599723679111414	1.62778277853359	45	TGFBR2 SOX4 MATR3 SMAD4 TGFB1 RB1 BMPR1A NOTCH2 MEF2C NOTCH1 ZBTB14
GOBP_NEGATIVE_REGULATION_OF_CARDIAC_MUSCLE_TISSUE_GROWTH	0.00954148192642122	0.169439324016136	0.380730400722792	0.734065128210365	1.62630820614351	16	TGFBR2 PTEN RGS2 CTDP1
GOBP_CARTILAGE_DEVELOPMENT_INVOLVED_IN_ENDOCHONDRAL_BONE_MORPHOGENESIS	0.0108791189352172	0.172364163676613	0.380730400722792	0.716429851806929	1.62336346788387	18	TGFBR2 COL27A1 TRIP11 IFT80
GOBP_CELL_CELL_ADHESION_MEDIATED_BY_CADHERIN	0.0129149560716816	0.186122499843158	0.380730400722792	0.69460816665692	1.6195428699358	20	TJP1 CTNND1 FLOT1 NOTCH1 VEGFA DENND6A MAD2L2
GOBP_REGULATION_OF_SKELETAL_MUSCLE_ADAPTATION	0.00626796822507186	0.138742474373724	0.407017918923954	0.816444140169543	1.61934720223862	10	PPP3CA ATP2A2 CAMK2G GTF2IRD1
GOBP_POSITIVE_REGULATION_OF_EXCITATORY_POSTSYNAPTIC_POTENTIAL	0.0112608381291168	0.173836802847451	0.380730400722792	0.714264103859238	1.61845608429278	18	PTEN ADRB2 DLG4 STX1A
GOBP_REGULATION_OF_CARDIAC_MUSCLE_CELL_PROLIFERATION	0.0127622454424556	0.184505605539502	0.380730400722792	0.683354342700261	1.61845209372615	21	TGFBR2 PTEN TGFBR1 MAPK1 BMPR1A MEF2C NOTCH1
GOBP_SMAD_PROTEIN_COMPLEX_ASSEMBLY	0.00880496225585334	0.164335238168673	0.380730400722792	0.778791134941614	1.61830894770315	12	PMEPA1 SMAD1 LDLRAD4 SMAD4 EID2 TGFB1 FKBP1A SMAD2 SMAD3
GOBP_PROTEIN_DEMANNOSYLATION	0.0194642434185696	0.218825351373802	0.352487857583619	0.70097929442214	1.61749138465159	19	SEL1L RNF5 MAN1A2 MAN1A MAN1C1 DERL2 SYVN1 EDEM1 RNF139 UGGT2 EDEM2 MAN1B1 UGGT1 TRIM13 AMFR
GOBP_PHOTORECEPTOR_CELL_DIFFERENTIATION	0.00590725280424401	0.137253210563914	0.407017918923954	0.610549340893669	1.61725405720708	38	IFT20 TUG1 NAGLU ARL3 AHI1 MYO7A STAT3 IFT140 BBS4 NOTCH1 ROM1 VEGFA 2610301B20RIK
GOBP_HEART_GROWTH	0.00392173070623194	0.109995310913834	0.407017918923954	0.569016810242117	1.61598416760889	57	TGFBR2 PTEN DUSP6 BASP1 SMAD1 TGFBR1 MAPK1 ARID2 BMPR1A RGS2 PARP2 PDLIM5 CTDP1 PRKAR1A MEF2C NOTCH1
GOBP_CENTRAL_NERVOUS_SYSTEM_NEURON_AXONOGENESIS	0.0166369947380032	0.207998878544827	0.352487857583619	0.638916514491698	1.61513962290532	30	PTEN HSP90AA1 B4GALT6 HSP90AB1 PAFAH1B1 B4GALT5 ARHGAP35 PLXNA4 TCTN1 SZT2 SCN1B NIN
GOBP_MATING_BEHAVIOR	0.0096791998321696	0.169439324016136	0.380730400722792	0.777054050023704	1.61469932769151	12	PTEN HEXB HDAC4 PPP1R9B UBE2Q1 HDAC2 APP
GOBP_CHONDROCYTE_DIFFERENTIATION	0.00272277568887821	0.0909029784659664	0.431707695803346	0.559444217443312	1.61468772615681	66	TGFBR2 CREB3L2 COL27A1 MAF GLG1 TGFBR1 TGFB1 MEX3C BMPR1A MEF2D TRIP11 CHSY1 MEF2C PKDCC IFT80 SNX19
GOBP_MICROTUBULE_CYTOSKELETON_ORGANIZATION_INVOLVED_IN_MITOSIS	0.000181498801077538	0.0183676786690469	0.518848077743792	0.511439859898703	1.61267046485748	134	HSPA1B VCP CHMP2B RAN CLTC SBDS HSPA1A HNRNPU ZFP207 SUN2 TACC1 STAG2 NUMA1 SPAST KIF2A CHMP1A DRG1 NSFL1C CDK5RAP2 KPNB1 GOLGA2 PAFAH1B1 CHMP1B DYNC1H1 MZT1 TUBG1 LSM14A PCNT RAE1 PTPA
GOBP_CARDIAC_VENTRICLE_DEVELOPMENT	0.00278804293081225	0.0920054167168044	0.431707695803346	0.548619051844874	1.61148432737955	73	TGFBR2 SOX4 MED1 MATR3 SALL1 TGFBR1 SMAD4 TMEM65 ENG TGFB1 BMPR1A HES1 TRIP11 FKBP1A LUZP1 MYL2 SUFU LMO4
GOBP_VACUOLE_ORGANIZATION	0.00020298046244583	0.0200950657821372	0.518848077743792	0.501389431868252	1.61130406279508	160	HOOK3 ACP2 GAA IFT20 RAB20 TRAPPC8 ADPRH RAB39 RAB14 MTM1 RNF5 ATG14 UBQLN1 TBC1D14 ATG12 PIP4K2A TPP1 LAMTOR1 RAB3GAP2 ULK1 SCFD1 NAGLU PINK1 SCARB2 CLN5 NSFL1C MYO7A UBQLN2 SNAPIN GABARAPL1 FEZ2 RALB ARF1 PHF23 CLN8 GABARAP NAGPA MAN2A1 ZKSCAN3 HEXB TFEB SH3GLB1 ATG2B LAPTM4B LAPTM5 ABCA1 RAB1A HPS1 TMEM41B AMBRA1 PACS2 WIPI2 BECN1 STX12 PIP4K2B PIKFYVE ATG101 ATG5 LRSAM1 SEC22B TRP53INP2 TMEM9 ENO1 MAP1LC3A GBA IFT88 RAB3GAP1 VPS4A CHMP5
GOBP_STEM_CELL_DIFFERENTIATION	6.23805072658165e-05	0.0107234453029672	0.538434096309916	0.497339717873745	1.61027450166968	190	CDK13 PSMC4 PSMB3 PSMA2 PSMC5 PSMA6 NELFB LMO2 PSMD7 PSMD14 PUM1 ABL1 HNRNPU NFE2L2 PSMD12 FAM172A LDB1 UFL1 SMAD4 PDCD6 PSMD2 TRP53 SETD1A MAPK1 PSMA4 NOLC1 BMPR1A CBFB NRP2 HES1 PRKDC METTL5 PSMD9 PSMD1 TAL1 PSMA5 PSMB6 ITCH PSMD8 PSMA3 CORO1C NRP1 KLHL12 SEMA4D XRCC5 MTF2 MEF2C N4BP2L2 PSMD10 NOTCH1
GOBP_NEGATIVE_REGULATION_OF_INTERLEUKIN_17_PRODUCTION	0.0107504807045643	0.172364163676613	0.380730400722792	0.760761249022358	1.60898058749276	13	TLR4 VSIR DDIT3 TUSC2 NCKAP1L
GOBP_TOLL_LIKE_RECEPTOR_7_SIGNALING_PATHWAY	0.0107504807045643	0.172364163676613	0.380730400722792	0.760574874062396	1.60858641166827	13	TLR7 SLC15A4 DDX3X
GOBP_CELL_FATE_DETERMINATION	0.0133352419459725	0.189965722334924	0.380730400722792	0.724913586212356	1.60603312798183	16	KLF4 CDC42 HES1 NOTCH2 MEF2C MCL1 IFRD1
GOBP_NUCLEUS_LOCALIZATION	0.0157280311263958	0.202830066391219	0.352487857583619	0.688211616875894	1.60462872540464	20	HOOK3 SUN2 CDC42 PAFAH1B1 DYNC1H1 SLC9A3R1 PCM1 TMEM201 DCTN1 FBXW11 BIN1 DOCK7
GOBP_CEREBELLAR_CORTEX_DEVELOPMENT	0.0117692670622679	0.177862378711443	0.380730400722792	0.630345833146509	1.60347177083456	31	MTPN MAP2K1 SERPINE2 LDB1 ATP7A RERE HERC1 NAGLU
GOBP_EMBRYONIC_DIGIT_MORPHOGENESIS	0.0178878738517735	0.212139003960876	0.352487857583619	0.63389694525337	1.60245047654135	30	CREBBP SALL1 SMAD4 BMPR1A C2CD3 IFT52 IFT140 ECE1 NOTCH1 BAX HDAC2 FLVCR1
GOBP_RESPONSE_TO_ESTROGEN	0.00625268934035715	0.138742474373724	0.407017918923954	0.572343400453954	1.60128069717825	52	TGFBR2 CCND1 HMOX1 NCOA4 WBP2 BCAS3 MAPK1 LDHA SRA1 ASH2L MMP14 CTNNA1 PELP1
GOBP_FOREBRAIN_CELL_MIGRATION	0.00996148398466545	0.169439324016136	0.380730400722792	0.619583036578844	1.59934326696624	33	P2RY12 ZMIZ1 SRGAP2 CDK5R1 SUN2 ADGRG1 RTN4 PAFAH1B1
GOBP_HEMATOPOIETIC_PROGENITOR_CELL_DIFFERENTIATION	0.000447774123072445	0.0345620907876596	0.49849310876659	0.500829815489854	1.59811627264677	146	SOX4 TNFRSF13B PSMC4 PSMB3 PSMA2 PSMC5 PSMA6 SBDS LMO2 PSMD7 FNIP1 CSF1R PSMD14 ABL1 NFE2L2 PSMD12 LDB1 SPI1 UFL1 PSMD2 TENT2 TRP53 SETD1A PSMA4 TGFB1 AGPAT5 CBFB HES1 PRKDC ZBTB1 PSMD9 PSMD1 TAL1 PSMA5 PSMB6 PLD4 ITCH PSMD8 PSMA3 JAM3 SIPA1L3 KDR XRCC5 N4BP2L2 PSMD10 NOTCH1
GOBP_POSITIVE_REGULATION_OF_AUTOPHAGOSOME_ASSEMBLY	0.00901676547162988	0.165573991765333	0.380730400722792	0.804612329954307	1.59587981748223	10	PIP4K2A RAB3GAP2 ULK1 RALB SH3GLB1 BECN1 PIP4K2B LRSAM1 RAB3GAP1
GOBP_PROXIMAL_DISTAL_PATTERN_FORMATION	0.00914466072496785	0.166579139766014	0.380730400722792	0.803972488357252	1.59461074633689	10	CHSY1 PBX1 PBX2
GOBP_POSITIVE_REGULATION_OF_TRANSCRIPTION_REGULATORY_REGION_DNA_BINDING	0.0143512307522493	0.193933248800425	0.380730400722792	0.718860979142038	1.592623684911	16	LAMTOR5 KLF4 CTNNB1 TGFB1 RB1 TRAF6 GTF2B
GOBP_REGULATION_OF_GOLGI_ORGANIZATION	0.0151132236158542	0.200074477751744	0.380730400722792	0.718015159899808	1.59074978745737	16	AKAP9 MAP2K1 RAB33B MAPK1 PDCD10 PDE4DIP MAP2K2 STX5A
GOBP_EXCITATORY_SYNAPSE_ASSEMBLY	0.0151132236158542	0.200074477751744	0.380730400722792	0.71766402025788	1.58997184384007	16	PTEN PLXNB2 PTPRS NPTN IL1RAP ZDHHC12 LRFN1
GOBP_ANTERIOR_POSTERIOR_AXIS_SPECIFICATION	0.0132676647063814	0.189965722334924	0.380730400722792	0.642447111040284	1.58969108991779	27	BASP1 WLS LDB1 SMAD4 DDIT3 TIFAB SKI
GOBP_CEREBELLAR_CORTEX_MORPHOGENESIS	0.0212452610031898	0.225232429184141	0.352487857583619	0.662273690929894	1.58920414397093	23	MTPN MAP2K1 SERPINE2 LDB1 ATP7A HERC1 COQ8B GBA TTLL1 RORA
GOBP_POSITIVE_REGULATION_OF_ARP2_3_COMPLEX_MEDIATED_ACTIN_NUCLEATION	0.00978413740616814	0.169439324016136	0.380730400722792	0.801039452825516	1.58879332093238	10	WAS WASF2 ABI2 WASL CYFIP1 BRK1
GOBP_HINDBRAIN_MORPHOGENESIS	0.0213903421898147	0.225232429184141	0.352487857583619	0.628251002045939	1.58817789729796	30	MTPN MAP2K1 ABL1 SERPINE2 LDB1 ATP7A HERC1 HES1 COQ8B GBA XRCC1 LRP6 TTLL1 RORA
GOBP_INCLUSION_BODY_ASSEMBLY	0.0178164583563909	0.211843737219332	0.352487857583619	0.670081319814226	1.58701635045554	21	HSPA1B VCP PSMC5 HSPA1A DNAJB1 DNAJA4 PRKN BAG5 DNAJB6 BAG3
GOBP_N_TERMINAL_PROTEIN_AMINO_ACID_ACETYLATION	0.0176672417872419	0.211172228606561	0.352487857583619	0.724724017510229	1.58373855057813	15	SOX4 NAA20 CREBBP NAA35 NAA80 NAA15 NAA16 NAA50 KAT2B NAA25 NAA30 EP300
GOBP_NEUROBLAST_PROLIFERATION	0.00622361237022782	0.138742474373724	0.407017918923954	0.594058941995244	1.58174078160276	40	AKNA PLXNB2 CX3CR1 ARHGEF2 RAB10 TRP53 CTNNB1 DAGLB PAFAH1B1 CTNNA1 NF1 NOTCH1 NUMB DAGLA
GOBP_POSITIVE_REGULATION_OF_TOLL_LIKE_RECEPTOR_SIGNALING_PATHWAY	0.0133579209288738	0.189965722334924	0.380730400722792	0.644129068497165	1.58105553770438	26	PJA2 TLR3 WDFY1 SLC15A4 DDX3X TICAM2 RTN4 TIRAP FLOT1 TLR9 PELI1
GOBP_REGULATION_OF_ORGAN_GROWTH	0.00546371430276991	0.132388561820679	0.407017918923954	0.554406428555387	1.58095135548466	60	TGFBR2 PTEN DUSP6 BASP1 TGFBR1 MAPK1 BMPR1A RGS2 YBX3 SASH3 PARP2 CTDP1 LATS2 MEF2C NOTCH1 LATS1 PIN1
GOBP_ENDOPLASMIC_RETICULUM_MANNOSE_TRIMMING	0.0181684318489879	0.213795965478787	0.352487857583619	0.723359004521133	1.5807555892844	15	SEL1L RNF5 DERL2 SYVN1 EDEM1 RNF139 UGGT2 EDEM2 MAN1B1 UGGT1 TRIM13 AMFR
GOBP_HISTONE_H4_K16_ACETYLATION	0.0205870032360705	0.222691716715119	0.352487857583619	0.677958352411046	1.58072229562922	20	PHF20 MSL3 OGT KANSL2 MSL2 HCFC1 MCRS1 ATG5 WDR5 KANSL3 KMT2A KANSL1L
GOBP_SYMPATHETIC_NERVOUS_SYSTEM_DEVELOPMENT	0.010935196867873	0.172364163676613	0.380730400722792	0.795921370691868	1.5786420422641	10	SOX4 CTNNB1 NRP2 NRP1 NF1 PLXNA4
GOBP_ESTABLISHMENT_OF_CELL_POLARITY	0.00185894698078788	0.0749172084115754	0.45505986738723	0.508881937955293	1.57546692125639	114	FSCN1 HSP90AA1 CRK IFT20 HSP90AB1 FRMD4B RAP1B AMOTL1 RAB10 DOCK2 NUMA1 BCAS3 CDC42 CYTH3 MSN GSK3B NSFL1C HES1 CDK5RAP2 PAFAH1B1 STK11 JAM3 MYO9A SIPA1L3 UST CYTH1 DOCK8 MARK2 SH3BP1 ARF6
GOBP_NEURON_PROJECTION_EXTENSION_INVOLVED_IN_NEURON_PROJECTION_GUIDANCE	0.0136123498981252	0.191237450906966	0.380730400722792	0.641809983664252	1.57536319730739	26	RYK NRP2 NRP1 SEMA4D SEMA4B VEGFA MEGF8 PLXNA4 BMPR2 SEMA4C
GOBP_NEGATIVE_REGULATION_OF_NERVOUS_SYSTEM_DEVELOPMENT	0.00156793619820908	0.0667325368845249	0.45505986738723	0.521065582493514	1.5749693221179	91	SPP1 PTEN HOOK3 PPP3CA RNF6 IDH2 CDK5R1 TRP53 ARHGDIA RYK RTN4 BMPR1A APPL2 HES1 SPG20 SKI NRP1 SEMA4D CTNNA1 GDI1 NF1 NOTCH1 SEMA4B CERS2 IL1B TRAK2
GOBP_ACIDIC_AMINO_ACID_TRANSPORT	0.0108129387422789	0.172364163676613	0.380730400722792	0.566971686734383	1.57483820090204	49	SLC1A3 SLC6A6 GLS PPFIA1 STXBP1 CLN8 LRRC8D PRAF2 SLC12A2 CCK APBA1 STX1A SLC9A3R1 SLC25A22 RAB3GAP1 SLC25A12 KCNJ10 ARL6IP1 LRRC8A SLC38A7 PPFIA4
GOBP_MESODERM_MORPHOGENESIS	0.00614195887844506	0.138742474373724	0.407017918923954	0.584543809414708	1.57465607499934	43	KLF4 SMAD1 EXT2 KDM6B BMPR1A TAL1 PRKAR1A SMAD2 SMAD3 TBX6 ITGB3 TXNRD1 POFUT2 PRKACA BMPR2
GOBP_REGULATION_OF_MUSCLE_ORGAN_DEVELOPMENT	0.0157947686491419	0.202830066391219	0.352487857583619	0.636257984019914	1.57437652174622	27	MTPN MTM1 TGFB1 CREB1 YBX3 TIFAB FLOT1 MEF2C MRTFB PRKAA1 SMAD3
GOBP_REGULATION_OF_PHOSPHOLIPASE_C_ACTIVITY	0.012446868701703	0.183655276624655	0.380730400722792	0.597636512141983	1.57365494379927	37	P2RY12 ABL2 ANG ABL1 HRAS CD86 GNA15 PTAFR
GOBP_NUCLEAR_MIGRATION	0.0266537040081722	0.243248432972377	0.352487857583619	0.706160029259057	1.57327394934604	17	HOOK3 SUN2 CDC42 PAFAH1B1 DYNC1H1 SLC9A3R1
GOBP_NOREPINEPHRINE_TRANSPORT	0.0118304663244558	0.177862378711443	0.380730400722792	0.793145552850727	1.57313644471759	10	P2RY12 NISCH STX1A
GOBP_REGULATION_OF_CELLULAR_RESPONSE_TO_HEAT	0.00231397139533761	0.0832561265504968	0.431707695803346	0.53202307171895	1.57240687706012	77	HSPA1B HSP90AA1 YWHAE CREBBP HSP90AB1 HSPA1A HSPA8 SEH1L HSPH1 DNAJB1 MAPK1 NUP214 CAMK2G GSK3B HSBP1
GOBP_HIPPOCAMPUS_DEVELOPMENT	0.0110518963095237	0.172364163676613	0.380730400722792	0.566082169944596	1.57236745138548	49	PTEN CRK ANXA3 CDK5R1 KIF5B TENT2 CDK6 KDM6B GSK3B PAFAH1B1 UBA6 EZH1 BBS4 PPP1R9B
GOBP_CHONDROCYTE_DEVELOPMENT	0.0210624708563231	0.225232429184141	0.352487857583619	0.660525951639967	1.56890683541879	22	TGFBR2 COL27A1 MEX3C CHSY1
GOBP_PURINERGIC_NUCLEOTIDE_RECEPTOR_SIGNALING_PATHWAY	0.019308324369912	0.21863626942093	0.352487857583619	0.648972213998774	1.56842965862893	24	P2RY12 P2RY13 GPR34 P2RX7 ADORA3 PTAFR
GOBP_POSITIVE_REGULATION_OF_EPITHELIAL_TO_MESENCHYMAL_TRANSITION	0.0146409353778587	0.195577628387152	0.380730400722792	0.584044963130257	1.56812237777209	42	TGFBR2 TGFBR1 ZFP703 SMAD4 ENG CTNNB1 TGFB1 SDCBP NOTCH1 TIAM1 HDAC2 SMAD2 IL1B SMAD3 IL6
GOBP_REGULATION_OF_CELL_CELL_ADHESION_MEDIATED_BY_CADHERIN	0.0219273632645948	0.226948209788556	0.352487857583619	0.717312286870287	1.5675417042513	15	TJP1 FLOT1 NOTCH1 VEGFA DENND6A MAD2L2
GOBP_POSITIVE_REGULATION_OF_PHAGOCYTOSIS_ENGULFMENT	0.018321881442307	0.214023996514638	0.352487857583619	0.740966862990636	1.56711622740961	13	TREM2 APPL2 RAB31 NCKAP1L ABCA7
GOBP_NEUROMUSCULAR_PROCESS	0.0102039933604384	0.170841859424398	0.380730400722792	0.560397188766581	1.56650000693385	51	PTEN GAA ABL1 PNKD CHD8 TPP1 CDH23 HERC1 MYO7A PAFAH1B1 TIFAB SPG20 CLN8 HEXB PRKN DLG4 NBN UBA5 GBA
GOBP_LIPID_EXPORT_FROM_CELL	0.0102039933604384	0.170841859424398	0.380730400722792	0.560056187108992	1.56554679176845	51	SPP1 SLC1A3 GLS PPFIA1 STXBP1 SLC12A2 POMC CCK APBA1 TMF1 IL1B FZD4 STX1A GDF9 RAB3GAP1 P2RX4
GOBP_POLARIZED_EPITHELIAL_CELL_DIFFERENTIATION	0.0174751901952714	0.210534434257318	0.352487857583619	0.729920578577381	1.56532244959762	14	IFT20 RAB10 CDC42 MSN AHI1 MYO9A ZDHHC7 SH3BP1 SLC9A3R1
GOBP_REGULATION_OF_NUCLEOTIDE_BINDING_OLIGOMERIZATION_DOMAIN_CONTAINING_SIGNALING_PATHWAY	0.0188273047494039	0.215551487229749	0.352487857583619	0.739504204988135	1.56402276236366	13	HSPA1B TLR4 SLC15A3 HSPA1A SLC15A4
GOBP_BONE_MORPHOGENESIS	0.00948577636831545	0.16940480620121	0.380730400722792	0.557055164015152	1.56269723965621	54	TGFBR2 COL27A1 GLG1 TMEM119 EXT2 MEF2D TRIP11 TIFAB SKI MMP14 CHSY1 FOXN3 MEF2C IFT80
GOBP_SIALYLATION	0.0177266274739217	0.211327386168166	0.352487857583619	0.728463501819335	1.56219773298174	14	ST3GAL5 ST3GAL6 ST6GALNAC4 ST6GAL1
GOBP_REGULATION_OF_PATTERN_RECOGNITION_RECEPTOR_SIGNALING_PATHWAY	0.00384745995457549	0.109508328957105	0.431707695803346	0.515764760060029	1.56199610740389	93	HSPA1B PJA2 TLR3 CD300A TLR4 SLC15A3 HSPA1A PUM1 ZDHHC5 WDFY1 PUM2 SLC15A4 NFKBIL1 DDX3X TICAM2 RTN4 APPL2 TIRAP DDX60 FLOT1 UFD1 TICAM1 TLR9 GRAMD4 PELI1
