pathway	pval	padj	log2err	ES	NES	size	leadingEdge
REACTOME_INFLUENZA_INFECTION	1.39306181688216e-09	5.86757637270767e-07	0.788186810800237	-0.621512907561483	-1.97665299710353	147	UBA52 HSPA1A RPL23A RPS27 RPL10 RPL22L1 ISG15 RPL10A RPL37 RPL36A RPL18A RPS12 RPSA RPLP2 RPL13A RPS29 RPS21 RPS24 RPS13 RPS2 RPL12 GTF2F1 KPNA1 RPL17 TGFB1 RPS15 POLR2I RPL22 FAU RPL28 SEH1L RPS25 RPL38 CALR RPS9 RPL23 RPS16 POLR2B RPL21 RPL5 RPL26 RPS6 RPS26 CANX NUP35 RPS11 RPS27A RPL34 POLR2L EIF2AK2 RPL29 RPS17 RPL35 RPL14 RPL39 RPL27A TPR RPL18 POLR2C NUP133 RPL27 RPS8 RPL36AL CLTC RPS14 POLR2J HSP90AA1 RPL4 RPS18 KPNA4 RPL6 RPL36
REACTOME_EUKARYOTIC_TRANSLATION_INITIATION	1.17816949994885e-08	3.10153120861534e-06	0.747739663149885	-0.649804055268427	-2.01517104650891	116	UBA52 RPL23A RPS27 RPL10 RPL22L1 RPL10A RPL37 RPL36A RPL18A RPS12 RPSA RPLP2 RPL13A RPS29 RPS21 RPS24 RPS13 EIF3L RPS2 RPL12 RPL17 RPS15 RPL22 FAU PABPC1 RPL28 RPS25 RPL38 RPS9 RPL23 RPS16 RPL21 RPL5 RPL26 RPS6 RPS26 EIF4EBP1 EIF5B EIF3B RPS11 EIF2B2 RPS27A RPL34 RPL29 EIF3D RPS17 RPL35 RPL14 RPL39 RPL27A EIF2B5 EIF3G RPL18
REACTOME_SELENOAMINO_ACID_METABOLISM	2.8375902994369e-09	9.9599419510235e-07	0.774939030136436	-0.668403585303211	-2.04837840342486	109	UBA52 RPL23A RPS27 RPL10 RPL22L1 GSR RPL10A RPL37 RPL36A RPL18A RPS12 RPSA RPLP2 RPL13A RPS29 RPS21 RPS24 RPS13 RPS2 RPL12 RPL17 RPS15 RPL22 FAU RPL28 RPS25 RPL38 RPS9 RPL23 RPS16 RPL21 RPL5 RPL26 RPS6 RPS26 RPS11 RPS27A RPL34 RPL29 RPS17 RPL35 RPL14 RPL39 RPL27A EEF1E1 RPL18 LARS RPL27 RPS8 RPL36AL RPS14
WP_CYTOPLASMIC_RIBOSOMAL_PROTEINS	4.97456857470692e-09	1.49663448833325e-06	0.761460801445585	-0.704357546737954	-2.10003952757294	85	UBA52 RPL23A RPS27 RPL10 RPL10A RPL37 RPL36A RPL18A RPS12 RPSA RPLP2 RPL13A RPS29 RPS21 RPS24 RPS13 RPS2 RPL12 RPL17 RPS15 RPL22 FAU RPL28 RPS25 RPL38 RPS9 RPL23 RPS16 RPL21 RPL5 RPL26 RPS6 RPS26 RPS11 RPS27A RPL34 RPL29 RPS17 RPL35 RPL14 RPL39 RPL27A RPL18
REACTOME_SRP_DEPENDENT_COTRANSLATIONAL_PROTEIN_TARGETING_TO_MEMBRANE	5.47503698408467e-10	2.88260697212058e-07	0.801215574617779	-0.685238534524998	-2.10280477653033	108	UBA52 RPL23A RPS27 SEC61A1 RPL10 RPL22L1 RPL10A RPL37 RPL36A RPL18A RPS12 RPSA RPLP2 RPL13A RPS29 SSR3 RPS21 RPS24 RPS13 RPS2 RPL12 RPL17 RPS15 SRPR RPL22 FAU RPL28 RPS25 RPL38 RPS9 RPL23 RPS16 SEC61B RPL21 RPL5 RPL26 RPS6 RPS26 RPS11 SSR1 RPS27A RPL34 SEC61G RPL29 RPS17 RPL35 RPL14 SEC11A RPL39 RPL27A SRP19 RPL18 SPCS2 RPL27 RPS8 SPCS1 RPL36AL RPS14
KEGG_RIBOSOME	3.42927393238907e-10	2.40735030053713e-07	0.814035837847908	-0.723560661314502	-2.15526530194869	83	UBA52 RPL23A RPS27 RPL10 RPL22L1 RPL10A RPL37 RPL36A RPL18A RPS12 RPSA RPLP2 RPL13A RPS29 RPS21 RPS24 RPS13 RPS2 RPL12 RPL17 RPS15 RPL22 FAU RPL28 RPS25 RPL38 RPS9 RPL23 RPS16 RPL21 RPL5 RPL26 RPS6 RPS26 RPS11 RPS27A RPL34 RPL29 RPS17 RPL35 RPL14 RPL39 RPL27A RPL18
REACTOME_EUKARYOTIC_TRANSLATION_ELONGATION	5.06739551683949e-11	9.9149165596967e-08	0.851339057116899	-0.738715241657833	-2.21382228015841	88	UBA52 RPL23A RPS27 RPL10 RPL22L1 RPL10A RPL37 RPL36A RPL18A RPS12 RPSA EEF1D RPLP2 RPL13A EEF1A1 RPS29 RPS21 RPS24 RPS13 RPS2 RPL12 RPL17 RPS15 RPL22 FAU EEF1G RPL28 RPS25 RPL38 RPS9 EEF1B2 RPL23 RPS16 RPL21 RPL5 RPL26 RPS6 RPS26 RPS11 RPS27A RPL34 RPL29 EEF2 RPS17 RPL35 RPL14 RPL39 RPL27A RPL18
