pathway	pval	padj	log2err	ES	NES	size	leadingEdge
KEGG_ASTHMA	0.000125281571795559	0.0114714343565846	0.518848077743792	0.855942577606217	2.02954600797656	18	TNF FCER1G IL10 H2-DMA H2-OA
WP_PROXIMAL_TUBULE_TRANSPORT	0.000864851515934198	0.0607125764185807	0.477270815362862	0.697196657712481	1.81611525285686	29	ATP6V1D ATP6V1C1 ATP6V0C ATP6V1A ATP6V1F ATP6V1E1 ATP6V1H ATP6V1G1 ATP6V0B ATP6V0E SLC3A2 SLC7A8 ABCC4 SLC2A1
BIOCARTA_INFLAM_PATHWAY	0.00355122362767205	0.136564409354709	0.431707695803346	0.825294095661114	1.80662298804734	13	TNF CSF3 IL1A IL10 TGFB1
REACTOME_PRC2_METHYLATES_HISTONES_AND_DNA	0.00516891464240952	0.160084327013448	0.407017918923954	0.784097586613789	1.78418533498439	15	SUZ12 H3F3B H3F3A EED RBBP4 AEBP2 DNMT3A DNMT1 RBBP7 PHF1
REACTOME_PEPTIDE_LIGAND_BINDING_RECEPTORS	0.000222882187947029	0.0173848106598683	0.518848077743792	0.572239598405066	1.77088583121231	74	CXCL9 CCL4 CXCL2 CCL3 CCRL2 PROK2 PSAP SAA1 CXCL1 CCL6 CCL25 C5AR1
REACTOME_GPCR_LIGAND_BINDING	2.85000738842183e-06	0.000483759355983175	0.627256739718528	0.506994092651878	1.76567259702769	157	CXCL9 CCL4 CXCL2 CCL3 CCRL2 PROK2 HCAR2 PSAP SAA1 CXCL1 ADM CCL6 GNAS GNG10 S1PR2 P2RY2 ADORA3 GPR68 CCL25 C5AR1 GNGT2
REACTOME_CLASS_A_1_RHODOPSIN_LIKE_RECEPTORS	1.74180810191243e-05	0.00229265491414223	0.575610261071129	0.525327051732042	1.75755265849071	124	CXCL9 CCL4 CXCL2 CCL3 CCRL2 PROK2 HCAR2 PSAP SAA1 CXCL1 CCL6 S1PR2 P2RY2 ADORA3 GPR68 CCL25 C5AR1
WP_LUNG_FIBROSIS	0.00122809437033436	0.0757848310547004	0.45505986738723	0.640151710930012	1.74402994066983	36	CCL4 CCL3 TNF HMOX1 SPP1 CXCL1 PLAU CSF3 MECP2
NABA_SECRETED_FACTORS	0.000193127168433883	0.0156433006431445	0.518848077743792	0.514764716113491	1.69142088756642	113	CXCL9 CCL4 CXCL2 CCL3 TNF IL1RN IL12A CRLF3 CXCL1 GDF15 CCL6 CSF3 IL1A CCL25 IL10 EBI3 INHBA INSL6 CCL2 S100A4 S100A13
REACTOME_AMINO_ACIDS_REGULATE_MTORC1	0.00350759874433183	0.136564409354709	0.431707695803346	0.575818974505768	1.67315200308969	50	FNIP2 ATP6V1D RRAGC ATP6V1C1 ATP6V0C ATP6V1A ATP6V1F ATP6V1E1 SESN2 LAMTOR4 ATP6V1H ATP6V1G1 RRAGA NPRL2 ATP6V0B LAMTOR3 DEPDC5 ATP6V0E
PID_IL23_PATHWAY	0.00526935942306705	0.160830013695351	0.407017918923954	0.625111163675307	1.67123356963331	33	CXCL9 CXCL2 TNF NFKBIA NOS2 CXCL1 TYK2 CCL2 STAT5A NFKB1
REACTOME_CHEMOKINE_RECEPTORS_BIND_CHEMOKINES	0.00565728302432217	0.165475528461423	0.407017918923954	0.622679406679088	1.66473227168595	33	CXCL9 CCL4 CXCL2 CCL3 CCRL2 CXCL1 CCL25
WP_MIRNAS_INVOLVEMENT_IN_THE_IMMUNE_RESPONSE_IN_SEPSIS	0.00640187633460239	0.177091512801749	0.407017918923954	0.616276267592872	1.66453000000184	35	CCL4 CCL3 TNF LCN2 NFKBIA RELB CHUK REL IRAK4 IL1A IL10 MAPK8 TAB1
WP_SARSCOV2_INNATE_IMMUNITY_EVASION_AND_CELLSPECIFIC_IMMUNE_RESPONSE	0.00750719642842069	0.200128552889291	0.407017918923954	0.51754781482092	1.52600507944706	51	CXCL9 CCL4 CXCL2 CCL3 TNF BSG IFNAR2 CXCL1 IFNAR1 IL10 IL6RA
NABA_MATRISOME_ASSOCIATED	2.33480784474426e-05	0.00273172517835078	0.575610261071129	0.409542326905092	1.51012604386135	280	CXCL9 CCL4 CXCL2 CCL3 TNF CSTB F10 SLPI IL1RN IL12A EGLN3 LGALS8 CRLF3 CTSH CTSB CXCL1 ANXA5 GDF15 SEMA4D CLEC4E EGLN1 PLAU CCL6 CSF3 CTSZ LGALS3 CLEC4A3 IL1A CTSD CCL25 IL10 CTSL
REACTOME_IRON_UPTAKE_AND_TRANSPORT	0.00880117337743322	0.215526408521795	0.380730400722792	0.520959267811199	1.48127052225098	46	LCN2 HMOX1 FTH1 FTL1 ATP6V1D ATP6V1C1 ATP6V0C ATP6V1A ATP6V1F ATP6V1E1 UBB TFRC ATP6V1H TRF ATP6V1G1 ATP6V0B
WP_SMALL_CELL_LUNG_CANCER	0.00764135384801809	0.201158640049076	0.407017918923954	0.475027395066107	1.45979726787884	73	TRAF1 GADD45G GADD45B NFKBIA NFKBIB CHUK NOS2 CYCS MAX LAMB3 BAX GADD45A CDK6 NFKB1 AKT1 RB1 RXRB CDK2 COL4A4 RXRA RELA TRP53 ITGB1 TRAF2
NABA_MATRISOME	5.87534241531367e-05	0.00562430505756845	0.557332238758646	0.383381171515778	1.45768396931763	353	CXCL9 CCL4 CXCL2 CCL3 TNF CSTB F10 SLPI SPP1 IL1RN IL12A EGLN3 LGALS8 CRLF3 CTSH CTSB CXCL1 ANXA5 GDF15 SEMA4D CLEC4E EGLN1 PLAU CCL6 CSF3 CTSZ LGALS3 CLEC4A3 IL1A CTSD LAMB3 CCL25 IL10 CTSL THBS1 CRELD2 ECM1 PRSS2 EBI3
REACTOME_SIGNALING_BY_GPCR	0.000668227555105034	0.0485271458983173	0.477270815362862	0.359426704824264	1.35000074463487	323	CXCL9 CCL4 CXCL2 CCL3 CCRL2 PROK2 ITPR2 HCAR2 PSAP SAA1 PDPK1 VAV1 CXCL1 ADM AKAP13 DAGLB ABR CCL6 GNAS ARHGEF3 GNG10 S1PR2 P2RY2 ADORA3 GPR68 ITPR1 MCF2L CCL25 PDE2A GNA13 C5AR1 GNGT2
REACTOME_G_ALPHA_I_SIGNALLING_EVENTS	0.0087665961177012	0.215526408521795	0.380730400722792	0.383127999587721	1.33022866888089	154	CXCL9 CCL4 CXCL2 ITPR2 HCAR2 PSAP SAA1 CXCL1 CCL6 GNAS GNG10 S1PR2 ADORA3 ITPR1 CCL25 C5AR1 GNGT2
WP_IL18_SIGNALING_PATHWAY	0.00564514375730299	0.165475528461423	0.407017918923954	0.36584674555994	1.32913687841499	214	CCL4 CXCL2 CCL3 TNF BSG TRAF1 HMOX1 SPP1 NR4A1 HCAR2 NFKBIA IER3 CHUK MEF2A REL NOS2 CXCL1 ANP32A LRRFIP1 CYCS PKN1 SP1 CFLAR ATF3 UGGT1 IL10 BAX FBXW7 ITM2C KLC1 CLDN1 CD83 CXCL16 NFKBIZ CENPB CCL2 NR1H3 TRF NFKB1 ACOD1 ZDHHC7 NFKBIE TNIP3 CLDN15 PLD1 AARS TNFAIP3 CD81 EEF2 HPS1
REACTOME_NEUTROPHIL_DEGRANULATION	0.00512955185464216	0.160084327013448	0.407017918923954	-0.418151502403418	-1.29593648917227	420	HSPA1B HSPA1A TNFAIP6 CLEC5A MMP9 PGLYRP1 HSP90AA1 SNAP23 SELL LYZ2 DOK3 CST3 PTPN6 FGL2 COTL1 PLAC8 PLAUR AGPAT2 CXCL3 FPR2 ADGRE5 ARHGAP9 ALDH3B1 MAPK14 PLEKHO2 GGH ASAH1 CD300A DEGS1 ACTR2 CAP1 ROCK1 CYFIP1 LAIR1 ARPC5 CMTM6 SPTAN1 CTSC CFP GNS DIAPH1 ITGAL RHOG GM2A ADAM10 SLC11A1 PIRB H2-Q10 CPNE1 CLEC12A MMP8 TCIRG1 GLIPR1 ITGB2 CDK13 DDX3X PPIA FUCA2 ARHGAP45 SIGLECF CXCR2 LAMP2 CD14 CD44 MGAM MGST1 PSMA2 OLFM4 GYG CKAP4 RAP1B CD47 S100A11 RAP2C DYNC1H1 IGF2R VPS35L FCGR4 PSMC3 H2-T23 SLC15A4 ALOX5 QSOX1 FCGR3 GMFG B4GALT1 ADAM8 NCSTN CAB39 MAPK1 GOLGA7 TMEM179B PSMD13 RAB27A NDUFC2 RAB7 ILF2 COPB1 TUBB5 LRG1 HP HMOX2 PRDX6 GSDMD CAPN1 PSMD14 ATP8B4 SNAP29 AP2A2 FGR VAMP8 NFAM1 PSEN1 BST2 TYROBP NAPRT SIGLECE FUCA1 PYGL VCL MAN2B1 MAGT1 SVIP YPEL5 HEXB PRCP SLC44A2 FPR1 SRP14 PYCARD AP1M1 APAF1 BST1 LAMTOR2 GHDC UBR4 RETN 2310033P09RIK GPI1 H2-D1 MNDAL RAB5C PFKL C3 PKM
REACTOME_APOPTOSIS	0.00541756576063311	0.162991335598476	0.407017918923954	-0.478301928135141	-1.38045224721778	157	UBA52 PSMB10 PSMB9 YWHAZ PSMB8 PSMB3 UBC VIM YWHAQ LMNB1 YWHAB ROCK1 SPTAN1 PSMC6 TLR4 ADD1 RPS27A PSMA7 CD14 STK24 PSMA2 BIRC2 YWHAH FAS CASP7 PSMB2 AKT2 YWHAE PSMC3 BBC3 MAPK1 PSMD13 LMNA BCL2L1 ARHGAP10 PSME3 CASP3 BCL2L11 GSDMD PSMD14 RIPK1 HMGB2 APAF1 PPP3R1 BCAP31 PSMD5 PMAIP1 PAK2 TFDP2 PSMD4 KPNA1 CASP8 TNFSF10 XIAP YWHAG BMF BAD DYNLL2 MAPK3 OMA1 APIP LY96
REACTOME_RHO_GTPASE_EFFECTORS	0.00241266204461011	0.117190918818457	0.431707695803346	-0.47068975075131	-1.40620160940359	221	WAS ACTG1 ACTB YWHAZ ARPC4 ARPC2 MAPK14 CDC42 NCF2 NDEL1 ACTR2 YWHAQ YWHAB ROCK1 CYFIP1 ARPC5 PFN1 DIAPH1 RHOG BTK RHOB DYNC1LI2 PPP2R5A RPS27 PRKCB ABI1 FMNL1 YWHAH CENPL NCF1 TUBB6 DYNC1H1 MAPRE1 FLNA YWHAE PPP2CA WIPF2 PPP2R5C PPP1CC MAPK1 ITGB3BP NCOA2 NUP98 TAX1BP3 BRK1 PIK3C3 ACTR3 PIN1 TAOK1 PAFAH1B1 RANGAP1 PAK2 CENPA ZW10 YWHAG CLIP1 NUP160 ARPC1B NUDC PPP1CB DYNLL2 KIF5B MAPK3 CFL1 PPP2CB PPP2R1B
REACTOME_CELLULAR_RESPONSE_TO_STARVATION	0.00460298096316045	0.151466842318998	0.407017918923954	-0.495147130375843	-1.42503592341388	147	UBA52 RPL23A RPLP0 RPL13A RPS29 RHEB RPL32 RPS21 RPS20 RPS4X RPL17 RPS25 RPL26 RPS6 RPS19 RPL37 RPL11 RPL14 RPL38 TCIRG1 RPS14 RPS27A RPS27 LAMTOR5 RPL31 RPS26 RPS15 RPL39 RPL22 RPL27 ATF4 RPL6 RPS12 RPS28 RPS11 RPS24 ATP6V0D1 RPL7 RPS3A1 RPL36 RPS16 RPL35A RPS9 CEBPG EIF2S3X RPL28 RPS15A RPL3 CEBPB RPS7 RPL15 RPL13 RPS23 RPS17
WP_VEGFAVEGFR2_SIGNALING_PATHWAY	0.00013873421757091	0.0121739275918474	0.518848077743792	-0.462755065640769	-1.43062403575585	369	HSPA1A HSP90AA1 TXNIP EGR1 PTMA DUSP5 VEGFA PXN ANXA1 PTPN6 PPP3CA RPL13A GPX1 ACTG1 PLAUR FLII RAB11A CALR PABPC1 EPN1 NCL MAPK14 CDC42 BRD4 NCF2 ACP1 PPM1G RPL26 GLUD1 CRK EIF3H ROCK1 RPS6 SET PFN1 LUC7L 1700017B05RIK ADAM10 STAT1 CLIC1 DNAJA1 ELOC PTGS2 PRKCB CAPZB EWSR1 PDIA6 EGR3 FAS RACK1 PIK3R1 RAP1B MAP3K5 NCF1 RPL27 ATF4 HDAC7 PRKD2 SLC25A11 SSR3 TAOK2 IER5 RAPGEF1 PLA2G4A STIP1 RPS11 LRRC59 YWHAE ATP6V0D1 PPP2CA PTK2B RBM39 PRRC2C ARF4 MAPK1 GIGYF2 PLOD3 ADRB2 BCL2L1 GIPC1 TKT RPL7 CCDC124 PRKAA1 MAP2K2 ARPC5L EIF4E HDAC5 HLX MAP2K4 PRDX6 PPP1CA CBL GPC1 ELOA MKNK1 RPS6KB1 VCL PTPN9 SHC1 SYNJ1 TMSB4X EIF2A FHOD1 EIF4G1 RPLP2
REACTOME_PROGRAMMED_CELL_DEATH	0.00265144169331608	0.11880715332178	0.431707695803346	-0.488554756002217	-1.4348634646288	182	HSP90AA1 UBA52 PSMB10 PSMB9 IL1B YWHAZ PSMB8 PSMB3 UBC VIM YWHAQ LMNB1 YWHAB ROCK1 SPTAN1 PSMC6 TLR4 ADD1 RPS27A PSMA7 CD14 STK24 PSMA2 BIRC2 YWHAH FAS CASP7 PSMB2 CASP1 AKT2 PELI1 YWHAE PSMC3 BBC3 IRF1 MAPK1 PSMD13 LMNA BCL2L1 ARHGAP10 PSME3 CASP3 BIRC3 BCL2L11 GSDMD PSMD14 RIPK1 HMGB2 APAF1 PPP3R1 BCAP31 CHMP3 PSMD5 PMAIP1 FLOT1 PAK2 TFDP2 PSMD4 KPNA1 CHMP4B CASP8 CHMP2A TNFSF10 XIAP YWHAG BMF BAD IRF2 DYNLL2 MAPK3 OMA1
WP_FOCAL_ADHESION	0.0033886988881376	0.136564409354709	0.431707695803346	-0.509482281003575	-1.46366754280284	141	VEGFA PXN ACTG1 CCND2 ACTB TLN1 CDC42 CRK ROCK1 CCND3 DIAPH1 PRKCB BIRC2 PIK3R1 RAP1B PTEN ACTN1 RAPGEF1 AKT2 ACTN4 FLNA MYL12A PPP1CC MAPK1 ITGA4 BIRC3 PPP1CA FGR ZYX VCL TXK SHC1 ILK CAPN2 PIK3CD HCK PAK2 XIAP MAPK9 BAD ITGAV VASP PPP1CB HRAS MAPK3 ITGB5
KEGG_FOCAL_ADHESION	0.00319869479621232	0.134729024816463	0.431707695803346	-0.510426133599061	-1.4663388952823	139	VEGFA PXN ACTG1 CCND2 ACTB TLN1 CDC42 CRK ROCK1 CCND3 DIAPH1 PRKCB BIRC2 PIK3R5 PIK3R1 RAP1B PTEN ACTN1 RAPGEF1 AKT2 ACTN4 FLNA MYL12A PPP1CC MAPK1 ITGA4 PIK3CG BIRC3 PPP1CA ZYX VCL SHC1 ILK CAPN2 PIK3CD PAK2 XIAP MAPK9 BAD ITGAV VASP PPP1CB HRAS MAPK3 ITGB5
REACTOME_SIGNALING_BY_VEGF	0.00515400645427188	0.160084327013448	0.407017918923954	-0.532213118879695	-1.47168318036459	94	HSP90AA1 VEGFA PXN ACTG1 ACTB AAMP MAPK14 CDC42 NCF2 CRK ROCK1 CYFIP1 PRKCB ABI1 PIK3R1 NCF1 AKT2 ELMO1 PTK2B
KEGG_REGULATION_OF_ACTIN_CYTOSKELETON	0.00122772362689956	0.0757848310547004	0.45505986738723	-0.512456249390143	-1.47597711978144	150	WAS PXN ACTG1 ACTB ARPC4 ARPC2 CDC42 CRK ROCK1 CYFIP1 ARPC5 PFN1 DIAPH1 ITGAL ITGB2 CD14 PIK3R5 PIK3R1 ACTN1 CHRM3 ACTN4 MYL12A PPP1CC MAPK1 ITGA4 GIT1 MAP2K2 ARPC5L PIK3CG SLC9A1 PPP1CA BRK1 GNG12 VCL TMSB4X RDX PIK3CD FGD3 RRAS PAK2 ARHGEF1 ITGAV ARAF ARPC1B PPP1CB HRAS MAPK3 CFL1 ITGB5 GNA12 ENAH
REACTOME_ANTIVIRAL_MECHANISM_BY_IFN_STIMULATED_GENES	0.0079018207960955	0.202941885324111	0.380730400722792	-0.548414385813744	-1.48200855250882	76	OASL1 UBA52 UBA7 USP18 OAS1A EIF4A2 UBC EIF4G3 DDX58 STAT1 RPS27A KPNA4 HERC6 PPM1B FLNA UBE2L6 EIF4E2 EIF4A3 JAK1 NUP98 EIF4A1 EIF4E AAAS EIF2AK2 OAS1G IFIT1BL1 PIN1 EIF4G1 POM121 KPNA1 OAS2 NUP160 ABCE1 MAPK3 UBE2E1
REACTOME_CLATHRIN_MEDIATED_ENDOCYTOSIS	0.00363134231902361	0.136564409354709	0.431707695803346	-0.529244392232877	-1.4861379275384	114	UBA52 AREG GAK ACTG1 ITSN2 ACTB ARPC4 ARPC2 EPN1 UBC ACTR2 AP2M1 SCARB2 ARPC5 SYT11 LDLRAP1 RPS27A COPS7A FNBP1 TOR1B IGF2R UBQLN1 GRK2 COPS4 DNM2 ADRB2 AP2A2 VAMP8 CBL AP2B1 EPS15L1 CLTB ACTR3 NEDD8 IL7R SYNJ1 ARFGAP1 RAB5C VAMP3 SH3KBP1 PIK3C2A EREG SH3GL1 M6PR AGFG1 ITSN1 UBQLN2
PID_PDGFRB_PATHWAY	0.00196003851142555	0.100679051342981	0.431707695803346	-0.530239732664822	-1.50177989898278	123	YWHAZ FOS ARPC4 ARPC2 ACTR2 YWHAQ YWHAB CRK ARPC5 EPS8 STAT1 ABI1 YWHAH PIK3R5 PIK3R1 RAP1B PTEN RAPGEF1 PLA2G4A ACTN4 YWHAE PPP2CA DNM2 MAPK1 MAP2K2 PIK3CG MAP2K4 FGR BRK1 CBL EIF2AK2 JUND ACTR3 SHC1 PIN1 SLA PAG1 PIK3CD HCK PIK3R6 PTPRJ YWHAG MAPK9 ITGAV ARPC1B HRAS MAPK3
REACTOME_IMMUNOREGULATORY_INTERACTIONS_BETWEEN_A_LYMPHOID_AND_A_NON_LYMPHOID_CELL	0.0040094372586236	0.146717453219588	0.407017918923954	-0.553017585460635	-1.50757713854928	81	SELL CD300LB PILRA CD300A LAIR1 ITGAL CD300LD IFITM1 PIRB H2-Q10 ITGB2 FCGR1 SIGLECF JAML HCST FCGR4 H2-T23 PIRA2 ITGA4 GM14548 TYROBP SIGLECE PVR CD34 GM15448 TREM1 SIGLECG H2-D1 C3 ICAM2
REACTOME_TRANSLATION	2.57819197996269e-05	0.00285772226831654	0.575610261071129	-0.498596946015819	-1.51388317518951	285	UBA52 RPL23A RPLP0 LARS2 RPL13A RPS29 RPL32 RPS21 PABPC1 EIF4A2 RPS20 RPS4X RPL17 RPS25 RPL26 EIF3H RPS6 RPS19 RPL37 RPL11 RPL14 MRPL43 RPL38 SRP19 RPS14 RPS27A RPS27 RPL31 RPS26 SEC61B RPS15 EEF1D RPL39 MRPS23 RPL22 RPL27 EIF1AX SSR1 SSR3 MRPL17 SRP68 MRPL51 MRPL32 RPL6 RPS12 RPS28 RPS11 RPS24 MRPL34 RPN2 RPN1 MRPS33 SPCS2 RPL7 MRPL57 AIMP2 EIF5B RPS3A1 EIF4A1 CARS RPL36 RPS16 EIF4E RPL35A MRPL4 RPS9 EIF2S3X EIF4H RPL28 EIF3G RPS15A RPL3 CHCHD1 SPCS3 RPS7 MRPL18 RPL15 GSPT1 RPL13 EIF3J1 TRAM1 RPS23 RPS17 EIF3C SRP14 EIF4G1 GARS RPLP2 SPCS1 MRPL30 HARS2
REACTOME_GAP_JUNCTION_DEGRADATION	0.00940940135729842	0.227772405269775	0.380730400722792	-0.82949704949506	-1.51997981055662	10	ACTG1 ACTB AP2M1 DNM2 CLTB
WP_GASTRIN_SIGNALING_PATHWAY	0.00253636553281533	0.118701906935758	0.431707695803346	-0.549433798065648	-1.52478647867094	99	HDC EGR1 VEGFA PXN FOS MAPK14 CDC42 CRK ROCK1 RPS6 RHOB GNAQ PTGS2 CD44 BIRC2 PIK3R1 KAT5 HDAC7 PRKD2 TCF4 MAPK1 BCL2L1 CASP3 BIRC3 SLC9A1 KIT RPS6KB1 SHC1
REACTOME_SIGNALING_BY_ERBB2	0.00655894491858328	0.177091512801749	0.407017918923954	-0.618125322991125	-1.52657083004722	42	HSP90AA1 UBA52 UBC DIAPH1 PTPN18 RPS27A PIK3R1 PTPN12 AKT2
WP_KIT_RECEPTOR_SIGNALING_PATHWAY	0.0051594836231001	0.160084327013448	0.407017918923954	-0.597275490907768	-1.52779174213169	54	PTPN6 FOS SOCS1 MAPK14 CRK RPS6 INPP5D BTK STAT1 PRKCB PIK3R1 TEC MAPK1 JUNB EP300 MAP2K2 SH2B2 CBL KIT RPS6KB1 SHC1
REACTOME_EPH_EPHRIN_SIGNALING	0.00435845911938516	0.148531635181359	0.407017918923954	-0.577663217590808	-1.53166994949105	67	MMP9 ACTG1 ACTB ARPC4 ARPC2 CDC42 ACTR2 AP2M1 ROCK1 ARPC5 ADAM10 MYL12A NCSTN GIT1 AP2A2 PSEN1 AP2B1 CLTB ACTR3 EPHA1 PAK2 PSEN2 ITSN1 ARPC1B HRAS CFL1 ARPC3 MYL6
WP_METABOLIC_PATHWAY_OF_LDL_HDL_AND_TG_INCLUDING_DISEASES	0.00653268917147797	0.177091512801749	0.407017918923954	-0.841971281795111	-1.54283773543991	10	APOE LIPG LDLRAP1
KEGG_ADHERENS_JUNCTION	0.00444325404388682	0.148531635181359	0.407017918923954	-0.592594877280342	-1.54794277499999	59	WAS PTPN6 ACTG1 ACTB CDC42 SMAD4 ACP1 TGFBR2 MAP3K7 ACTN1 ACTN4 MAPK1 EP300 TCF7L2
PID_VEGFR1_2_PATHWAY	0.0043191744218962	0.148531635181359	0.407017918923954	-0.587537353604685	-1.54956754497961	64	HSP90AA1 VEGFA PXN PTPN6 MAPK14 CDC42 ROCK1 PRKCB FES PIK3R1 PTK2B DNM2 MAPK1 PRKAA1 MAP2K2 CBL VCL
REACTOME_NERVOUS_SYSTEM_DEVELOPMENT	2.93130568051763e-07	0.000154333244079253	0.674962860011025	-0.502833493189142	-1.55781398488313	408	MMP9 HSP90AA1 SEMA4A UBA52 PSMB10 RPL23A RPLP0 PSMB9 RPL13A ACTG1 RPS29 ACTB CXCR4 RPL32 RPS21 ARPC4 ARPC2 PSMB8 PSMB3 PABPC1 TLN1 MAPK14 CDC42 RPS20 RPS4X UBC RPL17 ACTR2 RPS25 RPL26 AP2M1 CAP1 ROCK1 RPS6 UTRN ARPC5 SPTAN1 RPS19 PSMC6 RPL37 PFN1 RPL11 RPL14 ADAM10 RPL38 RHOB ELOC RPS14 RPS27A PSMA7 RPS27 RPL31 RPS6KA2 FES PSMA2 RPS26 PIK3R1 ST8SIA4 RPS15 RPL39 RPL22 MAGOH PDLIM7 RPL27 TUBB6 PSMB2 RPL6 RPS12 RPS28 RPS11 PSMC3 MYL12A RPS24 PRNP NCSTN AGRN DNM2 MAPK1 PSMD13 EIF4A3 GIT1 RPL7 PSME3 RPS3A1 MAP2K2 RPL36 RPS16 RPL35A RPS9 PSMD14 RPL28 AP2A2 CUL2 RPS15A RPL3 PSEN1 TYROBP GPC1 AP2B1 RPS7 CLTB ACTR3 RPL15 GSPT1 SHC1 RPL13 RPS23 RPS17 MAPK13 EIF4G1 USP33 RPLP2 RDX EPHA1
REACTOME_RRNA_PROCESSING	4.02661598768138e-05	0.00403812060478904	0.557332238758646	-0.530266945537426	-1.56587316034506	195	UBA52 RPL23A RPLP0 RPL13A RPS29 RPL32 RPS21 CSNK1E NCL RPS20 RPS4X EMG1 RPL17 RPS25 RPL26 RPS6 RPS19 RPL37 RPL11 RPL14 RPL38 RPS14 RPS27A RPS27 RPL31 RPS26 RPS15 RPL39 RPL22 RPL27 DDX52 RIOK1 RPL6 RPS12 RPS28 RPS11 RPS24 TRMT10C C1D UTP3 RPL7 RPP21 BMS1 RPS3A1 RPL36 RPS16 RPL35A RPS9 IMP3 RPL28 RPS15A RPL3 RPS7 RPL15 RPL13 RPS23 RPS17 RBM28 RPLP2 EXOSC1 RRP1 XRN2 CSNK1D
BIOCARTA_TCYTOTOXIC_PATHWAY	0.00609458876305783	0.173448701824322	0.407017918923954	-0.825410791045042	-1.56795682263043	12	ITGAL ITGB2
BIOCARTA_THELPER_PATHWAY	0.00609458876305783	0.173448701824322	0.407017918923954	-0.825410791045042	-1.56795682263043	12	ITGAL ITGB2
WP_AMPLIFICATION_AND_EXPANSION_OF_ONCOGENIC_PATHWAYS_AS_METASTATIC_TRAITS	0.00642916002454488	0.177091512801749	0.407017918923954	-0.810580731702115	-1.57214843485911	13	VEGFA CXCR4 CYTIP TCF7L2 VHL PIK3CG
REACTOME_RHOD_GTPASE_CYCLE	0.00306936921817164	0.131920236193254	0.431707695803346	-0.634258542057115	-1.57568835873847	44	TOR1AIP1 EFHD2 LMNB1 DIAPH1 ANKFY1 SLC4A7 CAPZB TMPO PIK3R1 ACTN1 ARHGAP1 RAB7 VAPB WHAMM LBR VAMP3
REACTOME_IRE1ALPHA_ACTIVATES_CHAPERONES	0.00357357621281657	0.136564409354709	0.431707695803346	-0.628830266134393	-1.58065670515935	47	DCTN1 TLN1 ADD1 PREB PDIA6 SERP1 SSR1 MYDGF ATP6V0D1 GOSR2 SYVN1 LMNA CXXC1 TATDN2 SHC1 ARFGAP1 DNAJB11 HSPA5 EDEM1 KLHDC3 DNAJB9 HYOU1 ACADVL
REACTOME_RHOJ_GTPASE_CYCLE	0.0040406516081368	0.146717453219588	0.407017918923954	-0.628153505491379	-1.58598201367348	48	SNAP23 WAS CDC42 PREX1 SLC4A7 TMPO PIK3R1 FNBP1 DOCK8 ARHGAP1 WIPF2 GIT1 RAB7 WWP2 NIPSNAP2 SCRIB PAK2 VAMP3 SLC1A5
REACTOME_METABOLISM_OF_AMINO_ACIDS_AND_DERIVATIVES	2.98333057878774e-06	0.000483759355983175	0.627256739718528	-0.522711835081642	-1.58801764463721	284	UBA52 HDC PSMB10 RPL23A RPLP0 PSMB9 RPL13A SERINC3 RPS29 RPL32 RPS21 PSMB8 PSMB3 RPS20 RPS4X TXN2 HNMT RPL17 RPS25 RPL26 GLUD1 SECISBP2 RPS6 RPS19 PSMC6 RPL37 RPL11 RPL14 RPL38 SQOR RPS14 RPS27A PSMA7 RPS27 GLUL RPL31 PSMA2 RPS26 RPS15 SLC25A44 RPL39 GLS RPL22 RPL27 PSMB2 RPL6 RPS12 RPS28 RPS11 PSMC3 RPS24 SERINC5 SLC25A12 PSMD13 SLC44A1 RPL7 AIMP2 PSME3 RPS3A1 RPL36 RPS16 RPL35A RPS9 PSMD14 RPL28 OAT RPS15A RPL3 PDHA1 GSR GOT2 RPS7 RPL15 RPL13 RPS23 RPS17
PID_P38_MK2_PATHWAY	0.00866722674336356	0.215526408521795	0.380730400722792	-0.747636572411199	-1.59025679477636	19	LSP1 YWHAZ MAPK14 YWHAQ YWHAB YWHAH YWHAE CDC25B
REACTOME_RHOF_GTPASE_CYCLE	0.00415806421745939	0.148421749863889	0.407017918923954	-0.672705554079716	-1.60161881373967	33	SNAP23 TOR1AIP1 ACTB LMNB1 DIAPH1 SLC4A7 CAPZB TMPO PIK3R1 ACTN1 ARHGAP1 RAB7
REACTOME_REGULATION_OF_INSULIN_LIKE_GROWTH_FACTOR_IGF_TRANSPORT_AND_UPTAKE_BY_INSULIN_LIKE_GROWTH_FACTOR_BINDING_PROTEINS_IGFBPS	0.00244843325166767	0.117190918818457	0.431707695803346	-0.612567517024573	-1.60708307437625	60	PNPLA2 APOE CST3 IGFBP6 ADAM10 MGAT4A FUCA2 PDIA6 CKAP4 F5 APP QSOX1 GOLM1 SHISA5
REACTOME_DOWNREGULATION_OF_ERBB2_SIGNALING	0.00278442263218849	0.12216654298727	0.431707695803346	-0.717704608609163	-1.61048133184636	23	HSP90AA1 UBA52 UBC PTPN18 RPS27A PTPN12 AKT2
WP_MBDNF_AND_PROBDNF_REGULATION_OF_GABA_NEUROTRANSMISSION	0.00443418274469103	0.148531635181359	0.407017918923954	-0.747183504548286	-1.61341157693193	20	ROCK1 PIK3R1 PTEN CREM PIK3CG AP2A2 AP2B1 SHC1
REACTOME_INTERFERON_ALPHA_BETA_SIGNALING	0.00177886857055127	0.0936574302395241	0.45505986738723	-0.626653372314879	-1.61515079631395	56	GBP2 IFIT3 OASL1 USP18 EGR1 OAS1A PTPN6 PSMB8 IRF9 SOCS1 IFIT2 RSAD2 SAMHD1 IFI27 IFITM1 STAT1 H2-Q10 ISG20 SOCS3 H2-Q4 H2-T22 IFITM3 H2-T23 IRF1 JAK1 IFITM2 BST2 IRF7 STAT2 OAS1G IFIT1BL1
REACTOME_EPHB_MEDIATED_FORWARD_SIGNALING	0.00338328074644371	0.136564409354709	0.431707695803346	-0.678484412439652	-1.61537747563131	33	ACTG1 ACTB ARPC4 ARPC2 CDC42 ACTR2 ROCK1 ARPC5
PID_ENDOTHELIN_PATHWAY	0.00260289675362913	0.11880715332178	0.431707695803346	-0.64111763900585	-1.61871427162805	48	FOS MAPK14 CDC42 CRK GNAQ PRKCB GNAI3 PLA2G4A PTK2B MAPK1 MAP2K2 SLC9A1 GNAI2 CYSLTR1
REACTOME_INTERACTION_BETWEEN_L1_AND_ANKYRINS	0.00123273718081191	0.0757848310547004	0.45505986738723	-0.888294610810002	-1.62772112942337	10	ACTG1 ACTB SPTAN1
REACTOME_GENERATION_OF_SECOND_MESSENGER_MOLECULES	0.00803695326572126	0.203925585272397	0.380730400722792	-0.718425967337204	-1.62876492616738	24	WAS LCP2 PLCG2 CD101 FYB
PID_EPHA_FWDPATHWAY	0.00782119941499163	0.202941885324111	0.380730400722792	-0.718521226394927	-1.62898089081672	24	CRK ROCK1 PIK3R5 PIK3CG FGR CBL EPHA1 HCK PIK3R6
KEGG_PATHOGENIC_ESCHERICHIA_COLI_INFECTION	0.00145473971461615	0.0825456250506893	0.45505986738723	-0.652297226214456	-1.63964433631821	47	WAS ACTG1 ACTB YWHAZ ARPC4 ARPC2 NCL CDC42 YWHAQ ROCK1 ARPC5 TLR4 CD14 TUBB6 ARPC5L TUBB5
WP_PATHOGENIC_ESCHERICHIA_COLI_INFECTION	0.00145473971461615	0.0825456250506893	0.45505986738723	-0.652297226214456	-1.63964433631821	47	WAS ACTG1 ACTB YWHAZ ARPC4 ARPC2 NCL CDC42 YWHAQ ROCK1 ARPC5 TLR4 CD14 TUBB6 ARPC5L TUBB5
REACTOME_HSP90_CHAPERONE_CYCLE_FOR_STEROID_HORMONE_RECEPTORS_SHR	0.00103895862375229	0.0705821568265266	0.45505986738723	-0.663237870694886	-1.64138675499549	43	HSPA1B HSPA1A HSP90AA1 DCTN1 CAPZA2 DNAJA1 DYNC1LI2 CAPZB DCTN2 TUBB6 DYNC1H1 STIP1
REACTOME_TRANSCRIPTIONAL_REGULATION_BY_THE_AP_2_TFAP2_FAMILY_OF_TRANSCRIPTION_FACTORS	0.00173506537242379	0.0936574302395241	0.45505986738723	-0.734127502774532	-1.64733321234281	23	APOE CITED2 VEGFA UBE2I YY1 EP300 KIT YEATS4 CREBBP
REACTOME_INTERFERON_GAMMA_SIGNALING	0.000472767091434403	0.035558839091459	0.49849310876659	-0.608492404230423	-1.65429426411327	79	GBP2 OASL1 GBP9 OAS1A GBP7 PTPN6 GBP3 TRIM30D IRF9 SOCS1 STAT1 H2-Q10 FCGR1 CD44 SOCS3 SP100 TRIM30A H2-Q4 GBP4 H2-T22 H2-T23 TRIM8 IRF1 TRIM34A JAK1 IFNGR1 TRIM21 IRF7 TRIM26 OAS1G PML
REACTOME_SIGNALING_BY_ROBO_RECEPTORS	2.98616886409367e-06	0.000483759355983175	0.627256739718528	-0.565850108964908	-1.66502523108453	188	UBA52 PSMB10 RPL23A RPLP0 PSMB9 RPL13A RPS29 CXCR4 RPL32 RPS21 PSMB8 PSMB3 PABPC1 CDC42 RPS20 RPS4X UBC RPL17 RPS25 RPL26 CAP1 RPS6 RPS19 PSMC6 RPL37 PFN1 RPL11 RPL14 RPL38 ELOC RPS14 RPS27A PSMA7 RPS27 RPL31 PSMA2 RPS26 RPS15 RPL39 RPL22 MAGOH RPL27 PSMB2 RPL6 RPS12 RPS28 RPS11 PSMC3 RPS24 PSMD13 EIF4A3 RPL7 PSME3 RPS3A1 RPL36 RPS16 RPL35A RPS9 PSMD14 RPL28 CUL2 RPS15A RPL3 GPC1 RPS7 RPL15 GSPT1 RPL13 RPS23 RPS17 EIF4G1 USP33 RPLP2
KEGG_PRIMARY_IMMUNODEFICIENCY	0.00235998848264264	0.117190918818457	0.431707695803346	-0.735722344620017	-1.67277480735621	25	TAP1 IL2RG DCLRE1C BTK JAK3 ADA IL7R RFXAP TAP2
REACTOME_RHO_GTPASES_ACTIVATE_WASPS_AND_WAVES	0.00125948199758524	0.0757848310547004	0.45505986738723	-0.702718272714248	-1.67307494268795	33	WAS ACTG1 ACTB ARPC4 ARPC2 CDC42 ACTR2 CYFIP1 ARPC5 BTK ABI1 WIPF2 MAPK1 BRK1 ACTR3
REACTOME_REGULATION_OF_EXPRESSION_OF_SLITS_AND_ROBOS	1.66271257066246e-05	0.00229265491414223	0.575610261071129	-0.581553173552481	-1.67751048835103	152	UBA52 PSMB10 RPL23A RPLP0 PSMB9 RPL13A RPS29 RPL32 RPS21 PSMB8 PSMB3 PABPC1 RPS20 RPS4X UBC RPL17 RPS25 RPL26 RPS6 RPS19 PSMC6 RPL37 RPL11 RPL14 RPL38 ELOC RPS14 RPS27A PSMA7 RPS27 RPL31 PSMA2 RPS26 RPS15 RPL39 RPL22 MAGOH RPL27 PSMB2 RPL6 RPS12 RPS28 RPS11 PSMC3 RPS24 PSMD13 EIF4A3 RPL7 PSME3 RPS3A1 RPL36 RPS16 RPL35A RPS9 PSMD14 RPL28 CUL2 RPS15A RPL3 RPS7 RPL15 GSPT1 RPL13 RPS23 RPS17 EIF4G1 USP33 RPLP2
WP_OVERVIEW_OF_LEUKOCYTEINTRINSIC_HIPPO_PATHWAY_FUNCTIONS	0.00148942723263352	0.0825456250506893	0.45505986738723	-0.737180148490073	-1.69467570709151	27	RASSF5 SAV1 MAPK14 YWHAQ ITGAL FYB TAZ STK38L VMP1 LATS1
REACTOME_INTERFERON_SIGNALING	1.15582251847034e-06	0.000270462469322058	0.643551836150722	-0.584195416232228	-1.69938960706096	166	GBP2 IFIT3 OASL1 UBA52 UBA7 USP18 GBP9 EGR1 OAS1A GBP7 PTPN6 GBP3 TRIM30D PSMB8 IRF9 EIF4A2 SOCS1 IFIT2 UBC RSAD2 EIF4G3 SAMHD1 DDX58 IFI27 IFITM1 STAT1 H2-Q10 FCGR1 RPS27A KPNA4 CD44 ISG20 SOCS3 SP100 TRIM30A H2-Q4 GBP4 H2-T22 HERC6 PPM1B IFITM3 FLNA H2-T23 TRIM8 UBE2L6 IRF1 EIF4E2 TRIM34A EIF4A3 JAK1 IFITM2 NUP98 IFNGR1 EIF4A1 EIF4E TRIM21 AAAS BST2 EIF2AK2 IRF7 STAT2 TRIM26 OAS1G IFIT1BL1 PML PIN1 EIF4G1
REACTOME_NONSENSE_MEDIATED_DECAY_NMD	2.25866748044619e-05	0.00273172517835078	0.575610261071129	-0.608522672923014	-1.70229317312086	110	UBA52 RPL23A RPLP0 RPL13A RPS29 RPL32 RPS21 PABPC1 RPS20 RPS4X RPL17 RPS25 RPL26 RPS6 RPS19 RPL37 RPL11 RPL14 RPL38 RPS14 RPS27A RPS27 SMG7 RPL31 RPS26 RPS15 RPL39 RPL22 MAGOH RPL27 PNRC2 RPL6 RPS12 RPS28 RPS11 RPS24 PPP2CA SMG9 EIF4A3 RPL7 RPS3A1 RPL36 RPS16 RPL35A RPS9 RPL28 RPS15A RPL3 RPS7 RPL15 GSPT1 RPL13 RPS23 RPS17 EIF4G1 RPLP2
REACTOME_INFLUENZA_INFECTION	2.45341518462795e-06	0.000483759355983175	0.627256739718528	-0.596316909767622	-1.71620305567154	147	HSPA1A HSP90AA1 UBA52 RPL23A RPLP0 RPL13A RPS29 RPL32 RPS21 CALR RPS20 RPS4X RPL17 RPS25 RPL26 RPS6 RPS19 RPL37 RPL11 RPL14 POLR2A RPL38 POLR2J RPS14 RPS27A RPS27 KPNA4 RAN RPL31 RPS26 RPS15 RPL39 RPL22 RPL27 RPL6 RPS12 RPS28 RPS11 RPS24 CPSF4 NUP98 RPL7 RPS3A1 RPL36 RPS16 RPL35A RPS9 RPL28 RPS15A AAAS RPL3 EIF2AK2 RPS7 RPL15 RPL13 RPS23 RPS17
KEGG_VEGF_SIGNALING_PATHWAY	0.000166393881040702	0.0140170205388688	0.518848077743792	-0.674042279181994	-1.74454618554996	57	VEGFA PXN PPP3CA MAPK14 CDC42 PLCG2 NFAT5 PTGS2 PRKCB PIK3R5 PIK3R1 PLA2G4A AKT2 CHP1 MAPK1 MAP2K2 PIK3CG MAPK13 PPP3R1 PIK3CD BAD HRAS MAPK3
KEGG_LEUKOCYTE_TRANSENDOTHELIAL_MIGRATION	1.43784074911077e-05	0.0021629232983052	0.593325476396405	-0.649682117866769	-1.77653182356858	82	MMP9 RASSF5 PXN ACTG1 ACTB CXCR4 MAPK14 CDC42 NCF2 ROCK1 RHOH ITGAL PLCG2 ITGB2 PRKCB PIK3R5 PIK3R1 RAP1B NCF1 ACTN1 GNAI3 ACTN4 MYL12A PTK2B ITGA4 PIK3CG GNAI2 VCL TXK MAPK13
REACTOME_ACTIVATION_OF_THE_MRNA_UPON_BINDING_OF_THE_CAP_BINDING_COMPLEX_AND_EIFS_AND_SUBSEQUENT_BINDING_TO_43S	2.91857388313983e-05	0.00307325829894624	0.575610261071129	-0.684406031435717	-1.78776667187784	59	RPS29 RPS21 PABPC1 EIF4A2 RPS20 RPS4X RPS25 EIF3H RPS6 RPS19 RPS14 RPS27A RPS27 RPS26 RPS15 EIF1AX RPS12 RPS28 RPS11 RPS24 RPS3A1 EIF4A1 RPS16 EIF4E RPS9 EIF2S3X EIF4H EIF3G RPS15A RPS7 EIF3J1 RPS23 RPS17 EIF3C EIF4G1
REACTOME_RESPONSE_OF_EIF2AK4_GCN2_TO_AMINO_ACID_DEFICIENCY	8.67870623913928e-07	0.000270462469322058	0.659444398037935	-0.65900599002815	-1.82410361554291	97	UBA52 RPL23A RPLP0 RPL13A RPS29 RPL32 RPS21 RPS20 RPS4X RPL17 RPS25 RPL26 RPS6 RPS19 RPL37 RPL11 RPL14 RPL38 RPS14 RPS27A RPS27 RPL31 RPS26 RPS15 RPL39 RPL22 RPL27 ATF4 RPL6 RPS12 RPS28 RPS11 RPS24 RPL7 RPS3A1 RPL36 RPS16 RPL35A RPS9 CEBPG EIF2S3X RPL28 RPS15A RPL3 CEBPB RPS7 RPL15 RPL13 RPS23 RPS17
