pathway	pval	padj	log2err	ES	NES	size	leadingEdge
WP_MITOCHONDRIAL_COMPLEX_I_ASSEMBLY_MODEL_OXPHOS_SYSTEM	0.00959021711849621	0.140879880374032	0.380730400722792	-0.593743402558914	-1.49768772520638	54	MT-ND2 MT-ND1 NDUFB11 NDUFB4 NDUFB5 NDUFA13 MT-ND5 NDUFS6 NDUFS4 MT-ND4 NDUFAF2 NDUFAF7 NDUFA5 NDUFB8 NDUFA12 NDUFB7 NDUFB9 NDUFC2
KEGG_CARDIAC_MUSCLE_CONTRACTION	0.0130225544585937	0.172487419432694	0.380730400722792	-0.61151548960548	-1.5114787134714	46	MT-CYTB MT-CO3 MT-CO2 UQCR10 UQCRB COX5A COX7A2 COX7A2L COX6B1 TPM3 COX5B UQCRH CYC1 COX6C COX8A UQCRC2 COX7B COX7C COX6A1 UQCRFS1 MT-CO1 TPM4
REACTOME_PROTEIN_METHYLATION	0.0205454519973169	0.244456055968075	0.352487857583619	-0.723113167428257	-1.51204654440397	17	RPS2 EEF1A1 ETFB EEF2 EEF1AKMT1
REACTOME_ALPHA_PROTEIN_KINASE_1_SIGNALING_PATHWAY	0.0177690175471106	0.217011248269932	0.352487857583619	-0.798807863995681	-1.51634298015201	11	UBA52 RPS27A UBC
REACTOME_HDACS_DEACETYLATE_HISTONES	0.0149190356532225	0.192757601752679	0.380730400722792	-0.651608271816041	-1.52241863764738	32	NCOR1 REST ARID4A CHD4 GATAD2B SAP18 GPS2 SUDS3 KDM1A CHD3 MTA2 MTA3 ARID4B
REACTOME_INTERLEUKIN_2_SIGNALING	0.01554845813864	0.198454865696824	0.380730400722792	-0.789219014392844	-1.52426645890512	12	IL2RB LCK IL2RA IL2RG JAK1 STAT5B
REACTOME_REGULATION_OF_FZD_BY_UBIQUITINATION	0.0167749633183684	0.20781219263814	0.352487857583619	-0.803032990216608	-1.52436335748444	11	UBA52 RPS27A UBC
REACTOME_COMPLEX_I_BIOGENESIS	0.00779098432384309	0.120645683720688	0.407017918923954	-0.603445530059489	-1.52949970505932	55	MT-ND2 MT-ND1 NDUFB11 NDUFB4 NDUFB5 NDUFA13 MT-ND5 MT-ND3 NDUFS6 NDUFS4 MT-ND4 NDUFAF2 NDUFAF7 NDUFA5 NDUFB8 NDUFA12 NDUFB7 NDUFB9 NDUFC2 NDUFS7
REACTOME_ANTIGEN_ACTIVATES_B_CELL_RECEPTOR_BCR_LEADING_TO_GENERATION_OF_SECOND_MESSENGERS	0.0179062592625505	0.217011248269932	0.352487857583619	-0.66451628872211	-1.53083898610841	29	CD79A IGHM FYN DAPP1 CD79B SH3KBP1 PIK3R1 PIK3CD GRB2 BLK SOS1 ITPR3 NCK1 BTK
KEGG_SPLICEOSOME	0.00175007598884295	0.0432956021477896	0.45505986738723	-0.549596537313974	-1.53910779497038	123	SNRPG SF3B1 SRSF3 DDX5 SNRPE TRA2B HNRNPA3 HNRNPM SRSF7 SF3B4 LSM5 LSM6 DDX39B PRPF38B PUF60 ISY1 HSPA2 SNRPD1 BCAS2 TXNL4A SNRPA1 CCDC12 WBP11 ZMAT2 PRPF8 PRPF6 THOC2 EIF4A3 LSM2 RBM25 SF3B5 TRA2A HNRNPA1 ACIN1 SRSF5 PRPF4 SRSF10 RBM8A HNRNPU SNU13 PCBP1 SYF2 SF3B2 LSM8 PPIH PRPF40A CTNNBL1 RBM22 NCBP1 LSM4 CWC15 THOC3 SRSF6 SNRNP70
REACTOME_TNFR1_INDUCED_NFKAPPAB_SIGNALING_PATHWAY	0.0121503946998361	0.164030328447788	0.380730400722792	-0.667266977871567	-1.54177672588555	30	UBA52 TNF RACK1 RPS27A BIRC2 TRAF1 IKBKB CYLD UBC
WP_MRNA_PROCESSING	0.00315822172958405	0.0633449044048002	0.431707695803346	-0.550416060633049	-1.54216229134989	124	SNRPG CELF2 HNRNPA2B1 XRN2 SF3B1 SRSF3 SMC1A CLK1 SNRPE TRA2B RBM39 NUDT21 SRRM1 HNRNPM SRSF7 SF3B4 CELF1 DNAJC8 DHX9 SNRPD1 CSTF2 TXNL4A RBM5 SNRPA1 PRPF8 PRPF6 LSM2 SF3B5 CPSF2 RNPS1 HNRNPA1 PTBP1 PRPF4B SRSF5 PRPF4 SRSF10 HNRNPU SNU13 SRP54A SF3B2 NXF1 CD2BP2 PRPF40A CPSF1 HNRNPR NCBP1 SREK1 SUPT5 SRSF6 SNRNP70 HNRNPAB PABPN1 PPM1G CLK4 DHX8 SNRPB2
WP_B_CELL_RECEPTOR_SIGNALING_PATHWAY	0.00309414833571447	0.062656503798218	0.431707695803346	-0.569707293914898	-1.54356107588718	93	PTPN18 CD79A FYN MALT1 DAPP1 LCK CD79B REL ETS1 PTPRC RAC2 HRAS MEF2C LAT2 IKBKB CARD11 PIK3R1 RPS6KA1 IRF4 GRB2 BCL10 INPP5D AKT1 CD81 GSK3A MAPK14 BLK NFATC2 PLCG1 TEC MEF2D SOS1 NFATC3 ELK1 CREB1 PIP5K1A MYC NCK1 BTK
REACTOME_REGULATION_OF_TNFR1_SIGNALING	0.0153149848148287	0.196666817195301	0.380730400722792	-0.659060176660909	-1.54846011561385	34	UBA52 TNF RACK1 RPS27A BIRC2 TRAF1 IKBKB MADD CYLD CASP8 UBC OTULIN
WP_THE_HUMAN_IMMUNE_RESPONSE_TO_TUBERCULOSIS	0.0159595923034064	0.202475309584181	0.352487857583619	-0.699208675641608	-1.54873582004677	23	IFNGR1 IFITM1 SOCS1 PSMB8 STAT1 IFI35 IFIT3 JAK1 IRF1 JAK2 TAP1 OAS1A IRF9 MED14 STAT2
BIOCARTA_THELPER_PATHWAY	0.0106598282378974	0.146729400451058	0.380730400722792	-0.80492940341445	-1.55460888427156	12	CD3D CD3G CD3E THY1 CD2 PTPRC CD247 ICAM1 CD4 ITGAL CD28
WP_TCELL_ANTIGEN_RECEPTOR_TCR_SIGNALING_PATHWAY	0.00322149675556951	0.0634062819367233	0.431707695803346	-0.578824031254634	-1.5571365569361	87	CD3D CD3G CD3E FYN MALT1 SKAP1 CCR5 MAP3K14 ITK LCK CD83 LAT REL HRAS PRKCQ WAS ICOS CD8A IKBKB CARD11 PIK3R1 NFATC1 CD247 IRF4 DBNL GRB2 BCL10 AKT1 CD4 GRAP2 MAPK14 CD28 NFATC2 PLCG1 SH2B3
BIOCARTA_TCYTOTOXIC_PATHWAY	0.00980705166398121	0.141463361673592	0.380730400722792	-0.806970127949212	-1.55855025910348	12	CD3D CD3G CD3E THY1 CD2 PTPRC CD8A CD247 ICAM1 ITGAL CD28
WP_GPCRS_OTHER	0.0163033833762378	0.205598355630879	0.352487857583619	-0.680909931285356	-1.56107490284359	28	GPR183 CCR5 S1PR1 GPR132 GPR18 C5AR2 F2R HTR7
REACTOME_SIGNALING_BY_THE_B_CELL_RECEPTOR_BCR	0.000715528121254615	0.0207132898628303	0.477270815362862	-0.571971894982974	-1.56774556787978	106	UBA52 CD79A IGHM FYN PSME1 MALT1 DAPP1 PSME2 PSMB8 PSMB9 PSMB10 CD79B RPS27A REL HRAS SH3KBP1 IKBKB PSMA1 PPP3CB PSMC4 PPIA CARD11 PIK3R1 NFATC1 RASGRP1 PIK3CD PSMD13 GRB2 BCL10 PSMD4 UBC BLK NFATC2 NFKBIB PSMC3 PSMD14 SOS1 PSMC5 PPP3R1 PSMA7 NFATC3 ITPR3
REACTOME_GLUTAMATE_NEUROTRANSMITTER_RELEASE_CYCLE	0.00927421493548836	0.13852125286623	0.380730400722792	-0.841297973406821	-1.57077142894348	10	SLC38A2 ARL6IP5 GLS VAMP2
WP_OXIDATIVE_PHOSPHORYLATION	0.00392797370740234	0.0725641458578012	0.407017918923954	-0.615034629319896	-1.57157123311247	57	MT-ND2 MT-ND1 NDUFB4 NDUFA4 NDUFB5 MT-ATP6 MT-ND5 ATP5A1 MT-ND3 NDUFS6 ATP5E NDUFS4 MT-ND4 ATP5G2 NDUFA5 ATP5H ATP5J ATP6AP2 NDUFB8 NDUFB7 ATP5D NDUFB9 ATP5G1 NDUFC2 ATP5O ATP5B NDUFS7
REACTOME_IMMUNOREGULATORY_INTERACTIONS_BETWEEN_A_LYMPHOID_AND_A_NON_LYMPHOID_CELL	0.00228262278827558	0.0506021430748251	0.431707695803346	-0.590108944491291	-1.57865829253708	81	KLRD1 CD3D CD3G HCST IFITM1 CD3E H2-T23 KLRK1 CD8B1 JAML ITGA4 CD300A SH2D1A CD8A KLRC1 H2-D1 FCGR1 CD226 CD247 H2-Q7 SIGLECG ICAM1 CD81 CDH1 ITGAL LAIR1 ITGB7
WP_TCELL_ANTIGEN_RECEPTOR_TCR_PATHWAY_DURING_STAPHYLOCOCCUS_AUREUS_INFECTION	0.0033424454429057	0.0645797257133891	0.431707695803346	-0.618179975370543	-1.57960839904709	57	CD3D TNF FYN MALT1 MAP3K14 ITK LCK PDCD1 LAT PTPRC PRKCQ ICOS CD8A IKBKB CTLA4 CARD11 GRB2 BCL10 AKT1 CD4 GRAP2 CD28 NFATC2 PLCG1 AHSA1 IL4 SOS1
REACTOME_INITIAL_TRIGGERING_OF_COMPLEMENT	0.00684962421284342	0.110116859482811	0.407017918923954	-0.847825476233081	-1.58295880519534	10	C1QB CFP C1QC C1QA
PID_IL2_STAT5_PATHWAY	0.00921133020091073	0.13852125286623	0.380730400722792	-0.699254385878913	-1.59337133613672	27	CCND2 IL2RB LCK IL2RA IL2RG CCND3 BCL2 JAK1 PIK3R1 STAT5B GRB2 ELF1 IL4 SOS1 MYC SP1
BIOCARTA_STATHMIN_PATHWAY	0.00384745995457549	0.0717057580914689	0.431707695803346	-0.752182940094682	-1.60199406208409	19	CD3D CD3G CD3E CD2 CD247 PRKACB
REACTOME_THE_CITRIC_ACID_TCA_CYCLE_AND_RESPIRATORY_ELECTRON_TRANSPORT	9.72986255736256e-05	0.0037946463973714	0.538434096309916	-0.558420067705431	-1.61188873347565	165	MT-ND2 MT-CYTB MT-ND1 NDUFB11 MPC1 NDUFB4 NDUFA4 MT-CO3 NDUFB5 MT-ATP6 NDUFA13 MT-ND5 ATP5A1 MPC2 MT-ND3 ETFB MT-CO2 PDHA1 UQCR10 NDUFS6 UQCRB UCP2 CYCS ATP5E MT-ATP8 SDHA COX5A IDH3B COX7A2L NDUFS4 MT-ND4 NDUFAF2 COX6B1 NDUFAF7 ATP5G2 NDUFA5 ATP5H ATP5J ACO2 NDUFB8 COX5B NDUFA12 NDUFB7 UQCRH ATP5D NDUFB9 CYC1 ATP5G1 PDHB COX6C NDUFC2 ATP5O SURF1 ATP5B IDH3G FH1 NDUFS7 COX8A IDH3A UQCRC2 ETFA COX7B COX14 SDHB COX7C COX6A1 UQCRFS1 NDUFAF4
REACTOME_MHC_CLASS_II_ANTIGEN_PRESENTATION	0.00064818984854478	0.0195012545862187	0.477270815362862	-0.59242170992265	-1.61612828145325	97	H2-EB1 CD74 H2-AA H2-AB1 IFI30 H2-DMA H2-DMB1 H2-DMB2 H2-OA LGMN CTSS CAPZA1 H2-OB DCTN6 TUBB4B CLTA DNM2
BIOCARTA_TH1TH2_PATHWAY	0.00644053486475629	0.106545424675548	0.407017918923954	-0.787145788691743	-1.61713751349703	15	H2-EB1 IFNGR1 CD86 IL2RA IL18R1 IL4RA IL12RB2 CD28 IL18 IL4
WP_COMPLEMENT_ACTIVATION	0.00197428534902043	0.046198277167078	0.431707695803346	-0.86431854699872	-1.64069912231583	11	C1QB CFP C1QC C1QA
KEGG_T_CELL_RECEPTOR_SIGNALING_PATHWAY	0.000410709448970393	0.0131053651444189	0.49849310876659	-0.604515662299459	-1.64167780236107	95	CD3D CD3G TNF CD3E FYN MALT1 MAP3K14 ITK LCK PDCD1 LAT CD8B1 PTPRC HRAS PRKCQ ICOS CD8A IKBKB PPP3CB CTLA4 CARD11 PIK3R1 NFATC1 CD247 RASGRP1 PIK3CD GRB2 BCL10 AKT1 CD4 GRAP2 MAPK14 CD28 NFATC2 PLCG1 NFKBIB TEC IL4 SOS1 PPP3R1 NFATC3
WP_IL2_SIGNALING_PATHWAY	0.00261636420171346	0.0562251327429444	0.431707695803346	-0.673897007145676	-1.64307590353887	42	CCND2 IL2RB FYN LCK STAT1 RPS6 IL2RA IL2RG HRAS BCL2 JAK1 PIK3R1 NMI STAT5B GRB2 AKT1 CISH
REACTOME_FORMATION_OF_ATP_BY_CHEMIOSMOTIC_COUPLING	0.00306287205098169	0.0626253256249265	0.431707695803346	-0.785974628913209	-1.64349133049817	17	MT-ATP6 ATP5A1 ATP5E MT-ATP8 ATP5G2 ATP5H ATP5J ATP5D ATP5G1 ATP5O ATP5B
BIOCARTA_MHC_PATHWAY	0.00111787011806116	0.0298004363118582	0.45505986738723	-0.862457984023989	-1.66571731457085	12	H2-EB1 CD74 PSMB8 PSMB9 TAP2 H2-D1 H2-Q7
WP_OXYSTEROLS_DERIVED_FROM_CHOLESTEROL	0.00329991094148055	0.0643482633588707	0.431707695803346	-0.767716354843149	-1.67042286761337	21	GPR183 IL17F
PID_CD8_TCR_DOWNSTREAM_PATHWAY	0.000717982032282342	0.0207132898628303	0.477270815362862	-0.672841471075717	-1.68329824787116	51	CD3D CD3G TNF CD3E IL2RB EGR1 STAT4 TNFRSF18 IL2RA CD8B1 IL2RG HRAS PRKCQ CD8A TNFRSF4 H2-D1 PPP3CB PTPN7 NFATC1 CD247 H2-Q7 PRKCA EOMES NFATC2 JUNB
WP_INTERACTIONS_BETWEEN_IMMUNE_CELLS_AND_MICRORNAS_IN_TUMOR_MICROENVIRONMENT	0.00239254635183223	0.0522022946136702	0.431707695803346	-0.745813962088524	-1.69151763067361	26	CCL2 CCL5 CD86 IL2RB SOCS1 PDCD1 IL2RA IL2RG CTLA4 IL4RA CXCL10 TGFBR2 IRAK4 CD274 IL4 CD80
KEGG_PARKINSONS_DISEASE	6.8902521169058e-05	0.00290217419164072	0.538434096309916	-0.617243059236405	-1.70064618037251	110	MT-ND2 MT-CYTB MT-ND1 NDUFB4 NDUFA4 MT-CO3 NDUFB5 MT-ATP6 MT-ND5 ATP5A1 MT-ND3 MT-CO2 UQCR10 NDUFS6 UQCRB CYCS ATP5E MT-ATP8 SDHA COX5A SLC25A5 COX7A2 COX7A2L NDUFS4 MT-ND4 COX6B1 ATP5G2 NDUFA5 ATP5H VDAC2 ATP5J SLC25A4 NDUFB8 COX5B UBE2G2 UBA7 NDUFB7 UQCRH ATP5D NDUFB9 CYC1 ATP5G1 COX6C NDUFC2 ATP5O ATP5B NDUFS7 COX8A UQCRC2 COX7B SDHB COX7C COX6A1 PINK1 UBE2L3 UQCRFS1 NDUFV2 UBE2L6 MT-CO1
BIOCARTA_IL12_PATHWAY	0.00123948229978622	0.0322265397944416	0.45505986738723	-0.816034485048024	-1.72418440924249	18	CD3D CD3G CD3E CCR5 STAT4 CD247 IL18R1 IL12RB2 JAK2 MAPK14 IL18
PID_IL12_STAT4_PATHWAY	0.000629732024753481	0.0193175409366586	0.477270815362862	-0.762164853871628	-1.73672365321449	27	CD3D CD3G CD3E CD86 STAT4 IL2RA PPP3CB IRF1 IL18RAP CD247 IL18R1 CD4 CD28 IL18 CD80 PPP3R1
REACTOME_RESPIRATORY_ELECTRON_TRANSPORT	2.36198645032683e-05	0.0011305326055428	0.575610261071129	-0.645392227555771	-1.76716400587982	101	MT-ND2 MT-CYTB MT-ND1 NDUFB11 NDUFB4 NDUFA4 MT-CO3 NDUFB5 NDUFA13 MT-ND5 MT-ND3 ETFB MT-CO2 UQCR10 NDUFS6 UQCRB CYCS SDHA COX5A COX7A2L NDUFS4 MT-ND4 NDUFAF2 COX6B1 NDUFAF7 NDUFA5 NDUFB8 COX5B NDUFA12 NDUFB7 UQCRH NDUFB9 CYC1 COX6C NDUFC2 SURF1 NDUFS7 COX8A UQCRC2 ETFA COX7B COX14 SDHB COX7C COX6A1 UQCRFS1 NDUFAF4 NDUFV2 MT-CO1
REACTOME_INTERFERON_ALPHA_BETA_SIGNALING	8.333857399839e-05	0.00337521224693479	0.538434096309916	-0.697511880275085	-1.77484315405783	56	IFITM1 EGR1 ISG15 BST2 H2-T23 SOCS1 PSMB8 STAT1 IFI35 GBP2 SAMHD1 IFITM2 IFIT3 H2-T22 H2-D1 JAK1 H2-K1 IRF1 XAF1 OAS3 H2-Q7 IRF4 USP18 IRF7 IFIT2 IFITM3
REACTOME_INTERFERON_GAMMA_SIGNALING	1.41787824743678e-05	0.000746512897275467	0.593325476396405	-0.672974887360429	-1.78841741433751	79	H2-EB1 H2-AA H2-AB1 IFNGR1 IFI30 H2-T23 SOCS1 GBP4 CIITA STAT1 TRIM30A GBP2 SP100 GBP5 GBP7 H2-T22 H2-D1 TRIM26 SUMO1 FCGR1 TRIM12C JAK1 H2-K1 IRF1 GBP3 OAS3 H2-Q7 IRF4 CAMK2G GBP8 ICAM1 IRF7
KEGG_SYSTEMIC_LUPUS_ERYTHEMATOSUS	0.000120310943043697	0.00444517273771976	0.538434096309916	-0.757650459061446	-1.79441103001526	36	H2-EB1 H2-AA H2-AB1 TNF H2-DMA H2-DMB1 CD86 H2-DMB2 C1QB H2-OA C1QC H2-OB C1QA FCGR1 SNRPD1
REACTOME_INTERFERON_SIGNALING	2.90818859433935e-07	2.26838710358469e-05	0.674962860011025	-0.622258048572269	-1.79557989110931	166	H2-EB1 H2-AA H2-AB1 UBA52 IFNGR1 IFI30 IFITM1 EGR1 ISG15 BST2 H2-T23 SOCS1 GBP4 CIITA PSMB8 STAT1 TRIM30A RPS27A IFI35 GBP2 SAMHD1 SP100 GBP5 IFITM2 GBP7 IFIT3 H2-T22 H2-D1 TRIM26 SUMO1 FCGR1 TRIM12C JAK1 H2-K1 IRF1 XAF1 GBP3 OAS3 H2-Q7 IRF4 USP18 CAMK2G GBP8 ICAM1 IRF7 IFIT2 IFITM3 EIF4A3 JAK2 UBC RANBP2 TRIM30D PLCG1 UBA7 IRF2 ISG20 EIF2AK2 HERC6 NEDD4
KEGG_VIRAL_MYOCARDITIS	0.000187067624713737	0.00650596444417501	0.518848077743792	-0.732221530511211	-1.79685794822358	44	H2-EB1 H2-AA H2-AB1 H2-DMA H2-DMB1 CD86 H2-DMB2 FYN H2-T23 H2-OA RAC2 H2-OB ACTB CYCS H2-D1 H2-Q7 ICAM1 ITGAL CASP8 CD28 ACTG1 CCND1 BID MYH9 CD80
WP_ELECTRON_TRANSPORT_CHAIN_OXPHOS_SYSTEM_IN_MITOCHONDRIA	6.47901190867439e-06	0.000401317619990243	0.610526878385931	-0.659340914952112	-1.79868408251362	97	MT-ND2 MT-CYTB MT-ND1 NDUFB4 NDUFA4 MT-CO3 NDUFB5 MT-ATP6 MT-ND5 ATP5A1 MT-ND3 MT-CO2 UQCR10 NDUFS6 UQCRB UCP2 ATP5E MT-ATP8 SDHA COX5A SLC25A5 COX7A2 COX7A2L NDUFS4 MT-ND4 COX6B1 ATP5G2 NDUFA5 ATP5H ATP5J SLC25A4 NDUFB8 COX5B NDUFA12 NDUFB7 UQCRH ATP5D NDUFB9 ATP5G1 COX6C NDUFC2 ATP5O SURF1 ATP5B NDUFS7 COX8A UQCRC2 COX7B SDHB COX7C COX6A1 UQCRFS1
KEGG_CELL_ADHESION_MOLECULES_CAMS	1.7564924631504e-05	0.00088075550652256	0.575610261071129	-0.682694828708461	-1.81137700537842	78	H2-EB1 H2-AA H2-AB1 H2-DMA H2-DMB1 CD86 H2-DMB2 SELPLG H2-T23 H2-OA PDCD1 CD2 CD8B1 PTPRC SPN ITGA4 H2-OB ICOS CD8A H2-D1 ICOSL CTLA4 CD226 H2-Q7 CD6 ICAM1 CD4 CDH1 ITGAL
BIOCARTA_CSK_PATHWAY	6.03788227359606e-05	0.00259505715677414	0.557332238758646	-0.874652824052808	-1.81209208050926	16	H2-EB1 CD3D CD3G CD3E LCK PTPRC CD247 PRKACB CD4
REACTOME_NERVOUS_SYSTEM_DEVELOPMENT	2.11122924709362e-13	2.61544046728186e-11	0.943632225232838	-0.594105703801564	-1.81590016288452	408	RPL12 UBA52 RPL3 RPL10A RPL39 RPS18 RPS2 RPS21 RPS24 RPL36 RPL38 RPLP1 RPL36A RPL32 RPS13 RPS27 RPSA RPS7 RPL14 FYN RPS23 RPL21 RPL6 RPL13 RPS15A PSME1 RPL18A RPL18 RPS5 RPL8 RPS28 RPL30 RPL23A RPS11 ABLIM1 RPS8 RPL37A RPL29 RPS12 RPL11 RPS29 RPL37 PSME2 RPS3A1 PSMB8 RPL13A RPS6 PSMB9 RPL34 RPS4X PSMB10 RPL35 RPS26 RPS19 RPL4 RPS27A RPL27A RPL35A PTPRC CD72 RPL5 RPL9 RPL27 RPS14 RPS3 RPS10 RPL17 RPLP0 RPL22L1 RPS17 ACTB RPS20 HRAS PRNP PRKCQ RPL19 RPS16 RPL23 RPL28 RPL26 SH3KBP1 LYPLA2 ARPC4 SEMA4D RPS15 RPL15 CXCR4 PSMA1 PPP3CB PSMC4 RPL10 RPL7A TUBB4B RPL7 RPLP2 RPL22 CLTA PFN1 UPF3A PIK3R1 RPS6KA1 DNM2 UTRN PRKACB PIK3CD PSMD13 GRB2 ROCK1 SEMA4A CFL1 RPS6KA3 PSMD4 MBP RPL31 RPS9 RPS25 ITGA2 MYL6
REACTOME_TCR_SIGNALING	1.05453274955421e-06	7.40281990187055e-05	0.643551836150722	-0.66313064917168	-1.81760702804304	106	H2-EB1 H2-AA H2-AB1 CD3D UBA52 CD3G CD3E PSME1 MALT1 PTPN22 ITK LCK PSME2 PSMB8 PSMB9 PSMB10 LAT RPS27A PTPRC PRKCQ WAS IKBKB PSMA1 PSMC4 CARD11 PIK3R1 CD247 PSMD13 BCL10 INPP5D PSMD4 UBE2D2A CD4
WP_ALLOGRAFT_REJECTION	2.47851111520962e-05	0.0011599432019181	0.575610261071129	-0.719909320767557	-1.82469011523688	55	H2-EB1 H2-AA H2-AB1 TNF H2-DMA H2-DMB1 CD86 H2-DMB2 H2-T23 C1QB H2-OA STAT1 IL2RA C1QC H2-OB C1QA H2-D1 CTLA4
BIOCARTA_CTLA4_PATHWAY	0.00012366548576868	0.00449033643153171	0.518848077743792	-0.864581903606883	-1.82675936621043	18	H2-EB1 CD3D CD3G CD3E CD86 ITK LCK ICOS ICOSL CTLA4 PIK3R1 CD247 GRB2
KEGG_PRIMARY_IMMUNODEFICIENCY	0.000136056997977325	0.00485654301254655	0.518848077743792	-0.811708114570395	-1.83231145057934	25	CD3D CD79A CD3E LCK CIITA CD8B1 PTPRC IL2RG TAP2 ICOS CD8A
WP_PATHOGENESIS_OF_SARSCOV2_MEDIATED_BY_NSP9NSP10_COMPLEX	3.586509879013e-05	0.00164199778373943	0.557332238758646	-0.906301001267327	-1.83624237585033	14	H2-EB1 CD3G CD3E FYN LCK CD2 CD8B1 CD8A CD247 CD4
WP_CANCER_IMMUNOTHERAPY_BY_PD1_BLOCKADE	5.58561411016409e-05	0.0024506881908345	0.557332238758646	-0.838719428549045	-1.85774986383159	23	H2-EB1 CD3D CD3G CD3E LCK PDCD1 CD8B1 CD8A H2-D1 BATF NFATC1 H2-Q7
REACTOME_RESPIRATORY_ELECTRON_TRANSPORT_ATP_SYNTHESIS_BY_CHEMIOSMOTIC_COUPLING_AND_HEAT_PRODUCTION_BY_UNCOUPLING_PROTEINS	2.27911645513487e-07	1.84608432865925e-05	0.690132458796796	-0.665614528353216	-1.85805935185349	121	MT-ND2 MT-CYTB MT-ND1 NDUFB11 NDUFB4 NDUFA4 MT-CO3 NDUFB5 MT-ATP6 NDUFA13 MT-ND5 ATP5A1 MT-ND3 ETFB MT-CO2 UQCR10 NDUFS6 UQCRB UCP2 CYCS ATP5E MT-ATP8 SDHA COX5A COX7A2L NDUFS4 MT-ND4 NDUFAF2 COX6B1 NDUFAF7 ATP5G2 NDUFA5 ATP5H ATP5J NDUFB8 COX5B NDUFA12 NDUFB7 UQCRH ATP5D NDUFB9 CYC1 ATP5G1 COX6C NDUFC2 ATP5O SURF1 ATP5B NDUFS7 COX8A UQCRC2 ETFA COX7B COX14 SDHB COX7C COX6A1 UQCRFS1 NDUFAF4
PID_TCR_PATHWAY	9.00018050636135e-06	0.000514353788569798	0.593325476396405	-0.72659418651254	-1.87267562952606	61	CD3D CD3G CD3E CD86 FYN MALT1 MAP3K14 ITK LCK LAT PTPRC HRAS PRKCQ WAS RASSF5 IKBKB CARD11 CD247 RASGRP1 DBNL GRB2 BCL10 AKT1 CD4 GRAP2 PRKCA CD28 PLCG1
KEGG_TYPE_I_DIABETES_MELLITUS	3.80272255588804e-05	0.00170394334100004	0.557332238758646	-0.818054790722778	-1.87549739587087	28	H2-EB1 H2-AA H2-AB1 TNF H2-DMA H2-DMB1 CD86 H2-DMB2 H2-T23 H2-OA HSPD1 H2-OB H2-D1
REACTOME_PD_1_SIGNALING	1.01199862098639e-05	0.000560860288367723	0.593325476396405	-0.914156461011709	-1.87807230572207	15	H2-EB1 H2-AA H2-AB1 CD3D CD3G CD3E LCK PDCD1
REACTOME_COSTIMULATION_BY_THE_CD28_FAMILY	2.68131068702554e-06	0.000176463759589869	0.627256739718528	-0.73220617130035	-1.88122124089661	59	H2-EB1 H2-AA H2-AB1 CD3D CD3G CD3E CD86 FYN MAP3K14 LCK PDCD1 ICOS ICOSL CTLA4 PIK3R1 CD247 GRB2 AKT1 CD4 GRAP2 RICTOR
REACTOME_GENERATION_OF_SECOND_MESSENGER_MOLECULES	1.89106345519161e-05	0.000926181310845007	0.575610261071129	-0.851796848231081	-1.90213522572174	24	H2-EB1 H2-AA H2-AB1 CD3D CD3G CD3E ITK LCK LAT WAS
KEGG_GRAFT_VERSUS_HOST_DISEASE	9.03660502235638e-06	0.000514353788569798	0.593325476396405	-0.848970371591059	-1.91642550461898	25	H2-EB1 H2-AA H2-AB1 KLRD1 TNF H2-DMA H2-DMB1 CD86 H2-DMB2 H2-T23 H2-OA H2-OB KLRC1 H2-D1
KEGG_ASTHMA	5.48776651208679e-06	0.000350219281044084	0.610526878385931	-0.907521938271921	-1.91748658381991	18	H2-EB1 H2-AA H2-AB1 TNF H2-DMA H2-DMB1 H2-DMB2 H2-OA MS4A2 H2-OB
KEGG_ALLOGRAFT_REJECTION	1.21068896894478e-05	0.00065377204323018	0.593325476396405	-0.858876709508092	-1.91794516157228	24	H2-EB1 H2-AA H2-AB1 TNF H2-DMA H2-DMB1 CD86 H2-DMB2 H2-T23 H2-OA H2-OB H2-D1
PID_CD8_TCR_PATHWAY	1.35053655460078e-06	9.17493543222338e-05	0.643551836150722	-0.769247694971417	-1.9250699976612	52	CD3D CD3G CD3E CD86 FYN MALT1 MAP3K14 LCK LAT CD8B1 PTPRC HRAS PRKCQ RASSF5 CD8A IKBKB H2-D1 CARD11 CD247 RASGRP1 H2-Q7 GRB2 BCL10 AKT1 GRAP2 PRKCA CD28 PLCG1
KEGG_AUTOIMMUNE_THYROID_DISEASE	8.91103677689934e-06	0.000514353788569798	0.593325476396405	-0.864012157754485	-1.92941305679826	24	H2-EB1 H2-AA H2-AB1 H2-DMA H2-DMB1 CD86 H2-DMB2 H2-T23 H2-OA H2-OB H2-D1 CTLA4 H2-Q7
KEGG_INTESTINAL_IMMUNE_NETWORK_FOR_IGA_PRODUCTION	3.85765571794548e-07	2.901508193569e-05	0.674962860011025	-0.847973518022204	-1.99069346706031	33	H2-EB1 H2-AA H2-AB1 H2-DMA H2-DMB1 CD86 H2-DMB2 MAP3K14 H2-OA ITGA4 H2-OB ICOS CXCR4 ICOSL
KEGG_ANTIGEN_PROCESSING_AND_PRESENTATION	6.93324677841834e-08	5.84056708613961e-06	0.704975715167238	-0.803522590633624	-2.01084415563867	52	H2-EB1 CD74 H2-AA H2-AB1 KLRD1 IFI30 H2-DMA H2-DMB1 H2-DMB2 PSME1 H2-T23 H2-OA CIITA PSME2 LGMN CTSS CD8B1 H2-OB TAP2 CD8A KLRC1 H2-D1 TAPBP HSPA2 CALR H2-Q7 NFYC CD4
REACTOME_ACTIVATION_OF_THE_MRNA_UPON_BINDING_OF_THE_CAP_BINDING_COMPLEX_AND_EIFS_AND_SUBSEQUENT_BINDING_TO_43S	2.70206549745353e-09	2.70978568458911e-07	0.774939030136436	-0.800540400143444	-2.05678900830783	59	RPS18 RPS2 RPS21 RPS24 RPS13 RPS27 RPSA RPS7 RPS23 RPS15A RPS5 RPS28 RPS11 RPS8 RPS12 RPS29 RPS3A1 RPS6 RPS4X RPS26 RPS19 RPS27A RPS14 RPS3 RPS10 RPS17 RPS20 RPS16 EIF3F RPS15 EIF3M EIF3E EIF3K EIF3I EIF3J1 EIF3H RPS9 RPS25
REACTOME_TRANSLATION	1.13128193664869e-23	2.16589068962012e-21	1.26273988547916	-0.719280290195988	-2.15514415699823	285	RPL12 UBA52 RPL3 RPL10A RPL39 EEF1B2 SEC61A1 RPS18 RPS2 RPS21 RPS24 RPL36 RPL38 RPLP1 RPL36A RPL32 RPS13 RPS27 RPSA RPS7 RPL14 RPS23 RPL21 RPL6 RPL13 RPS15A RPL18A RPL18 RPS5 RPL8 RPS28 RPL30 RPL23A AIMP1 RPS11 RPS8 RPL37A RPL29 RPS12 RPL11 RPS29 SEC11C RPL37 RPS3A1 RPL13A RPS6 RPL34 RPS4X RPL35 RPS26 EEF1A1 RPS19 RPL4 RPS27A RPL27A TRMT112 RPL35A RPL5 RPL9 RPL27 RPS14 RPS3 RPS10 SEC61B RPL17 MRPL30 RPLP0 RPL22L1 RPS17 SRP72 RPS20 RPL19 RPS16 RPL23 EEF2 RPL28 RPL26 EIF3F MRPS24 RPS15 RPL15 EIF3M SRP14 SPCS2 MRPL15 RPL10 EIF3E RPL7A MRPS34 RPL7 RPLP2 RPL22 RPN2 MRPL57 GADD45GIP1 MRPS23 EIF3K SRP68 EIF3I MRPS16 MRPL4 SEC11A EIF2B2 MRPL35 MRPS17 EIF3J1 EIF5B RPL31 EIF3H RPS9 RPS25 EEF1G RPL36AL VARS MRPL13 SSR4 MRPL43 MTIF2 AURKAIP1 MRPS36
REACTOME_METABOLISM_OF_AMINO_ACIDS_AND_DERIVATIVES	5.15041613207541e-24	1.08467763741508e-21	1.27091304449619	-0.720756191268443	-2.15789215217057	284	RPL12 UBA52 RPL3 RPL10A RPL39 RPS18 RPS2 RPS21 RPS24 RPL36 RPL38 RPLP1 RPL36A RPL32 RPS13 RPS27 RPSA RPS7 RPL14 RPS23 RPL21 RPL6 RPL13 RPS15A PSME1 RPL18A RPL18 RPS5 RPL8 RPS28 RPL30 RPL23A AIMP1 RPS11 ODC1 RPS8 RPL37A RPL29 RPS12 RPL11 RPS29 RPL37 PSME2 RPS3A1 PSMB8 RPL13A RPS6 PSMB9 RPL34 RPS4X PSMB10 RPL35 RPS26 RPS19 RPL4 RPS27A RPL27A RPL35A RPL5 RPL9 RPL27 RPS14 RPS3 RPS10 RPL17 RPLP0 RPL22L1 HSD17B10 RPS17 RPS20 PDHA1 HDC RPL19 RPS16 RPL23 CKB RPL28 RPL26 RPS15 RPL15 OAT PSMA1 PSMC4 RPL10 RPL7A RPL7 GOT2 RPLP2 RPL22 GLS SERINC3 HAAO PSMD13 APIP PSMD4 RPL31 RPS9 RPS25 LIAS RPL36AL SMS ASRGL1 GOT1 OAZ1
REACTOME_CELLULAR_RESPONSE_TO_STARVATION	3.12555198447837e-18	4.38827498620763e-16	1.10533657731401	-0.774328541780454	-2.20890901600229	147	RPL12 UBA52 RPL3 RPL10A RPL39 RPS18 RPS2 RPS21 RPS24 RPL36 RPL38 RPLP1 RPL36A RPL32 RPS13 RPS27 RPSA RPS7 RPL14 RPS23 RPL21 RPL6 RPL13 RPS15A RPL18A RPL18 RPS5 RPL8 RPS28 RPL30 RPL23A RPS11 RPS8 RPL37A RPL29 RPS12 RPL11 RPS29 RPL37 RPS3A1 RPL13A RPS6 RPL34 RPS4X RPL35 RPS26 RPS19 RPL4 RPS27A RPL27A LAMTOR4 RPL35A RPL5 RPL9 RPL27 RPS14 RPS3 RPS10 RPL17 RPLP0 RPL22L1 RPS17 RPS20 RPL19 RPS16 RPL23 RPL28 RPL26 RPS15 RPL15 RPL10 RPL7A RPL7 RPLP2 RPL22
REACTOME_SIGNALING_BY_ROBO_RECEPTORS	2.44892814883113e-20	3.68388762959883e-18	1.16906996676109	-0.759029195737869	-2.22165034590117	188	RPL12 UBA52 RPL3 RPL10A RPL39 RPS18 RPS2 RPS21 RPS24 RPL36 RPL38 RPLP1 RPL36A RPL32 RPS13 RPS27 RPSA RPS7 RPL14 RPS23 RPL21 RPL6 RPL13 RPS15A PSME1 RPL18A RPL18 RPS5 RPL8 RPS28 RPL30 RPL23A RPS11 RPS8 RPL37A RPL29 RPS12 RPL11 RPS29 RPL37 PSME2 RPS3A1 PSMB8 RPL13A RPS6 PSMB9 RPL34 RPS4X PSMB10 RPL35 RPS26 RPS19 RPL4 RPS27A RPL27A RPL35A RPL5 RPL9 RPL27 RPS14 RPS3 RPS10 RPL17 RPLP0 RPL22L1 RPS17 RPS20 RPL19 RPS16 RPL23 RPL28 RPL26 RPS15 RPL15 CXCR4 PSMA1 PPP3CB PSMC4 RPL10 RPL7A RPL7 RPLP2 RPL22 PFN1 UPF3A
REACTOME_REGULATION_OF_EXPRESSION_OF_SLITS_AND_ROBOS	1.10996437832093e-22	1.94798748395324e-20	1.22950405660873	-0.806577790064438	-2.307052642728	152	RPL12 UBA52 RPL3 RPL10A RPL39 RPS18 RPS2 RPS21 RPS24 RPL36 RPL38 RPLP1 RPL36A RPL32 RPS13 RPS27 RPSA RPS7 RPL14 RPS23 RPL21 RPL6 RPL13 RPS15A PSME1 RPL18A RPL18 RPS5 RPL8 RPS28 RPL30 RPL23A RPS11 RPS8 RPL37A RPL29 RPS12 RPL11 RPS29 RPL37 PSME2 RPS3A1 PSMB8 RPL13A RPS6 PSMB9 RPL34 RPS4X PSMB10 RPL35 RPS26 RPS19 RPL4 RPS27A RPL27A RPL35A RPL5 RPL9 RPL27 RPS14 RPS3 RPS10 RPL17 RPLP0 RPL22L1 RPS17 RPS20 RPL19 RPS16 RPL23 RPL28 RPL26 RPS15 RPL15 PSMA1 PSMC4 RPL10 RPL7A RPL7 RPLP2 RPL22 UPF3A
REACTOME_RRNA_PROCESSING	4.00286891433117e-29	4.21502096679072e-26	1.40258870935552	-0.800975406286309	-2.35389375287713	195	RPL12 UBA52 RPL3 RPL10A RPL39 RPS18 RPS2 RPS21 RPS24 RPL36 RPL38 RPLP1 RPL36A RPL32 RPS13 RPS27 RPSA RPS7 RPL14 RPS23 RPL21 RPL6 RPL13 RPS15A RPL18A RPL18 RPS5 RPL8 RPS28 RPL30 RPL23A RPS11 RPS8 RPL37A RPL29 RPS12 RPL11 RPS29 RPL37 RPS3A1 RPL13A RPS6 RPL34 RPS4X RPL35 RPS26 RPS19 RPL4 XRN2 RPS27A RPL27A TRMT112 RPL35A RPL5 RPL9 RPL27 RPS14 RPS3 RPS10 RPL17 RPLP0 RPL22L1 HSD17B10 RPS17 RPS20 RPL19 RPS16 RPL23 RPL28 RPL26 RPS15 RPL15 NOP10 RPL10 RPL7A RPL7 UTP3 RPLP2 RPL22 EXOSC3 EXOSC5 NCL
REACTOME_RESPONSE_OF_EIF2AK4_GCN2_TO_AMINO_ACID_DEFICIENCY	2.42076417662943e-21	3.92163796613968e-19	1.19534448258848	-0.864130694198855	-2.35735124215644	97	RPL12 UBA52 RPL3 RPL10A RPL39 RPS18 RPS2 RPS21 RPS24 RPL36 RPL38 RPLP1 RPL36A RPL32 RPS13 RPS27 RPSA RPS7 RPL14 RPS23 RPL21 RPL6 RPL13 RPS15A RPL18A RPL18 RPS5 RPL8 RPS28 RPL30 RPL23A RPS11 RPS8 RPL37A RPL29 RPS12 RPL11 RPS29 RPL37 RPS3A1 RPL13A RPS6 RPL34 RPS4X RPL35 RPS26 RPS19 RPL4 RPS27A RPL27A RPL35A RPL5 RPL9 RPL27 RPS14 RPS3 RPS10 RPL17 RPLP0 RPL22L1 RPS17 RPS20 RPL19 RPS16 RPL23 RPL28 RPL26 RPS15 RPL15 RPL10 RPL7A RPL7 RPLP2 RPL22
REACTOME_INFLUENZA_INFECTION	7.58646524519064e-26	2.28244225805307e-23	1.31888879607587	-0.826569739613212	-2.35793626564261	147	RPL12 UBA52 RPL3 RPL10A RPL39 RPS18 RPS2 RPS21 RPS24 RPL36 RPL38 RPLP1 RPL36A RPL32 RPS13 RPS27 RPSA RPS7 RPL14 RPS23 RPL21 RPL6 RPL13 RPS15A ISG15 RPL18A RPL18 RPS5 RPL8 RPS28 RPL30 RPL23A RPS11 RPS8 RPL37A RPL29 RPS12 RPL11 RPS29 RPL37 RPS3A1 RPL13A RPS6 RPL34 RPS4X RPL35 RPS26 RPS19 RPL4 RPS27A RPL27A RPL35A RPL5 RPL9 RPL27 RPS14 RPS3 RPS10 RPL17 RPLP0 RPL22L1 RPS17 RPS20 RPL19 RPS16 RPL23 RPL28 RPL26 RPS15 RPL15 RPL10 RPL7A RPL7 RPLP2 RPL22 CLTA
REACTOME_EUKARYOTIC_TRANSLATION_INITIATION	1.92323299001445e-24	5.06291084621305e-22	1.27903397725049	-0.857321138529844	-2.37186785237887	116	RPL12 UBA52 RPL3 RPL10A RPL39 RPS18 RPS2 RPS21 RPS24 RPL36 RPL38 RPLP1 RPL36A RPL32 RPS13 RPS27 RPSA RPS7 RPL14 RPS23 RPL21 RPL6 RPL13 RPS15A RPL18A RPL18 RPS5 RPL8 RPS28 RPL30 RPL23A RPS11 RPS8 RPL37A RPL29 RPS12 RPL11 RPS29 RPL37 RPS3A1 RPL13A RPS6 RPL34 RPS4X RPL35 RPS26 RPS19 RPL4 RPS27A RPL27A RPL35A RPL5 RPL9 RPL27 RPS14 RPS3 RPS10 RPL17 RPLP0 RPL22L1 RPS17 RPS20 RPL19 RPS16 RPL23 RPL28 RPL26 EIF3F RPS15 RPL15 EIF3M RPL10 EIF3E RPL7A RPL7 RPLP2 RPL22 EIF3K EIF3I EIF2B2 EIF3J1 EIF5B RPL31 EIF3H RPS9 RPS25
