"","pathway","pval","padj","log2err","ES","NES","size","leadingEdge"
"404","GOBP_NEGATIVE_REGULATION_OF_LEUKOCYTE_CELL_CELL_ADHESION",0.0171433714122999,0.156575374614893,0.352487857583619,-0.452502364494037,-1.43912295786414,109,"CD74 H2-EB1 FGL2 IRF1 H2-M3 FCGR2B IL4RA PRDX2 RIPOR2 BCL6 RUNX1 PIRB PTPN2 SOCS1 HMGB1 CEBPB WNK1 SDC4 LGALS9 LILR4B"
"405","GOBP_LEUKOCYTE_CELL_CELL_ADHESION",0.000595020874584493,0.0238288209567554,0.477270815362862,-0.405194525312067,-1.44065217424008,310,"CD74 S100A9 S100A8 H2-EB1 CCL2 H2-Q7 LGALS1 CCL5 H2-T23 IL1B FGL2 IRF1 H2-M3 H2-D1 RAC2 TNF CD47 FCGR2B BAD PYCARD IL4RA PRDX2 RIPOR2 BCL6 RPS3 RUNX1 PIRB PTPN2 SOCS1 H2-DMB1 AP3B1 HMGB1 CEBPB GOLPH3 ITGB1 WNK1 SDC4 RHOA LGALS9 LILR4B MAP3K8 FLOT2 SELL SART1 PIK3CA RIPK2 NLRP3 PDCD1 JAK3 CCR2"
"406","GOBP_POSITIVE_REGULATION_OF_CYSTEINE_TYPE_ENDOPEPTIDASE_ACTIVITY",0.0148687557486167,0.143581775849593,0.380730400722792,-0.449876621362617,-1.44091972300013,124,"S100A9 S100A8 ANP32B NDUFA13 TNF RPS27L PML BAD PYCARD ARL6IP5 CTSH RPS3 BAK1 RACK1 HIP1 HMGB1 TRADD BCAP31 SENP1 HSPE1 FIS1 LGALS9 CASP8AP2 RIPK2 NLRP3 NLRP1A"
"407","GOBP_RESPONSE_TO_TOXIC_SUBSTANCE",0.00639355877831698,0.0936598704523082,0.407017918923954,-0.432881648604177,-1.44662050635107,178,"S100A9 APOE CCL5 PRDX4 SELENOW PIM1 CDKN1A GPX1 ESD TLR2 MT1 TXN1 PRDX2 PRXL2C HP RPS6KB1 BAK1 ALOX5AP TXNDC17"
"408","GOBP_ANTIGEN_RECEPTOR_MEDIATED_SIGNALING_PATHWAY",0.00356720336377883,0.0676876838277033,0.431707695803346,-0.417329641283088,-1.45008580253856,228,"H2-AB1 H2-EB1 H2-AA H2-Q7 PSMA4 PSMB8 GBP2 PSME2 H2-D1 PSMB4 FCGR2B CD79B LAT2 PSMB9 NECTIN2 STK11 PHPT1 PSME1 RPS3 RUNX1 PTPN2 PSMA7 PRKCB PSMB1 HRAS PLEKHA1 TRBC2 IKBKG THEMIS2 LCP2 PSMB7 WNK1 CHUK RAB29 LILR4B PSMB6 PIK3CA RIPK2 PSME4 PSMB3 PSMA2 MNDAL MAPK1 PSMC3 PSMD4 NFATC2 PSMD8 H2-Q10 NFKBIZ"
"409","GOBP_RIBONUCLEOSIDE_TRIPHOSPHATE_METABOLIC_PROCESS",0.0264573490233753,0.198823048601405,0.352487857583619,-0.490230305059319,-1.45041600820223,75,"MT-ATP8 PKM TMSB4X NME2 ATP5J2 PARP1 ATP5D ENO1 ATP5J MT-ATP6 NME4 ATP5E ATP5H ATP6V0C ITPA ALDOA ATP5G1 NME1 UCKL1 ATP5K ATP5O SLC25A13 ATP5B RAN ATP5G2 ATP5L ATP5C1 IMPDH2 NME3"
"410","GOBP_NEGATIVE_REGULATION_OF_HEMOPOIESIS",0.0139799324742838,0.139615378262913,0.380730400722792,-0.47660854298612,-1.45226015486313,86,"CD74 FGL2 IRF1 H2-M3 NME2 FCGR2B IL4RA PRDX2 BCL6 RUNX1 PIRB TRIB1 PTPN2 TMEM176A SOCS1 HMGB1"
"411","GOBP_MODULATION_OF_PROCESS_OF_OTHER_ORGANISM_INVOLVED_IN_SYMBIOTIC_INTERACTION",0.0197348178547181,0.167672314385049,0.352487857583619,-0.4802450426994,-1.45438196998816,83,"CCL12 APOE CCL5 EIF2AK2 IRGM1 CFL1 BAD PPIB HDAC1 PHB BCL2L1 RRAGA FMR1 CPSF4 ANXA2 HIPK2 RAB9 CHD1 PABPN1"
"412","GOBP_PLASMA_LIPOPROTEIN_PARTICLE_CLEARANCE",0.0216586099993628,0.177926672864025,0.352487857583619,-0.540735622829551,-1.45502678579558,42,"APOE LRPAP1 AP2S1 HNRNPK APOC2 APOBR MSR1 ANXA2 EHD1 NPC2 SOAT2 HMOX1 CLTA"
"413","GOBP_PROTEIN_TETRAMERIZATION",0.023515118620567,0.183999742608354,0.352487857583619,-0.497698668144131,-1.45640270120567,66,"H2-EB1 GBP5 PKD2 B2M RRM1 CBY1 SAMHD1 TRPM7 FARSA ALDOA HSD17B10 CBR4 THG1L NUDT21 SHMT2"
"414","GOBP_NEGATIVE_REGULATION_OF_CELL_ACTIVATION",0.0043592265504802,0.0760609873980338,0.407017918923954,-0.440222718938858,-1.45719921943855,169,"CD74 H2-EB1 APOE H2-Q7 H2-T23 FGL2 IRF1 TSPAN32 H2-M3 CD300LF H2-D1 FCGR2B IL4RA PRDX2 RIPOR2 BCL6 RHBDD3 MILR1 FGR CST7 RUNX1 PIRB PTPN2 SOCS1 HMGB1 CEBPB SDC4 PKN1 LGALS9 THOC1 AXL LILR4B"
"415","GOBP_POSITIVE_REGULATION_OF_LEUKOCYTE_MEDIATED_IMMUNITY",0.0148694118195285,0.143581775849593,0.380730400722792,-0.456013496500408,-1.45763192105962,114,"H2-EB1 H2-Q7 H2-T23 IL1B H2-K1 RSAD2 H2-M3 H2-D1 TNF DDX58 H2-Q4 NECTIN2 SCIMP B2M"
"416","GOBP_REGULATION_OF_ADAPTIVE_IMMUNE_RESPONSE",0.00898239483859407,0.112274302319084,0.380730400722792,-0.443637145108614,-1.46239343638279,154,"H2-EB1 H2-Q7 H2-T23 IL1B H2-K1 IRF7 IRF1 RSAD2 H2-M3 H2-D1 TNF FCGR2B PYCARD H2-Q4 IL4RA NECTIN2 BCL6 ADCY7 B2M PIRB PLA2G4A HMGB1 PKN1 THOC1 LILR4B HMCES RIPK2 NLRP3 JAK3 CCR2"
"417","GOBP_REGULATION_OF_RHO_PROTEIN_SIGNAL_TRANSDUCTION",0.0191187428248572,0.164810848324754,0.352487857583619,-0.500241091089563,-1.46520101524735,68,"APOE STMN1 AKAP13 EPS8 NRP1 RIPOR2 BCL6 ARHGDIB STARD8"
"418","GOBP_NEGATIVE_REGULATION_OF_LYMPHOCYTE_ACTIVATION",0.00721162803581041,0.0995204668941837,0.407017918923954,-0.454498235521685,-1.46688233123356,136,"CD74 H2-EB1 H2-Q7 H2-T23 FGL2 IRF1 H2-M3 H2-D1 FCGR2B IL4RA PRDX2 RIPOR2 BCL6 RHBDD3 FGR RUNX1 PIRB PTPN2 SOCS1 HMGB1 CEBPB SDC4 PKN1 LGALS9 THOC1 AXL LILR4B"
"419","GOBP_POSITIVE_REGULATION_OF_PEPTIDASE_ACTIVITY",0.00517749902785397,0.0839029551043817,0.407017918923954,-0.44481186561357,-1.46850169248963,162,"S100A9 S100A8 FN1 ANP32B NDUFA13 PSME2 PRELID1 TNF RPS27L PML BAD PYCARD ARL6IP5 PSME1 CTSH RPS3 BAK1 RACK1 PSENEN HIP1 PICALM HMGB1 STAT3 TRADD BCAP31 APH1C SENP1 HSPE1 FIS1 LGALS9 CASP8AP2 RIPK2 NLRP3 NLRP1A PSME4 NCSTN PIDD1 GRN BEX3 ADRM1 SMAD3 XDH"
"420","GOBP_NEGATIVE_REGULATION_OF_RESPONSE_TO_EXTERNAL_STIMULUS",0.000790905914330287,0.0278636853267252,0.477270815362862,-0.417437498918689,-1.4702139971942,276,"SPP1 H2-EB1 APOE CCL2 H2-Q7 H2-T23 PARP14 MIF FGL2 RPS19 GPX1 DHX58 H2-M3 H2-D1 NLRC5 TNF PSMB4 SOCS3 FCGR2B NRP1 NR1H2 PRDX2 TFPI CST7 PIRB TRIB1 PTPN2 SAMHD1 NMI"
"421","GOBP_LEUKOCYTE_MEDIATED_CYTOTOXICITY",0.012753059829918,0.132390126981647,0.380730400722792,-0.473772901469458,-1.47119565098365,96,"H2-EB1 H2-Q7 H2-T23 CLEC2D H2-K1 CTSC H2-M3 H2-D1 FCGR2B H2-Q4 NECTIN2 CTSH B2M TUBB4B PIRB TUBB5"
"422","GOBP_POSITIVE_REGULATION_OF_VIRAL_PROCESS",0.0138291714547323,0.138718164768395,0.380730400722792,-0.484494265524311,-1.47361846149563,85,"CD74 H2-EB1 LGALS1 CCL5 PPIA POLR2B POLR2L POLR2F FMR1 CHMP2A HACD3 SRPK2 PKN2 P4HB CHMP4B LGALS9 AXL POLR2I CHMP3"
"423","GOBP_REGULATION_OF_CD4_POSITIVE_ALPHA_BETA_T_CELL_DIFFERENTIATION",0.0362071225933311,0.239661680654113,0.321775918075361,-0.53648907382341,-1.47813619322974,48,"H2-EB1 IL4RA BCL6 RUNX1 SOCS1 HMGB1 LGALS9 RIPK2 NLRP3 JAK3 SH3RF1 IL12B NFKBIZ HLX"
"424","GOBP_MODULATION_BY_HOST_OF_SYMBIONT_PROCESS",0.0260734466678985,0.196912895730696,0.352487857583619,-0.528246068929979,-1.48081943814251,52,"CCL12 APOE CCL5 CFL1 PPIB HDAC1 PHB FMR1 ANXA2 RAB9 CHD1"
"425","GOBP_POSITIVE_REGULATION_OF_I_KAPPAB_KINASE_NF_KAPPAB_SIGNALING",0.00519057352034855,0.0839029551043817,0.407017918923954,-0.447140580289663,-1.48100006323022,165,"CD74 H2-EB1 BST2 LGALS1 UBE2V1 MIER1 TNF AKAP13 TMEM106A TERF2IP TRIM30A SHISA5 S100A4 REL BIRC2 TRIM25 PRKCB SLC35B2 SHARPIN IKBKG TRADD TLR6 TMEM9B CHUK RHOA LGALS9 FLNA PPM1A S100A13 ZDHHC13 RIPK2 TRIM34A PIM2 CANT1 HMOX1"
"426","GOBP_NUCLEOSIDE_TRIPHOSPHATE_METABOLIC_PROCESS",0.00746890431206431,0.101512777570903,0.407017918923954,-0.479136379214762,-1.4823719457927,95,"MT-ATP8 PKM TMSB4X NME2 ATP5J2 PARP1 ATP5D ENO1 ATP5J MT-ATP6 NME4 ATP5E TBPL1 SAMHD1 ATP5H ATP6V0C ITPA ALDOA SMPDL3A ATP5G1 NME1 UCKL1 ATP5K ATP5O SLC25A13 ATP5B RAN ATP5G2 ATP5L ATP5C1 IMPDH2 DTYMK NME3"
"427","GOBP_POSITIVE_REGULATION_OF_ALPHA_BETA_T_CELL_ACTIVATION",0.016002837968932,0.149528537428372,0.352487857583619,-0.514819908448329,-1.48646458452441,61,"H2-EB1 H2-Q7 H2-T23 H2-D1 IL4RA RUNX1 SOCS1 AP3B1 LGALS9 LILR4B RIPK2 NLRP3 CCR2 IL12B H2-Q10 NFKBIZ HLX"
"428","GOBP_POSITIVE_REGULATION_OF_LEUKOCYTE_CHEMOTAXIS",0.0177093300125094,0.157863423571377,0.352487857583619,-0.502684168148059,-1.4872625315637,75,"CD74 CXCL10 CCL5 CCL7 GAS6 RAC2 CALR RIPOR2 MOSPD2 CMKLR1 HMGB1 CCR1 WNK1 LGALS9"
"429","GOBP_GENERATION_OF_PRECURSOR_METABOLITES_AND_ENERGY",5.35359863818437e-05,0.00460005437703616,0.557332238758646,-0.409185691135102,-1.49049134397915,439,"GAPDH NDUFB11 PGK1 NDUFA4 MT-ATP8 COX6A2 COX6C NDUFA13 PKM COX6A1 NDUFA11 CYBB PRELID1 NDUFC1 NDUFA1 NDUFB5 MT-ND3 UQCR10 ATP5J2 UQCC2 NDUFA10 NDUFA2 UQCRQ COX8A COX6B1 MT-ND4L ATP5D DHDH COX7A2 SLC2A6 ENO1 COX4I1 COX7B COX7C IDH3B ATP5J SURF1 PRXL2C NDUFB10 CISD1 FH1 NDUFB8 CS PANK2 NDUFV2 SUCLG1 MT-ATP6 COX5B ATP5E NDUFV3 UQCRB PYGB ATPIF1 ATP5H NDUFA7 UQCR11 AKT2 PGAM1 ETFB PNPT1 COX11 GPI1 DNAJC15 HMGB1 AKR1B3 ALDOA PPP1CA ATP5G1 NDUFC2 SDHB CALM1 NDUFA8 GLRX ATP5K TALDO1 COX5A NCF1 ME2 MT-CO3 ALDH2 NCOR1 GLRX2 TPI1 ATP5O NDUFB9 GYG BNIP3 SLC25A13 PPP1R3D NUP98 NCF2 FXN NUPL2 PIK3CA CHCHD10 ATP5B NUP188 NDUFS7 ACADVL PFKFB4 ATP5G2 FDXR ATP5L LDHA NDUFV1 CROT NDUFB4 RPIA SUCLG2 SHMT2 ATP5C1 AGL PPP1CC GALK1 IRS2 XDH NUP210 ARNT"
"430","GOBP_POSITIVE_REGULATION_OF_IMMUNE_EFFECTOR_PROCESS",0.00183597504804002,0.0475079587416111,0.45505986738723,-0.443180917420814,-1.49194945769092,191,"CD74 H2-EB1 H2-Q7 H2-T23 IL1B CD244A H2-K1 RPS19 RSAD2 DHX58 H2-M3 H2-D1 RAC2 TNF DDX58 H2-Q4 IL4RA NECTIN2 SCIMP B2M FGR PHB PIRB H2-DMB1 GPI1 SLAMF6"
"431","GOBP_NEGATIVE_REGULATION_OF_INFLAMMATORY_RESPONSE",0.00785997566332716,0.104356644812804,0.380730400722792,-0.477971607744058,-1.49416980774081,101,"H2-EB1 APOE RPS19 GPX1 PSMB4 SOCS3 FCGR2B CST7 PTPN2 SHARPIN ACOD1 METRNL NLRP3 GBA CALCRL RB1 ALOX5 GRN SMAD3 IL12B"
"432","GOBP_TONGUE_DEVELOPMENT",0.0325304611379377,0.22389595517242,0.321775918075361,-0.761481316092793,-1.49581826927734,10,"HDAC1"
"433","GOBP_T_HELPER_1_TYPE_IMMUNE_RESPONSE",0.0334267253208618,0.226941912679515,0.321775918075361,-0.561049931146385,-1.4967553848449,39,"H2-EB1 IL1B IL4RA PLA2G4A HRAS HMGB1 IL18BP RIPK2 JAK3 CCR2 BCL3 IL12B HLX"
"434","GOBP_NEGATIVE_REGULATION_OF_IMMUNE_SYSTEM_PROCESS",0.000192667501165015,0.0108321950654997,0.518848077743792,-0.422386451686188,-1.49725206431033,328,"CD74 H2-EB1 BST2 CCL2 H2-Q7 H2-T23 PARP14 MIF FGL2 RPS19 GPX1 IRF1 TSPAN32 DHX58 H2-M3 GBP2 CD300LF H2-D1 NLRC5 NME2 TNF CD47 PSMB4 FCGR2B NR1H2 IL4RA PRDX2 PHPT1 RIPOR2 BCL6 RHBDD3 MILR1 FGR CST7 RUNX1 PIRB TRIB1 PTPN2 SAMHD1 TMEM176A NMI SOCS1 HMGB1 CEBPB ACOD1 NME1 H2-OA WASL SDC4 PKN1 LGALS9 THOC1 AXL LILR4B"
"435","GOBP_REGULATION_OF_MONOOXYGENASE_ACTIVITY",0.0310609804406895,0.217283724926114,0.352487857583619,-0.544039936124738,-1.49894035011246,48,"APOE IL1B TNF S100A1 CALM3 TERF2 POR CALM1 WASL"
"436","GOBP_POSITIVE_REGULATION_OF_RESPONSE_TO_CYTOKINE_STIMULUS",0.0251796880160389,0.192841731033105,0.352487857583619,-0.530337707575665,-1.50091012035636,55,"CD74 ZBP1 PARP14 IRF7 IRGM1 GAS6 CD300LF NLRC5 TLR2 DDX58"
"437","GOBP_ERK1_AND_ERK2_CASCADE",0.000934926604135168,0.0301961401080252,0.477270815362862,-0.436675450755959,-1.50871127794653,225,"CD74 H2-EB1 CCL12 APOE CCL2 CCL5 FN1 IL1B MIF CCL7 GAS6 GBP2 GCNT2 TNF NRP1 PYCARD PIN1 SCIMP PRXL2C ABCA7 CTSH RAP1B VRK3 PHB PTPN2 GNAI2 HRAS"
"438","GOBP_INNER_MITOCHONDRIAL_MEMBRANE_ORGANIZATION",0.018382601707868,0.161764954353191,0.352487857583619,-0.534012701530084,-1.50880349400977,54,"MT-ATP8 TIMM10B NDUFA13 ATP5J2 ATP5D OMA1 ATP5J MT-ATP6 ATP5E TIMM13 ATP5H MICOS13 ATP5G1 ATP5K MTX1 ATP5O CHCHD10 ATP5B APOOL ATP5G2 ATP5L ROMO1 ATP5C1"
"439","GOBP_T_CELL_RECEPTOR_SIGNALING_PATHWAY",0.00218782042891405,0.0529964586876307,0.431707695803346,-0.450054361101258,-1.50899256448309,180,"H2-AB1 H2-EB1 H2-AA H2-Q7 PSMA4 PSMB8 GBP2 PSME2 H2-D1 PSMB4 PSMB9 NECTIN2 STK11 PHPT1 PSME1 RPS3 PTPN2 PSMA7 PSMB1 HRAS TRBC2 IKBKG THEMIS2 LCP2 PSMB7 WNK1 CHUK RAB29 LILR4B PSMB6 PIK3CA RIPK2 PSME4 PSMB3 PSMA2 MAPK1 PSMC3 PSMD4 PSMD8 H2-Q10 NFKBIZ"
"440","GOBP_CD8_POSITIVE_ALPHA_BETA_T_CELL_PROLIFERATION",0.0295581615516262,0.211547639430774,0.352487857583619,-0.769854664029931,-1.51226648219431,10,"H2-Q7 H2-T23 IRF1 H2-D1"
"441","GOBP_INTRINSIC_APOPTOTIC_SIGNALING_PATHWAY_BY_P53_CLASS_MEDIATOR",0.0148319518977538,0.143581775849593,0.380730400722792,-0.517124227832624,-1.51324721258089,66,"CD74 MIF CDKN1A RPS27L PML PYCARD SHISA5 STK11 HNRNPK RPS7 RPL11 RPL26 HIPK2"
"442","GOBP_NEGATIVE_REGULATION_OF_LEUKOCYTE_APOPTOTIC_PROCESS",0.0280961386603803,0.204842717407595,0.352487857583619,-0.561674841420432,-1.5133674533261,41,"CD74 CCL5 IRF7 GAS6 BCL6 PIRB"
"443","GOBP_REGULATION_OF_NATURAL_KILLER_CELL_ACTIVATION",0.034277095863878,0.229893806427247,0.321775918075361,-0.58356762418647,-1.51385817406894,35,"H2-Q7 H2-T23 GAS6 H2-M3 H2-D1 RHBDD3 FGR BLOC1S3 AXL IL15 IL12B H2-Q10"
"444","GOBP_ADAPTIVE_IMMUNE_RESPONSE",0.000112866274364722,0.00829020989446685,0.538434096309916,-0.424975106759936,-1.52435126873397,362,"CD74 H2-AB1 H2-EB1 H2-AA H2-Q7 H2-T23 IL1B CD244A H2-K1 IRF7 TAP1 H2-DMA CTSC C4B IRF1 RSAD2 H2-M3 H2-D1 TNF FCGR2B CD79B PYCARD LAT2 H2-Q4 IL4RA NECTIN2 CTSL FCGR1 BCL6 ADCY7 CTSH B2M PHB PIRB DBNL PRKCB PLA2G4A HRAS FCER1G H2-DMB1 TRBC2 SLAMF6 HMGB1 STAT3 H2-OA IL18BP CLEC4D NFKB2 PKN1 THOC1 LILR4B HMCES RIPK2 NLRP3 PDCD1 JAK3 CCR2 BCL3 TAP2"
"445","GOBP_NUCLEOSIDE_TRIPHOSPHATE_BIOSYNTHETIC_PROCESS",0.0102512024886952,0.117888828619995,0.380730400722792,-0.515767895632952,-1.52787556083652,73,"MT-ATP8 PKM TMSB4X NME2 ATP5J2 PARP1 ATP5D ENO1 ATP5J MT-ATP6 NME4 ATP5E TBPL1 ATP5H ATP6V0C ALDOA ATP5G1 NME1 UCKL1 ATP5K ATP5O SLC25A13 ATP5B ATP5G2 ATP5L ATP5C1 IMPDH2 DTYMK NME3"
"446","GOBP_INTRINSIC_APOPTOTIC_SIGNALING_PATHWAY_IN_RESPONSE_TO_DNA_DAMAGE",0.00844581373652014,0.108650383491844,0.380730400722792,-0.499114449039631,-1.52829450979175,91,"CD74 MIF CDKN1A TNF RPS27L PML BAD PYCARD SHISA5 HNRNPK RPS3 BCL2L1 BAK1 POLB RPL26 NACC2 HIPK2 MCL1 BCL2L2 BCL3 CRIP1 HMOX1"
"447","GOBP_GLYCOLYTIC_PROCESS_THROUGH_FRUCTOSE_6_PHOSPHATE",0.0337066747350096,0.227624053863143,0.321775918075361,-0.627340368546915,-1.53053794346584,24,"GAPDH PGK1 PKM ENO1 PGAM1 GPI1 ALDOA TPI1"
"448","GOBP_MODULATION_OF_PROCESS_OF_OTHER_ORGANISM",0.00301247016695698,0.0632202264530971,0.431707695803346,-0.497446104590672,-1.53901933140115,95,"S100A9 CCL12 APOE CCL5 EIF2AK2 IRGM1 CFL1 BAD PPIB HDAC1 PHB BCL2L1 RRAGA FMR1 CPSF4 ANXA2 HIPK2 RAB9 CHD1 PABPN1"
"449","GOBP_ANDROGEN_METABOLIC_PROCESS",0.0332651781134181,0.226498051042463,0.321775918075361,-0.675559086399756,-1.53953641464946,18,"SPP1 PLEKHA1 HSD17B10"
"450","GOBP_ACUTE_INFLAMMATORY_RESPONSE",0.00884213292863711,0.111543139493112,0.380730400722792,-0.512895607207058,-1.54237523533126,80,"S100A8 FN1 H2-T23 IL1B TNF FCGR2B HP RHBDD3"
"451","GOBP_POSITIVE_REGULATION_OF_INFLAMMATORY_RESPONSE",0.00484449454327995,0.0817104746299884,0.407017918923954,-0.492425547192042,-1.54403360619427,104,"S100A9 S100A8 H2-T23 ZBP1 IL1B CTSC RPS19 NEAT1 TNF CD47 TLR2 IFI35 NMI CEBPB TRADD"
"452","GOBP_RIBONUCLEOSIDE_TRIPHOSPHATE_BIOSYNTHETIC_PROCESS",0.0110575919510507,0.123120473704364,0.380730400722792,-0.531609230783969,-1.54531978494163,62,"MT-ATP8 PKM TMSB4X NME2 ATP5J2 PARP1 ATP5D ENO1 ATP5J MT-ATP6 NME4 ATP5E ATP5H ATP6V0C ALDOA ATP5G1 NME1 UCKL1 ATP5K ATP5O SLC25A13 ATP5B ATP5G2 ATP5L ATP5C1 IMPDH2 NME3"
"453","GOBP_NEGATIVE_REGULATION_OF_SECRETION",0.00713237331080952,0.0995204668941837,0.407017918923954,-0.492533414626838,-1.54639868533848,103,"CD74 APOE H2-Q7 H2-T23 IL1B RSAD2 H2-M3 H2-D1 FCGR2B RAP1B ENY2 PIRB GNAI2 FMR1 KLF7 TIFAB ERP29 UCP2"
"454","GOBP_REGULATION_OF_MONOCYTE_DIFFERENTIATION",0.0322310369009885,0.223750216535216,0.321775918075361,-0.678899351889271,-1.54714856946942,18,"CD74 H2-EB1 IRF7"
"455","GOBP_PROTON_TRANSMEMBRANE_TRANSPORT",0.00377219305238107,0.0706936920186972,0.431707695803346,-0.483228665706333,-1.5477437192142,124,"NDUFA4 MT-ATP8 COX6A2 COX6C ATP1A1 COX6A1 TMSB4X ATP5J2 COX8A COX6B1 ATP5D COX7A2 COX4I1 COX7B COX7C ATP5J SURF1 SLC30A5 MT-ATP6 ATP5E ATP6V1H ATP5H ATP6V0C ATP5G1 UCP2 ATP5K COX5A MT-CO3 ATP5O TMCO3 ATP5B NDUFS7 ATP6V1B2 SLC25A3 ATP5G2 ATP5L"
"456","GOBP_MULTICELLULAR_ORGANISMAL_RESPONSE_TO_STRESS",0.0269064881300598,0.199889160996094,0.352487857583619,-0.600893958103157,-1.55091518889587,34,"APOE TSPO RPS6KB1"
"457","GOBP_CELLULAR_OXIDANT_DETOXIFICATION",0.00748974379969773,0.101512777570903,0.407017918923954,-0.523680081544372,-1.55131407957569,73,"S100A9 APOE PRDX4 SELENOW GPX1 TXN1 PRDX2 PRXL2C HP ALOX5AP TXNDC17"
"458","GOBP_FIBROBLAST_PROLIFERATION",0.0173128524749159,0.156966501280604,0.352487857583619,-0.532876898193656,-1.55187612790966,67,"CD74 IFI30 FN1 MIF CDKN1A GAS6 PML MORC3 ZMPSTE24 FTH1 S100A6"
"459","GOBP_POSITIVE_T_CELL_SELECTION",0.0269064881300598,0.199889160996094,0.352487857583619,-0.60128188826082,-1.551916441722,34,"CD74 CTSL STK11 PTPN2 SLAMF6 STAT3"
"460","GOBP_NEGATIVE_REGULATION_OF_DEFENSE_RESPONSE",0.000899366072906151,0.0294902029394604,0.477270815362862,-0.471304148043199,-1.55271592451456,166,"H2-EB1 APOE H2-Q7 H2-T23 PARP14 FGL2 RPS19 GPX1 DHX58 H2-M3 H2-D1 NLRC5 PSMB4 SOCS3 FCGR2B NR1H2 CST7 PIRB PTPN2 SAMHD1 NMI SHARPIN ACOD1 METRNL LGALS9 NLRP3 GBA CALCRL RB1 ALOX5 TTLL12 GRN"
"461","GOBP_MYELOID_LEUKOCYTE_CYTOKINE_PRODUCTION",0.0290202334773524,0.209956992887982,0.352487857583619,-0.636854806694857,-1.55375055551233,24,"CD74 H2-M3 DDX58 BCL6 PIRB"
"462","GOBP_ASTROCYTE_DEVELOPMENT",0.0261431964860404,0.197112776154682,0.352487857583619,-0.602104860460713,-1.55404054376636,34,"S100A9 S100A8 TNF VIM"
"463","GOBP_POSITIVE_REGULATION_OF_OXIDOREDUCTASE_ACTIVITY",0.0234644406918065,0.183999742608354,0.352487857583619,-0.571611459344746,-1.5550812281123,43,"APOE IL1B TNF S100A1 CALM3 GNAI2 TERF2 POR CALM1 FXN"
"464","GOBP_MITOCHONDRIAL_RESPIRATORY_CHAIN_COMPLEX_ASSEMBLY",0.00386434133058308,0.0713445933854417,0.431707695803346,-0.501073321307543,-1.55605168783896,97,"NDUFB11 NDUFA13 PET100 NDUFA11 NDUFC1 NDUFA1 NDUFB5 MT-ND3 UQCC2 NDUFA10 NDUFA2 COX20 OMA1 SURF1 NDUFB10 NDUFB8 NDUFV2 NDUFV3 NDUFA7 NDUFC2 NDUFA8 TIMM21 NDUFB9 DMAC1 NDUFS7 BCS1L ECSIT NDUFV1 NDUFB4 COA3 COA5 COX19 DMAC2 NDUFA12 NDUFAF6 NDUFS3 COX14 NDUFS5"
"465","GOBP_AEROBIC_RESPIRATION",0.00717556989563136,0.0995204668941837,0.407017918923954,-0.517859245283859,-1.55730184483859,80,"NDUFA4 COX6A2 COX6C COX6A1 UQCR10 COX8A COX6B1 ATP5D COX4I1 COX7B COX7C IDH3B SURF1 FH1 CS PANK2 SUCLG1 COX5B UQCRB SDHB COX5A ME2 MT-CO3 BNIP3 FXN NDUFS7"
"466","GOBP_CRISTAE_FORMATION",0.024616614423005,0.189364969733724,0.352487857583619,-0.603577671213451,-1.55784188764074,34,"MT-ATP8 ATP5J2 ATP5D OMA1 ATP5J MT-ATP6 ATP5E ATP5H MICOS13 ATP5G1 ATP5K ATP5O CHCHD10 ATP5B APOOL ATP5G2 ATP5L ATP5C1"
"467","GOBP_REGULATION_OF_PLASMA_LIPOPROTEIN_PARTICLE_LEVELS",0.0105943167446043,0.120016215062009,0.380730400722792,-0.532767340288449,-1.55902324674406,66,"APOE LRPAP1 AP2S1 NR1H2 HNRNPK ABCA7 APOC2 APOBR MSR1 PRKACB ANXA2 P4HB EHD1 NPC2 ARF1 MTTP SOAT2 HMOX1"
"468","GOBP_DEFENSE_RESPONSE_TO_GRAM_POSITIVE_BACTERIUM",0.00767353891537577,0.103052384233639,0.407017918923954,-0.544632817713123,-1.5595772013448,59,"H2-Q7 H2-T23 GBP2 H2-D1 GBP4 TNF TLR2 RPL39 TNFSF8 HMGB2 FGR PGLYRP1 GBP9 PPP1R11 GBP3"
"469","GOBP_DIVALENT_INORGANIC_CATION_HOMEOSTASIS",2.87538134258983e-05,0.00304522944980328,0.575610261071129,-0.437962230191405,-1.56006838791077,336,"S100A9 S100A8 CCL12 APOE CXCL10 CD52 CCL2 CCL5 CCL7 SLC39A14 SMDT1 CALR MT1 PML PKD2 MCUB SRI ATP13A3 CALM3 SLC30A5 CXCR2 TRIM24 ATP13A1 BAK1 PRKCB CMKLR1 TRPM7 AP3B1 HMGB1 CCR1 GNA13 STIM1 HSP90B1 BCAP31 FIS1 CALM1 SELENOT BNIP3 TMEM165 CAMK2D"
"470","GOBP_REGULATION_OF_COLLATERAL_SPROUTING",0.0183295153372858,0.161764954353191,0.352487857583619,-0.794644101132636,-1.56096169259499,10,"SPP1 IST1"
"471","GOBP_ENERGY_DERIVATION_BY_OXIDATION_OF_ORGANIC_COMPOUNDS",0.000119197347667384,0.00846969682786545,0.538434096309916,-0.448491491471158,-1.56140516059435,243,"NDUFB11 NDUFA4 COX6A2 COX6C NDUFA13 COX6A1 NDUFA11 PRELID1 NDUFC1 NDUFA1 NDUFB5 MT-ND3 UQCR10 NDUFA10 NDUFA2 UQCRQ COX8A COX6B1 MT-ND4L ATP5D COX4I1 COX7B COX7C IDH3B SURF1 NDUFB10 CISD1 FH1 NDUFB8 CS PANK2 NDUFV2 SUCLG1 COX5B NDUFV3 UQCRB PYGB NDUFA7 UQCR11 AKT2 ETFB PNPT1 DNAJC15 HMGB1 PPP1CA NDUFC2 SDHB CALM1 NDUFA8 COX5A ME2 MT-CO3 NDUFB9 GYG BNIP3 SLC25A13 PPP1R3D FXN PIK3CA NDUFS7 ACADVL"
"472","GOBP_NEGATIVE_REGULATION_OF_RESPONSE_TO_BIOTIC_STIMULUS",0.00401076035306422,0.0717784691580962,0.407017918923954,-0.512588459175727,-1.56189352049712,86,"H2-Q7 H2-T23 PARP14 FGL2 RPS19 DHX58 H2-M3 H2-D1 NLRC5 NR1H2 PRDX2 PIRB TRIB1 PTPN2 SAMHD1 NMI"
"473","GOBP_MYELOID_LEUKOCYTE_MIGRATION",0.000775805186465535,0.0278636853267252,0.477270815362862,-0.472169981563746,-1.56294915954251,169,"CD74 S100A9 S100A8 CCL12 CXCL10 CCL2 CCL5 MIF CCL7 RPS19 RAC2 CD47 PPIA PPIB BSG RHOG RIPOR2 CXCR2 MOSPD2 FCER1G CMKLR1 HMGB1 CCR1"
"474","GOBP_LOW_DENSITY_LIPOPROTEIN_PARTICLE_REMODELING",0.0179992628155302,0.160095005589697,0.352487857583619,-0.795758868293896,-1.56315148904903,10,"APOE"
"475","GOBP_POSITIVE_REGULATION_OF_B_CELL_PROLIFERATION",0.0185150082690387,0.161989926037078,0.352487857583619,-0.598779689489974,-1.56481907657808,36,"CD74 MIF CDKN1A BCL6"
"476","GOBP_POSITIVE_REGULATION_OF_FATTY_ACID_METABOLIC_PROCESS",0.0337765520678286,0.227624053863143,0.321775918075361,-0.643906566734457,-1.56495456200366,23,"CD74 IL1B NR1H2 APOC2 AKT2 CPT1A MLYCD LPGAT1 IRS2"
"477","GOBP_RECEPTOR_CLUSTERING",0.0171565902355801,0.156575374614893,0.352487857583619,-0.572902181843524,-1.56542985337108,45,"APOE FLNA SSH1 RER1 SCRIB MESD ITGAL ITGB2 DLG1 PICK1 DLG3 ITGB7 LRP4 SYNGAP1 ITGB1BP1 SYNJ2BP GPHN"
"478","GOBP_NEGATIVE_REGULATION_OF_IMMUNE_RESPONSE",0.00195477709615999,0.0494558605328476,0.431707695803346,-0.490661224057416,-1.56808226900881,122,"H2-EB1 H2-Q7 H2-T23 PARP14 FGL2 RPS19 GPX1 DHX58 H2-M3 H2-D1 NLRC5 PSMB4 FCGR2B NR1H2 IL4RA BCL6 PIRB PTPN2 SAMHD1 NMI ACOD1 LGALS9 THOC1 LILR4B PDCD1 JAK3 CCR2 TTLL12 HMOX1 GRN"
"479","GOBP_NEGATIVE_REGULATION_OF_STEROID_METABOLIC_PROCESS",0.0324428928117381,0.22389595517242,0.321775918075361,-0.692938331847012,-1.57179513502823,17,"APOE ATP1A1"
"480","GOBP_MITOCHONDRIAL_DEPOLARIZATION",0.0253367721130116,0.193596745306468,0.352487857583619,-0.6900904382418,-1.572652015883,18,"TSPO PARP1 ATPIF1 RACK1"
"481","GOBP_RNA_CATABOLIC_PROCESS",1.48280593245172e-05,0.00177702584641714,0.593325476396405,-0.435561963673776,-1.57558245342586,390,"RPS2 RPSA RPS26 UBA52 RPL38 RPL37A RPS19 RNASET2A RPL37 PSMA4 RPS8 SERBP1 RPL35 RPL32 PSMB8 RPS20 LSM4 RPL22 PSME2 RPS15A RPL36 RPS18 RPS28 RPL19 HNRNPM RPS27 PSMB4 RPL15 RPL39 RPL18 RPL9 RPL31 RPLP0 RPL10A RPL8 PSMB9 RPL14 RPL23 RPL28 TAF15 RPL35A RPS27A MAPKAPK2 RPS5 VIM PSME1 RPS24 RPS29 RPS3 ETF1 DNA2 RPS7 RPL29 RPL34 YTHDF1 RPLP2 UPF3B PSMA7 FMR1 RPL36A OAS2 PSMB1 UPF2 ZFP36 PNPT1 RPS21 RPL27 MTPAP RPL27A RNH1 RPS10 YBX3 SND1 DCP2 RPL11 RPL26 RPS16 DIS3 RNASEL RPS17 TENT4B CNOT2 RPS25 RPS11 RPL13 PSMB7 SLFN9 SKIV2L RPL18A LSM7 RPL7A XRN2 RPL3 RPL24 ZCCHC8 ZC3HAV1 GIGYF2 RPS14 RPS13 RNASEH2C NPM1 ZFP36L1 RNASEH2B PSMB6"
"482","GOBP_REVERSE_CHOLESTEROL_TRANSPORT",0.0330450781141683,0.225618119538115,0.321775918075361,-0.768315314085637,-1.57713451698868,12,"APOE APOC2"
"483","GOBP_REGULATION_OF_LEUKOCYTE_PROLIFERATION",0.000358505578433115,0.0164912566079233,0.49849310876659,-0.463009750002184,-1.57754942658952,204,"CD74 H2-EB1 CCL12 BST2 H2-Q7 CCL5 H2-T23 IL1B MIF CDKN1A IRF1 H2-M3 H2-D1 RAC2 FCGR2B PYCARD BCL6 TNFSF8 RPS3 PIRB H2-DMB1 HMGB1 CEBPB SDC4 PKN1 LGALS9 LILR4B RIPK2 JAK3 CCR2 SH3RF1 IL15 CLCF1 MNDAL MAPK1 SCRIB NFATC2 IRS2 IL12B IGFBP2 H2-Q10 VCAM1 AIF1"
"484","GOBP_LYMPHOCYTE_MEDIATED_IMMUNITY",0.000302408251269551,0.0146507146412929,0.49849310876659,-0.459383371059828,-1.58059646476887,222,"CD74 H2-AB1 H2-EB1 H2-Q7 H2-T23 IL1B CLEC2D H2-K1 IRF7 CTSC C4B RSAD2 H2-M3 H2-D1 TNF FCGR2B H2-Q4 IL4RA NECTIN2 BCL6 CTSH B2M TUBB4B PIRB TUBB5 FCER1G TRBC2 SLAMF6 HMGB1"
"485","GOBP_DENDRITIC_CELL_DIFFERENTIATION",0.0130263396834162,0.134516895506298,0.380730400722792,-0.579773227389904,-1.58064782224192,44,"H2-Q7 H2-T23 GAS6 H2-M3 H2-D1 FCGR2B PIRB TMEM176A HMGB1 CEBPB AZI2 LGALS9 AXL"
"486","GOBP_PROTEIN_CONTAINING_COMPLEX_REMODELING",0.034220470603191,0.22985254148515,0.321775918075361,-0.661358636844037,-1.58087993070561,21,"APOE APOC2"
"487","GOBP_RESPONSE_TO_FUNGUS",0.0266500093706284,0.199612076766187,0.352487857583619,-0.62580338971891,-1.58167070891845,30,"S100A9 S100A8 GAPDH SCIMP BAK1 COTL1"
"488","GOBP_THYMIC_T_CELL_SELECTION",0.0232684975061239,0.183999742608354,0.352487857583619,-0.694100510726962,-1.58179059863702,18,"CD74 STK11 PTPN2"
"489","GOBP_REGULATION_OF_LEUKOCYTE_CHEMOTAXIS",0.00286006179410926,0.0611489268092656,0.431707695803346,-0.509625511557764,-1.58260997683117,97,"CD74 CXCL10 CCL2 CCL5 MIF CCL7 GAS6 RAC2 CALR RIPOR2 MOSPD2 CMKLR1 HMGB1 CCR1 WNK1 LGALS9 MPP1 DDT CCR2"
"490","GOBP_POSITIVE_REGULATION_OF_T_CELL_CYTOKINE_PRODUCTION",0.0270901414291756,0.199889160996094,0.352487857583619,-0.657274796525536,-1.58320986242126,22,"H2-Q7 IL1B RSAD2 H2-D1 B2M"
"491","GOBP_DETOXIFICATION",0.00505828036151794,0.0837651227867371,0.407017918923954,-0.51256354317784,-1.58328733002255,93,"S100A9 APOE PRDX4 SELENOW PIM1 GPX1 ESD MT1 TXN1 PRDX2 PRXL2C HP ALOX5AP TXNDC17"
"492","GOBP_POSITIVE_REGULATION_OF_LEUKOCYTE_PROLIFERATION",0.00153184805474553,0.0430619508722911,0.45505986738723,-0.493859833584876,-1.58343457775659,126,"CD74 BST2 H2-Q7 CCL5 H2-T23 IL1B MIF CDKN1A H2-D1 PYCARD BCL6 RPS3 PIRB H2-DMB1 HMGB1 LGALS9 RIPK2 JAK3 CCR2 IL15 CLCF1 MAPK1 NFATC2 IRS2 IL12B IGFBP2 H2-Q10 VCAM1 AIF1"
"493","GOBP_RESPONSE_TO_NUTRIENT",0.00386363905034098,0.0713445933854417,0.431707695803346,-0.492757609320242,-1.58378053064167,125,"SPP1 CXCL10 TSPO PIM1 GAS6 PKM CYBB FOLR2 COX4I1 GNPAT TRIM24 ARSB RPS6KB1 GNAI2 TRIM25"
"494","GOBP_RESPONSE_TO_INTERLEUKIN_4",0.0156954902539468,0.147992349488318,0.352487857583619,-0.623513994367272,-1.58426305619599,32,"PARP14 CD300LF MRC1 PML RPLP0 IL4RA PTPN2 TUBA1B FASN RPL3 JAK3 ALAD"
"495","GOBP_KILLING_OF_CELLS_IN_OTHER_ORGANISM_INVOLVED_IN_SYMBIOTIC_INTERACTION",0.030425736778049,0.213825316801289,0.352487857583619,-0.698745113583216,-1.58496668415989,17,"GAPDH BAD"
"496","GOBP_RESPONSE_TO_GAMMA_RADIATION",0.0154541753161966,0.146621488312415,0.380730400722792,-0.575892094375592,-1.58669950540621,48,"CXCL10 CCL7 CDKN1A GPX1 PARP1 PML BAK1 ZMPSTE24 HRAS POLB RPL26 GTF2H5"
"497","GOBP_NEGATIVE_REGULATION_OF_MULTI_ORGANISM_PROCESS",0.0300209597920883,0.21262123000493,0.352487857583619,-0.756626741149803,-1.5871269497398,13,"BST2 PRDX2 TRIB1 ACOD1"
