"","pathway","pval","padj","log2err","ES","NES","size","leadingEdge"
"343","GOBP_CELL_PROJECTION_ASSEMBLY",0.0346238138275122,0.231537221983099,0.321775918075361,0.341485726946021,1.20634017619227,497,"P2RY12 TGFBR1 FSCN1 WASF2 RALA ATG3 HSP90AA1 NOTCH1 CYFIP1 PMP22 CSNK1D ATG5 RDX CFAP20 DYNC1H1 RAC1 ATP7A DNM2 VAV2 BBS9 PPP1R9A PPP2R1A RHOQ RAP2A ATAT1 ATXN10 SH2B1 POC1B ATP6V1D FGD2 SPATA13 CDC42EP3 RAB5A UBE2B S1PR1 ATP6V0D1 SDCCAG8 PIBF1 MAP4 CSNK1E CD2AP BRK1 TESK1 TNPO1 NCKAP1L TUBA1A PCM1 ANO6 CNTRL DCTN3 AKAP9 PIK3R1 DNAAF2 WAS PTPN23 HDAC6 PLEKHM1 ATMIN VDAC3 MKKS ARAP1 CKAP5 RO60 CEP83 CETN2 ARL3 PDGFA SNAP29 TBC1D7 NCK1 YWHAG P2RX7 TUBG1 YWHAE MAPRE1 PARVB CLUAP1 ZMYND8 ARHGEF6 HAUS4 CEP162 IFT74 SH3BP1 KIF3A CAPG ASAP1 RILPL1 TRPM2 CDC42 ACTR1A FGD4 IFT20 TTLL3 ADAMTS16 GAS8 CDK10"
"344","GOBP_POSITIVE_REGULATION_OF_PROTEOLYSIS",0.0336509626362147,0.227624053863143,0.321775918075361,-0.343459486083381,-1.22115582634864,310,"S100A9 S100A8 APOE FN1 IL1B ANP32B DAB2 CTSC NDUFA13 PSME2 PRELID1 TNF RPS27L PML BAD PYCARD ARL6IP5 ENO1 RHBDD1 PSME1 CHFR CTSH DDA1 RPS3 TRIB1 ATPIF1 FMR1 ELOB BAK1 RACK1 IST1 PSENEN HIP1 PICALM HMGB1 STAT3 TRADD BCAP31 APH1C SENP1 HSPE1 FIS1 MYH9 LGALS9 PLGRKT ADAM9 CASP8AP2 RIPK2 NLRP3 NLRP1A GBA PSME4 NCSTN HECTD1 PIDD1 GRN MNDAL BEX3 USP5 ADRM1 PSMC3 BBS7 SMAD3 XDH FBXO22"
"345","GOBP_REGULATION_OF_CELL_ACTIVATION",0.010991408981338,0.122683520835817,0.380730400722792,-0.33356122687583,-1.22677742235623,488,"CD74 H2-EB1 APOE CCL2 H2-Q7 LGALS1 CCL5 H2-T23 IL1B MIF FGL2 CDKN1A CTSC GAS6 IRF1 TSPAN32 H2-M3 CD300LF H2-D1 PRELID1 RAC2 CD47 FCGR2B BAD PYCARD IL4RA NECTIN2 PRDX2 RIPOR2 BCL6 CRLF2 TNFSF8 RPS3 RHBDD3 MILR1 FGR CST7 RUNX1 PIRB PTPN2 PLA2G4A SOCS1 FCER1G H2-DMB1 BLOC1S3 AP3B1 TRBC2 HMGB1 CEBPB TLR6 H2-OA CLEC4D SDC4 PKN1 LGALS9 THOC1 AXL LILR4B ZFP36L1 MAP3K8 FLOT2 SART1 CGAS PIK3CA HMCES RIPK2 NLRP3 PDCD1 JAK3 CCR2 PCID2 SH3RF1 FANCA D6WSU163E IL15 HMOX1 TSLP CLCF1 GRN MNDAL"
"346","GOBP_MYELOID_LEUKOCYTE_MEDIATED_IMMUNITY",0.00899870890348387,0.112274302319084,0.380730400722792,-0.341260446830818,-1.25985206375233,496,"S100A9 S100A8 BST2 H2-Q7 H2-T23 PRDX4 LRG1 H2-K1 MIF PLAC8 FGL2 S100A11 CTSC RNASET2A PKM H2-M3 FCGR4 H2-D1 CYBB RAC2 NME2 CD63 DNAJC13 CD47 TLR2 DDOST FTL1 GM2A CFP FCGR2B DDX58 PPIA PYCARD FOLR2 LAT2 H2-Q4 IL4RA RHOG ACTR2 ARPC5 LAMTOR2 RAB24 GOLGA7 HUWE1 TMBIM1 IQGAP1 LCN2 HP CTSH B2M RAP1B MILR1 CXCR2 ARSB FGR GLIPR1 TUBB4B ACAA1A PGLYRP1 PIRB TUBB5 PDAP1 PYGB MOSPD2 DBNL PSMB1 GALNS TMEM179B IST1 ATP6V0C FCER1G PGAM1 MAGT1 ARHGAP9 FTH1 HMOX2 SNAP23 GPI1 HMGB1 ANXA2 COTL1 ALDOA PSMB7 NDUFC2 CTSB CLEC4D CTSZ RHOA HGSNAT LGALS9 NPC2 GYG S100A13 TRAPPC1 ATP8A1 CLEC5A SELL NEU1 PLD1 TXNDC5 SLPI CCR2 NCSTN SURF4 RAB5B ARHGAP45 GUSB ALOX5 ALAD D6WSU163E CANT1 HMOX1 PSMA2 GRN MNDAL"
"347","GOBP_IMMUNE_RESPONSE_REGULATING_SIGNALING_PATHWAY",0.0167211684057191,0.154458825394817,0.352487857583619,-0.351686971051235,-1.26442898592525,365,"H2-AB1 H2-EB1 H2-AA H2-Q7 ACTB PSMA4 PSMB8 H2-M3 FCGR4 GBP2 PSME2 H2-D1 CD47 PSMB4 FCGR2B ARPC1B ACTG1 CD79B LAT2 PSMB9 NECTIN2 ACTR2 ARPC5 STK11 FCGR1 PHPT1 PSME1 CTSH RPS3 FGR RUNX1 PIRB PTPN2 PSMA7 PRKCB PSMB1 HRAS FCER1G PLEKHA1 CMKLR1 TRBC2 PRKACB PPP3R1 ARPC3 IKBKG THEMIS2 LCP2 PSMB7 CALM1 WNK1 WASL CLEC4D CHUK RAB29 WIPF1 LILR4B PSMB6 ARPC2 PIK3CA RIPK2 BAIAP2 PSME4 PSMB3 ARPC4 PSMA2 MNDAL MAPK1 TAB1 PSMC3 PSMD4 MAP2K4 NFATC2 PLA2G6 PSMD8 H2-Q10 NFKBIZ"
"348","GOBP_METAL_ION_TRANSPORT",0.0163315303493577,0.151166238233689,0.352487857583619,-0.357152888393484,-1.27151509396952,343,"CCL12 CXCL10 TSPO CCL2 CCL5 SLC39A14 SMDT1 GAS6 ATP1A1 PML PKD2 MCUB NIPA2 SRI CALM3 SLC30A5 PHB YME1L1 PIRB GNAI2 FMR1 BAK1 STIMATE PRKCB ZMPSTE24 MAGT1 TRPM7 ANXA2 CCR1 STIM1 CALM1 RAMP1 CACNA1D TMEM165 CAMK2D PMPCB ZDHHC13 CAMK2G PMPCA THADA SLC8A1 CALCRL HTT CACNB2 SLC39A9 PSEN2 ANK2 IBTK TMCO1 RAMP2 BEST1 P2RY6 BAX ICAM1 ATP2B1 DLG1 CACNA1S FKBP1B SELENON NOS1AP PSEN1 SLC30A7 DIAPH1 PIRA2 CHERP"
"349","GOBP_NEGATIVE_REGULATION_OF_TRANSPORT",0.0152878968734964,0.145650799920298,0.380730400722792,-0.358556016531269,-1.2723712417834,305,"CD74 APOE BST2 H2-Q7 H2-T23 IL1B LRPAP1 SP100 RSAD2 H2-M3 CD300LF H2-D1 TNF CD47 TLR2 FCGR2B TXN1 NR1H2 ARL6IP5 PKD2 SRI WWP2 ABCA7 CALM3 RAP1B APOC2 ENY2 PIRB GNAI2 FMR1 PRKCB RACK1 AKT2 KLF7 TIFAB PICALM RUBCN HMGB1 MTMR2 ERLEC1 ERP29 YOD1 UCP2 FIS1 CALM1 WNK1"
"350","GOBP_T_CELL_ACTIVATION",0.0188787102995806,0.164071844855515,0.352487857583619,-0.351031536221348,-1.27399706065538,404,"CD74 H2-EB1 CCL2 H2-Q7 LGALS1 CCL5 H2-T23 IL1B FGL2 IRF1 RSAD2 H2-M3 RPL22 H2-D1 PRELID1 RAC2 CD47 DDOST FCGR2B BAD PYCARD IL4RA PRDX2 CTSL STK11 RIPOR2 BCL6 TNFSF8 B2M RPS3 RUNX1 ELF4 PIRB PTPN2 PATZ1 SOCS1 FCER1G H2-DMB1 AP3B1 SLAMF6 HMGB1 STAT3 CEBPB AZI2 H2-OA MYH9 SDC4 TREML2 RAB29 LGALS9 LILR4B ZFP36L1 MAP3K8 FLOT2 SART1 CGAS PIK3CA RIPK2 NLRP3 PDCD1 LCP1 JAK3 CCR2 GBA BCL3 KIF13B NCSTN SH3RF1 FANCA IL15 PKNOX1 SCRIB NFATC2 SMAD3 IL12B IGFBP2 H2-Q10 VCAM1 ITGAL AIF1 NFKBIZ HLX"
"351","GOBP_REGULATION_OF_LYMPHOCYTE_ACTIVATION",0.0120852565134651,0.130109357357731,0.380730400722792,-0.352347127452687,-1.27527870996895,388,"CD74 H2-EB1 CCL2 H2-Q7 LGALS1 CCL5 H2-T23 IL1B MIF FGL2 CDKN1A GAS6 IRF1 H2-M3 H2-D1 PRELID1 RAC2 CD47 FCGR2B BAD PYCARD IL4RA PRDX2 RIPOR2 BCL6 TNFSF8 RPS3 RHBDD3 FGR RUNX1 PIRB PTPN2 SOCS1 H2-DMB1 BLOC1S3 AP3B1 TRBC2 HMGB1 CEBPB H2-OA SDC4 PKN1 LGALS9 THOC1 AXL LILR4B ZFP36L1 MAP3K8 FLOT2 SART1 CGAS PIK3CA HMCES RIPK2 NLRP3 PDCD1 JAK3 CCR2 PCID2 SH3RF1 FANCA IL15 CLCF1 MNDAL"
"352","GOBP_NUCLEOSIDE_PHOSPHATE_BIOSYNTHETIC_PROCESS",0.0336616437618662,0.227624053863143,0.321775918075361,-0.370691588619191,-1.27940806052951,223,"MT-ATP8 PKM TMSB4X NME2 ATP5J2 PARP1 ATP5D PPT2 ENO1 ATP5J ADCY7 NAXD SLC35B3 HSD17B12 PANK2 MT-ATP6 RRM1 NME4 ATP5E TBPL1 ATP5H HACD2 DCAKD ATP6V0C SLC35B2 PRPSAP2 TECR AK6 PARP9 ALDOA RAD50 ATP5G1 NME1 UCKL1 FASN ATP5K ATP5O SLC25A13 GARS HACD1 ATP5B GSTZ1 CBR4 ATP5G2 MLYCD ATP5L PARP10 APRT ACSL5 ATP5C1 MAPK1 PDP2 IMPDH2 DTYMK NME3"
"353","GOBP_LEUKOCYTE_MIGRATION",0.00838222862710562,0.10821320090584,0.380730400722792,-0.362830998208668,-1.30201545311991,368,"CD74 S100A9 S100A8 CCL12 CXCL10 CCL2 CH25H CCL5 FN1 CD244A MIF CCL7 RPS19 GAS6 RAC2 CALR TNF CD47 EPS8 PPIA PYCARD PPIB BSG RHOG RIPOR2 CXCR2 MOSPD2 SDC3 FCER1G CMKLR1 HMGB1 CXCL16 CCR1 MAG GOLPH3 ITGB1 MYH9 WNK1 WASL SDC4 RHOA LGALS9 MPP1 SELL PIK3CA NLRP3 DDT CCR2 GBA GBF1 ALOX5 CD48 HMOX1 GLG1 SLC7A6 ITGA6"
"354","GOBP_LYMPHOCYTE_ACTIVATION_INVOLVED_IN_IMMUNE_RESPONSE",0.0355749724494519,0.235820123049205,0.321775918075361,-0.393523388243992,-1.30481708970113,172,"CD74 H2-EB1 H2-Q7 LGALS1 H2-T23 CD244A FGL2 H2-M3 H2-D1 FCGR2B IL4RA BCL6 DOCK11 PIRB FCER1G H2-DMB1 SLAMF6 HMGB1 STAT3 LGALS9 THOC1 HMCES RIPK2 NLRP3 LCP1 JAK3 BCL3 KLRB1B"
"355","GOBP_POSITIVE_REGULATION_OF_SECRETION",0.0271833767175804,0.199889160996094,0.352487857583619,-0.379744835779529,-1.30542526494617,221,"SPP1 S100A8 H2-EB1 H2-Q7 HCAR2 H2-T23 IL1B H2-M3 H2-D1 TLR2 PPIA BAD NR1H2 IL4RA PHPT1 SRI FGR GNAI2 PLA2G4A CHMP2A TM7SF3 RAB9 GOLPH3 HGS SDC4 SELENOT ITSN1 ARF1 ADAM9"
"356","GOBP_CELLULAR_ION_HOMEOSTASIS",0.00369071637413735,0.0696562449988481,0.431707695803346,-0.357888434807004,-1.31292651935822,466,"S100A9 S100A8 CCL12 APOE CXCL10 CD52 CCL2 CCL5 CCL7 SLC39A14 SMDT1 ATP1A1 NEDD8 CALR BOLA2 FTL1 DMXL1 MT1 PML PKD2 MCUB SRI LACC1 ATP13A3 SLC22A17 CALM3 LCN2 SLC30A5 CXCR2 ATP13A1 ATP6V1H BAK1 PRKCB ATP6V0C CMKLR1 TRPM7 FTH1 HMOX2 AP3B1 ATOX1 HMGB1 CCR1 GNA13 STIM1 HSP90B1 BCAP31 VPS33A FIS1 CALM1 SLC31A1 SELENOT BNIP3 TMEM165 CAMK2D ARF1 FXN ATP5B CCR2 THADA FBXL5 SLC8A1 MT2 ATP6V1B2 HMOX1 GPR65 GRN HTT LRP6 CACNB2 MAPK1 DMXL2 ANK2 VAPB IBTK COX19 SMAD3 TMCO1"
"357","GOBP_T_CELL_PROLIFERATION",0.025444815481652,0.193832584786762,0.352487857583619,-0.396785791828257,-1.3134168711923,169,"H2-EB1 H2-Q7 CCL5 H2-T23 IL1B IRF1 H2-M3 H2-D1 RAC2 PYCARD PRDX2 TNFSF8 RPS3 ELF4 PIRB H2-DMB1 HMGB1 CEBPB SDC4 LGALS9 LILR4B RIPK2 JAK3 CCR2 NCSTN SH3RF1 IL15 SCRIB IL12B IGFBP2 H2-Q10 VCAM1 AIF1"
"358","GOBP_RESPONSE_TO_INTERLEUKIN_1",0.0324982494585106,0.22389595517242,0.321775918075361,-0.397348688019866,-1.31750074884287,172,"CCL12 CCL2 CCL5 ZBP1 IL1B CCL7 UBA52 PSMA4 PSMB8 UBE2V1 GBP2 PSME2 CD47 PSMB4 PYCARD TLE5 PSMB9 TFPI RPS27A PSME1 PSMA7 PSMB1 IKBKG CEBPB ACOD1 PSMB7 CHUK LGALS9 MAP3K8 PSMB6 RIPK2 PSME4 PSMB3 PSMA2 TAB1 IRAK4 IL1R2 PSMC3 PSMD4"
"359","GOBP_POSITIVE_REGULATION_OF_MAPK_CASCADE",0.00439113285255588,0.0763252633990056,0.407017918923954,-0.366853949908952,-1.32188571616002,383,"CD74 H2-EB1 CCL12 APOE CCL2 CCL5 IL1B EIF2AK2 MIF CCL7 UBA52 GAS6 UBE2V1 GCNT2 TNF AKAP13 FCGR2B TMEM106A PPIA NRP1 PYCARD TAOK3 ARL6IP5 PRDX2 SCIMP RPS27A MAPKAPK2 PRXL2C ABCA7 IQGAP1 RPS3 RAP1B PHB DAXX IGFBP6 S1PR2 GNAI2 DBNL MYDGF HRAS MINK1 HMGB1 HACD3 IKBKG CCR1 ERP29 HIPK2 TLR6 DUSP22 NCF1 MAP2K5 PKN1 LGALS9 OSM NENF MAP2K2 RIPK2 SASH1 DDT GADD45B"
"360","GOBP_POSITIVE_REGULATION_OF_CELL_ACTIVATION",0.00589437060443,0.088883985869451,0.407017918923954,-0.372127339756343,-1.32333487144264,306,"CD74 H2-EB1 CCL2 H2-Q7 LGALS1 CCL5 H2-T23 IL1B MIF CDKN1A CTSC GAS6 H2-M3 H2-D1 CD47 BAD PYCARD IL4RA NECTIN2 BCL6 CRLF2 RPS3 FGR RUNX1 PIRB PLA2G4A SOCS1 H2-DMB1 BLOC1S3 AP3B1 TRBC2 HMGB1 TLR6 CLEC4D LGALS9 AXL LILR4B MAP3K8 FLOT2 SART1 PIK3CA HMCES RIPK2 NLRP3 PDCD1 JAK3 CCR2 PCID2 IL15 TSLP CLCF1 NFATC2 IRS2 IL12B IGFBP2 STX4A H2-Q10 VCAM1 AIF1 NFKBIZ HLX"
"361","GOBP_REGULATION_OF_LYMPHOCYTE_DIFFERENTIATION",0.0183270402646471,0.161764954353191,0.352487857583619,-0.403366884225754,-1.32379103296311,153,"CD74 H2-EB1 FGL2 GAS6 IRF1 H2-M3 PRELID1 BAD IL4RA PRDX2 BCL6 RUNX1 PIRB PTPN2 SOCS1 AP3B1 HMGB1 H2-OA LGALS9 AXL LILR4B ZFP36L1 SART1 RIPK2 NLRP3 JAK3 CCR2 PCID2 SH3RF1 FANCA IL15"
"362","GOBP_PEPTIDE_SECRETION",0.00893081703435266,0.112274302319084,0.380730400722792,-0.373762725061036,-1.32472726726263,291,"CD74 S100A8 H2-EB1 APOE CCL5 HCAR2 IL1B RSAD2 PDIA4 UQCC2 TNF TLR2 PPIA BAD NR1H2 PHPT1 CANX SRI TMEM167 RHBDD3 ENY2 BLOC1S3 KLF7 TM7SF3 ERP29 M6PR GOLPH3 UCP2 RAB13 SELENOT ITSN1 CACNA1D EIPR1 RAB11B ARF1 ADAM9 CPT1A MYH10 CAMK2G MTTP"
"363","GOBP_REGULATION_OF_SECRETION",0.00398785163129552,0.0717784691580962,0.407017918923954,-0.365756759331014,-1.33269698553487,444,"CD74 SPP1 S100A8 H2-EB1 APOE H2-Q7 CCL5 HCAR2 H2-T23 IL1B RSAD2 H2-M3 H2-D1 RAC2 UQCC2 TNF TLR2 FCGR2B PPIA BAD NR1H2 IL4RA POFUT2 PHPT1 SRI CALM3 RHBDD3 RAP1B FGR ENY2 PIRB GNAI2 FMR1 PRKCB PLA2G4A OAS2 CHMP2A RHOT1 KLF7 TIFAB TM7SF3 NSF ERP29 RAB9 GOLPH3 HGS UCP2 RAB13 CALM1 SDC4 SELENOT ITSN1 LGALS9 CACNA1D EIPR1 ARF1 ADAM9 OSM CPT1A"
"364","GOBP_I_KAPPAB_KINASE_NF_KAPPAB_SIGNALING",0.0103328742101439,0.118528738420643,0.380730400722792,-0.3823405465292,-1.33536273142028,253,"CD74 H2-EB1 BST2 LGALS1 PRDX4 IL1B UBA52 UBE2V1 MIER1 TNF TLR2 AKAP13 TMEM106A TERF2IP PYCARD STAT1 TRIM30A SHISA5 RPS27A S100A4 HDAC1 REL BIRC2 NKIRAS1 TRIM25 PRKCB TIFAB SLC35B2 SHARPIN HACD3 IKBKG TRADD TLR6 AZI2 TMEM9B CHUK RHOA LGALS9 FLNA LILR4B PPM1A S100A13 ZDHHC13 RIPK2 TRIM34A BCL3 PIM2 CANT1 HMOX1 PIDD1 TAB1 IRAK4 WDR83"
"365","GOBP_ACTIVATION_OF_IMMUNE_RESPONSE",0.00370153958931077,0.0696562449988481,0.431707695803346,-0.37117320829599,-1.34270441664523,393,"H2-AB1 H2-EB1 H2-AA H2-Q7 ZBP1 IL1B C4B ACTB PSMA4 PSMB8 FCGR4 GBP2 PSME2 H2-D1 CD47 PSMB4 CFP FCGR2B ARPC1B ACTG1 CD79B PYCARD LAT2 PSMB9 NECTIN2 ACTR2 ARPC5 STK11 FCGR1 PHPT1 PSME1 CD5L RPS3 FGR PHB RUNX1 PTPN2 PSMA7 PRKCB PSMB1 HRAS FCER1G PLEKHA1 CMKLR1 TRBC2 PRKACB HMGB1 ARPC3 IKBKG THEMIS2 LCP2 PSMB7 WNK1 WASL CLEC4D CHUK RAB29 WIPF1 LILR4B PSMB6 ARPC2 CGAS PIK3CA RIPK2"
"366","GOBP_POSITIVE_REGULATION_OF_NF_KAPPAB_TRANSCRIPTION_FACTOR_ACTIVITY",0.0295906557570056,0.211547639430774,0.352487857583619,-0.412192542116965,-1.34294741128043,140,"S100A9 S100A8 IL1B EIF2AK2 UBA52 UBE2V1 TNF TLR2 PPIA TERF2IP PYCARD TRIM30A RPS27A RPS3 TRIM25 PRKCB IKBKG STAT3 TRADD TLR6 NFKB2 CHUK LGALS9 NPM1 FLOT2 RIPK2 NLRP3 TRIM34A RAB7B"
"367","GOBP_MONONUCLEAR_CELL_MIGRATION",0.0303308517311893,0.213825316801289,0.352487857583619,-0.407633337722902,-1.34371146354491,154,"CCL12 CXCL10 CCL2 CH25H CCL5 CCL7 RPS19 GAS6 CALR TNF CD47 EPS8 PYCARD RIPOR2 CXCR2 MOSPD2 CMKLR1 HMGB1 CXCL16 CCR1 WNK1 WASL RHOA LGALS9"
"368","GOBP_REGULATION_OF_LEUKOCYTE_MIGRATION",0.022114343052658,0.179197007583282,0.352487857583619,-0.405815198017736,-1.34557340542535,172,"CD74 CCL12 CXCL10 CCL2 CCL5 MIF CCL7 GAS6 RAC2 CALR TNF PYCARD RHOG RIPOR2 MOSPD2 CMKLR1 HMGB1 CCR1 WNK1 WASL RHOA LGALS9 MPP1"
"369","GOBP_NEGATIVE_REGULATION_OF_CYTOKINE_PRODUCTION",0.00683804876324913,0.0982349339679386,0.407017918923954,-0.385452554109015,-1.34730316388398,251,"H2-EB1 TSPO BST2 H2-Q7 FN1 H2-T23 SRGN ISG15 GAS6 DHX58 H2-M3 GBP2 H2-D1 NLRC5 TMSB4X TNF FCGR2B DDX58 PML PYCARD PIN1 BCL6 ADCY7 UBE2L6 NAV3 REL PIRB TRIM25 NMI PPP1R11 ZFP36 CMKLR1 HMGB1 ACOD1 TLR6 SARS MAP2K5 LGALS9 AXL LILR4B"
"370","GOBP_REGULATION_OF_APOPTOTIC_SIGNALING_PATHWAY",0.00713383971926262,0.0995204668941837,0.407017918923954,-0.380693415444461,-1.34879565068726,293,"CD74 S100A9 S100A8 IL1B MIF SP100 CTSC GPX1 NDUFA13 PRELID1 TNF PARP1 PTPMT1 PML PPIA BAD PYCARD PHIP HYOU1 PRDX2 ENO1 HNRNPK TMBIM1 HDAC1 RPS3 HMGB2 BCL2L1 RPS7 PRKRA PDIA3 RPS6KB1 PTPN2 GNAI2 RACK1 QARS YBX3 RPL11 RPL26 NACC2 ERP29 TRADD P4HB PPP1CA BCAP31 PIH1D1 FIS1 MAP2K5 MCL1 BCL2L2 FXN FAF1 CAAP1 G0S2"
"371","GOBP_POSITIVE_REGULATION_OF_CELL_CELL_ADHESION",0.00795021878378234,0.105247954480654,0.380730400722792,-0.389351991532191,-1.35515150362376,237,"CD74 H2-EB1 CCL2 H2-Q7 LGALS1 CCL5 H2-T23 IL1B H2-M3 H2-D1 GCNT2 TNF CD47 BAD PYCARD IL4RA BCL6 RPS3 RUNX1 PIRB SOCS1 H2-DMB1 AP3B1 HMGB1 RHOA LGALS9 LILR4B MAP3K8 FLOT2 SART1 PIK3CA RIPK2 NLRP3 PDCD1 JAK3 CCR2 ALOX5 IL15 FLOT1 IL12B IGFBP2 H2-Q10 VCAM1 AIF1 NFKBIZ CITED2 HLX"
"372","GOBP_ALPHA_BETA_T_CELL_ACTIVATION",0.0229448833140687,0.182996494942678,0.352487857583619,-0.419558029794164,-1.35928206408903,137,"H2-EB1 H2-Q7 H2-T23 IRF1 RSAD2 RPL22 H2-D1 IL4RA CTSL BCL6 TNFSF8 RUNX1 ELF4 PIRB SOCS1 AP3B1 SLAMF6 HMGB1 STAT3 LGALS9 LILR4B RIPK2 NLRP3 JAK3 CCR2 BCL3 SH3RF1 IL15"
"373","GOBP_METAL_ION_HOMEOSTASIS",0.00209359534739308,0.0515363957406924,0.431707695803346,-0.374695438087353,-1.36526658248511,444,"S100A9 S100A8 CCL12 APOE CXCL10 CD52 CCL2 CCL5 CCL7 SLC39A14 SMDT1 ATP1A1 NEDD8 CALR BOLA2 FTL1 MT1 PML PKD2 MCUB SRI ATP13A3 SLC22A17 CALM3 LCN2 SLC30A5 B2M CXCR2 TRIM24 ATP13A1 GNAI2 BAK1 PRKCB CMKLR1 TRPM7 FTH1 HMOX2 AP3B1 COX11 PICALM ATOX1 HMGB1 CCR1 GNA13 STIM1 HSP90B1 BCAP31 FIS1 CALM1 SLC31A1 SELENOT BNIP3 TMEM165 CAMK2D ARF1 FXN CCR2 THADA FBXL5 SLC8A1 MT2"
"374","GOBP_REGULATION_OF_IMMUNE_EFFECTOR_PROCESS",0.00276128301950314,0.0595966012834944,0.431707695803346,-0.383781149461026,-1.3665462493078,341,"CD74 H2-EB1 BST2 H2-Q7 H2-T23 IL1B CD244A H2-K1 FGL2 RPS19 C4B TSPAN32 RSAD2 DHX58 H2-M3 H2-D1 RAC2 TNF CD47 CFP FCGR2B DDX58 PYCARD H2-Q4 STAT1 IL4RA NECTIN2 SCIMP APOBEC3 BCL6 CD5L B2M FGR PHB PIRB ZMPSTE24 H2-DMB1 GPI1 SLAMF6 HMGB1 PARP9 IFIT1 DDX60 PKN1 LGALS9 THOC1 LILR4B CGAS HMCES RIPK2 NLRP3 JAK3 CCR2 ULBP1 D6WSU163E IL15 HMOX1 CLCF1 GRN C1QC"
"375","GOBP_NEGATIVE_REGULATION_OF_ANION_TRANSPORT",0.0149059783340422,0.143581775849593,0.380730400722792,-0.420127329177604,-1.36789481264387,142,"CD74 APOE IL1B SP100 RSAD2 TNF TXN1 NR1H2 ARL6IP5 WWP2 APOC2 ENY2 PIRB PRKCB AKT2 KLF7 ERLEC1 ERP29 YOD1 UCP2 FIS1"
"376","GOBP_IMMUNOGLOBULIN_PRODUCTION",0.0270872176412435,0.199889160996094,0.352487857583619,-0.438647941840179,-1.37395428342258,102,"H2-AB1 H2-EB1 H2-T23 TNF FCGR2B IL4RA BCL6 PHB SAMHD1 POLB GPI1 PKN1 THOC1 PMS2 CGAS HMCES"
"377","GOBP_CALCIUM_ION_TRANSPORT",0.00404180129121312,0.0718998557819708,0.407017918923954,-0.388467400831759,-1.37515566613983,287,"CCL12 CXCL10 TSPO CCL2 CCL5 SMDT1 GAS6 PML PKD2 MCUB SRI CALM3 PHB YME1L1 PIRB GNAI2 FMR1 BAK1 STIMATE PRKCB ZMPSTE24 TRPM7 ANXA2 CCR1 STIM1 CALM1 RAMP1 CACNA1D TMEM165 CAMK2D PMPCB CAMK2G PMPCA THADA SLC8A1 CALCRL HTT CACNB2 PSEN2 ANK2 IBTK TMCO1 RAMP2 BEST1 P2RY6 BAX ICAM1 ATP2B1 CACNA1S FKBP1B SELENON NOS1AP PSEN1 DIAPH1 PIRA2 CHERP"
"378","GOBP_INTERFERON_GAMMA_PRODUCTION",0.0270224156851639,0.199889160996094,0.352487857583619,-0.445743241341951,-1.37714585503142,94,"H2-EB1 H2-Q7 IL1B CD244A ISG15 GAS6 H2-D1 TNF CD47 PYCARD PIRB HRAS SLAMF6 HMGB1 LGALS9 AXL LILR4B RIPK2 CCR2 BCL3"
"379","GOBP_ACTIN_MEDIATED_CELL_CONTRACTION",0.0373089591611577,0.246239130463641,0.321775918075361,-0.465963919197138,-1.38033966518839,73,"ATP1A1 MYL6 SRI VIM TPM4 TPM2 FLNA CACNA1D CAMK2D PIK3CA CACNB2 ANK2 DLG1 NOS1AP MYL2 PDE4D"
"380","GOBP_REGULATION_OF_T_CELL_DIFFERENTIATION",0.0257490779460498,0.194786214229752,0.352487857583619,-0.429934104600539,-1.38036635867215,128,"CD74 H2-EB1 FGL2 IRF1 H2-M3 PRELID1 BAD IL4RA PRDX2 BCL6 RUNX1 PIRB PTPN2 SOCS1 AP3B1 HMGB1 H2-OA LGALS9 LILR4B SART1 RIPK2 NLRP3 JAK3 CCR2 SH3RF1 FANCA IL15"
"381","GOBP_REGULATION_OF_CYSTEINE_TYPE_ENDOPEPTIDASE_ACTIVITY",0.0136817288995663,0.137846445594303,0.380730400722792,-0.4099660878429,-1.38103782562313,189,"S100A9 S100A8 ANP32B GPX1 GAS6 NDUFA13 TNF RPS27L PML BAD PYCARD PSMB9 ARL6IP5 NAIP2 CTSH RPS3 BIRC2 CST7 BAK1 RACK1 HIP1 HMGB1 TRADD BCAP31 CAST PIH1D1 SENP1 HSPE1 FIS1 MAP2K5 LGALS9 CASP8AP2 CAAP1 RIPK2 NLRP3 NLRP1A PCID2 TNFAIP8 SH3RF1 PIDD1 MICAL1"
"382","GOBP_REGULATION_OF_PEPTIDASE_ACTIVITY",0.00386959037466054,0.0713445933854417,0.431707695803346,-0.388393248174576,-1.38359244285353,311,"S100A9 S100A8 BST2 GAPDH FN1 ANP32B C4B GPX1 GAS6 NDUFA13 PSMB8 PSME2 PRELID1 TNF RPS27L PML BAD PYCARD PSMB9 ARL6IP5 TFPI PEBP1 NAIP2 PSME1 HDAC1 CTSH RPS3 BIRC2 CST7 BAK1 RACK1 PSENEN HIP1 PICALM HMGB1 ANXA2 STAT3 TRADD BCAP31 CAST APH1C PIH1D1 SENP1 HSPE1 FIS1 MAP2K5 LGALS9 CASP8AP2 CAAP1 RIPK2 NLRP3 SLPI NLRP1A PSME4 PCID2 NCSTN TNFAIP8 SH3RF1 PIDD1 MICAL1 GRN"
"383","GOBP_ALPHA_BETA_T_CELL_DIFFERENTIATION",0.0346990785836552,0.231700298929568,0.321775918075361,-0.445632962720083,-1.38381337272624,96,"H2-EB1 IRF1 RSAD2 RPL22 IL4RA CTSL BCL6 TNFSF8 RUNX1 SOCS1 AP3B1 SLAMF6 HMGB1 STAT3 LGALS9 LILR4B RIPK2 NLRP3 JAK3 BCL3 SH3RF1"
"384","GOBP_POSITIVE_REGULATION_OF_APOPTOTIC_SIGNALING_PATHWAY",0.0354611097687419,0.235408008581415,0.321775918075361,-0.43813059129729,-1.3872741248348,107,"S100A9 S100A8 CTSC TNF PML BAD PYCARD RPS3 BCL2L1 RPS7 PRKRA PDIA3 PTPN2 RACK1 RPL11 RPL26 NACC2 PPP1CA BCAP31 FIS1 MCL1 FAF1 G0S2 BCLAF1"
"385","GOBP_REGULATION_OF_MONONUCLEAR_CELL_MIGRATION",0.0205309772016324,0.172187974541867,0.352487857583619,-0.449976665010347,-1.39215641602057,95,"CXCL10 CCL2 CCL5 CCL7 GAS6 CALR TNF PYCARD RIPOR2 MOSPD2 CMKLR1 HMGB1 CCR1 WNK1 WASL RHOA LGALS9"
"386","GOBP_REGULATION_OF_T_CELL_ACTIVATION",0.00254945856869194,0.0570354470728209,0.431707695803346,-0.395381871314537,-1.39359604202322,283,"CD74 H2-EB1 CCL2 H2-Q7 LGALS1 CCL5 H2-T23 IL1B FGL2 IRF1 H2-M3 H2-D1 PRELID1 RAC2 CD47 FCGR2B BAD PYCARD IL4RA PRDX2 RIPOR2 BCL6 TNFSF8 RPS3 RUNX1 PIRB PTPN2 SOCS1 H2-DMB1 AP3B1 HMGB1 CEBPB H2-OA SDC4 LGALS9 LILR4B MAP3K8 FLOT2 SART1 CGAS PIK3CA RIPK2 NLRP3 PDCD1 JAK3 CCR2"
"387","GOBP_REGULATION_OF_RESPONSE_TO_CYTOKINE_STIMULUS",0.0175416508643088,0.156988647637226,0.352487857583619,-0.42349838120351,-1.39434942362373,155,"CD74 CCL5 ZBP1 PARP14 IRF7 IRGM1 GAS6 CD300LF NLRC5 LIFR TNF TLR2 SOCS3 DDX58 PYCARD NR1H2 TLE5 STAT1 BIRC2 RUNX1 PTPN2 SAMHD1 ABCE1 RACK1 SOCS1 SHARPIN PARP9 IKBKG RNASEL TRADD RNF113A2 CHUK MAP2K5 USP18 AXL SPATA2"
"388","GOBP_REGULATION_OF_PEPTIDE_SECRETION",0.00556014629816985,0.0864194752282099,0.407017918923954,-0.405893126481928,-1.40235851707289,225,"CD74 S100A8 H2-EB1 APOE CCL5 HCAR2 IL1B RSAD2 UQCC2 TNF TLR2 PPIA BAD NR1H2 PHPT1 SRI RHBDD3 ENY2 KLF7 TM7SF3 ERP29 GOLPH3 UCP2 SELENOT ITSN1 CACNA1D EIPR1 ARF1 ADAM9 CPT1A MYH10"
"389","GOBP_POSITIVE_REGULATION_OF_LEUKOCYTE_MIGRATION",0.0230854374493252,0.18335948348371,0.352487857583619,-0.438745545396055,-1.40243549171232,114,"CD74 CCL12 CXCL10 CCL5 CCL7 GAS6 RAC2 CALR TNF PYCARD RIPOR2 MOSPD2 CMKLR1 HMGB1 CCR1 WNK1 RHOA LGALS9"
"390","GOBP_INTRINSIC_APOPTOTIC_SIGNALING_PATHWAY",0.00586649044682935,0.088883985869451,0.407017918923954,-0.402820160078553,-1.40270126186725,247,"CD74 S100A9 S100A8 MIF CDKN1A GPX1 NDUFA13 TNF PARP1 RPS27L PTPMT1 PML PPIA BAD PYCARD HYOU1 ARL6IP5 ENO1 SHISA5 STK11 HNRNPK HDAC1 RPS3 BCL2L1 RPS7 PRKRA PTPN2 BAK1 RACK1 HRAS POLB YBX3 RPL11 RPL26 NACC2 CEBPB ERP29 P4HB HIPK2 BCAP31 FIS1 BNIP3 MCL1 BCL2L2"
"391","GOBP_REGULATION_OF_LEUKOCYTE_MEDIATED_CYTOTOXICITY",0.0349083352159842,0.232416021306421,0.321775918075361,-0.480299401713065,-1.40570045366731,65,"H2-EB1 H2-Q7 H2-T23 H2-K1 H2-M3 H2-D1 FCGR2B H2-Q4 NECTIN2 B2M PIRB"
"392","GOBP_REGULATION_OF_RESPONSE_TO_BIOTIC_STIMULUS",0.000900118183703336,0.0294902029394604,0.477270815362862,-0.39291610587823,-1.40900109662535,363,"H2-EB1 APOE H2-Q7 CCL5 H2-T23 ZBP1 PARP14 IRF7 FGL2 IRGM1 RPS19 PSMA4 IRF1 TSPAN32 PSMB8 DHX58 H2-M3 PSME2 H2-D1 GBP5 NLRC5 LY86 PSMB4 SOCS3 FCGR2B DDX58 PYCARD NR1H2 STAT1 PSMB9 NECTIN2 PRDX2 SCIMP APOBEC3 PSME1 HMGB2 BIRC2 FGR PIRB TRIB1 IFI35 PTPN2 SAMHD1 PSMA7 ABCE1 NMI PSMB1 ZMPSTE24 SOCS1 HRAS FCER1G PRKACB SLAMF6 HMGB1 PARP9 IKBKG RNASEL ACOD1 IFIT1 PSMB7 DDX60 CLEC4D CHUK LGALS9 USP18"
"393","GOBP_LEUKOCYTE_PROLIFERATION",0.00303005594799626,0.0632975907668576,0.431707695803346,-0.401957873739925,-1.40920271149639,257,"CD74 H2-EB1 CCL12 BST2 H2-Q7 CCL5 H2-T23 IL1B MIF CDKN1A IRF1 H2-M3 H2-D1 RAC2 FCGR2B PYCARD PRDX2 BCL6 TNFSF8 RPS3 ELF4 PIRB H2-DMB1 HMGB1 CEBPB AZI2 SDC4 PKN1 LGALS9 LILR4B RIPK2 JAK3 CCR2 GBA NCSTN SH3RF1 IL15 CLCF1 MNDAL MAPK1 SCRIB NFATC2 HELLS IRS2 IL12B IGFBP2 H2-Q10 VCAM1 AIF1"
"394","GOBP_RESPONSE_TO_BACTERIUM",0.000332409369290243,0.0156294219504111,0.49849310876659,-0.386635545489531,-1.40999264472626,443,"S100A9 S100A8 H2-EB1 CXCL10 TSPO CCL2 H2-Q7 CCL5 H2-T23 IL1B LRG1 PLAC8 IRGM1 RPS19 C4B ISG15 GPX1 DHX58 H2-M3 GBP2 H2-D1 MRC1 NLRC5 GBP4 TNF LY86 TLR2 RPL39 CFP FCGR2B CHMP5 PYCARD PRDX2 TFPI SCIMP MAPKAPK2 SBNO2 VIM NAIP2 LCN2 HP TNFSF8 B2M HMGB2 FGR PGLYRP1 PLAAT3 PIRB TRIB1 RPS6KB1 GBP9 OAS2 PPP1R11 FCER1G ZFP36 TRBC2 HMGB1 CEBPB ACOD1 GBP3 TLR6 CEP192 WASL NFKB2 CHUK RAB29 RHOA PABPN1 LGALS9 BNIP3 AXL ADAM9 TMEM229B RIPK2 NLRP3 SASH1 SLPI NLRP1A BAIAP2"
"395","GOBP_POSITIVE_REGULATION_OF_RESPONSE_TO_BIOTIC_STIMULUS",0.0044502808909602,0.0770592364160941,0.407017918923954,-0.408726585746328,-1.41214810322984,225,"H2-EB1 H2-Q7 CCL5 H2-T23 ZBP1 IRF7 IRGM1 RPS19 PSMA4 PSMB8 DHX58 H2-M3 PSME2 H2-D1 GBP5 NLRC5 LY86 PSMB4 PYCARD PSMB9 NECTIN2 SCIMP PSME1 HMGB2 IFI35 PSMA7 NMI PSMB1 HRAS FCER1G PRKACB SLAMF6 HMGB1 PARP9 IKBKG ACOD1 PSMB7 DDX60 CLEC4D CHUK PSMB6 CGAS SASH1 ULBP1 PSME4 PSMB3 PSMA2 GRN MNDAL IL18RAP TAB1 PSMC3 PSMD4 IL12B MED1 PSMD8 H2-Q10"
"396","GOBP_LYMPHOCYTE_MIGRATION",0.0236316457323656,0.184576192029584,0.352487857583619,-0.459106041209297,-1.41815934406261,93,"CCL12 CXCL10 CCL2 CH25H CCL5 CCL7 GAS6 PYCARD RIPOR2"
"397","GOBP_POSITIVE_REGULATION_OF_DEFENSE_RESPONSE",0.00202160181867305,0.0508639485206468,0.431707695803346,-0.399701175698396,-1.42081412368458,303,"S100A9 S100A8 H2-Q7 CCL5 H2-T23 ZBP1 IL1B IRF7 CTSC IRGM1 RPS19 PSMA4 NEAT1 PSMB8 H2-M3 PSME2 H2-D1 GBP5 NLRC5 TNF CD47 PSMB4 TLR2 PYCARD PSMB9 NECTIN2 PSME1 HMGB2 IFI35 PSMA7 NMI PSMB1 HRAS FCER1G PRKACB SLAMF6 HMGB1 PARP9 IKBKG CEBPB TRADD PSMB7 CLEC4D CHUK OSM PSMB6 CGAS RIPK2 DDT CCR2 ULBP1 PSME4 PSMB3 IL15 PSMA2 TSLP GRN MNDAL IL18RAP TAB1 PSMC3 PSMD4 IL12B MED1 PSMD8 H2-Q10 NFKBIZ"
"398","GOBP_POSITIVE_REGULATION_OF_LEUKOCYTE_CELL_CELL_ADHESION",0.00355300610767021,0.0676876838277033,0.431707695803346,-0.418064003362472,-1.42182645368599,206,"CD74 H2-EB1 CCL2 H2-Q7 LGALS1 CCL5 H2-T23 IL1B H2-M3 H2-D1 TNF CD47 BAD PYCARD IL4RA BCL6 RPS3 RUNX1 PIRB SOCS1 H2-DMB1 AP3B1 HMGB1 RHOA LGALS9 LILR4B MAP3K8 FLOT2 SART1 PIK3CA RIPK2 NLRP3 PDCD1 JAK3 CCR2"
"399","GOBP_POSITIVE_REGULATION_OF_RESPONSE_TO_EXTERNAL_STIMULUS",0.000179945726126294,0.010506062009989,0.518848077743792,-0.391753190631577,-1.42370978512271,416,"CD74 S100A9 S100A8 CXCL10 H2-Q7 CCL5 H2-T23 ZBP1 IL1B IRF7 CCL7 CTSC IRGM1 RPS19 GAS6 PSMA4 NEAT1 PSMB8 DHX58 H2-M3 PSME2 H2-D1 GBP5 RAC2 CALR NLRC5 TMSB4X TNF CD47 LY86 PSMB4 TLR2 NRP1 PYCARD PSMB9 NECTIN2 SCIMP RIPOR2 PSME1 HMGB2 IFI35 PSMA7 MOSPD2 NMI PSMB1 HRAS FCER1G CMKLR1 PRKACB SLAMF6 HMGB1 PARP9 IKBKG CCR1 CEBPB TRADD ACOD1 PSMB7 DDX60 WNK1 CLEC4D CHUK LGALS9 FLNA OSM PSMB6 CGAS RIPK2 SASH1 DDT CCR2 ULBP1 PSME4 PSMB3 IL15 PSMA2 TSLP GRN SCARF1 MNDAL MAPK1 IL18RAP TAB1 PSMC3 PSMD4 SMAD3 IL12B STX4A MED1 PSMD8 H2-Q10 AIF1 NFKBIZ"
"400","GOBP_MONOSACCHARIDE_BIOSYNTHETIC_PROCESS",0.02337625760073,0.183999742608354,0.352487857583619,-0.479054336508253,-1.42912552180375,76,"GAPDH PGK1 SLC39A14 ENO1 CLK2 ARPP19 PTPN2 G6PC3 SLC35B4 PGAM1 GPI1 AKR1B3 ALDOA TALDO1 TPI1 FAM3C SLC25A13 NLN SIRT7 KAT2B"
"401","GOBP_REGULATION_OF_INNATE_IMMUNE_RESPONSE",0.00207460647502493,0.051346510256867,0.431707695803346,-0.406437120989767,-1.43283571122734,278,"APOE H2-Q7 CCL5 H2-T23 ZBP1 PARP14 IRF7 IRGM1 RPS19 PSMA4 IRF1 PSMB8 DHX58 H2-M3 PSME2 H2-D1 GBP5 NLRC5 PSMB4 SOCS3 FCGR2B PYCARD NR1H2 STAT1 PSMB9 NECTIN2 PSME1 HMGB2 BIRC2 FGR PIRB IFI35 PTPN2 SAMHD1 PSMA7 ABCE1 NMI PSMB1 SOCS1 HRAS FCER1G PRKACB SLAMF6 HMGB1 PARP9 IKBKG RNASEL ACOD1 PSMB7 CLEC4D CHUK LGALS9 USP18 PSMB6 CGAS ULBP1 PSME4 TTLL12 PSMB3 PSMA2 GRN MNDAL IL18RAP TAB1 PSMC3 PSMD4 IL12B MED1 PSMD8 BIRC3 H2-Q10"
"402","GOBP_T_CELL_ACTIVATION_INVOLVED_IN_IMMUNE_RESPONSE",0.018335328316902,0.161764954353191,0.352487857583619,-0.469128168047403,-1.43326714971892,89,"CD74 H2-EB1 FGL2 FCGR2B IL4RA BCL6 PIRB FCER1G H2-DMB1 SLAMF6 HMGB1 STAT3 LGALS9 RIPK2 NLRP3 LCP1 JAK3 BCL3"
"403","GOBP_CHEMOKINE_PRODUCTION",0.0329288301262204,0.225162000592804,0.321775918075361,-0.485195599424051,-1.43552011626203,75,"CD74 S100A9 S100A8 IL1B EIF2AK2 TNF TLR2 PYCARD IL4RA"
