"","pathway","pval","padj","log2err","ES","NES","size","leadingEdge"
"292","GOBP_CELLULAR_COMPONENT_DISASSEMBLY",0.00536095594274464,0.131966450612211,0.407017918923954,0.445935489293535,1.28716525350084,494,"CTSL CST3 C1QC C1QA CX3CR1 PDPN TREM2 NAV3 STMN1 UFM1 PLEK TIMP2 FSCN1 C1QB ITGAM BNIP3 LRP6 VCP MAP4K4 PIK3R1 WDR45B MRPL1 DENR UPF1 BNIP3L BSG CCNB2 DDRGK1 SQSTM1 GFM2 FURIN GSPT1 WASHC2 LAMP2 DUSP3 KIF2C CHMP3 VRK1 INSR HMGB1 MRPL34 SMARCD1 CSNK2A2 MAP1LC3A NEK6 KIF5B USP36 SPTAN1 MFSD8 MRPL15 ZMPSTE24 CAMSAP1 CD44 ADAM10 MRPL42 TGFBR1 CLASP2 IQSEC1 ATG5 MRPL51 MRPS23 CSNK1A1 MRPL23 ADD3 MRPL40 SUPT16 MRPL47 GABARAP LRP1 UBQLN1 GABARAPL2 CAPZA1 MRPL18 TPX2 ADRB2 MAP1LC3B MRPL22 MRPL48 DVL3 DICER1 CISD2 MRPS28 SMCR8 KPNB1 EIF5A MTIF2 HK2 HMGB2 RB1CC1 NCKAP5L MRPS2 CCNB1 MFN2 VPS13C MRPS17 EXOG TAOK1 SMARCC1 MRPL38 PARK7 CFL1 TFIP11 RDX SNX14 PINK1 SNAP29 MMP9 MRPS31 HIF1A TOP2A ATG3 CAPN10 ADAM8 MYC FUNDC2 RUBCNL TSC2 DDIT4 IGF1R MRPL20 HUWE1 TGFB1 UBQLN4 PLK3 LPIN1 TTBK2 CAMKK2 GSK3B SNAPIN ARHGEF2 EPG5 SH3GL1 SET RNF41 ETF1 MRPL12 KIF18A AMBRA1 KIF2A CTNNB1 CNEP1R1 STMN4 HPN AKAP8L MRPS14 MRPL32 WIPI2 MRPL41 UBA5 MRPS5 TMEM39B KIF18B MAP1A"
"293","GOBP_MAINTENANCE_OF_LOCATION",0.0162435335096092,0.211957167916218,0.352487857583619,0.462376607923294,1.28556464112215,262,"S100A8 S100A9 HEXB LCN2 CALM2 ABCA1 HSP90B1 CD36 HSPA5 FTH1 CCL3 KDELR2 FTL1 PLIN2 CALR SRGN OSBPL11 ITPR2 OS9 NRIP1 TXN1 CCDC88A MTLN LATS1 PKD2 CALM3 CAPN3 TOPORS ITGAV CHD7 AKAP9 PDE4D SOAT1 ATG5 GOPC SLC25A23 HILPDA ANK2 INSIG2 TMEM38B OSBPL8 CCR5 YWHAB ITGB3 HK2 VPS13C ITPR3 PARK7 DGAT1 ABL1 PRKCE PINK1 CALM1 FBN1 KDELR1 RANGAP1"
"294","GOBP_LEUKOCYTE_MIGRATION",0.0094598179699661,0.167471152560431,0.380730400722792,0.451176274308171,1.28515397489986,368,"PF4 S100A8 S100A9 CD81 P2RY12 CCL7 CX3CR1 TREM2 LGMN CCL12 CXCL3 WNK1 RHOH GAS6 CSF1 CCL3 SIRPA THBS1 LYST HMOX1 CALR ITGA6 CXCL2 ITGAM MERTK CD34 S1PR1 CCL4 MYH9 AKIRIN1 PIK3R1 APP PDGFB PPIA BSG IL16 PTAFR CD84 WASL SLC7A8 CCL24 JAM2 GCNT1 HMGB1 VEGFB SLC7A7 SRP54A ITGAV MTUS1 CRK CD44 ADAM10 SLC7A11 YES1 PPIB CKLF C3AR1 PYCARD CSF1R CRKL ITGB1 ITGB2 MPP1 SELPLG GLG1 ATP1B3 CCL2 SLC3A2 SLC7A5 CCR5 ADAM17 RIPOR2 NCKAP1L FN1 ITGB3 GPR183 ITGA5 VEGFA"
"295","GOBP_MALE_GAMETE_GENERATION",0.014221526871033,0.19685359687138,0.380730400722792,0.453049526869993,1.28440591006433,347,"TMEM119 CALR QK MERTK TAF1 BCAP31 ETV5 SKIL ATP2B4 SGPL1 PRDX4 PAFAH1B1 HSF2 WDR33 JAM2 DNMT3A SFMBT1 NOTCH1 CSNK2A2 CADM1 SLC4A2 IGF2R BCL2L11 ABHD2 DNAJA1 PGM3 RPL39L ADAM10 DDX6 MEA1 RAD23B METTL3 AP3B1 KHDRBS1 TSNAX UBE2J1 CRKL ZFX HERPUD2 HERC4 BRD2 PIWIL2 CDYL PIAS1 MYCBP ATRX TESK1 DHX36 TMF1 HMGB2 NSUN2 CCNB1 CDC25C SPATA2 TBP NR2C2 ACVR2A MLH1 ARNTL WDR48 ACOX1 GM17018 IFT81 RSPH1 PSMA8 ZFP449 GGT5 KIFC1 TDRD7 KIF18A MORN2 LARP7 KDM5A ING2 NUP62 RACGAP1 DAZAP1 EIF5A2 CLOCK PYGO2 USP42 TXNRD3 RNF8 PRKAG1 FANCA STRBP RUVBL1 FIGNL1"
"296","GOBP_REGULATION_OF_CELL_CYCLE_PHASE_TRANSITION",0.00744359927288986,0.152009646137849,0.407017918923954,0.445984348805966,1.27589207118823,409,"GPNMB CDKN1A TUBB4B PSMD14 HSP90AA1 ZFP36L1 RAB11A ID2 EIF4G1 TAF1 CEP250 PSMC3 CNOT1 ADAMTS1 ZFP207 ATP2B4 BABAM1 CSNK1D CENPF YWHAE DYNC1H1 APP CSNK1E SOX4 DDRGK1 PAFAH1B1 RGCC PKD2 CUL4A ANAPC2 ANAPC1 ARID3A UBE2C TRIAP1 PSMD2 RB1 PSMD7 PSMA1 PSMB2 CNOT8 NEK6 CDK6 CCND1 AKAP9 DLG1 PSMB7 HAUS3 NEK2 CNOT6 DCTN2 MEPCE ANKRD17 PSMA5 CUL1 NDE1 PSMD12 KLF4 KIF14 PSMB6 HAUS2 RAD21 LSM11 NSMCE2 PSMB5 ANAPC15 CDKN2A PSMC1 PSMD4 TPX2 DLGAP5 CCL2 CEP290 PSMA6 ERCC3 ADAM17 PSMD13 XPC CENPJ RPS27L ANAPC11 TUBB5 SENP2 CEP78 PRMT1 CCNB1 CDC25C TAOK1 CRADD FOXN3 DUSP1 PCM1 RDX RINT1 APPL1 PSMC5 RCC2 CEP152 UBE2D1 PSMA4 ZFP655 CDC25B PSMF1 PBX1 HMMR NINL MDM4 PLK3 CDC20 PSMA8 RPA2 NBN CTC1 MAPRE1 PSMD3 RBL2 MTBP PCNA TRIM39"
"297","GOBP_REGULATION_OF_PEPTIDASE_ACTIVITY",0.0169243738019104,0.215471283074367,0.352487857583619,0.450584917895177,1.26697593580743,311,"S100A8 S100A9 CTSD CST3 ARL6IP1 CST7 LGMN CSTB SERPINE2 GAS6 THBS1 PSMD14 TIMP2 DNAJB6 SLPI BIN1 TFPI VCP BCAP31 JAK2 TMED10 YWHAE APP SERPINF1 DDRGK1 ASPH FURIN TRIAP1 HDAC1 CFLAR GRN HMGB1 BCL2L11 RPS6KA3 CD44 CASP8AP2 HSPD1 CYCS KLF4 PICALM RENBP PYCARD LRP1 CR1L CD109 REST UCHL5 XIAP DAP PEBP1 C4B FN1 RPS27L VEGFA AIFM1 BST2 SERPINB6A CLPX BIRC6 AKIRIN2 CRADD PARK7 USP14 PROS1 LGALS9 PINK1 UBE2Z MMP9 CASP9 MYC PPM1F PAK2 PMAIP1 PSMF1"
"298","GOBP_TAXIS",0.011622277801509,0.177381842142627,0.380730400722792,0.439551116861763,1.26584261274644,458,"PF4 S100A8 S100A9 P2RY12 CCL7 GPNMB CX3CR1 TREM2 LGMN CCL12 CXCL3 PTPRA WNK1 RHOH GAS6 CSF1 CCL3 THBS1 LYST CALR CXCL2 ECSCR S1PR1 CCL4 DOCK2 AKIRIN1 CYFIP1 PIK3R1 APP PDGFB PPIA BSG IL16 PTAFR STX4A CREB1 OPHN1 DUSP3 CCL24 HMGB1 VEGFB NOTCH1 DAG1 KIF5B SRP54A ITGAV MTUS1 PLXNA1 SPTAN1 CDK5R1 CRK BMPR2 ADAM10 MAPK7 PTPRJ PPIB CKLF EVL C3AR1 NPTN LRP1 CSF1R CRKL ITGB2 MPP1 PLD1 CCL2 CCR5 RALA ADAM17 RIPOR2 NCKAP1L EZR ITGB3 GPR183 VEGFA IL6RA TMEFF1 HMGB2 SEMA6B STX3 NRP1 ABCC1 USP14 DUSP1 IRS2 SCN1B LGALS9 SH3KBP1 RIN3 ZSWIM8 PLXNA4 VAV1 ALOX5 EFNB1 ADAM8 BST1 PPM1F"
"299","GOBP_CELL_PROJECTION_ASSEMBLY",0.00924370582527321,0.166386704854918,0.380730400722792,0.437353647141395,1.2615341001145,497,"P2RY12 RHOH TUBB4B PMP22 FSCN1 HSP90AA1 RAB11A RILPL2 TNPO1 CEP250 S1PR1 TRIP11 AKIRIN1 EMP1 CYFIP1 CSNK1D PIK3R1 YWHAE DYNC1H1 ASAP1 CD2AP CCDC88A CSNK1E PAFAH1B1 CYLD OPHN1 WASL ATP6V0D1 FXR2 TMEM237 RAB5A NOTCH1 RAP2A FGD2 MAP4 AKAP9 HAUS3 NEK2 MTSS1 DCTN2 SH2B1 VDAC3 TGFBR1 ATG5 NDE1 HAUS2 BAG4 EVL TOGARAM1 ATMIN PPP1R9A KIF3A VANGL2 IQCB1 KCTD17 IFT22 ITGB1 PLD1 ACTR2 CEP350 CEP290 DYNLL2 RFX3 RALA TCTN3 SRF FAM98A RHOQ RIPOR2 NCKAP1L EZR CENPJ TESK1 TUBB5 ABI2 CEP78 RAPGEF6 CEP162 PARVG NRP1 SHTN1 ARHGAP24 PCM1 RDX WRAP73 ABL1 DYNLRB1 SNAP29 RILPL1 RHOV ATG3 RCC2 CEP152 CFAP20 UNC119B ARL6 TXNDC15 SCLT1 IFT81 NINL RSPH1 TTBK2 ARL3 FNBP1L RPGRIP1L MAPRE1 AUTS2 DYNC2H1 PTPN23 P2RX7 FGD6 FER CDC42EP4 KIF24 CFAP298 NUDCD3 GALNT11 PLEKHM1 CEP97 TAPT1 EPS8 HAUS1 EHD4 TRPM2 SRGAP2 APC PIP5K1A FMR1 NCK1 TCHP RHOU NEK1 CAPG"
"300","GOBP_PROCESS_UTILIZING_AUTOPHAGIC_MECHANISM",0.0154578449765193,0.207473435278485,0.380730400722792,0.430927095065429,1.24299689425607,497,"S100A8 S100A9 TREM2 SCOC ATP6V1A MTDH UFM1 HMOX1 HSP90AA1 CLTC TCIRG1 EIF4G1 NPC1 BNIP3 SH3GLB1 VCP SCFD1 TM9SF1 PIK3C2A ULK2 VPS35 WDR45B BNIP3L SNRNP70 DDRGK1 SQSTM1 ARSB CD84 PSAP RAB1A RRAGC LAMP2 GPR137B ATP6V0C ATP6V0D1 CHMP3 ATP6V1C1 EIF4G2 WDFY3 TBK1 SNX6 HMGB1 ATP6V1G1 RAB5A ACBD5 CSNK2A2 MAP1LC3A USP36 MFSD8 ZMPSTE24 BCL2L11 CDK5R1 TOMM20 TRIM8 NRBF2 HERC1 TMEM59 ATG5 DAPK3 SOGA1 TFEB YOD1 CTSA GABARAP PYCARD TOMM5 UBQLN1 SLC38A9 GABARAPL2 VPS26A BAG3 DYNLL2 ADRB2 MAP1LC3B MTERF3 TOMM70A DAP SESN1 NHLRC1 CISD2 IL10RA RRAGA SMCR8 RAB3GAP2 RNF185 ATP6V1E1 HK2 RB1CC1 ATP6V1H VPS11 GNAI3 GRAMD1A MFN2 VPS13C ORMDL3 RAB7 VPS41 PARK7 ATP6V0E ABL1 PIP4K2A SNX14 PINK1 RMC1 SNAP29 HIF1A VPS18 EXOC4 ATG3 TBC1D12 LAMTOR2 FUNDC2 PRKAA1 RUBCNL TSC2 HUWE1 IKBKG CSNK2B UBQLN4 TMEM41B PLK3 CAMKK2 TRP53INP1 GSK3B SNAPIN DRAM2 EPG5 FNBP1L TMEM208 RNF41 KDM4A C9ORF72 RAB39 MAPK8 AMBRA1 MAPK3 PIP4K2B TRIM5 WIPI2 MTMR14 FOXO3 UBA5 NPRL3 TMEM39B HTR2B TMEM150A TOLLIP ATP6V1B2 PLEKHM1 ABL2 WAC IRF8 VPS33A MTMR9 FEZ2 RALB ATG2A HGF WDFY4 QSOX1 GBA ATP6V0B PRKAG1 EVA1A PHB2 PRKAB1 FZD5 STAM2"
"301","GOBP_RIBONUCLEOPROTEIN_COMPLEX_BIOGENESIS",0.0160889663227152,0.211760556744639,0.352487857583619,-0.338611053345302,-1.16959332877657,420,"EIF3F RPS27 RPLP0 RPSA RPS9 RPS5 RPL38 RPS24 RPS7 RPL27 RPS28 RPL35 RPL24 RPS16 RPS21 RPS10 EMG1 RPL11 RPL6 RPS6 ISG20 SBDS RPS2 RPS19 NSA2 RPL26 EIF3E RPS14 EIF3K LSM4 SNRPB RPL35A RPL7A RBFA RPL3 PIN4 RPL10 C1D EIF3M SNRPD2 UTP23 RPF2 RPL7 EXOSC3 GTF3A EIF3H CRNKL1 RPL10A NOP53 DDX54 RRP15 SF1 RPL14 ABT1 EXOSC4 POP4 PRPF19 ERCC2 EIF6 MAK16 SRSF10 FRG1 NOP16 PSIP1 PWP2 RPS8 EIF3I SART1 RPL5 EXOSC7 HELB BMT2 ISY1 RPL13A MRPS11 NUFIP1 SENP3 DDX10 XRN2 IMP3 NGDN TFB2M WDR36 RRP36 TSR3 SNRPD1 NOP9 YBEY MTERF4 XAB2 RCL1 NSUN4 KAT2B SRPK1 NOP56 PRPF31 KHDC4 DDX39B EXOSC5 USP4 CPSF7 MRPL36 SF3A2 MPV17L2 RRS1 RPS25 PTEN MTREX UTP11 ABCE1 WDR18 RPL3L LTO1 DDX51 CELF4 FAM207A MPHOSPH6 BRIX1 LSG1 WDR46 FDXACB1"
"302","GOBP_NCRNA_PROCESSING",0.0215472628465161,0.246344758899982,0.352487857583619,-0.340367115198929,-1.17876134007587,372,"RPS27 RPS9 RPS24 RPS7 RPL27 RPS28 RPL35 RPS16 RPS21 EMG1 RPL11 RPS6 ISG20 SBDS RPS2 RPS19 NSA2 RPL26 RPS14 RPL35A RPL7A RBFA PIN4 RTRAF C1D UTP23 RPF2 STAT3 LAGE3 RPL7 EXOSC3 RPP21 RPL10A NOP53 TSEN34 2210016F16RIK DDX54 ELP1 RRP15 RPL14 ABT1 URM1 ALKBH1 EXOSC4 POP4 ERCC2 EIF6 MAK16 FRG1 PWP2 RPS8 KTI12 HSD17B10 SART1 RPL5 EXOSC7 HELB BMT2 MRPS11 SENP3 DDX10 XRN2 RTCB IMP3 NGDN INTS7 TFB2M WDR36 RRP36 TSR3 NOP9 YBEY MTERF4 CPSF4 TRMT1L TSEN54 RCL1 NSUN4 GRSF1 KAT2B NOP56 SMAD1 EXOSC5 TYW1 DUS2 INTS3 RRS1 RPS25 MTREX TRIT1 UTP11 WDR18 DDX51 FAM207A MPHOSPH6 WDR46 FDXACB1 ANKRD16 BCDIN3D CTU1 DGCR8 MTO1"
"303","GOBP_NEGATIVE_REGULATION_OF_IMMUNE_SYSTEM_PROCESS",0.018533712612206,0.228114938475638,0.352487857583619,-0.35364077502616,-1.21060978588362,328,"CD74 H2-EB1 SAMHD1 CCR2 FGL2 LST1 IRF1 MNDAL PIRB H2-D1 H2-T23 SLAMF8 GPX1 CEBPB AXL RPS19 KLRK1 GBP2 CD47 PTPRC RUNX3 H2-Q7 RARA IL4RA LDLR TMEM176B TNFAIP8L2 CD200R1 NR1H3 CUEDC2 IFI205 FGR TSC22D3 PARP14 TRIM27 NMI LYN HFE HLX TNFRSF13B PTPN6 TMEM176A PCBP2"
"304","GOBP_T_CELL_ACTIVATION",0.0113719186654983,0.177381842142627,0.380730400722792,-0.355034953425849,-1.21284225224,404,"CCL5 CD74 H2-EB1 CCR2 H2-DMB1 FGL2 IRF1 CLEC4A3 IL1B RAC2 PIRB CORO1A PSMB10 H2-D1 RPS3 H2-T23 CEBPB RPS6 RPL22 KLRK1 CD47 ICAM1 SIRPB1B PTPRC RUNX3 H2-Q7 RARA ELF4 IL4RA SEMA4A IL18 AZI2 LFNG TNFAIP8L2 PAK1 STAT3 MALT1 GSN JAML CSK PRELID1 ZFP36L2 BAD SIRPB1A SOD1 LYN CCND3 HFE HLX FCER1G PTPN6 LCP1 TARM1 RASGRP1 CDC42 RAB29 XBP1 TNFSF9 EBI3 SART1 FYN NCSTN"
"305","GOBP_IMMUNE_RESPONSE_REGULATING_SIGNALING_PATHWAY",0.013301137115441,0.191083212693118,0.380730400722792,-0.356183859185641,-1.22849760801166,365,"H2-EB1 H2-AB1 H2-AA FCGR4 PSMB8 MNDAL CLEC4A3 FCGR1 ARPC1B PIRB PSMB10 H2-D1 RPS3 PSMB9 HCK PSME2 GBP2 RAP1A CD47 PSMA7 PTPRC IGHM FYB ACTR3 ELF2 H2-Q7 KCNN4 ACTG1 ARPC2 THEMIS2 HRAS MAP3K1 PAK1 CD200R1 CD40 PSME1 SHC1 MYO1G RBCK1 IFI205 PLSCR1 MALT1 FGR PSMB1 CSK PLCG2 FPR2 CLEC4E LYN FCER1G CMKLR1 NFAM1 FOS PRKCD PTPN6 CDC42 RAB29 PPP3R1 ELMO2 PIK3R2 MAPK1 PLD2 FYN BRK1 MYO1C RAF1 STK11 CD38 CLEC4N PLEKHA1 PSMD6 BAG6 GBP2B PSME3 INPP5D STAP1 ZC3H12A CD79B IKBKB CARD9 MGL2 CD300A NFKBID"
"306","GOBP_MONONUCLEAR_CELL_DIFFERENTIATION",0.0104876748616425,0.173458654918535,0.380730400722792,-0.356465511000122,-1.23512236955863,357,"CD74 H2-EB1 CCR2 IRF7 FGL2 IRF1 IL1B SPI1 PIRB H2-D1 H2-T23 SLAMF8 CEBPB AXL RPS6 RPL22 ITGA4 PTPRC RUNX3 H2-Q7 RARA IL4RA SEMA4A PRTN3 TMEM176B IL18 AZI2 LYL1 LFNG PTK2B IFI205 STAT3 CEBPG MALT1 PLCG2 PRELID1 ZFP36L2 FNIP1 ACIN1 BAD DOCK11 PPP2R3C SOD1 LYN BAK1 HLX BATF2 FCER1G NFAM1 MMP14 PTPN6 TMEM176A CMTM7 XBP1 BATF3 TNFSF9 EZH2 SART1 NOTCH2 DOCK10"
"307","GOBP_POSITIVE_REGULATION_OF_RESPONSE_TO_BIOTIC_STIMULUS",0.0176604583615659,0.221558477626917,0.352487857583619,-0.38147715846633,-1.23624000479251,225,"CCL5 H2-EB1 IRF7 PSMB8 MNDAL CLEC4A3 PSMB10 H2-D1 H2-T23 PSMB9 HCK SCIMP IRGM1 PSME2 RPS19 KLRK1 PSMA7 H2-Q7 HRAS IRGM2 PAK1 PSME1 ZBP1 IFI205 PLSCR1 MALT1 PSMB1 PLCG2 IRF3 NMI FPR2 CLEC4E LYN DDX60 FCER1G CYBA MATR3 PRKCD PSPC1 PUM1 RASGRP1 FYN DHX58 PARP9 IL18RAP IFI35 RAF1 CLEC4N"
"308","GOBP_LEUKOCYTE_PROLIFERATION",0.01749843580779,0.220132255990817,0.352487857583619,-0.375118550953351,-1.24206254256938,257,"CCL5 CD74 H2-EB1 CCR2 H2-DMB1 LST1 IRF1 MNDAL IL1B RAC2 PIRB CORO1A PSMB10 H2-D1 RPS3 H2-T23 CEBPB RPS6 PTPRC H2-Q7 ELF4 IL18 AZI2 CD40 IFI205 MALT1 MYD88 LYN GSTP1 CCND3 TNFRSF13B PRKCD PTPN6 RASGRP1 MAPK1 TNFSF9 EBI3 FYN PURA NCSTN"
"309","GOBP_REGULATION_OF_LYMPHOCYTE_ACTIVATION",0.00334560735322504,0.101082911137009,0.431707695803346,-0.36928073152137,-1.25992527985824,388,"CCL5 CD74 H2-EB1 CCR2 H2-DMB1 FGL2 LST1 IRF1 MNDAL IL1B RAC2 PIRB CORO1A H2-D1 RPS3 H2-T23 SLAMF8 CEBPB AXL KLRK1 CD47 SIRPB1B PTPRC RUNX3 IGHM H2-Q7 RARA IL4RA IL18 TNFAIP8L2 PAK1 CD40 IFI205 EXOSC3 MALT1 MYD88 FGR CSK TNFSF13 PRELID1 ZFP36L2 BAD PPP2R3C SIRPB1A SOD1 LYN HFE HLX TNFRSF13B NFAM1 MMP14 PTPN6 MAD2L2 NSD2 TARM1 CDC42 XBP1 TNFSF9 EBI3 SART1 FYN"
"310","GOBP_REGULATION_OF_INNATE_IMMUNE_RESPONSE",0.00719690247447605,0.150321752549619,0.407017918923954,-0.385465999607703,-1.28853379673469,278,"CCL5 SAMHD1 IRF7 PSMB8 IRF1 STAT1 MNDAL CLEC4A3 PIRB PSMB10 H2-D1 H2-T23 PSMB9 SLAMF8 HCK IRGM1 PSME2 RPS19 KLRK1 PSMA7 SOCS3 APOE H2-Q7 HRAS IRGM2 PAK1 PSME1 ZBP1 NR1H3 IFI205 PTPN1 CDC37 PLSCR1 MALT1 FGR PSMB1 PARP14 PLCG2 IRF3 NMI FPR2 CLEC4E LYN FCER1G MATR3 PRKCD PSPC1 PTPN6 RASGRP1 BIRC3 FYN DHX58 PARP9 IL18RAP IFI35 RAF1 MUL1 CLEC4N IFNGR1 PSMD6"
"311","GOBP_PRODUCTION_OF_MOLECULAR_MEDIATOR_OF_IMMUNE_RESPONSE",0.0109222308962193,0.173901812327162,0.380730400722792,-0.407752490101196,-1.29190365444742,182,"CD74 H2-EB1 H2-AB1 SAMHD1 CCR2 IL1B PIRB H2-D1 H2-T23 SCIMP PTPRC H2-Q7 IL4RA IL18 CD40 CUEDC2 EXOSC3 MALT1 GPI1 TNFSF13 HFE SIRT1 MAD2L2 NSD2"
"312","GOBP_REGULATION_OF_T_CELL_ACTIVATION",0.00349239336563834,0.103275060955305,0.431707695803346,-0.38825241943822,-1.29789856910357,283,"CCL5 CD74 H2-EB1 CCR2 H2-DMB1 FGL2 IRF1 IL1B RAC2 PIRB CORO1A H2-D1 RPS3 H2-T23 CEBPB KLRK1 CD47 SIRPB1B PTPRC RUNX3 H2-Q7 RARA IL4RA IL18 TNFAIP8L2 PAK1 MALT1 CSK PRELID1 BAD SIRPB1A SOD1 LYN HFE HLX PTPN6 TARM1 CDC42 XBP1 TNFSF9 EBI3 SART1 FYN"
"313","GOBP_REGULATION_OF_LEUKOCYTE_PROLIFERATION",0.00929277697009107,0.16661144221179,0.380730400722792,-0.403923089806478,-1.29921704148149,204,"CCL5 CD74 H2-EB1 CCR2 H2-DMB1 LST1 IRF1 MNDAL IL1B RAC2 PIRB CORO1A H2-D1 RPS3 H2-T23 CEBPB PTPRC H2-Q7 IL18 CD40 IFI205 MYD88"
"314","GOBP_ADAPTIVE_IMMUNE_RESPONSE_BASED_ON_SOMATIC_RECOMBINATION_OF_IMMUNE_RECEPTORS_BUILT_FROM_IMMUNOGLOBULIN_SUPERFAMILY_DOMAINS",0.00323648749132788,0.101082911137009,0.431707695803346,-0.402129559753296,-1.30009209357692,231,"CD74 H2-EB1 H2-AB1 CCR2 IRF7 IL1B H2-T22 PIRB H2-D1 H2-K1 H2-T23 ICAM1 PTPRC IGHM H2-Q7 CTSC C3 IL4RA SEMA4A IL18 HRAS CD40 MYO1G IL18BP STAT3 EXOSC3 MALT1 MYD88 TNFSF13 NFKB2 HFE HLX FCER1G PRKCD PTPN6 MAD2L2 NSD2"
"315","GOBP_REGULATION_OF_LYMPHOCYTE_DIFFERENTIATION",0.0159635075742409,0.211330853177597,0.352487857583619,-0.417813400801482,-1.31004002266647,153,"CD74 H2-EB1 CCR2 FGL2 IRF1 PIRB SLAMF8 AXL PTPRC RUNX3 RARA IL4RA IL18 MALT1 PRELID1 ZFP36L2 BAD PPP2R3C SOD1 HLX NFAM1 MMP14 PTPN6 XBP1 TNFSF9 SART1 ATP11C"
"316","GOBP_REGULATION_OF_RESPONSE_TO_CYTOKINE_STIMULUS",0.0202128729454404,0.238470008791544,0.352487857583619,-0.417446725493366,-1.31011044656388,155,"CCL5 CD74 SAMHD1 IRF7 CXCR4 STAT1 RACK1 CASP4 IRGM1 AXL TLE5 SOCS3 PTPRC IRGM2 ZBP1 NR1H3 CASP1 RBCK1 PTPN1 CDC37 RIPK1 PARP14 IRF3 GSTP1 SH2B3 PTPN6 TRAF1 BIRC3"
"317","GOBP_REGULATION_OF_RESPONSE_TO_BIOTIC_STIMULUS",0.00132356353754689,0.063447456315669,0.45505986738723,-0.381578771899624,-1.31718411243742,363,"CCL5 H2-EB1 SAMHD1 IRF7 FGL2 PSMB8 IRF1 STAT1 MNDAL CLEC4A3 PIRB PSMB10 H2-D1 H2-T23 PSMB9 SLAMF8 HCK SCIMP IRGM1 PSME2 RPS19 KLRK1 PSMA7 SOCS3 APOE H2-Q7 DTX3L HRAS IRGM2 IFIT1 PAK1 PSME1 ZBP1 NR1H3 IFI205 PTPN1 NFKBIL1 CDC37 PLSCR1 MALT1 FGR PSMB1 PARP14 PLCG2 IRF3 NOP53 NMI FPR2 CLEC4E PPP2R3C LYN DDX60 FCER1G CYBA MATR3 PRKCD PSPC1 PTPN6 PCBP2 PUM1 RASGRP1 BIRC3 FYN ILRUN DHX58 PARP9 IL18RAP IFI35 RAF1 MUL1 CLEC4N"
"318","GOBP_POSITIVE_REGULATION_OF_LEUKOCYTE_PROLIFERATION",0.0187221773900537,0.229195687726625,0.352487857583619,-0.425316387636203,-1.31736382140008,126,"CCL5 CD74 CCR2 H2-DMB1 IL1B PIRB CORO1A H2-D1 RPS3 H2-T23 PTPRC H2-Q7 IL18 CD40 MYD88"
"319","GOBP_NEGATIVE_REGULATION_OF_DEFENSE_RESPONSE",0.00792619212154826,0.156259216110523,0.380730400722792,-0.422634630857715,-1.31878541785619,166,"H2-EB1 SAMHD1 FGL2 METRNL PIRB H2-D1 H2-T23 SLAMF8 GPX1 RPS19 SOCS3 PTPRC APOE H2-Q7 LDLR TNFAIP8L2 CD200R1 NR1H3 IFI205 PARP14 NMI FPR2 SOD1 GSTP1 SMPDL3B PRKCD PCBP2"
"320","GOBP_POSITIVE_REGULATION_OF_CELL_CELL_ADHESION",0.00237109084383215,0.092247063544875,0.431707695803346,-0.409808941211312,-1.32124375871529,237,"CCL5 CD74 H2-EB1 CCR2 H2-DMB1 IL1B PIRB CORO1A H2-D1 RPS3 H2-T23 KLRK1 CD47 ICAM1 ITGA4 SIRPB1B PTPRC RUNX3 H2-Q7 RARA IL4RA IL18 PAK1 PLAUR FLOT1 ST3GAL4 MALT1 CSK BAD SIRPB1A LYN HLX PTPN6 PIEZO1 CITED2 CDC42 XBP1 TNFSF9 EBI3 SART1 FYN"
"321","GOBP_REGULATION_OF_T_CELL_DIFFERENTIATION",0.0166129294124208,0.214929774273195,0.352487857583619,-0.428445257722143,-1.32256240303678,128,"CD74 H2-EB1 CCR2 FGL2 IRF1 PIRB PTPRC RUNX3 RARA IL4RA IL18 MALT1 PRELID1 BAD SOD1 HLX"
"322","GOBP_LYMPHOCYTE_MEDIATED_IMMUNITY",0.00604441276225988,0.141160285740162,0.407017918923954,-0.411191412668521,-1.33396370191765,222,"CD74 H2-EB1 H2-AB1 CCR2 IRF7 IL1B CLEC2D H2-T22 PIRB CORO1A H2-D1 H2-K1 H2-T23 KLRK1 ICAM1 PTPRC IGHM H2-Q7 CTSC C3 IL4RA IL18 CD40 MYO1G CEBPG EXOSC3 MALT1 MYD88 TNFSF13 HFE FCER1G PRKCD PTPN6 MAD2L2 NSD2 RASGRP1"
"323","GOBP_NEGATIVE_REGULATION_OF_LYMPHOCYTE_ACTIVATION",0.0177272112632539,0.221784945310051,0.352487857583619,-0.433656909296405,-1.34483009171905,136,"CD74 H2-EB1 FGL2 LST1 IRF1 MNDAL PIRB H2-D1 H2-T23 CEBPB AXL RUNX3 H2-Q7 IL4RA TNFAIP8L2 IFI205 FGR LYN HFE HLX TNFRSF13B PTPN6 TARM1"
"324","GOBP_ACTIVATION_OF_MAPK_ACTIVITY",0.0116787904207842,0.177381842142627,0.380730400722792,-0.43497511297086,-1.34578161290758,129,"CD74 CXCR4 IL1B UBA52 RPS27A MAPKAPK2 PTPRC IGFBP6 S1PR2 UBC MAP2K1 PEA15A DBNL SHC1 ERP29 UBB MAP3K5 PTPN1 RIPK1 MAP3K11 SOD1"
"325","GOBP_T_CELL_PROLIFERATION",0.00697778353771646,0.14780427464739,0.407017918923954,-0.429091614971128,-1.34898449857166,169,"CCL5 H2-EB1 CCR2 H2-DMB1 IRF1 IL1B RAC2 PIRB CORO1A PSMB10 H2-D1 RPS3 H2-T23 CEBPB RPS6 PTPRC H2-Q7 ELF4 IL18"
"326","GOBP_POSITIVE_REGULATION_OF_IMMUNE_EFFECTOR_PROCESS",0.00186845111598445,0.0818165998287805,0.45505986738723,-0.428444561707268,-1.35418879212413,191,"CD74 H2-EB1 CCR2 H2-DMB1 IL1B H2-T22 RAC2 PIRB H2-D1 H2-K1 H2-T23 SCIMP RPS19 KLRK1 RAP1A PTPRC H2-Q7 C3 RARA IL4RA IL18 CD40 EXOSC3 MALT1 FGR GPI1 TNFSF13 LYN HLX DDX60 MAD2L2 NSD2 RASGRP1 XBP1 UNC13D CD244A DHX58 IL18RAP VAMP8"
"327","GOBP_RIBOSOME_BIOGENESIS",0.000902057758583605,0.05105235677725,0.477270815362862,-0.413002063050866,-1.37710220260262,291,"RPS27 RPLP0 RPSA RPS9 RPS5 RPL38 RPS24 RPS7 RPL27 RPS28 RPL35 RPL24 RPS16 RPS21 RPS10 EMG1 RPL11 RPL6 RPS6 ISG20 SBDS RPS2 RPS19 NSA2 RPL26 RPS14 RPL35A RPL7A RBFA RPL3 PIN4 RPL10 C1D UTP23 RPF2 RPL7 EXOSC3 GTF3A RPL10A NOP53 DDX54 RRP15 RPL14 ABT1 EXOSC4 POP4 ERCC2 EIF6 MAK16 FRG1 NOP16 PWP2 RPS8 SART1 RPL5 EXOSC7 HELB BMT2 MRPS11 SENP3 DDX10 XRN2 IMP3 NGDN TFB2M WDR36 RRP36 TSR3 NOP9 YBEY MTERF4 RCL1 NSUN4 KAT2B NOP56 EXOSC5 MRPL36 MPV17L2 RRS1 RPS25 PTEN MTREX UTP11 ABCE1 WDR18 RPL3L LTO1 DDX51 FAM207A MPHOSPH6 BRIX1 LSG1 WDR46 FDXACB1"
"328","GOBP_REGULATION_OF_LEUKOCYTE_APOPTOTIC_PROCESS",0.0195168604894429,0.233280269472239,0.352487857583619,-0.492640597253341,-1.40081278884619,70,"CCL5 CD74 IRF7 PIRB AXL TSC22D3 PRELID1 FNIP1 LYN SIRT1"
"329","GOBP_POSITIVE_REGULATION_OF_LEUKOCYTE_CELL_CELL_ADHESION",0.00237578481686874,0.092247063544875,0.431707695803346,-0.435404396384997,-1.40522802083618,206,"CCL5 CD74 H2-EB1 CCR2 H2-DMB1 IL1B PIRB CORO1A H2-D1 RPS3 H2-T23 KLRK1 CD47 ICAM1 ITGA4 SIRPB1B PTPRC RUNX3 H2-Q7 RARA IL4RA IL18 PAK1 ST3GAL4 MALT1 CSK BAD SIRPB1A LYN HLX PTPN6 CDC42 XBP1 TNFSF9 EBI3 SART1 FYN"
"330","GOBP_POSITIVE_REGULATION_OF_PRODUCTION_OF_MOLECULAR_MEDIATOR_OF_IMMUNE_RESPONSE",0.0187881290275155,0.229386433220658,0.352487857583619,-0.477721263326918,-1.4140818126802,90,"CD74 IL1B PIRB H2-D1 H2-T23 SCIMP PTPRC H2-Q7 IL4RA IL18 CD40 EXOSC3 MALT1 GPI1 TNFSF13 MAD2L2 NSD2 XBP1 CD244A"
"331","GOBP_FC_RECEPTOR_MEDIATED_STIMULATORY_SIGNALING_PATHWAY",0.0207358985503979,0.241614677273374,0.352487857583619,-0.478637344492227,-1.41705320540641,88,"FCGR4 FCGR1 ARPC1B HCK RAP1A CD47 PTPRC ACTR3 ACTG1 ARPC2 PAK1 MYO1G PLSCR1 FGR CSK PLCG2 LYN FCER1G PRKCD CDC42 ELMO2 PIK3R2 MAPK1 PLD2 FYN BRK1 MYO1C"
"332","GOBP_RRNA_METABOLIC_PROCESS",0.000597489692574684,0.0406114635818673,0.477270815362862,-0.439026497759793,-1.4198205581448,227,"RPS27 RPS9 RPS24 RPS7 RPL27 RPS28 RPL35 RPS16 RPS21 EMG1 RPL11 RPS6 ISG20 SBDS RPS2 RPS19 NSA2 SLFN9 RPL26 RPS14 RPL35A RPL7A RBFA PIN4 C1D UTP23 TRIR RPF2 RPL7 EXOSC3 RPL10A NOP53 DDX54 RRP15 RPL14 ABT1 EXOSC4 POP4 ERCC2 EIF6 MAK16 FRG1 PWP2 RPS8 SART1 RPL5 EXOSC7 HELB BMT2 MRPS11 SENP3 DDX10 XRN2 IMP3 NGDN TFB2M WDR36 RRP36 TSR3 NOP9 YBEY MTERF4 RCL1 NSUN4 KAT2B NOP56 DEDD2 EXOSC5 RRS1 RPS25 MTREX UTP11 WDR18 DDX51 FAM207A MPHOSPH6 WDR46 FDXACB1"
"333","GOBP_LYMPHOCYTE_ACTIVATION_INVOLVED_IN_IMMUNE_RESPONSE",0.00088847075372992,0.05105235677725,0.477270815362862,-0.456032210001605,-1.42429847766594,172,"CD74 H2-EB1 H2-DMB1 FGL2 PIRB CORO1A H2-D1 H2-T23 RPS6 ICAM1 PTPRC H2-Q7 RARA IL4RA SEMA4A IL18 LFNG PTK2B CD40 STAT3 EXOSC3 MALT1 TNFSF13 PLCG2 DOCK11 HLX FCER1G LCP1 MAD2L2 NSD2 XBP1 UNC13D NOTCH2 DOCK10 CD244A"
"334","GOBP_ADAPTIVE_IMMUNE_RESPONSE",0.000222297078942969,0.0210904353647142,0.518848077743792,-0.415846222224855,-1.43610016928405,362,"CD74 H2-EB1 H2-AB1 H2-AA CCR2 H2-DMB1 IRF7 H2-DMA IRF1 CLEC4A3 IL1B FCGR1 H2-T22 PIRB H2-D1 H2-K1 H2-T23 OTUB1 KLRK1 ICAM1 PTPRC IGHM H2-Q7 CTSC C3 TAP1 IL4RA SEMA4A IL18 HRAS UNC93B1 DBNL PTK2B CD40 MYO1G IL18BP STAT3 EXOSC3 MALT1 MYD88 TAP2 CSK TNFSF13 TRIM27 LYN NFKB2 HFE HLX FCER1G TNFRSF13B PRKCD SIRT1 PTPN6 MAD2L2 NSD2 TARM1"
"335","GOBP_PROTEIN_TETRAMERIZATION",0.0116091028895315,0.177381842142627,0.380730400722792,-0.51125172068112,-1.44098712613052,66,"H2-EB1 SAMHD1 SOD2 OXA1L USP16 VASP ALDOA GLS HSD17B10"
"336","GOBP_RIBOSOMAL_LARGE_SUBUNIT_BIOGENESIS",0.0124194224212708,0.1843390157328,0.380730400722792,-0.511060432612457,-1.44616167487627,69,"RPLP0 RPL38 RPL35 RPL24 RPL11 RPL6 NSA2 RPL26 RPL35A RPL7A RPL3 RPL10 RPF2 RPL7 GTF3A RPL10A NOP53 RRP15 RPL14 EIF6 MAK16 NOP16 RPL5"
"337","GOBP_INTERFERON_GAMMA_PRODUCTION",0.0104903252817687,0.173458654918535,0.380730400722792,-0.485163794703625,-1.44697670486744,94,"H2-EB1 CCR2 IL1B PIRB H2-D1 AXL ISG15 CD47 H2-Q7 RARA IL18 HRAS CEBPG TRIM27 TLR7 RASGRP1 EBI3 CD244A"
"338","GOBP_NEGATIVE_REGULATION_OF_SECRETION",0.0127483220661579,0.186076470157959,0.380730400722792,-0.477970026980331,-1.45156454889612,103,"CD74 CCR2 IL1B PIRB H2-D1 H2-T23 GNAI2 RAP1A APOE H2-Q7 UCP2 NR1H3 ERP29 RHBDF2 SREBF1 HMGCR FRMD4A"
"339","GOBP_POSITIVE_REGULATION_OF_T_CELL_PROLIFERATION",0.00827406592833863,0.158319732090984,0.380730400722792,-0.4970659692688,-1.45730310103302,86,"CCL5 CCR2 H2-DMB1 IL1B PIRB CORO1A H2-D1 RPS3 H2-T23 PTPRC H2-Q7 IL18"
"340","GOBP_NEGATIVE_REGULATION_OF_IMMUNE_RESPONSE",0.00301381455814787,0.099137515876941,0.431707695803346,-0.476912852322798,-1.46896993060619,122,"H2-EB1 SAMHD1 CCR2 FGL2 PIRB H2-D1 H2-T23 SLAMF8 GPX1 RPS19 PTPRC H2-Q7 IL4RA NR1H3 IFI205 PARP14 TRIM27 NMI LYN HFE HLX"
"341","GOBP_T_CELL_ACTIVATION_INVOLVED_IN_IMMUNE_RESPONSE",0.00694272376834083,0.14780427464739,0.407017918923954,-0.498910856957813,-1.47652145816879,89,"CD74 H2-EB1 H2-DMB1 FGL2 PIRB RPS6 ICAM1 RARA IL4RA SEMA4A IL18 STAT3 MALT1 HLX FCER1G LCP1"
"342","GOBP_POSITIVE_REGULATION_OF_ADAPTIVE_IMMUNE_RESPONSE",0.00519380332368645,0.130078660473537,0.407017918923954,-0.498636100521416,-1.49350143559088,95,"H2-EB1 CCR2 IL1B H2-T22 H2-D1 H2-K1 H2-T23 PTPRC H2-Q7 C3 IL18 CD40 EXOSC3 MALT1 TNFSF13 SIRT1 MAD2L2 NSD2"
"343","GOBP_POSITIVE_REGULATION_OF_T_CELL_MEDIATED_IMMUNITY",0.0094878255073762,0.167471152560431,0.380730400722792,-0.572699170866116,-1.51737693115316,45,"H2-EB1 IL1B H2-T22 H2-D1 H2-K1 H2-T23 PTPRC H2-Q7 IL18 MALT1"
"344","GOBP_DEFENSE_RESPONSE_TO_VIRUS",4.58433653910991e-05,0.00745609592825233,0.557332238758646,-0.474875753204001,-1.53181564874632,209,"SAMHD1 IFITM2 CXCL10 IRF7 FGL2 IFITM3 IFITM1 IRF1 STAT1 RNASE6 PIRB IFIT2 IRF5 OAS3 ISG20 SLFN9 GBP2 ISG15 OAS1A PTPRC IRF2 RTP4 DTX3L IFIT1 UNC93B1 CD40 TRIM30A ZBP1 BECN1 IFI205 IFIT3 PLSCR1 APOBEC1 OAS1G IRF3 EIF2AK2 NOP53 ZMYND11 TLR7 DDX60 PCBP2 EXOSC4 CXCL9 PUM1 BIRC3 CRCP UNC13D ILRUN DHX58 EXOC1 PARP9 VAMP8 NT5C3 MUL1 PRF1 TICAM1 FLNA GBP2B HYAL2 IFIT1BL1 ZC3H12A CARD9 MLKL NLRX1 OAS2 EXOSC5 NLRC5 TRIM11 POLR3E ZC3HAV1 IL12RB1 ABCE1 MOV10 HERC6 MAP3K14 TRIM56 USP15 STAT2 TRIM30D NPLOC4 EIF2AK4"
"345","GOBP_ACUTE_PHASE_RESPONSE",0.0161979488339843,0.211957167916218,0.352487857583619,-0.640873350188913,-1.5343607389396,30,"HP IL1B ASS1 CEBPB PLSCR1 HFE"
"346","GOBP_RESPONSE_TO_VIRUS",1.62538218024733e-05,0.00336454111311198,0.575610261071129,-0.460431418442456,-1.53853905262466,293,"CCL5 SAMHD1 IFITM2 CXCL10 IRF7 FGL2 IFITM3 IFITM1 CXCR4 IRF1 STAT1 RNASE6 PIRB IFIT2 IRF5 IRGM1 OAS3 ISG20 RPS15A SLFN9 GBP2 ISG15 OAS1A PTPRC NPC2 IRF2 RTP4 DTX3L TPT1 IRGM2 IFIT1 UNC93B1 CD40 IFNAR1 TRIM30A ZBP1 BECN1 IFI205 IFIT3 PLSCR1 MYD88 APOBEC1 FGR OAS1G IRF3 EIF2AK2 NOP53 NMI ZMYND11 TLR7 DDX60 EEF1G AP1S1 PCBP2 EXOSC4 CXCL9 HMGA1 PUM1 BIRC3 BATF3 BANF1 CRCP UNC13D IFI44 ILRUN DHX58 EXOC1 PARP9 VAMP8 NT5C3 MUL1 PRF1 TICAM1 IFNGR1 FLNA GBP2B XPR1 HYAL2 IFIT1BL1 ZC3H12A IKBKB CARD9 MLKL GBF1 NLRX1 OAS2 EXOSC5 NLRC5 TRIM11 POLR3E ZC3HAV1 LGALS8 IL12RB1 BCL3 ABCE1 MOV10 HERC6 MAP3K14 BAX TRIM56 USP15"
"347","GOBP_REGULATION_OF_BIOLOGICAL_PROCESS_INVOLVED_IN_SYMBIOTIC_INTERACTION",0.000316549076126114,0.0262102635032423,0.49849310876659,-0.4971167496556,-1.54472671686067,165,"CCL5 CD74 H2-EB1 IFITM2 IFITM3 IFITM1 CXCR4 STAT1 LY6E CIITA SUPT4A POLR2L AXL OAS3 ISG20 ISG15 OAS1A POLR2J CHMP4B SNF8 CDK9 TRIM30A DDB1 POLR2I IFI205 PLSCR1 GSN OAS1G POLR2E PARP10 TRIM27 EIF2AK2 LARP1 MPHOSPH8 PPIE TSG101"
"348","GOBP_ACUTE_INFLAMMATORY_RESPONSE_TO_ANTIGENIC_STIMULUS",0.0151338930768774,0.204970623336684,0.380730400722792,-0.710227993654778,-1.5652406807214,20,"H2-T23 ICAM1 C3"
"349","GOBP_ANTIBACTERIAL_HUMORAL_RESPONSE",0.0124464166622188,0.1843390157328,0.380730400722792,-0.669103434464522,-1.56936267975124,27,"RNASE6 RPL39 H2-D1 H2-T23 IGHM H2-Q7"
