"","pathway","pval","padj","log2err","ES","NES","size","leadingEdge"
"111","GOBP_IMPORT_ACROSS_PLASMA_MEMBRANE",0.00235472778154212,0.092247063544875,0.431707695803346,0.583644597857751,1.50416421063562,112,"ARL6IP1 CD36 WNK1 THBS1 SLC2A5 ATP2B4 SLC6A6 SLC9A9 SLC15A3 SLC1A3 SLC7A8 SLC31A1 DLG1 SLC7A11 SLC15A4 SLC12A6 FOLR2 SLC39A10 SLC2A1 ITGB1 ATP1B3 SLC7A1 SLC3A2 SLC7A5 SLC12A9 IRS2 KCNJ13 TRPV2 SLC12A2 PRNP SLC22A4 KCNJ2 SLC8A1 SLC39A8 TRPM2 SLC27A1 SLC36A1 SLC12A7 SLC43A2 SLC19A1"
"112","GOBP_REGULATION_OF_EXTRACELLULAR_MATRIX_DISASSEMBLY",0.0117631348983472,0.177381842142627,0.380730400722792,0.826506485180384,1.50372943683237,13,"CST3 PDPN FSCN1 CLASP2 LRP1"
"113","GOBP_SERINE_FAMILY_AMINO_ACID_METABOLIC_PROCESS",0.00896378109450998,0.164079820819847,0.380730400722792,0.688979688281898,1.50369963587656,33,"SERINC3 SEPHS2 PSAT1 GART GCLM SLC7A11 CSAD"
"114","GOBP_AXONAL_FASCICULATION",0.0100881934234814,0.170422038862182,0.380730400722792,0.856858477467533,1.50356189024034,11,"RTN4 CDK5R1 TNFRSF21 MEGF8 CASP3 EPHB3"
"115","GOBP_WOUND_HEALING",1.57919776977849e-05,0.00336454111311198,0.575610261071129,0.525984654048518,1.50277294048816,393,"PF4 S100A8 SPARC CD9 P2RY12 PDPN CDKN1A CD36 JMJD1C SERPINE2 GAS6 PLEK THBS1 DST HMOX1 RREB1 MERTK MACF1 CD34 TFPI PRKACB MYH9 F13A1 HPS4 JAK2 VKORC1 GNB1 PIK3R1 ITPR2 PDGFB PPIA GNA12 TGFBR2 HDAC1 CFLAR DTNBP1 PPP3CA PDCD10 HMGB1 RAB5A DAG1 CRK F10 SH2B1 CD44 C1GALT1C1 TGFBR1 CLASP2 IL1A DGKZ SLC7A11 GNAS KDM1A AP3B1 NF1 TNFAIP3 DGKH CBX5 ITGB1 TLN1 RAB27A CD109 CAPZA1 LMAN1 ENPP4 HMG20B PRKCH SRF ADAM17 TEC FN1 ITGB3 YWHAZ ITGA5 VEGFA ELK3 B4GALT1 ACTB GNA11 HDAC2 PLA2G4A MFN2 ITPR3 SDC4 ARHGAP24 GNA15 GNA13 SMAD2 PROS1 PRKCE CD151 HIF1A VAV1 ALOX5 MYOZ1 PRKAR2A GNAQ PLPP3 GP9 F11R RHOA TGFB1 SLC12A2"
"116","GOBP_NEGATIVE_REGULATION_OF_MUSCLE_CELL_DIFFERENTIATION",0.00680947290367216,0.147668283825348,0.407017918923954,0.669693521606974,1.50158472688971,40,"TMEM119 ID2 PTBP1 PDGFB NFATC1 BHLHE41 NOTCH1 NFATC3 DNMT1 ANKRD17 PLPP7 MED28"
"117","GOBP_IMPORT_INTO_CELL",0.000937999264788325,0.05105235677725,0.477270815362862,0.558350351482578,1.49742370032361,157,"ARL6IP1 TREM2 CD36 GLUL WNK1 THBS1 SLC2A5 ATP2B4 SLC6A6 SLC9A9 SLC15A3 SLC1A3 OPHN1 SLC7A8 SLC31A1 SLC11A2 DLG1 ATAD1 EPRS SLC7A11 SLC15A4 SLC12A6 FOLR2 SLC39A10 SLC2A1 ITGB1 ATP1B3 SLC7A1 SLC3A2 SLC7A5 SLC12A9 RPS6KB1 NUMB IL10RA ITGB3 ACTB PARK7 IRS2 USP46 KCNJ13 TRPV2 SLC12A2 PRNP SLC22A4 KCNJ2 SLC8A1 AP2B1 SLC27A4 SLC39A8 TRPM2 SLC27A1 SLC36A1 SLC12A7 SLC43A2"
"118","GOBP_RESPONSE_TO_MAGNESIUM_ION",0.00903461587574769,0.164079820819847,0.380730400722792,0.842946341701423,1.49652952546063,12,"THBS1 CCND1 CD14"
"119","GOBP_NOREPINEPHRINE_TRANSPORT",0.00869958646232523,0.162368511268152,0.380730400722792,0.86781509729207,1.49614884582535,10,"P2RY12 NISCH ACTB"
"120","GOBP_REGULATION_OF_PLATELET_AGGREGATION",0.0186729648279157,0.229195687726625,0.352487857583619,0.776347130943895,1.49561956276727,17,"CD9 PDPN SERPINE2 F11R"
"121","GOBP_DECIDUALIZATION",0.0124673730447304,0.1843390157328,0.380730400722792,0.79931380906233,1.49416848676372,14,"SPP1 BSG VDR MAPK3 PPARD"
"122","GOBP_RESPONSE_TO_LIPOTEICHOIC_ACID",0.00962138411851845,0.168265510913374,0.380730400722792,0.866538079722867,1.49394721512288,10,"TREM2 CD36 TLR2 CD14"
"123","GOBP_RESPONSE_TO_INCREASED_OXYGEN_LEVELS",0.02157377494549,0.246344758899982,0.352487857583619,0.721624515398464,1.49383210436875,25,"PDPN CDKN1A ATP6V1A BNIP3 ATP6V0D1 ATP6V1G1"
"124","GOBP_SENSORY_PERCEPTION_OF_TASTE",0.0190102541945273,0.230679745308168,0.352487857583619,0.780766232423678,1.49372447793499,16,"CST3 CD36 GNB1 ITPR3"
"125","GOBP_CARDIAC_VENTRICLE_MORPHOGENESIS",0.0071213512339196,0.149449924051935,0.407017918923954,0.666104061568549,1.49353645077895,40,"MEF2C SMAD7 SOX4 TGFBR2 NOTCH1 CHD7 TGFBR1 PTCD2 MYL2 HIF1A TGFB1 PROX1 FKBP1A RBPJ ENG"
"126","GOBP_REGULATION_OF_BLOOD_PRESSURE",0.00282589833390942,0.0974934925198748,0.431707695803346,0.583992249136988,1.49193107295766,105,"GAS6 PTGS1 NOS2 HMOX1 CAMK2N1 KCNK6 SGK1 CTSZ ID2 CD34 SLC2A5 PDGFB PTAFR ATP2B1 PDE4D BMPR2 RENBP ADH5 ADRB2 NISCH ATP6AP2 ERAP1 EXT2"
"127","GOBP_CAMP_MEDIATED_SIGNALING",0.00854099991389236,0.160476201226247,0.380730400722792,0.65921168952988,1.49130654833403,43,"PDE3B GAL NDUFS4 PDE2A PDE4D MAPK7 CGAS CAP1 ADGRG6 PDE4A PRKAR2A"
"128","GOBP_CELLULAR_RESPONSE_TO_STEROID_HORMONE_STIMULUS",0.00251634206278731,0.0933098308842246,0.431707695803346,0.55657587191752,1.49012429316279,156,"ARG1 UFM1 CALR ZFP36L1 SGK1 NPC1 YWHAH TFPI CNOT1 JAK2 ZMIZ1 CBX3 SERPINF1 DDRGK1 ZFP36 CBFB LATS1 HDAC1 ATP2B1 CFLAR RUNX1 BCL2L11 ABHD2 DNAJA1 UBE2L3 RXRA UBR5 PAQR7 SAFB2 FECH KMT2D PMEPA1 DDX5 RXRB DDX17 NCOA4 REST TRIP4 RNF6 RPS6KB1 UBE3A ZBTB7A TMF1 VPS11 PARK7 NR3C1 PGRMC2 ACOD1 VPS18 ARNTL DDIT4"
"129","GOBP_NITRIC_OXIDE_MEDIATED_SIGNAL_TRANSDUCTION",0.0204619709512661,0.239547084092714,0.352487857583619,0.772982978538034,1.48913858029205,17,"CD36 NOS2 THBS1 ATP2B4 DDAH2 VEGFA"
"130","GOBP_AROMATIC_AMINO_ACID_TRANSPORT",0.0143193002148422,0.197606342964823,0.380730400722792,0.84817556156521,1.4883256501958,11,"SLC7A8 SLC15A4 SLC7A1 SLC3A2 SLC7A5"
"131","GOBP_REGULATION_OF_CARDIAC_CONDUCTION",0.011500234210769,0.177381842142627,0.380730400722792,0.669800233373613,1.48700158335102,38,"ATP2B4 ITPR2 ASPH ATP2A2 ATP2B1 TMEM65 ANK2 ATP1B3 ITPR3 AHCYL1 SLC8A1"
"132","GOBP_PEPTIDYL_CYSTEINE_MODIFICATION",0.0084728264618174,0.160104778867703,0.380730400722792,0.662668203756593,1.48583258110164,40,"S100A8 S100A9 NOS2 ATP2B4 TXN1 ZDHHC20 CHCHD4 ADH5 RAB6A GOLGA7 PARK7"
"133","GOBP_SPECIFICATION_OF_ANIMAL_ORGAN_IDENTITY",0.020360079498093,0.239156071754336,0.352487857583619,0.776499784668002,1.48556211488466,16,"MEF2C RBPJ BMP2 EXT1"
"134","GOBP_TRANSCYTOSIS",0.0196076215751585,0.233751593333172,0.352487857583619,0.789702196264797,1.4855209992242,15,"CLTC RAB11A VPS35 PTAFR RAB5A USO1 FCGRT PICALM LRP1 LRPAP1 IGF1R"
"135","GOBP_LYTIC_VACUOLE_ORGANIZATION",0.00692546517369287,0.14780427464739,0.407017918923954,0.619230638670016,1.48123296128263,64,"HEXB ABCA1 LYST CLN5 SCARB2 HPS4 ARSB RAB14 GRN TMEM165 TMEM106B HPS1 MFSD8 ARF1 NAGLU TFEB AP3B1 WASHC5 TPP1 HOOK3 ACP2 ATP6AP2 RAB7"
"136","GOBP_CELL_DIFFERENTIATION_INVOLVED_IN_KIDNEY_DEVELOPMENT",0.0160293769329397,0.211587775514804,0.352487857583619,0.657742020462531,1.47997949161423,41,"BASP1 CD24A SALL1 MEF2C CD34 PDGFB IQGAP1 NOTCH1 MTSS1"
"137","GOBP_NEGATIVE_REGULATION_OF_SMOOTH_MUSCLE_CELL_DIFFERENTIATION",0.0170164342162552,0.215857496993944,0.352487857583619,0.811601108618492,1.47661089160003,13,"PDGFB NFATC1 NFATC3 DNMT1 ANKRD17 MED28"
"138","GOBP_RESPONSE_TO_AXON_INJURY",0.012890241414802,0.18694955223888,0.380730400722792,0.627146360025765,1.47643041785936,58,"SPP1 P2RY12 ARG1 BNIP3 JAK2 GRN DAG1 KLF4 LRP1 LGALS1 RTN4RL1 CERS2"
"139","GOBP_REGULATION_OF_MICROVILLUS_ORGANIZATION",0.0126217740796211,0.18499997893681,0.380730400722792,0.856058533771688,1.47588004778671,10,"FSCN1 PLD1 EZR TWF2"
"140","GOBP_CELL_RECOGNITION",0.00326643491067386,0.101082911137009,0.431707695803346,0.581937048181777,1.47471464384366,99,"CD9 CD81 CD36 RTN4 DOCK2 APP BSG HVCN1 VDAC2 CADM1 DLG1 CDK5R1 UBAP2L FOLR2 NPTN C4B HAVCR2 MYO18A B4GALT1"
"141","GOBP_RESPONSE_TO_STEROL",0.0169224581556757,0.215471283074367,0.352487857583619,0.699438319618796,1.47449737352362,27,"CCL3 LRP6 TGFBR2 DAG1 TGFBR1 INHBA INSIG2 CCR5 GRAMD1A SMAD2 TGFB1"
"142","GOBP_ANTERIOR_POSTERIOR_AXIS_SPECIFICATION",0.0173535978286762,0.218914915545128,0.352487857583619,0.699030558560478,1.47363776576029,27,"BASP1 LRP6 WLS TMED2 WDR77 SRF TASOR SKI LDB1 FZD5 PGAP1 DDIT3 RNF2 AURKA"
"143","GOBP_REGULATION_OF_MEGAKARYOCYTE_DIFFERENTIATION",0.0103072978198278,0.172571449527557,0.380730400722792,0.637098723078077,1.4721032354282,51,"PF4 MEF2C THBS1 CBFB KMT2C HDAC1 RUNX1 ASH2L KMT2D TNRC6A TNRC6B DPY30 HMGB2 KMT2A PRMT1"
"144","GOBP_TISSUE_REGENERATION",0.0138525760187349,0.195308455694486,0.380730400722792,0.640981639540211,1.4709336510487,49,"CD9 CD81 CDKN1A AKIRIN1 TGFBR2 CFLAR CAPN3 PPP3CA RUNX1 NOTCH1 DAG1"
"145","GOBP_UROGENITAL_SYSTEM_DEVELOPMENT",0.000381832793920704,0.0294723142968625,0.49849310876659,0.536396587654481,1.47046974068469,219,"BASP1 CD24A SALL1 MEF2C CD34 SMAD7 HPGD ADAMTS1 SGPL1 TMED10 CENPF NFIA PDGFB SERPINF1 SEC61A1 SOX4 IQGAP1 PKD2 PSAP CFLAR GCNT1 NOTCH1 DLG1 AKR1B3 ZMPSTE24 BCL2L11 MTSS1 NPNT TGFBR1 NF1 VANGL2 CRKL PTCD2 WDR77 CEP290 SMAD5 UBE3A VEGFA IL6RA C1GALT1 SDC4 SMARCC1 SMAD2 MMP9 NUP133 FBN1 MYC PBX1 ARL3 PECAM1 ASXL1 PROX1 RPGRIP1L LRP4 DYNC2H1 MYO1E CTNNB1 FMN1 PLXND1 AP2B1"
"146","GOBP_SIGNAL_PEPTIDE_PROCESSING",0.0144744629106687,0.197948060345902,0.380730400722792,0.85044396752551,1.46620030513734,10,"CLN5 SPCS1 SEC11A SPCS3 SPCS2 SEC11C FURIN"
"147","GOBP_RESPONSE_TO_FUNGUS",0.0193144834040397,0.232079571034292,0.352487857583619,0.682546022416089,1.46354096730263,30,"S100A8 S100A9 ARG1 CRK ATG5"
"148","GOBP_RECEPTOR_INTERNALIZATION",0.00608686966170945,0.141426553262372,0.407017918923954,0.583207889702652,1.46293528024569,85,"CD9 CD81 CD63 CD36 CLTC LILR4B OPHN1 INSR RAB5A GTF2H2 ARF1 ATAD1 PICALM RAB31 LRP1 ITGB1 ITGB2 NUMB EZR ITGB3 VEGFA LRPAP1 RIN3 USP46 CALCRL RAMP2 TFRC MKLN1"
"149","GOBP_APICAL_PROTEIN_LOCALIZATION",0.0209633362425682,0.242302114844303,0.352487857583619,0.832860514087395,1.4614517587185,11,"GOPC VANGL2 ACTB RDX NAPA"
"150","GOBP_COLLAGEN_METABOLIC_PROCESS",0.00512851815974176,0.130078660473537,0.407017918923954,0.598486838627051,1.46133705994403,74,"CTSL CTSD CST3 ARG1 CTSB RGCC FURIN GOT1 RUNX1 ITGB1 VIM HDAC2 PHYKPL MMP9 HIF1A TGFB1 COL15A1"
"151","GOBP_CD4_POSITIVE_ALPHA_BETA_T_CELL_PROLIFERATION",0.0154008093704736,0.207473435278485,0.380730400722792,0.847485770564292,1.46110025216169,10,"CD81 TGFBR2 CD274 LGALS9"
"152","GOBP_POSITIVE_REGULATION_OF_MACROPHAGE_DERIVED_FOAM_CELL_DIFFERENTIATION",0.0213561374275252,0.24559558041654,0.352487857583619,0.802804090284659,1.46060577166191,13,"PF4 CD36 CSF1 PRKCH"
"153","GOBP_BONE_MORPHOGENESIS",0.0117359883321746,0.177381842142627,0.380730400722792,0.625582433556056,1.46027501540609,54,"TMEM119 MEF2C LRP6 TRIP11 TGFBR2 ZMPSTE24 BMPR2 GNAS COL27A1 GLG1 DHRS3 SKI FOXN3 EXT2"
"154","GOBP_REGULATION_OF_SYSTEMIC_ARTERIAL_BLOOD_PRESSURE",0.0117359883321746,0.177381842142627,0.380730400722792,0.625541229847481,1.46017883504208,54,"GAS6 CAMK2N1 KCNK6 CTSZ SLC2A5 PDGFB PDE4D BMPR2 ADRB2 ATP6AP2"
"155","GOBP_PLATELET_ACTIVATION",0.00269956569790999,0.0962328547336989,0.431707695803346,0.556146481472761,1.45876194362998,130,"PF4 CD9 P2RY12 PDPN SERPINE2 PLEK MERTK MYH9 GNB1 PIK3R1 ITPR2 PDGFB PPIA GNA12 C1GALT1C1 DGKZ SLC7A11 GNAS DGKH TLN1 PRKCH SRF TEC FN1 ITGB3 YWHAZ ACTB GNA11 PLA2G4A ITPR3 GNA15 GNA13 PRKCE VAV1 GNAQ GP9 F11R"
"156","GOBP_ANATOMICAL_STRUCTURE_MATURATION",0.00362443827323742,0.105449168045001,0.431707695803346,0.548345929538046,1.45827108216707,149,"C1QA CX3CR1 CDKN1A TUBB4B CLN5 S1PR1 APP GAL CBFB FLVCR1 ANG RB1 DAG1 MBTPS2 AKR1B3 ABHD2 CDK5R1 ANKRD17 BRD1 KIF14 YTHDF2 KDM1A WASHC5 TUT7 WDR77 CEBPA RFX3 ZBTB7A VEGFA ATP6AP2 TUSC2 NSUN2 CCNB1 HIF1A TYMS CDC25B SCLT1 RHOA"
"157","GOBP_AMINO_ACID_IMPORT",0.0169386735486656,0.215471283074367,0.352487857583619,0.65334332598684,1.45694979080635,39,"ARL6IP1 SLC6A6 SLC1A3 SFXN1 SLC7A8 SLC7A11 ITGB1 SLC7A1 SLC3A2 SLC7A5"
"158","GOBP_ADENYLATE_CYCLASE_MODULATING_G_PROTEIN_COUPLED_RECEPTOR_SIGNALING_PATHWAY",0.00227253360113332,0.092247063544875,0.431707695803346,0.558573133104152,1.45659460395103,124,"PF4 P2RY12 ABCA1 ADGRG1 PRKACB ADGRE1 S1PR1 ATP2B4 GNB1 GNA12 PSAP PDE2A ADGRL2 PDE4D GNAS ADRB2 GNAI3 GNA11 GNA15 ARRDC3 GNA13 ADGRG6"
"159","GOBP_POSITIVE_REGULATION_OF_PHOSPHATASE_ACTIVITY",0.0216620775802956,0.246622753251665,0.352487857583619,0.679032097516095,1.45600627677881,30,"CALM2 MEF2C PLEK PPP1R12A JAK2 CALM3 CD33 PPP1R15B SLC39A10 HSP90AB1 CALM1 PPP1R15A"
"160","GOBP_CELL_MATURATION",0.00574355297976582,0.136943142774102,0.407017918923954,0.564903921457606,1.45586588862995,112,"C1QA CDKN1A TUBB4B CLN5 APP CBFB FLVCR1 ANG RB1 AKR1B3 ABHD2 BRD1 KIF14 YTHDF2 KDM1A WASHC5 TUT7 WDR77 CEBPA RFX3 ZBTB7A VEGFA TUSC2 CCNB1 HIF1A TYMS CDC25B SCLT1"
"161","GOBP_GLYCOPROTEIN_METABOLIC_PROCESS",0.000240142369595289,0.021872167022739,0.518848077743792,0.517539164636841,1.45481889736046,310,"HEXB CTSL CST3 MAN1A2 NPC1 DDOST EDEM1 ST3GAL6 MGAT4A GALNT2 TRIP11 ST3GAL5 POGLUT1 MCFD2 OS9 MAN1C1 ARSB RAB1A MGAT5 GALNT1 NUS1 GCNT1 MGAT1 ITM2C VEGFB SDF2L1 TMEM165 TMTC3 AGO2 AMFR RPN1 FKTN ITM2B SOAT1 BMPR2 PGM3 B4GALT4 C1GALT1C1 TMEM59 HEXA PRKCSH HS6ST1 IDUA TUSC3 EOGT NGLY1 ALG10B UGDH UBE2J1 FKRP GAL3ST4 LMAN1 DAD1 AGA TMEM258 TET3 RNF139 DERL2 EXTL2 RNF185 ALG13 C1GALT1 ENGASE TRAK2 B4GALT1 DPAGT1 PARK7 B3GAT2 B3GAT3 POMT1 FUT11 OGA EDEM3 EXT2 ALG12 HIF1A GXYLT1 B3GALT5 GGTA1 ENTPD5 ALG3 GALNT6 TET2 IGF1 B3GLCT GALNT12 ALG14 CTNNB1 SYVN1 MOGS PPARD DHDDS GALNT11 SLC39A8 MPI STT3A MAN1A FAM20B ALG11 MGAT2 EDEM2 ALG5 OST4 POMT2 KRTCAP2 B3GALNT1"
"162","GOBP_CILIARY_BASAL_BODY_PLASMA_MEMBRANE_DOCKING",0.00666106701117808,0.145838938312043,0.407017918923954,0.57378172611676,1.45138262843324,94,"TUBB4B HSP90AA1 RAB11A CEP250 CSNK1D YWHAE DYNC1H1 CSNK1E PAFAH1B1 AKAP9 HAUS3 NEK2 DCTN2 NDE1 HAUS2 IQCB1 CEP290 TCTN3 CENPJ TUBB5 CEP78 CEP162 PCM1 CEP152 SCLT1 NINL TTBK2 RPGRIP1L MAPRE1"
"163","GOBP_ALTERNATIVE_MRNA_SPLICING_VIA_SPLICEOSOME",0.00726329420773112,0.150321752549619,0.407017918923954,0.610891968871703,1.45116442716065,62,"DHX9 SRSF1 PTBP1 SFPQ HNRNPM DYRK1A RBM25 CELF1 YTHDC1 FXR2 RBM8A MBNL2 KDM1A KHDRBS1 RBM5 DDX5 DDX17 REST ZBTB7A CDK13 NOVA1"
"164","GOBP_ARTERY_MORPHOGENESIS",0.0140452404974378,0.196080883239759,0.380730400722792,0.641371667833873,1.4509478265452,43,"SMAD7 HPGD ZMIZ1 SOX4 PKD2 NOTCH1 CHD7 BMPR2 TGFBR1 NF1 LRP1 SRF VEGFA NRP1"
"165","GOBP_GLOMERULAR_MESANGIUM_DEVELOPMENT",0.0190720816333978,0.230679745308168,0.352487857583619,0.817011806943541,1.45048650341499,12,"CD34 PDGFB CFLAR NOTCH1 IL6RA"
"166","GOBP_REGULATION_OF_COAGULATION",0.0158179816257669,0.210014834763098,0.352487857583619,0.623341276135934,1.45037827986696,53,"CD9 CD36 SERPINE2 THBS1 CD34 TFPI VKORC1 PDGFB"
"167","GOBP_FOREBRAIN_DEVELOPMENT",0.000953513867007407,0.0510859076511969,0.477270815362862,0.523825806187304,1.45013127397665,243,"P2RY12 SALL1 ADGRG1 ITGAM BNIP3 LRP6 RTN4 ATP2B4 BCL2A1A TENT2 ZMIZ1 APP PAFAH1B1 CREB1 OPHN1 NSUN5 HDAC1 NME1 UBA6 TACC3 TACC1 NOTCH1 CSNK2A2 KIF5B CDK6 CHD7 GART CDK5R1 CRK ANXA3 NDE1 INHBA KIF14 SLC7A11 METTL3 KDM1A NF1 DOCK7 LRP1 CSF1R SLC2A1 CRKL RTN4RL1 HOOK3 SRF NUMB ATRX EIF2B3 SKI PCM1 PLXNA4 HIF1A SLC32A1 GM17018 FBXO45 SLC4A10 GSK3B CCDC85C DNAJB1 ARPC5 PROX1 RPGRIP1L BTBD3 KRAS DYNC2H1 MCPH1 HPRT"
"168","GOBP_POSITIVE_REGULATION_OF_EPITHELIAL_CELL_MIGRATION",0.00336068688469994,0.101082911137009,0.431707695803346,0.554831836765328,1.44736045899219,126,"SPARC LGMN RHOB THBS1 HMOX1 CALR RAB11A RREB1 RTN4 MAP4K4 PIK3C2A PDGFB TGFBR2 NUS1 GRN RIN2 HMGB1 BMPR2 ANXA3 CLASP2 IQSEC1 ATP5B ADAM9 ADAM17 ITGB3 VEGFA NRP1 ABL1 PRKCE MMP9 HIF1A PPM1F PLPP3 TGFB1 ROCK2 AAMP ZFP580 PROX1 PIK3CG"
"169","GOBP_RECEPTOR_MEDIATED_ENDOCYTOSIS",0.000772529621504917,0.048193149264841,0.477270815362862,0.524470662191264,1.44491280696766,230,"SPARC CD9 CD81 CD63 CTSL CANX HSP90B1 CD36 HSP90AA1 CALR CLTC ITGAM LRP6 SCARB2 FCHSD2 BMP2K CD2AP STAB1 LILR4B OPHN1 RAB21 WASL TGFBR2 TRF INSR RAB5A CD163 GTF2H2 REPS1 M6PR ITGAV IGF2R MRC1 ARF1 MICALL1 GPR107 ATAD1 SMAP1 PICALM HSPH1 RAB31 RABEPK CD14 LRP1 ITGB1 ITGB2 ADRB2 AAK1 CAP1 NUMB EZR ITGB3 VEGFA LRPAP1 CLTA ITSN1 RIN3 USP46 CAV2 CBL SNX9 AP1G1 CALCRL FCHO2 RAMP2 TFRC MKLN1 FNBP1L"
"170","GOBP_REGULATION_OF_NEURON_PROJECTION_DEVELOPMENT",0.000174675364224975,0.0180789001972849,0.518848077743792,0.512094427945305,1.44400923728175,328,"SPP1 S100A9 HSPA5 ITGA6 ULK4 RAB11A MACF1 YWHAH RTN4 SCARB2 SKIL TANC2 KIF13B CYFIP1 MYLIP SERPINF1 DIP2B CCDC88A IQGAP1 ARSB ANAPC2 RAB21 NME1 CFLAR EIF4G2 GRN PPP3CA CAMK1 ITM2C RAP2A PLXNA1 EEF2K CDK5R1 CRK BMPR2 ADAM10 KLF4 KDM1A CSMD3 WASHC5 NPTN PPP1R9A LRP1 LGALS1 CRKL RTN4RL1 ACTR2 CERS2 PRAG1 RNF6 SRF UBE3A FN1 VIM VEGFA DHX36 ABI2 SEMA6B NRP1 CREB3L2 SHTN1 TRAK2 HDAC2 SNX3 CFL1 KIDINS220 SCN1B PLXNA4 DGUOK TMEM30A PAK2 TRPV2 PTPN9 RHOA CDC20 GOLGA4 GSK3B SNAPIN"
"171","GOBP_GLIAL_CELL_DEVELOPMENT",0.00967946401811237,0.168265510913374,0.380730400722792,0.571168629164683,1.44182217678468,91,"S100A8 S100A9 C1QA TREM2 APP SOX4 NSUN5 EIF2B5 GRN DAG1 CDK6 TLR2 NF1 LRP1 DICER1 VIM EIF2B3 EIF2B4 SKI ADGRG6 EIF2B1"
"172","GOBP_PROTEIN_N_LINKED_GLYCOSYLATION",0.0134467748570676,0.192567964462534,0.380730400722792,0.597561413443819,1.44125795549885,68,"DDOST MGAT4A MCFD2 MAN1C1 MGAT5 NUS1 MGAT1 TMEM165 RPN1 PGM3 TUSC3 ALG10B UBE2J1 LMAN1 DAD1 TMEM258 ALG13 B4GALT1 DPAGT1 EXT2 ALG12 ENTPD5 ALG3 ALG14 MOGS DHDDS SLC39A8 STT3A ALG11 MGAT2 ALG5 OST4 KRTCAP2 ALG6 MGAT4B ALG8 OSTC"
"173","GOBP_STEROID_HORMONE_MEDIATED_SIGNALING_PATHWAY",0.00780378331723575,0.155281526309858,0.407017918923954,0.563952610688202,1.44073560018082,105,"UFM1 CALR YWHAH CNOT1 JAK2 ZMIZ1 DDRGK1 CBFB LATS1 HDAC1 RUNX1 ABHD2 DNAJA1 RXRA UBR5 PAQR7 SAFB2 KMT2D PMEPA1 DDX5 RXRB DDX17 NCOA4 TRIP4 RNF6 UBE3A ZBTB7A TMF1 VPS11 PARK7 NR3C1 PGRMC2 VPS18 ARNTL"
"174","GOBP_EMBRYONIC_PATTERN_SPECIFICATION",0.0209365748416147,0.242302114844303,0.352487857583619,0.64568475340455,1.43987124224264,39,"BASP1 LRP6 TMED2 WDR77 SMAD5 SMAD2 TASOR EFNB1 FZD5 PGAP1 MEIS1 SMAD3"
"175","GOBP_PLATELET_AGGREGATION",0.0178589848144108,0.222621193844867,0.352487857583619,0.618662476155058,1.43949173965552,53,"CD9 P2RY12 PDPN SERPINE2 PLEK MYH9 PPIA SLC7A11 GNAS TLN1 FN1 ITGB3 ACTB"
"176","GOBP_POSITIVE_REGULATION_OF_ENDOTHELIAL_CELL_PROLIFERATION",0.0083520794975093,0.158480708465239,0.380730400722792,0.589124828750706,1.43847765668756,74,"ARG1 HMOX1 MYDGF PDGFB ANG CCL24 HMGB1 NRAS VEGFB BMPR2 TGFBR1 ARNT ADAM17 ITGB3 EGFL7 VEGFA HMGB2 NRP1 HIF1A CAV2 ZFP580 PROX1"
"177","GOBP_REGULATION_OF_BLOOD_CIRCULATION",0.00335711622075479,0.101082911137009,0.431707695803346,0.534691848189169,1.43816013915852,166,"CALM2 KCNK6 BIN1 SMAD7 ATP2B4 JAK2 YWHAE ITPR2 ASPH PTAFR ATP2A2 ATP2B1 CALM3 TMEM65 GLRX3 AKAP9 DLG1 ZMPSTE24 PDE4D BMPR2 MEF2A ANK2 ASB3 TMEM38B ATP1B3 ITPR3 SCN1B MYL2 CELF2 CALM1"
"178","GOBP_GLIOGENESIS",0.00164782307662533,0.075799861524765,0.45505986738723,0.524615069525477,1.438052330159,213,"S100A8 CD9 S100A9 HEXB P2RY12 C1QA CX3CR1 TREM2 SERPINE2 CSF1 CCL3 ADGRG1 BNIP3 BIN1 RTN4 ETV5 ZMIZ1 APP SOX4 PAFAH1B1 CREB1 NSUN5 HDAC1 EIF2B5 GRN NOTCH1 DAG1 CDK6 CDK5R1 TLR2 METTL3 NF1 LRP1 CSF1R CRKL CERS2 CCL2 PRKCH DICER1 VIM GPR183 HDAC2 EIF2B3 EIF2B4 CLCF1 SKI ADGRG6 EIF2B1 ABL1"
"179","GOBP_REGULATION_OF_STRIATED_MUSCLE_CONTRACTION",0.0188794874254254,0.22988552335665,0.352487857583619,0.616373808485272,1.43416651252045,53,"CALM2 BIN1 SMAD7 ATP2A2 CALM3 AKAP9 DLG1 PDE4D ANK2 ASB3 TMEM38B MYBPH MYL2 CALM1 PIK3CG KCNJ2 SLC8A1"
"180","GOBP_NEGATIVE_REGULATION_OF_PEPTIDASE_ACTIVITY",0.00481805222742021,0.128312338267086,0.407017918923954,0.540323213989804,1.43255664283888,145,"CST3 ARL6IP1 CST7 CSTB SERPINE2 GAS6 THBS1 TIMP2 DNAJB6 SLPI BIN1 TFPI TMED10 YWHAE APP SERPINF1 FURIN TRIAP1 RPS6KA3 CD44 KLF4 PICALM RENBP LRP1 CR1L CD109 UCHL5 XIAP PEBP1 C4B VEGFA BST2 SERPINB6A BIRC6 PARK7 USP14 PROS1 UBE2Z MMP9 PAK2 PSMF1 PRNP PIH1D1"
"181","GOBP_COAGULATION",0.00118516317453248,0.0580347644819452,0.45505986738723,0.516070009376553,1.43247647574474,258,"PF4 CD9 P2RY12 PDPN CD36 JMJD1C SERPINE2 GAS6 PLEK THBS1 MERTK CD34 TFPI PRKACB MYH9 F13A1 HPS4 JAK2 VKORC1 GNB1 PIK3R1 ITPR2 PDGFB PPIA GNA12 HDAC1 DTNBP1 RAB5A F10 SH2B1 C1GALT1C1 DGKZ SLC7A11 GNAS KDM1A AP3B1 DGKH CBX5 TLN1 RAB27A CAPZA1 LMAN1 ENPP4 HMG20B PRKCH SRF TEC FN1 ITGB3 YWHAZ ACTB GNA11 HDAC2 PLA2G4A MFN2 ITPR3 GNA15 GNA13 PROS1 PRKCE VAV1 PRKAR2A GNAQ GP9 F11R"
"182","GOBP_CELLULAR_RESPONSE_TO_ORGANIC_CYCLIC_COMPOUND",0.000144230710651138,0.016420666407632,0.518848077743792,0.500984069413976,1.43217642501831,407,"SPP1 P2RY12 ARG1 HSP90B1 HSPA5 P2RY13 CCL3 UFM1 MEF2C CALR DHX9 ITGA6 ZFP36L1 SGK1 NPC1 LRP6 TAF1 YWHAH TFPI CNOT1 VPS35 ATP2B4 JAK2 GNB1 ITPR2 ZMIZ1 APP CBX3 NRIP1 PDGFB SERPINF1 DDRGK1 PTAFR ZFP36 CBFB LATS1 PKD2 HDAC1 ATP2B1 CFLAR DTNBP1 DDX18 PDE2A RUNX1 DAG1 AKAP9 ATF4 EEF2K BCL2L11 GCLM ABHD2 DNAJA1 UBE2L3 TRIM24 RXRA UBR5 PAQR7 SAFB2 INHBA KLF4 GNAS KDM1A FECH KMT2D IMPACT PMEPA1 FOLR2 LGALS1 INSIG2 DDX5 RXRB DDX17 ACTR2 TMEM38B CGAS NCOA4 CCL2 REST CEBPA CDC5L TRIP4 RNF6 SMAD5 RAP1B RPS6KB1 UBE3A ZBTB7A EZR HSP90AB1 RUVBL2 TMF1 VPS11 GNAI3 ACTB GNA11 HDAC2 GRAMD1A CCNB1 GNA15 PARK7 NR3C1 PGRMC2 ACOD1"
"183","GOBP_ACTION_POTENTIAL",0.00986536921692374,0.168265510913374,0.380730400722792,0.579599879763214,1.43186902998405,80,"CD36 BIN1 YWHAH YWHAE ATP2A2 CALM3 AKAP9 DLG1 ANK2 SLMAP KCNAB2 GNA11 GNA15 SCN1B CALM1 GNAQ KCNJ2 SLC8A1 P2RX1 FMR1 GBA"
"184","GOBP_OSTEOCLAST_DIFFERENTIATION",0.00936391222801959,0.167228456025103,0.380730400722792,0.577024327577021,1.42907366343568,82,"CD81 TREM2 CSF1 CCL3 TCIRG1 PIK3R1 RASSF2 LILR4B CREB1 GLO1 GPR137B TRF OSTM1 GNAS IREB2 CSF1R CD109"
"185","GOBP_SENSORY_SYSTEM_DEVELOPMENT",0.000986301827601306,0.0516277991137511,0.45505986738723,0.515787804823668,1.42262639796554,231,"P2RY12 C1QA CRYBB1 TCIRG1 MAF ITGAM MERTK LRP6 SKIL ATP2B4 TENT2 GNB1 SERPINF1 LPCAT1 TGFBR2 HDAC1 ATP2B1 HMGB1 TOPORS CHD7 DLG1 ATF4 BMPR2 TGFBR1 NAGLU SPRED1 CRYBA4 INHBA KLF4 SLC7A11 NF1 CEP290 CRYBG3 SRF VIM VEGFA ABI2 RAB18 NRP1 HDAC2 SKI PBX3 PBX2 HIF1A SPRED2 FBN1 PBX1 TUG1 TDRD7 MDM1 PROX1 RPGRIP1L"
"186","GOBP_ENDOPLASMIC_RETICULUM_UNFOLDED_PROTEIN_RESPONSE",0.00945380780173919,0.167471152560431,0.380730400722792,0.549591170256967,1.42199462497494,116,"CANX HSP90B1 HSPA5 CALR EIF2S1 MYDGF EDEM1 VCP PIK3R1 DNAJB9 DNAJB11 DDRGK1 DNAJC3 ATP6V0D1 GOSR2 SRPR PDIA6 CCND1 AMFR MBTPS2 ATF4 BCL2L11 PPP1R15B YOD1 TMED2 TPP1 SSR1 TLN1 CCL2 HERPUD2 DERL2 EXTL2 PDIA5 YIF1A CREB3L2"
"187","GOBP_OSTEOBLAST_DIFFERENTIATION",0.00599164216625903,0.140649167139916,0.407017918923954,0.532462635814063,1.42172926252679,151,"SPP1 TMEM119 CCL3 MEF2C DHX9 CLTC TCIRG1 CBFB RASSF2 RRBP1 HSD17B4 SYNCRIP NOTCH1 FBL CDK6 ATF4 BMPR2 NPNT ATP5B GNAS MYBBP1A NF1 DDX5 CLEC5A ALYREF REST CEBPA SMAD5 IL6RA ATRAID RSL1D1 SKI ACVR2A NOCT IL6ST HNRNPU TPM4 IGF1 ASF1A WWOX"
"188","GOBP_CYCLIC_NUCLEOTIDE_MEDIATED_SIGNALING",0.0179407066625091,0.222621193844867,0.352487857583619,0.602556693185853,1.42027950723445,59,"CD36 THBS1 PDE3B NUDT4 GAL NDUFS4 PDE2A PDE4D MAPK7 CGAS CAP1 ADGRG6 PDE4A PRKAR2A"
"189","GOBP_REGULATION_OF_EPITHELIAL_CELL_MIGRATION",0.00241443994580391,0.092247063544875,0.431707695803346,0.521694254779927,1.41902759832583,192,"SPARC LGMN GLUL RHOB MEF2C THBS1 HMOX1 CALR RAB11A RREB1 MACF1 RTN4 MAP4K4 PIK3C2A ATP2B4 PDGFB SERPINF1 ARSB RGCC TGFBR2 NUS1 GRN RIN2 PDCD10 HMGB1 NOTCH1 BMPR2 ANXA3 CLASP2 IQSEC1 SPRED1 ATP5B KLF4 NF1 EVL ADAM9 ADAM17 SYNJ2BP ITGB3 VEGFA NRP1 ABL1 PRKCE MMP9 HIF1A PPM1F PLPP3 CSNK2B RHOA TGFB1 ROCK2 AAMP ZFP580 PROX1 PIK3CG"
"190","GOBP_CARDIAC_CHAMBER_DEVELOPMENT",0.00817096422644238,0.157767200254869,0.380730400722792,0.55986138977566,1.41877165683895,99,"SALL1 MEF2C SMAD7 TRIP11 ADAMTS1 SOX4 TGFBR2 PDE2A TMEM65 NOTCH1 CHD7 ZMPSTE24 MAML1 BMPR2 TGFBR1 ANK2 PTCD2 SAV1 SRF DHRS3 NRP1 ADGRG6 HECTD1 MYL2 HIF1A TGFB1 MDM4 PROX1 NPRL3 PLXND1 AP2B1"
"191","GOBP_POSITIVE_REGULATION_OF_GROWTH",0.00520801259127984,0.130078660473537,0.407017918923954,0.524490743459559,1.41829164592472,176,"S100A8 S100A9 BASP1 CSF1 MEF2C RAB11A EIF4G1 MACF1 SMAD7 CYFIP1 ZFP639 CREB1 ANAPC2 TGFBR2 INSR EIF4G2 TRIM32 CAPN3 NOTCH1 CHD7 BMPR2 RPS6KA3 ADAM10 TGFBR1 PPIB LRP1 EXOSC2 SRF ADAM17 CDKN2AIP RPS6KB1 FN1 EZR DERL2 VEGFA NCBP1 NRP1 SHTN1 CCNB1"
"192","GOBP_RENAL_TUBULE_DEVELOPMENT",0.0183422564149132,0.226985423134551,0.352487857583619,0.605559108468738,1.41783041787306,56,"CD24A SALL1 MEF2C PKD2 NOTCH1 DLG1 MTSS1 NPNT VEGFA MYC PBX1 CTNNB1 FMN1 SMO"
"193","GOBP_RESPONSE_TO_TOPOLOGICALLY_INCORRECT_PROTEIN",0.00297040425170662,0.0987388391406712,0.431707695803346,0.522528766603706,1.41657769593815,188,"CANX HSP90B1 HSPA5 THBS1 HSP90AA1 CALR EIF2S1 MYDGF EDEM1 VCP PIK3R1 DNAJB9 HSPA4 DNAJB11 DDRGK1 DNAJC3 MANF UBE2W ATP6V0D1 HSPA14 GOSR2 SRPR PDIA6 SDF2L1 CCND1 AMFR HSPA9 MBTPS2 ATF4 BCL2L11 DNAJA1 PPP1R15B ATXN3 DNAJB4 HSPD1 HSPH1 YOD1 TMED2 HSPA13 TPP1 SSR1 TLN1 UBXN4 BAG3 CCL2 HERPUD2 DERL2 HSP90AB1 EXTL2 PDIA5 RNF185 YIF1A HSPA4L CREB3L2 MFN2"
"194","GOBP_REGULATION_OF_RESPONSE_TO_WOUNDING",0.0109223174352615,0.173901812327162,0.380730400722792,0.546883640424184,1.41498924883803,116,"SPP1 CD9 CD36 SERPINE2 THBS1 RREB1 CD34 TFPI VKORC1 PDGFB GRN HMGB1 CRK CLASP2 KLF4 LRP1 TNFAIP3 RTN4RL1 ITGB1 CD109 ENPP4 CERS2"
"195","GOBP_ODONTOGENESIS",0.0190966763243696,0.230679745308168,0.352487857583619,0.58140323350461,1.41369217174728,72,"CSF1 TCIRG1 CD34 LRP6 BSG HDAC1 BCL2L11 INHBA"
"196","GOBP_GLYCOSYLATION",0.0032542267100369,0.101082911137009,0.431707695803346,0.518126618063673,1.41326351474809,206,"CLN5 MAN1A2 NPC1 DDOST ST3GAL6 MGAT4A GALNT2 TRIP11 ST3GAL5 POGLUT1 MCFD2 MAN1C1 MGAT5 GALNT1 NUS1 GCNT1 MGAT1 VEGFB SDF2L1 TMEM165 TMTC3 RPN1 FKTN PGM3 B4GALT4 C1GALT1C1 TMEM59 TUSC3 EOGT ALG10B UBE2J1 FKRP LMAN1 DAD1 TMEM258 TET3 EXTL2 ALG13 C1GALT1 TRAK2 B4GALT1 DPAGT1 B3GAT2 B3GAT3 POMT1 FUT11 OGA EDEM3 EXT2 ALG12 GXYLT1 B3GALT5 GGTA1 ENTPD5 ALG3 GALNT6 TET2 NANS B3GLCT GALNT12 ALG14 MOGS DHDDS GALNT11 SLC39A8 MPI STT3A MAN1A GBA ALG11 MGAT2 ALG5 OST4 POMT2 KRTCAP2 B3GALNT1"
"197","GOBP_NEGATIVE_REGULATION_OF_MYELOID_CELL_DIFFERENTIATION",0.0128150237102496,0.186452453598967,0.380730400722792,0.584194771466653,1.41289982380103,69,"PF4 C1QC CCL3 ZFP36L1 PIK3R1 ZFP36 LILR4B CUL4A GPR137B NME1 CDK6 CTR9 HSPA9 INHBA"
"198","GOBP_BONE_REMODELING",0.0198214443573743,0.235069941675735,0.352487857583619,0.5855407662013,1.41226536481486,68,"SPP1 TMEM119 TCIRG1 LRP6 S1PR1 RASSF2 GPR137B TRF NF1 CSF1R TPP1 TNFAIP3 ADRB2 ITGB3"
